"ID","Gemeinde_de","Gemeinde_fr","Gemeinde_it","Text_de","Text_fr","Text_it","Tabelle_de","Tabelle_fr","Tabelle_it","Staerkste_Partei"
4436,"Romanshorn TG","Romanshorn (TG)","Romanshorn TG","Alles bleibt beim Alten in Romanshorn: Die drei stärksten Parteien verteidigen ihre Spitzenplätze in unveränderter Reihenfolge: Die <b>SVP</b> geht mit 29,8 Prozent (-2,9 Prozentpunkte) wieder als stärkste Kraft aus den Nationalratswahlen. Zweitstärkste Partei ist die <b>SP</b> (20,5 Prozent, +1,9 Prozentpunkte), drittstärkste die <b>FDP</b> (12,1 Prozent, -3,8 Prozentpunkte).<br><br>","Le trio de tête reste inchangé à Romanshorn: l'<b>UDC</b> reste premier avec 29,8 % des voix. La formation devance le <b>PS</b> (20,5 %, +1,9 points de pourcentage) et le <b><b>PL</b>R</b> (12,1 %, -3,8 points). <br><br>","Il trio di testa rimane invariato a Romanshorn: il partito <b>UDC</b> rimane primo con il 29,8 percento dei voti. Precede il partito <b>PS</b> (20,5 percento, +1,9 punti percentuali) e il partito <b>PLR</b> (il 12,1 percento, -3,8 punti).<br><br>","tab_h$tr£$td£SVP$/td£tab_r145tab_r2#547d34tab_r3$td£$b£29.8%$/b£$/td£§-2.9$/td£$/tr£$tr£$td£SP$/td£tab_r131tab_r2#ea546ftab_r3$td£$b£20.5%$/b£$/td£§+1.9$/td£$/tr£$tr£$td£FDP$/td£tab_r118tab_r2#6268AFtab_r3$td£$b£12.1%$/b£$/td£§-3.8$/td£$/tr£$tr£$td£Mitte$/td£tab_r118tab_r2#f39f5etab_r3$td£$b£11.7%$/b£$/td£§+0.5$/td£$/tr£$tr£$td£Grüne$/td£tab_r115tab_r2#26b300tab_r3$td£$b£10.3%$/b£$/td£§+3.7$/td£$/tr£$tr£$td£GLP$/td£tab_r112tab_r2#cbd401tab_r3$td£$b£7.7%$/b£$/td£§+2.4$/td£$/tr£$tr£$td£EVP$/td£tab_r15tab_r2#87bfdctab_r3$td£$b£3.4%$/b£$/td£§+0.4$/td£$/tr£$tr£$td£EDU$/td£tab_r15tab_r2#3aa59atab_r3$td£$b£3.2%$/b£$/td£§-0.9$/td£$/tr£$/table£$br£Gültige Wahlzettel: $b£2'402$/b£$br£Wahlbeteiligung: $b£37.8%$/b£ (-7.0%)","tab_h_fr$tr£$td£UDC$/td£tab_r145tab_r2#547d34tab_r3$td£$b£29.8%$/b£$/td£§-2.9$/td£$/tr£$tr£$td£PS$/td£tab_r131tab_r2#ea546ftab_r3$td£$b£20.5%$/b£$/td£§+1.9$/td£$/tr£$tr£$td£PLR$/td£tab_r118tab_r2#6268AFtab_r3$td£$b£12.1%$/b£$/td£§-3.8$/td£$/tr£$tr£$td£Centre$/td£tab_r118tab_r2#f39f5etab_r3$td£$b£11.7%$/b£$/td£§+0.5$/td£$/tr£$tr£$td£Vert-e-s$/td£tab_r115tab_r2#26b300tab_r3$td£$b£10.3%$/b£$/td£§+3.7$/td£$/tr£$tr£$td£PVL$/td£tab_r112tab_r2#cbd401tab_r3$td£$b£7.7%$/b£$/td£§+2.4$/td£$/tr£$tr£$td£PEV$/td£tab_r15tab_r2#87bfdctab_r3$td£$b£3.4%$/b£$/td£§+0.4$/td£$/tr£$tr£$td£UDF$/td£tab_r15tab_r2#3aa59atab_r3$td£$b£3.2%$/b£$/td£§-0.9$/td£$/tr£$/table£$br£Bulletins de vote valables: $b£2'402$/b£$br£Taux de participation: $b£37.8%$/b£ (-7.0%)","tab_h_it$tr£$td£UDC$/td£tab_r145tab_r2#547d34tab_r3$td£$b£29.8%$/b£$/td£§-2.9$/td£$/tr£$tr£$td£PS$/td£tab_r131tab_r2#ea546ftab_r3$td£$b£20.5%$/b£$/td£§+1.9$/td£$/tr£$tr£$td£PLR$/td£tab_r118tab_r2#6268AFtab_r3$td£$b£12.1%$/b£$/td£§-3.8$/td£$/tr£$tr£$td£Centro$/td£tab_r118tab_r2#f39f5etab_r3$td£$b£11.7%$/b£$/td£§+0.5$/td£$/tr£$tr£$td£Verdi$/td£tab_r115tab_r2#26b300tab_r3$td£$b£10.3%$/b£$/td£§+3.7$/td£$/tr£$tr£$td£PVL$/td£tab_r112tab_r2#cbd401tab_r3$td£$b£7.7%$/b£$/td£§+2.4$/td£$/tr£$tr£$td£PEV$/td£tab_r15tab_r2#87bfdctab_r3$td£$b£3.4%$/b£$/td£§+0.4$/td£$/tr£$tr£$td£UDF$/td£tab_r15tab_r2#3aa59atab_r3$td£$b£3.2%$/b£$/td£§-0.9$/td£$/tr£$/table£$br£Schede elettorali valide: $b£2'402$/b£$br£Tasso di partecipazione: $b£37.8%$/b£ (-7.0%)","SVP"
4441,"Salmsach TG","Salmsach (TG)","Salmsach TG","Unverändert ist die <b>SVP</b> die stärkste Partei in Salmsach mit 32,5 Prozent (-6,9 Prozentpunkte).<br><br>Die <b>SP</b> steigert sich mit einem Plus von +13,2 Prozentpunkte stark. Die Partei belegt nun den zweiten Platz in der Gemeinde. Der Wählerstimmenanteil beträgt neu 27,3 Prozent.<br><br>Den dritten Platz belegen die <b>Grünen</b>. Die Partei erzielt einen Wähleranteil von 12,3 Prozent (Veränderung gegenüber 2019: +0,5 Prozentpunkte).","Aucune formation politique ne parvient à prendre la place de numéro un au <b>UDC</b> à Salmsach. Le parti obtient 32,5 % des suffrages (-6,9 points de pourcentage).<br><br>Une progression significative de +13,2 points de pourcentage permet au <b>PS</b> de devenir le deuxième parti de sa commune. La formation politique recueille27,3 % des voix.<br><br>La troisième place est occupée par les <b>Vert-e-s</b>. La formation obtient un pourcentage d'électeurs de 12,3. (+0,5 points de pourcentage de différence par rapport à 2019).","Il partito <b>UDC</b> mantiene il primo posto a Salmsach e ottiene il 32,5 percento dei voti (-6,9 punti percentuali).<br><br>Il partito <b>PS</b> perde molte preferenze. Il partito registra una diminuzione di +13,2 punti percentuali rispetto alle elezioni del 2019. Nonostante ciò, rimane in seconda posizione con una percentuale di elettori del 27,3 percento.<br><br>Il partito <b>Verdi</b> si posiziona terzo con il 12,3 percento dei voti. Questo rappresenta una variazione di +0,5 punti percentuali rispetto al 2019.","tab_h$tr£$td£SVP$/td£tab_r149tab_r2#547d34tab_r3$td£$b£32.5%$/b£$/td£§-6.9$/td£$/tr£$tr£$td£SP$/td£tab_r141tab_r2#ea546ftab_r3$td£$b£27.3%$/b£$/td£§+13.2$/td£$/tr£$tr£$td£Grüne$/td£tab_r119tab_r2#26b300tab_r3$td£$b£12.3%$/b£$/td£§+0.5$/td£$/tr£$tr£$td£Mitte$/td£tab_r113tab_r2#f39f5etab_r3$td£$b£8.7%$/b£$/td£§-2.1$/td£$/tr£$tr£$td£GLP$/td£tab_r110tab_r2#cbd401tab_r3$td£$b£6.6%$/b£$/td£§+1.7$/td£$/tr£$tr£$td£FDP$/td£tab_r18tab_r2#6268AFtab_r3$td£$b£5.3%$/b£$/td£§-2.7$/td£$/tr£$/table£$br£Gültige Wahlzettel: $b£305$/b£$br£Wahlbeteiligung: $b£37.2%$/b£ (-6.2%)","tab_h_fr$tr£$td£UDC$/td£tab_r149tab_r2#547d34tab_r3$td£$b£32.5%$/b£$/td£§-6.9$/td£$/tr£$tr£$td£PS$/td£tab_r141tab_r2#ea546ftab_r3$td£$b£27.3%$/b£$/td£§+13.2$/td£$/tr£$tr£$td£Vert-e-s$/td£tab_r119tab_r2#26b300tab_r3$td£$b£12.3%$/b£$/td£§+0.5$/td£$/tr£$tr£$td£Centre$/td£tab_r113tab_r2#f39f5etab_r3$td£$b£8.7%$/b£$/td£§-2.1$/td£$/tr£$tr£$td£PVL$/td£tab_r110tab_r2#cbd401tab_r3$td£$b£6.6%$/b£$/td£§+1.7$/td£$/tr£$tr£$td£PLR$/td£tab_r18tab_r2#6268AFtab_r3$td£$b£5.3%$/b£$/td£§-2.7$/td£$/tr£$/table£$br£Bulletins de vote valables: $b£305$/b£$br£Taux de participation: $b£37.2%$/b£ (-6.2%)","tab_h_it$tr£$td£UDC$/td£tab_r149tab_r2#547d34tab_r3$td£$b£32.5%$/b£$/td£§-6.9$/td£$/tr£$tr£$td£PS$/td£tab_r141tab_r2#ea546ftab_r3$td£$b£27.3%$/b£$/td£§+13.2$/td£$/tr£$tr£$td£Verdi$/td£tab_r119tab_r2#26b300tab_r3$td£$b£12.3%$/b£$/td£§+0.5$/td£$/tr£$tr£$td£Centro$/td£tab_r113tab_r2#f39f5etab_r3$td£$b£8.7%$/b£$/td£§-2.1$/td£$/tr£$tr£$td£PVL$/td£tab_r110tab_r2#cbd401tab_r3$td£$b£6.6%$/b£$/td£§+1.7$/td£$/tr£$tr£$td£PLR$/td£tab_r18tab_r2#6268AFtab_r3$td£$b£5.3%$/b£$/td£§-2.7$/td£$/tr£$/table£$br£Schede elettorali valide: $b£305$/b£$br£Tasso di partecipazione: $b£37.2%$/b£ (-6.2%)","SVP"
4446,"Sommeri TG","Sommeri (TG)","Sommeri TG","Kein Weg führt in Sommeri an der <b>SVP</b> vorbei. Die Partei holt mehr als die Hälfte der Stimmen und damit eine absolute Mehrheit.<br><br>Zweitstärkste Partei sind die <b>Grünen</b>. Die Partei verbessert sich gegenüber den Wahlen 2019 um +6,4 Prozentpunkte deutlich und weist neu einen Wähleranteil von 14 Prozent auf.<br><br>Auf dem dritten Platz landet die <b>Mitte</b> mit 10,5 Prozent der Stimmen. Das bedeutet eine Veränderung von -1,5 Prozentpunkten gegenüber 2019. ","L'<b>UDC</b> est incontournable à Sommeri. Le parti a remporté plus de la moitié des voix et donc obtenu la majorité absolue.<br><br>Une progression significative de +6,4 points de pourcentage permet aux <b>Vert-e-s</b> de devenir le deuxième parti de sa commune. La formation politique recueille14 % des voix.<br><br>Le <b>Centre</b> complète le podium. La formation récolte 10,5 % des suffrages (-1,5).","Il partito <b>UDC</b> è il leader indiscusso a Sommeri, ottenendo la maggioranza assoluta nel comune.<br><br>Il partito <b>Verdi</b> progredisce notevolmente: ha migliorato il suo risultato di quattro anni fa di +6,4 punti percentuali ed è ora al secondo posto nel comune. La proporzione di voti del partito è ora del 14 percento.<br><br>Il partito <b>Centro</b> si classifica terzo, ottenendo il 10,5 percento dei voti (-1,5 punti percentuali rispetto al 2019).","tab_h$tr£$td£SVP$/td£tab_r176tab_r2#547d34tab_r3$td£$b£50.4%$/b£$/td£§+3.1$/td£$/tr£$tr£$td£Grüne$/td£tab_r121tab_r2#26b300tab_r3$td£$b£14.0%$/b£$/td£§+6.4$/td£$/tr£$tr£$td£Mitte$/td£tab_r116tab_r2#f39f5etab_r3$td£$b£10.5%$/b£$/td£§-1.5$/td£$/tr£$tr£$td£SP$/td£tab_r111tab_r2#ea546ftab_r3$td£$b£7.4%$/b£$/td£§-2.5$/td£$/tr£$tr£$td£GLP$/td£tab_r110tab_r2#cbd401tab_r3$td£$b£6.6%$/b£$/td£§+0.0$/td£$/tr£$tr£$td£EVP$/td£tab_r17tab_r2#87bfdctab_r3$td£$b£4.5%$/b£$/td£§+2.2$/td£$/tr£$tr£$td£FDP$/td£tab_r15tab_r2#6268AFtab_r3$td£$b£3.4%$/b£$/td£§-2.0$/td£$/tr£$/table£$br£Gültige Wahlzettel: $b£175$/b£$br£Wahlbeteiligung: $b£45.6%$/b£ (-8.7%)","tab_h_fr$tr£$td£UDC$/td£tab_r176tab_r2#547d34tab_r3$td£$b£50.4%$/b£$/td£§+3.1$/td£$/tr£$tr£$td£Vert-e-s$/td£tab_r121tab_r2#26b300tab_r3$td£$b£14.0%$/b£$/td£§+6.4$/td£$/tr£$tr£$td£Centre$/td£tab_r116tab_r2#f39f5etab_r3$td£$b£10.5%$/b£$/td£§-1.5$/td£$/tr£$tr£$td£PS$/td£tab_r111tab_r2#ea546ftab_r3$td£$b£7.4%$/b£$/td£§-2.5$/td£$/tr£$tr£$td£PVL$/td£tab_r110tab_r2#cbd401tab_r3$td£$b£6.6%$/b£$/td£§+0.0$/td£$/tr£$tr£$td£PEV$/td£tab_r17tab_r2#87bfdctab_r3$td£$b£4.5%$/b£$/td£§+2.2$/td£$/tr£$tr£$td£PLR$/td£tab_r15tab_r2#6268AFtab_r3$td£$b£3.4%$/b£$/td£§-2.0$/td£$/tr£$/table£$br£Bulletins de vote valables: $b£175$/b£$br£Taux de participation: $b£45.6%$/b£ (-8.7%)","tab_h_it$tr£$td£UDC$/td£tab_r176tab_r2#547d34tab_r3$td£$b£50.4%$/b£$/td£§+3.1$/td£$/tr£$tr£$td£Verdi$/td£tab_r121tab_r2#26b300tab_r3$td£$b£14.0%$/b£$/td£§+6.4$/td£$/tr£$tr£$td£Centro$/td£tab_r116tab_r2#f39f5etab_r3$td£$b£10.5%$/b£$/td£§-1.5$/td£$/tr£$tr£$td£PS$/td£tab_r111tab_r2#ea546ftab_r3$td£$b£7.4%$/b£$/td£§-2.5$/td£$/tr£$tr£$td£PVL$/td£tab_r110tab_r2#cbd401tab_r3$td£$b£6.6%$/b£$/td£§+0.0$/td£$/tr£$tr£$td£PEV$/td£tab_r17tab_r2#87bfdctab_r3$td£$b£4.5%$/b£$/td£§+2.2$/td£$/tr£$tr£$td£PLR$/td£tab_r15tab_r2#6268AFtab_r3$td£$b£3.4%$/b£$/td£§-2.0$/td£$/tr£$/table£$br£Schede elettorali valide: $b£175$/b£$br£Tasso di partecipazione: $b£45.6%$/b£ (-8.7%)","SVP"
4451,"Uttwil TG","Uttwil (TG)","Uttwil TG","Nach wie vor ist die <b>SVP</b> in Uttwil unangefochten die grösste Partei, mit einem Wähleranteil von 38,4 Prozent (-4,9 Prozentpunkte). Der Vorsprung auf die zweitstärkste Partei, die <b>FDP</b>, ist beträchtlich - nämlich 20,2 Prozentpunkte. Die <b>FDP</b> erreicht einen Wähleranteil von 18,2 Prozent (-3,1 Prozentpunkte). <br><br>Die <b>Grünen</b> verzeichnen einen deutlichen Zuwachs. Die Partei belegt nun den dritten Platz in der Gemeinde und erreicht neu einen Wähleranteil von 11,9 Prozent. Das sind +6,6 Prozentpunkte mehr als im Vergleich zu den letzten Wahlen.","L'<b>UDC</b> maintient sa position de plus grand parti dans la commune d'Uttwil à, avec un pourcentage d'électeurs de 38,4 (-4,9 points de pourcentage). L'écart avec le deuxième plus grand parti, le <b><b>PL</b>R</b>, est de 20,2 points de pourcentage. <b><b>PL</b>R</b> obtient 18,2 pourcent des voix (-3,1 points de pourcentage).<br><br>Une forte progression de +6,6 points de pourcentage par rapport aux dernières élections fédérales permet aux <b>Vert-e-s</b> de grimper à la troisième place dans la commune. Son pourcentage d'électeurs est désormais de 11,9 %.","Il partito <b>UDC</b> rimane il partito preferito degli elettori di Uttwil, totalizzando il 38,4 percento dei voti (-4,9 punti percentuali rispetto al 2019). Ha 20,2 punti in più del partito <b>PLR</b> che, con il 18,2 percento dei voti (-3,1 punti percentuali), si classifica al secondo posto in questo comune.<br><br>Grazie a un notevole aumento di +6,6 punti percentuali rispetto alle ultime elezioni federali, il partito <b>Verdi</b> raggiunge il terzo posto nel comune. Ora ha una percentuale di elettori del 11,9 percento.","tab_h$tr£$td£SVP$/td£tab_r158tab_r2#547d34tab_r3$td£$b£38.4%$/b£$/td£§-4.9$/td£$/tr£$tr£$td£FDP$/td£tab_r127tab_r2#6268AFtab_r3$td£$b£18.2%$/b£$/td£§-3.1$/td£$/tr£$tr£$td£Grüne$/td£tab_r118tab_r2#26b300tab_r3$td£$b£11.9%$/b£$/td£§+6.6$/td£$/tr£$tr£$td£SP$/td£tab_r118tab_r2#ea546ftab_r3$td£$b£11.8%$/b£$/td£§+0.0$/td£$/tr£$tr£$td£Mitte$/td£tab_r113tab_r2#f39f5etab_r3$td£$b£8.9%$/b£$/td£§+2.4$/td£$/tr£$tr£$td£GLP$/td£tab_r111tab_r2#cbd401tab_r3$td£$b£7.4%$/b£$/td£§+1.6$/td£$/tr£$/table£$br£Gültige Wahlzettel: $b£573$/b£$br£Wahlbeteiligung: $b£46.6%$/b£ (-5.8%)","tab_h_fr$tr£$td£UDC$/td£tab_r158tab_r2#547d34tab_r3$td£$b£38.4%$/b£$/td£§-4.9$/td£$/tr£$tr£$td£PLR$/td£tab_r127tab_r2#6268AFtab_r3$td£$b£18.2%$/b£$/td£§-3.1$/td£$/tr£$tr£$td£Vert-e-s$/td£tab_r118tab_r2#26b300tab_r3$td£$b£11.9%$/b£$/td£§+6.6$/td£$/tr£$tr£$td£PS$/td£tab_r118tab_r2#ea546ftab_r3$td£$b£11.8%$/b£$/td£§+0.0$/td£$/tr£$tr£$td£Centre$/td£tab_r113tab_r2#f39f5etab_r3$td£$b£8.9%$/b£$/td£§+2.4$/td£$/tr£$tr£$td£PVL$/td£tab_r111tab_r2#cbd401tab_r3$td£$b£7.4%$/b£$/td£§+1.6$/td£$/tr£$/table£$br£Bulletins de vote valables: $b£573$/b£$br£Taux de participation: $b£46.6%$/b£ (-5.8%)","tab_h_it$tr£$td£UDC$/td£tab_r158tab_r2#547d34tab_r3$td£$b£38.4%$/b£$/td£§-4.9$/td£$/tr£$tr£$td£PLR$/td£tab_r127tab_r2#6268AFtab_r3$td£$b£18.2%$/b£$/td£§-3.1$/td£$/tr£$tr£$td£Verdi$/td£tab_r118tab_r2#26b300tab_r3$td£$b£11.9%$/b£$/td£§+6.6$/td£$/tr£$tr£$td£PS$/td£tab_r118tab_r2#ea546ftab_r3$td£$b£11.8%$/b£$/td£§+0.0$/td£$/tr£$tr£$td£Centro$/td£tab_r113tab_r2#f39f5etab_r3$td£$b£8.9%$/b£$/td£§+2.4$/td£$/tr£$tr£$td£PVL$/td£tab_r111tab_r2#cbd401tab_r3$td£$b£7.4%$/b£$/td£§+1.6$/td£$/tr£$/table£$br£Schede elettorali valide: $b£573$/b£$br£Tasso di partecipazione: $b£46.6%$/b£ (-5.8%)","SVP"
4461,"Amriswil TG","Amriswil (TG)","Amriswil TG","In Amriswil ist die <b>SVP</b> weiterhin mit deutlichem Abstand die grösste Partei. Sie holt 37,7 Prozent der Stimmen, 25,1 Prozentpunkte mehr als die nächstgrössere Partei.<br><br>Den dritten Platz belegt die <b>SP</b>. Die Partei erzielt einen Wähleranteil von zwölf Prozent (Veränderung gegenüber 2019: +0,4 Prozentpunkte).","Avec 37,7 % des voix (-2,2 points de pourcentage), la position de leader du <b>UDC</b> est solide à Amriswil. L'avance atteint 25,1 points par rapport au parti suivant. En comparaison, le <b><b>PL</b>R</b> se classe deuxième avec 12,6 % des suffrages (-4 points de pourcentage). <br><br>La troisième place est occupée par le <b>PS</b>. Le parti emmagasine douze % des voix (+0,4 points de pourcentage par rapport à 2019) ","Il partito <b>UDC</b> rimane nettamente il partito più forte a Amriswil, con il 37,7 percento dei voti (-2,2 punti percentuali). Il vantaggio sul partito <b>PLR</b>, che ottiene il 12,6 percento dei voti (-4 punti percentuali), è notevole. La differenza è di 25,1 punti percentuali.<br><br>La terza posizione è occupata dal partito <b>PS</b> che ottiene il dodici percento dei voti (+0,4 punti percentuali rispetto al 2019).","tab_h$tr£$td£SVP$/td£tab_r157tab_r2#547d34tab_r3$td£$b£37.7%$/b£$/td£§-2.2$/td£$/tr£$tr£$td£FDP$/td£tab_r119tab_r2#6268AFtab_r3$td£$b£12.6%$/b£$/td£§-4.0$/td£$/tr£$tr£$td£SP$/td£tab_r118tab_r2#ea546ftab_r3$td£$b£12.0%$/b£$/td£§+0.4$/td£$/tr£$tr£$td£Mitte$/td£tab_r118tab_r2#f39f5etab_r3$td£$b£11.9%$/b£$/td£§+1.0$/td£$/tr£$tr£$td£Grüne$/td£tab_r116tab_r2#26b300tab_r3$td£$b£10.5%$/b£$/td£§+5.5$/td£$/tr£$tr£$td£GLP$/td£tab_r110tab_r2#cbd401tab_r3$td£$b£6.4%$/b£$/td£§+2.2$/td£$/tr£$tr£$td£EDU$/td£tab_r16tab_r2#3aa59atab_r3$td£$b£4.2%$/b£$/td£§-1.1$/td£$/tr£$tr£$td£EVP$/td£tab_r15tab_r2#87bfdctab_r3$td£$b£3.1%$/b£$/td£§+0.8$/td£$/tr£$/table£$br£Gültige Wahlzettel: $b£2'623$/b£$br£Wahlbeteiligung: $b£34.8%$/b£ (-6.4%)","tab_h_fr$tr£$td£UDC$/td£tab_r157tab_r2#547d34tab_r3$td£$b£37.7%$/b£$/td£§-2.2$/td£$/tr£$tr£$td£PLR$/td£tab_r119tab_r2#6268AFtab_r3$td£$b£12.6%$/b£$/td£§-4.0$/td£$/tr£$tr£$td£PS$/td£tab_r118tab_r2#ea546ftab_r3$td£$b£12.0%$/b£$/td£§+0.4$/td£$/tr£$tr£$td£Centre$/td£tab_r118tab_r2#f39f5etab_r3$td£$b£11.9%$/b£$/td£§+1.0$/td£$/tr£$tr£$td£Vert-e-s$/td£tab_r116tab_r2#26b300tab_r3$td£$b£10.5%$/b£$/td£§+5.5$/td£$/tr£$tr£$td£PVL$/td£tab_r110tab_r2#cbd401tab_r3$td£$b£6.4%$/b£$/td£§+2.2$/td£$/tr£$tr£$td£UDF$/td£tab_r16tab_r2#3aa59atab_r3$td£$b£4.2%$/b£$/td£§-1.1$/td£$/tr£$tr£$td£PEV$/td£tab_r15tab_r2#87bfdctab_r3$td£$b£3.1%$/b£$/td£§+0.8$/td£$/tr£$/table£$br£Bulletins de vote valables: $b£2'623$/b£$br£Taux de participation: $b£34.8%$/b£ (-6.4%)","tab_h_it$tr£$td£UDC$/td£tab_r157tab_r2#547d34tab_r3$td£$b£37.7%$/b£$/td£§-2.2$/td£$/tr£$tr£$td£PLR$/td£tab_r119tab_r2#6268AFtab_r3$td£$b£12.6%$/b£$/td£§-4.0$/td£$/tr£$tr£$td£PS$/td£tab_r118tab_r2#ea546ftab_r3$td£$b£12.0%$/b£$/td£§+0.4$/td£$/tr£$tr£$td£Centro$/td£tab_r118tab_r2#f39f5etab_r3$td£$b£11.9%$/b£$/td£§+1.0$/td£$/tr£$tr£$td£Verdi$/td£tab_r116tab_r2#26b300tab_r3$td£$b£10.5%$/b£$/td£§+5.5$/td£$/tr£$tr£$td£PVL$/td£tab_r110tab_r2#cbd401tab_r3$td£$b£6.4%$/b£$/td£§+2.2$/td£$/tr£$tr£$td£UDF$/td£tab_r16tab_r2#3aa59atab_r3$td£$b£4.2%$/b£$/td£§-1.1$/td£$/tr£$tr£$td£PEV$/td£tab_r15tab_r2#87bfdctab_r3$td£$b£3.1%$/b£$/td£§+0.8$/td£$/tr£$/table£$br£Schede elettorali valide: $b£2'623$/b£$br£Tasso di partecipazione: $b£34.8%$/b£ (-6.4%)","SVP"
4471,"Bischofszell TG","Bischofszell (TG)","Bischofszell TG","Die Reihenfolge der Parteien in Bischofszell bleibt im Vergleich zu den Wahlen 2019 gleich: Die <b>SVP</b> bleibt mit 32,9 Prozent die stärkste Kraft, gefolgt von der <b>Mitte</b> (16,9 Prozent, +1 Prozentpunkte) und der <b>SP</b> (11,5 Prozent, -1 Prozentpunkte).<br><br>","Le trio de tête reste inchangé à Bischofszell: l'<b>UDC</b> reste premier avec 32,9 % des voix. La formation devance le <b>Centre</b> (16,9 %, +1 points de pourcentage) et le <b>PS</b> (11,5 %, -1 points). <br><br>","Nulla è cambiato in quattro anni a Bischofszell: i tre stessi partiti rimangono in cima. Il partito <b>UDC</b> mantiene la sua posizione al primo posto con il 32,9 percento dei voti. Precede il partito <b>Centro</b> (16,9 percento, +1 punti percentuali) e il partito <b>PS</b> (il 11,5 percento, -1 punti percentuali).<br><br>","tab_h$tr£$td£SVP$/td£tab_r149tab_r2#547d34tab_r3$td£$b£32.9%$/b£$/td£§-3.4$/td£$/tr£$tr£$td£Mitte$/td£tab_r125tab_r2#f39f5etab_r3$td£$b£16.9%$/b£$/td£§+1.0$/td£$/tr£$tr£$td£SP$/td£tab_r117tab_r2#ea546ftab_r3$td£$b£11.5%$/b£$/td£§-1.0$/td£$/tr£$tr£$td£GLP$/td£tab_r116tab_r2#cbd401tab_r3$td£$b£10.8%$/b£$/td£§+4.6$/td£$/tr£$tr£$td£Grüne$/td£tab_r112tab_r2#26b300tab_r3$td£$b£8.0%$/b£$/td£§+3.3$/td£$/tr£$tr£$td£EDU$/td£tab_r112tab_r2#3aa59atab_r3$td£$b£7.7%$/b£$/td£§-0.6$/td£$/tr£$tr£$td£FDP$/td£tab_r111tab_r2#6268AFtab_r3$td£$b£7.3%$/b£$/td£§-2.8$/td£$/tr£$tr£$td£EVP$/td£tab_r15tab_r2#87bfdctab_r3$td£$b£3.4%$/b£$/td£§+0.2$/td£$/tr£$/table£$br£Gültige Wahlzettel: $b£1'458$/b£$br£Wahlbeteiligung: $b£41.2%$/b£ (-3.1%)","tab_h_fr$tr£$td£UDC$/td£tab_r149tab_r2#547d34tab_r3$td£$b£32.9%$/b£$/td£§-3.4$/td£$/tr£$tr£$td£Centre$/td£tab_r125tab_r2#f39f5etab_r3$td£$b£16.9%$/b£$/td£§+1.0$/td£$/tr£$tr£$td£PS$/td£tab_r117tab_r2#ea546ftab_r3$td£$b£11.5%$/b£$/td£§-1.0$/td£$/tr£$tr£$td£PVL$/td£tab_r116tab_r2#cbd401tab_r3$td£$b£10.8%$/b£$/td£§+4.6$/td£$/tr£$tr£$td£Vert-e-s$/td£tab_r112tab_r2#26b300tab_r3$td£$b£8.0%$/b£$/td£§+3.3$/td£$/tr£$tr£$td£UDF$/td£tab_r112tab_r2#3aa59atab_r3$td£$b£7.7%$/b£$/td£§-0.6$/td£$/tr£$tr£$td£PLR$/td£tab_r111tab_r2#6268AFtab_r3$td£$b£7.3%$/b£$/td£§-2.8$/td£$/tr£$tr£$td£PEV$/td£tab_r15tab_r2#87bfdctab_r3$td£$b£3.4%$/b£$/td£§+0.2$/td£$/tr£$/table£$br£Bulletins de vote valables: $b£1'458$/b£$br£Taux de participation: $b£41.2%$/b£ (-3.1%)","tab_h_it$tr£$td£UDC$/td£tab_r149tab_r2#547d34tab_r3$td£$b£32.9%$/b£$/td£§-3.4$/td£$/tr£$tr£$td£Centro$/td£tab_r125tab_r2#f39f5etab_r3$td£$b£16.9%$/b£$/td£§+1.0$/td£$/tr£$tr£$td£PS$/td£tab_r117tab_r2#ea546ftab_r3$td£$b£11.5%$/b£$/td£§-1.0$/td£$/tr£$tr£$td£PVL$/td£tab_r116tab_r2#cbd401tab_r3$td£$b£10.8%$/b£$/td£§+4.6$/td£$/tr£$tr£$td£Verdi$/td£tab_r112tab_r2#26b300tab_r3$td£$b£8.0%$/b£$/td£§+3.3$/td£$/tr£$tr£$td£UDF$/td£tab_r112tab_r2#3aa59atab_r3$td£$b£7.7%$/b£$/td£§-0.6$/td£$/tr£$tr£$td£PLR$/td£tab_r111tab_r2#6268AFtab_r3$td£$b£7.3%$/b£$/td£§-2.8$/td£$/tr£$tr£$td£PEV$/td£tab_r15tab_r2#87bfdctab_r3$td£$b£3.4%$/b£$/td£§+0.2$/td£$/tr£$/table£$br£Schede elettorali valide: $b£1'458$/b£$br£Tasso di partecipazione: $b£41.2%$/b£ (-3.1%)","SVP"
4476,"Erlen TG","Erlen (TG)","Erlen TG","Mit grossem Abstand verteidigt die <b>SVP</b> ihre Position als grösste Partei in Erlen, mit einem Wähleranteil von 46,1 Prozent (-1 Prozentpunkte). Der Abstand zur zweitgrößten Partei, der <b>Mitte</b>, beträgt 33,2 Prozentpunkte. Die <b>Mitte</b> erhält 12,9 Prozent der Stimmen (+3 Prozentpunkte).<br><br>Den dritten Platz belegt die <b>SP</b>. Die Partei erzielt einen Wähleranteil von 9,2 Prozent (Veränderung gegenüber 2019: -0,7 Prozentpunkte).","L'<b>UDC</b> maintient sa position de plus grand parti dans la commune d'Erlen à, avec un pourcentage d'électeurs de 46,1 (-1 points de pourcentage). L'écart avec le deuxième plus grand parti, le <b>Centre</b>, est de 33,2 points de pourcentage. <b>Centre</b> obtient 12,9 pourcent des voix (+3 points de pourcentage).<br><br>Le <b>PS</b> arrive en troisième position avec 9,2 % des votes. Cela représente un changement de -0,7 points de pourcentage par rapport à 2019.","Il partito <b>UDC</b> rimane il partito preferito degli elettori di Erlen, totalizzando il 46,1 percento dei voti (-1 punti percentuali rispetto al 2019). Ha 33,2 punti in più del partito <b>Centro</b> che, con il 12,9 percento dei voti (+3 punti percentuali), si classifica al secondo posto in questo comune.<br><br>La terza posizione è occupata dal partito <b>PS</b> che ottiene il 9,2 percento dei voti (-0,7 punti percentuali rispetto al 2019).","tab_h$tr£$td£SVP$/td£tab_r169tab_r2#547d34tab_r3$td£$b£46.1%$/b£$/td£§-1.0$/td£$/tr£$tr£$td£Mitte$/td£tab_r119tab_r2#f39f5etab_r3$td£$b£12.9%$/b£$/td£§+3.0$/td£$/tr£$tr£$td£SP$/td£tab_r114tab_r2#ea546ftab_r3$td£$b£9.2%$/b£$/td£§-0.7$/td£$/tr£$tr£$td£FDP$/td£tab_r113tab_r2#6268AFtab_r3$td£$b£8.8%$/b£$/td£§-2.8$/td£$/tr£$tr£$td£Grüne$/td£tab_r112tab_r2#26b300tab_r3$td£$b£8.3%$/b£$/td£§+3.9$/td£$/tr£$tr£$td£EDU$/td£tab_r18tab_r2#3aa59atab_r3$td£$b£5.5%$/b£$/td£§-0.8$/td£$/tr£$tr£$td£GLP$/td£tab_r17tab_r2#cbd401tab_r3$td£$b£4.8%$/b£$/td£§+0.0$/td£$/tr£$/table£$br£Gültige Wahlzettel: $b£884$/b£$br£Wahlbeteiligung: $b£41.9%$/b£ (-0.4%)","tab_h_fr$tr£$td£UDC$/td£tab_r169tab_r2#547d34tab_r3$td£$b£46.1%$/b£$/td£§-1.0$/td£$/tr£$tr£$td£Centre$/td£tab_r119tab_r2#f39f5etab_r3$td£$b£12.9%$/b£$/td£§+3.0$/td£$/tr£$tr£$td£PS$/td£tab_r114tab_r2#ea546ftab_r3$td£$b£9.2%$/b£$/td£§-0.7$/td£$/tr£$tr£$td£PLR$/td£tab_r113tab_r2#6268AFtab_r3$td£$b£8.8%$/b£$/td£§-2.8$/td£$/tr£$tr£$td£Vert-e-s$/td£tab_r112tab_r2#26b300tab_r3$td£$b£8.3%$/b£$/td£§+3.9$/td£$/tr£$tr£$td£UDF$/td£tab_r18tab_r2#3aa59atab_r3$td£$b£5.5%$/b£$/td£§-0.8$/td£$/tr£$tr£$td£PVL$/td£tab_r17tab_r2#cbd401tab_r3$td£$b£4.8%$/b£$/td£§+0.0$/td£$/tr£$/table£$br£Bulletins de vote valables: $b£884$/b£$br£Taux de participation: $b£41.9%$/b£ (-0.4%)","tab_h_it$tr£$td£UDC$/td£tab_r169tab_r2#547d34tab_r3$td£$b£46.1%$/b£$/td£§-1.0$/td£$/tr£$tr£$td£Centro$/td£tab_r119tab_r2#f39f5etab_r3$td£$b£12.9%$/b£$/td£§+3.0$/td£$/tr£$tr£$td£PS$/td£tab_r114tab_r2#ea546ftab_r3$td£$b£9.2%$/b£$/td£§-0.7$/td£$/tr£$tr£$td£PLR$/td£tab_r113tab_r2#6268AFtab_r3$td£$b£8.8%$/b£$/td£§-2.8$/td£$/tr£$tr£$td£Verdi$/td£tab_r112tab_r2#26b300tab_r3$td£$b£8.3%$/b£$/td£§+3.9$/td£$/tr£$tr£$td£UDF$/td£tab_r18tab_r2#3aa59atab_r3$td£$b£5.5%$/b£$/td£§-0.8$/td£$/tr£$tr£$td£PVL$/td£tab_r17tab_r2#cbd401tab_r3$td£$b£4.8%$/b£$/td£§+0.0$/td£$/tr£$/table£$br£Schede elettorali valide: $b£884$/b£$br£Tasso di partecipazione: $b£41.9%$/b£ (-0.4%)","SVP"
