"ID","Gemeinde_de","Gemeinde_fr","Gemeinde_it","Text_de","Text_fr","Text_it","Tabelle_de","Tabelle_fr","Tabelle_it","Staerkste_Partei"
3392,"Kirchberg SG","Kirchberg (SG)","Kirchberg SG","Die <b>SVP</b> behauptet ihre Position als vorherrschende Partei in Kirchberg SG. Die Partei verzeichnet einen Wähleranteil von 36,7 Prozent (-5,1 Prozentpunkte).<br><br>Die <b>Mitte</b> ist die zweitstärkste Kraft in der Gemeinde. Die Partei kommt auf 26,4 Prozent (+3,3 Prozentpunkte).<br><br>Die <b>FDP</b> landet mit 11,6 Prozent auf dem dritten Platz (Veränderung gegenüber 2019: +0,4 Prozentpunkte).","Les électeurs de Kirchberg (SG) maintiennent leur confiance au <b>UDC</b>, qui termine en tête dans leur commune, comme en 2019, avec 36,7 % des voix (-5,1 points de pourcentage).<br><br>Le <b>Centre</b> arrive en deuxième position dans la commune, avec un pourcentage de votants de 26,4 (+3,3 points de pourcentage)<br><br>Le <b><b>PL</b>R</b> se classe troisième. La formation obtient 11,6 % des voix (+0,4 points de pourcentage par rapport à 2019).","Il partito <b>UDC</b> è imbattuto a Kirchberg SG, dove ha ottenuto il 36,7 percento dei voti (-5,1 punti percentuali).<br><br>Il partito <b>Centro</b> è la seconda formazione più forte con il 26,4 percento dei voti (+3,3 punti percentuali rispetto al 2019).<br><br>La terza posizione è occupata dal partito <b>PLR</b> che ottiene il 11,6 percento dei voti (+0,4 punti percentuali rispetto al 2019).","tab_h$tr£$td£SVP$/td£tab_r155tab_r2#547d34tab_r3$td£$b£36.7%$/b£$/td£§-5.1$/td£$/tr£$tr£$td£Mitte$/td£tab_r140tab_r2#f39f5etab_r3$td£$b£26.4%$/b£$/td£§+3.3$/td£$/tr£$tr£$td£FDP$/td£tab_r117tab_r2#6268AFtab_r3$td£$b£11.6%$/b£$/td£§+0.4$/td£$/tr£$tr£$td£SP$/td£tab_r113tab_r2#ea546ftab_r3$td£$b£8.4%$/b£$/td£§-0.3$/td£$/tr£$tr£$td£Grüne$/td£tab_r112tab_r2#26b300tab_r3$td£$b£8.0%$/b£$/td£§+2.9$/td£$/tr£$tr£$td£GLP$/td£tab_r17tab_r2#cbd401tab_r3$td£$b£4.6%$/b£$/td£§+1.8$/td£$/tr£$/table£$br£Gültige Wahlzettel: $b£2'231$/b£$br£Wahlbeteiligung: $b£43.8%$/b£ (-5.9%)","tab_h_fr$tr£$td£UDC$/td£tab_r155tab_r2#547d34tab_r3$td£$b£36.7%$/b£$/td£§-5.1$/td£$/tr£$tr£$td£Centre$/td£tab_r140tab_r2#f39f5etab_r3$td£$b£26.4%$/b£$/td£§+3.3$/td£$/tr£$tr£$td£PLR$/td£tab_r117tab_r2#6268AFtab_r3$td£$b£11.6%$/b£$/td£§+0.4$/td£$/tr£$tr£$td£PS$/td£tab_r113tab_r2#ea546ftab_r3$td£$b£8.4%$/b£$/td£§-0.3$/td£$/tr£$tr£$td£Vert-e-s$/td£tab_r112tab_r2#26b300tab_r3$td£$b£8.0%$/b£$/td£§+2.9$/td£$/tr£$tr£$td£PVL$/td£tab_r17tab_r2#cbd401tab_r3$td£$b£4.6%$/b£$/td£§+1.8$/td£$/tr£$/table£$br£Bulletins de vote valables: $b£2'231$/b£$br£Taux de participation: $b£43.8%$/b£ (-5.9%)","tab_h_it$tr£$td£UDC$/td£tab_r155tab_r2#547d34tab_r3$td£$b£36.7%$/b£$/td£§-5.1$/td£$/tr£$tr£$td£Centro$/td£tab_r140tab_r2#f39f5etab_r3$td£$b£26.4%$/b£$/td£§+3.3$/td£$/tr£$tr£$td£PLR$/td£tab_r117tab_r2#6268AFtab_r3$td£$b£11.6%$/b£$/td£§+0.4$/td£$/tr£$tr£$td£PS$/td£tab_r113tab_r2#ea546ftab_r3$td£$b£8.4%$/b£$/td£§-0.3$/td£$/tr£$tr£$td£Verdi$/td£tab_r112tab_r2#26b300tab_r3$td£$b£8.0%$/b£$/td£§+2.9$/td£$/tr£$tr£$td£PVL$/td£tab_r17tab_r2#cbd401tab_r3$td£$b£4.6%$/b£$/td£§+1.8$/td£$/tr£$/table£$br£Schede elettorali valide: $b£2'231$/b£$br£Tasso di partecipazione: $b£43.8%$/b£ (-5.9%)","SVP"
3393,"Lütisburg SG","Lütisburg (SG)","Lütisburg SG","Alles bleibt beim Alten in Lütisburg: Die drei stärksten Parteien verteidigen ihre Spitzenplätze in unveränderter Reihenfolge: Die <b>SVP</b> geht mit 37,6 Prozent (+0,6 Prozentpunkte) wieder als stärkste Kraft aus den Nationalratswahlen. Zweitstärkste Partei ist die <b>Mitte</b> (20,7 Prozent, +0,1 Prozentpunkte), drittstärkste die <b>FDP</b> (15,5 Prozent, -2,3 Prozentpunkte).<br><br>","Rien n'a changé en quatre ans à Lütisburg: les trois même partis restent en tête. L'<b>UDC</b> conserve sa première place avec 37,6 % des voix. La formation devance le <b>Centre</b> (20,7 %, +0,1 points de pourcentage) et le <b><b>PL</b>R</b> (15,5 %, -2,3 points de pourcentage).<br><br>","Il trio di testa rimane invariato a Lütisburg: il partito <b>UDC</b> rimane primo con il 37,6 percento dei voti. Precede il partito <b>Centro</b> (20,7 percento, +0,1 punti percentuali) e il partito <b>PLR</b> (il 15,5 percento, -2,3 punti).<br><br>","tab_h$tr£$td£SVP$/td£tab_r156tab_r2#547d34tab_r3$td£$b£37.6%$/b£$/td£§+0.6$/td£$/tr£$tr£$td£Mitte$/td£tab_r131tab_r2#f39f5etab_r3$td£$b£20.7%$/b£$/td£§+0.1$/td£$/tr£$tr£$td£FDP$/td£tab_r123tab_r2#6268AFtab_r3$td£$b£15.5%$/b£$/td£§-2.3$/td£$/tr£$tr£$td£Grüne$/td£tab_r113tab_r2#26b300tab_r3$td£$b£8.7%$/b£$/td£§+4.3$/td£$/tr£$tr£$td£SP$/td£tab_r111tab_r2#ea546ftab_r3$td£$b£7.3%$/b£$/td£§+0.6$/td£$/tr£$tr£$td£GLP$/td£tab_r15tab_r2#cbd401tab_r3$td£$b£3.4%$/b£$/td£§+0.5$/td£$/tr£$tr£$td£EDU$/td£tab_r15tab_r2#3aa59atab_r3$td£$b£3.0%$/b£$/td£§+0.5$/td£$/tr£$/table£$br£Gültige Wahlzettel: $b£525$/b£$br£Wahlbeteiligung: $b£50.8%$/b£ (-7.5%)","tab_h_fr$tr£$td£UDC$/td£tab_r156tab_r2#547d34tab_r3$td£$b£37.6%$/b£$/td£§+0.6$/td£$/tr£$tr£$td£Centre$/td£tab_r131tab_r2#f39f5etab_r3$td£$b£20.7%$/b£$/td£§+0.1$/td£$/tr£$tr£$td£PLR$/td£tab_r123tab_r2#6268AFtab_r3$td£$b£15.5%$/b£$/td£§-2.3$/td£$/tr£$tr£$td£Vert-e-s$/td£tab_r113tab_r2#26b300tab_r3$td£$b£8.7%$/b£$/td£§+4.3$/td£$/tr£$tr£$td£PS$/td£tab_r111tab_r2#ea546ftab_r3$td£$b£7.3%$/b£$/td£§+0.6$/td£$/tr£$tr£$td£PVL$/td£tab_r15tab_r2#cbd401tab_r3$td£$b£3.4%$/b£$/td£§+0.5$/td£$/tr£$tr£$td£UDF$/td£tab_r15tab_r2#3aa59atab_r3$td£$b£3.0%$/b£$/td£§+0.5$/td£$/tr£$/table£$br£Bulletins de vote valables: $b£525$/b£$br£Taux de participation: $b£50.8%$/b£ (-7.5%)","tab_h_it$tr£$td£UDC$/td£tab_r156tab_r2#547d34tab_r3$td£$b£37.6%$/b£$/td£§+0.6$/td£$/tr£$tr£$td£Centro$/td£tab_r131tab_r2#f39f5etab_r3$td£$b£20.7%$/b£$/td£§+0.1$/td£$/tr£$tr£$td£PLR$/td£tab_r123tab_r2#6268AFtab_r3$td£$b£15.5%$/b£$/td£§-2.3$/td£$/tr£$tr£$td£Verdi$/td£tab_r113tab_r2#26b300tab_r3$td£$b£8.7%$/b£$/td£§+4.3$/td£$/tr£$tr£$td£PS$/td£tab_r111tab_r2#ea546ftab_r3$td£$b£7.3%$/b£$/td£§+0.6$/td£$/tr£$tr£$td£PVL$/td£tab_r15tab_r2#cbd401tab_r3$td£$b£3.4%$/b£$/td£§+0.5$/td£$/tr£$tr£$td£UDF$/td£tab_r15tab_r2#3aa59atab_r3$td£$b£3.0%$/b£$/td£§+0.5$/td£$/tr£$/table£$br£Schede elettorali valide: $b£525$/b£$br£Tasso di partecipazione: $b£50.8%$/b£ (-7.5%)","SVP"
3394,"Mosnang SG","Mosnang (SG)","Mosnang SG","Mit einem grossen Sprung von +9,5 Prozentpunkten ist die <b>Mitte</b> neu die stärkste Partei in Mosnang. Die Partei erhält 39,1 Prozent der Wählerstimmen.<br><br>Die <b>SVP</b> verliert mit einem Minus von -5,8 Prozentpunkten gegenüber den Wahlen 2019 sehr viele Wählerstimmen. Trotzdem liegt die Partei mit einem Wähleranteil von 38,1 Prozent noch auf dem zweiten Platz.<br><br>Die <b>FDP</b> landet mit 6,7 Prozent auf dem dritten Platz (Veränderung gegenüber 2019: -3,4 Prozentpunkte).<br><br>Speziell: In keiner anderen Gemeinde des Kantons schneidet die <b>FDP</b> schwächer ab (ohne Kleinstgemeinden).","Le <b>Centre</b> réalise une forte progression (+9,5 points de pourcentage) La formation est désormais le parti le plus fort de Mosnang. Le parti obtient 39,1 %age des voix.<br><br>L'<b>UDC</b> connaît un fort recul à Mosnang. La formation perd -5,8 points de pourcentage par rapport aux élections pour le Conseil national de 2019 et est désormais le deuxième parti de la commune avec 38,1 % des suffrages.<br><br>Le <b><b>PL</b>R</b> complète le podium. La formation récolte 6,7 % des suffrages (-3,4).<br><br>Le <b><b>PL</b>R</b> a enregistré dans cette commune son moins bon résultat cantonal (sans tenir compte des petites communes).","Il partito <b>Centro</b> aumenta significativamente la sua percentuale di voti a Mosnang (+9,5 punti percentuali), diventando così la formazione più forte. Alla fine ottiene il 39,1 percento dei voti degli elettori.<br><br>Il partito <b>UDC</b> perde molti voti, registrando una perdita di -5,8 punti percentuali rispetto alle elezioni del 2019. Nonostante ciò, rimane in seconda posizione con una quota di elettori del 38,1 percento.<br><br>Il partito <b>PLR</b> si posiziona terzo con il 6,7 percento dei voti. Questo rappresenta una variazione di -3,4 punti percentuali rispetto al 2019.<br><br>Il partito <b>PLR</b> ha registrato in questo comune il suo peggior risultato a livello cantonale (senza considerare i piccoli comuni).","tab_h$tr£$td£Mitte$/td£tab_r159tab_r2#f39f5etab_r3$td£$b£39.1%$/b£$/td£§+9.5$/td£$/tr£$tr£$td£SVP$/td£tab_r157tab_r2#547d34tab_r3$td£$b£38.1%$/b£$/td£§-5.8$/td£$/tr£$tr£$td£FDP$/td£tab_r110tab_r2#6268AFtab_r3$td£$b£6.7%$/b£$/td£§-3.4$/td£$/tr£$tr£$td£Grüne$/td£tab_r18tab_r2#26b300tab_r3$td£$b£5.6%$/b£$/td£§+1.9$/td£$/tr£$tr£$td£SP$/td£tab_r16tab_r2#ea546ftab_r3$td£$b£4.2%$/b£$/td£§-0.7$/td£$/tr£$tr£$td£GLP$/td£tab_r15tab_r2#cbd401tab_r3$td£$b£3.5%$/b£$/td£§+1.5$/td£$/tr£$/table£$br£Gültige Wahlzettel: $b£1'154$/b£$br£Wahlbeteiligung: $b£55.7%$/b£ (-0.3%)","tab_h_fr$tr£$td£Centre$/td£tab_r159tab_r2#f39f5etab_r3$td£$b£39.1%$/b£$/td£§+9.5$/td£$/tr£$tr£$td£UDC$/td£tab_r157tab_r2#547d34tab_r3$td£$b£38.1%$/b£$/td£§-5.8$/td£$/tr£$tr£$td£PLR$/td£tab_r110tab_r2#6268AFtab_r3$td£$b£6.7%$/b£$/td£§-3.4$/td£$/tr£$tr£$td£Vert-e-s$/td£tab_r18tab_r2#26b300tab_r3$td£$b£5.6%$/b£$/td£§+1.9$/td£$/tr£$tr£$td£PS$/td£tab_r16tab_r2#ea546ftab_r3$td£$b£4.2%$/b£$/td£§-0.7$/td£$/tr£$tr£$td£PVL$/td£tab_r15tab_r2#cbd401tab_r3$td£$b£3.5%$/b£$/td£§+1.5$/td£$/tr£$/table£$br£Bulletins de vote valables: $b£1'154$/b£$br£Taux de participation: $b£55.7%$/b£ (-0.3%)","tab_h_it$tr£$td£Centro$/td£tab_r159tab_r2#f39f5etab_r3$td£$b£39.1%$/b£$/td£§+9.5$/td£$/tr£$tr£$td£UDC$/td£tab_r157tab_r2#547d34tab_r3$td£$b£38.1%$/b£$/td£§-5.8$/td£$/tr£$tr£$td£PLR$/td£tab_r110tab_r2#6268AFtab_r3$td£$b£6.7%$/b£$/td£§-3.4$/td£$/tr£$tr£$td£Verdi$/td£tab_r18tab_r2#26b300tab_r3$td£$b£5.6%$/b£$/td£§+1.9$/td£$/tr£$tr£$td£PS$/td£tab_r16tab_r2#ea546ftab_r3$td£$b£4.2%$/b£$/td£§-0.7$/td£$/tr£$tr£$td£PVL$/td£tab_r15tab_r2#cbd401tab_r3$td£$b£3.5%$/b£$/td£§+1.5$/td£$/tr£$/table£$br£Schede elettorali valide: $b£1'154$/b£$br£Tasso di partecipazione: $b£55.7%$/b£ (-0.3%)","Mitte"
3395,"Bütschwil-Ganterschwil SG","Bütschwil-Ganterschwil (SG)","Bütschwil-Ganterschwil SG","Alles bleibt beim Alten in Bütschwil-Ganterschwil: Die drei stärksten Parteien verteidigen ihre Spitzenplätze in unveränderter Reihenfolge: Die <b>SVP</b> geht mit 41,9 Prozent (-0,7 Prozentpunkte) wieder als stärkste Kraft aus den Nationalratswahlen. Zweitstärkste Partei ist die <b>Mitte</b> (26,9 Prozent, +3,3 Prozentpunkte), drittstärkste die <b>FDP</b> (10,9 Prozent, -1,2 Prozentpunkte).<br><br>Speziell: In keiner anderen Gemeinde des Kantons schneidet die <b>GLP</b> schwächer ab (ohne Kleinstgemeinden).","Le classement n'a pas changé depuis quatre ans à Bütschwil-Ganterschwil: l'<b>UDC</b> reste premier avec 41,9 % des voix. La formation devance le <b>Centre</b> (26,9 %, +3,3 points de pourcentage) et le <b><b>PL</b>R</b> (10,9 %, -1,2 points de pourcentage).<br><br>Le <b>PVL</b> a enregistré dans cette commune son moins bon résultat cantonal (sans tenir compte des petites communes).","Il trio di testa rimane invariato a Bütschwil-Ganterschwil: il partito <b>UDC</b> rimane primo con il 41,9 percento dei voti. Precede il partito <b>Centro</b> (26,9 percento, +3,3 punti percentuali) e il partito <b>PLR</b> (il 10,9 percento, -1,2 punti).<br><br>Il partito <b>PVL</b> ha registrato in questo comune il suo peggior risultato a livello cantonale (senza considerare i piccoli comuni).","tab_h$tr£$td£SVP$/td£tab_r163tab_r2#547d34tab_r3$td£$b£41.9%$/b£$/td£§-0.7$/td£$/tr£$tr£$td£Mitte$/td£tab_r140tab_r2#f39f5etab_r3$td£$b£26.9%$/b£$/td£§+3.3$/td£$/tr£$tr£$td£FDP$/td£tab_r116tab_r2#6268AFtab_r3$td£$b£10.9%$/b£$/td£§-1.2$/td£$/tr£$tr£$td£SP$/td£tab_r111tab_r2#ea546ftab_r3$td£$b£7.4%$/b£$/td£§+0.0$/td£$/tr£$tr£$td£Grüne$/td£tab_r19tab_r2#26b300tab_r3$td£$b£5.7%$/b£$/td£§+2.3$/td£$/tr£$/table£$br£Gültige Wahlzettel: $b£1'570$/b£$br£Wahlbeteiligung: $b£47.1%$/b£ (-3.0%)","tab_h_fr$tr£$td£UDC$/td£tab_r163tab_r2#547d34tab_r3$td£$b£41.9%$/b£$/td£§-0.7$/td£$/tr£$tr£$td£Centre$/td£tab_r140tab_r2#f39f5etab_r3$td£$b£26.9%$/b£$/td£§+3.3$/td£$/tr£$tr£$td£PLR$/td£tab_r116tab_r2#6268AFtab_r3$td£$b£10.9%$/b£$/td£§-1.2$/td£$/tr£$tr£$td£PS$/td£tab_r111tab_r2#ea546ftab_r3$td£$b£7.4%$/b£$/td£§+0.0$/td£$/tr£$tr£$td£Vert-e-s$/td£tab_r19tab_r2#26b300tab_r3$td£$b£5.7%$/b£$/td£§+2.3$/td£$/tr£$/table£$br£Bulletins de vote valables: $b£1'570$/b£$br£Taux de participation: $b£47.1%$/b£ (-3.0%)","tab_h_it$tr£$td£UDC$/td£tab_r163tab_r2#547d34tab_r3$td£$b£41.9%$/b£$/td£§-0.7$/td£$/tr£$tr£$td£Centro$/td£tab_r140tab_r2#f39f5etab_r3$td£$b£26.9%$/b£$/td£§+3.3$/td£$/tr£$tr£$td£PLR$/td£tab_r116tab_r2#6268AFtab_r3$td£$b£10.9%$/b£$/td£§-1.2$/td£$/tr£$tr£$td£PS$/td£tab_r111tab_r2#ea546ftab_r3$td£$b£7.4%$/b£$/td£§+0.0$/td£$/tr£$tr£$td£Verdi$/td£tab_r19tab_r2#26b300tab_r3$td£$b£5.7%$/b£$/td£§+2.3$/td£$/tr£$/table£$br£Schede elettorali valide: $b£1'570$/b£$br£Tasso di partecipazione: $b£47.1%$/b£ (-3.0%)","SVP"
3401,"Degersheim SG","Degersheim (SG)","Degersheim SG","In Degersheim behält die <b>SVP</b> ihren Status als stärkste politische Kraft. Die Partei sichert sich einen Wähleranteil von 27,6 Prozent (-6,2 Prozentpunkte).<br><br>Mit einer markanten Verbesserung um +6,9 Prozentpunkte ist die <b>Mitte</b> die zweitstärkste Kraft in der Gemeinde. Der Wählerstimmenanteil der Partei liegt neu bei 22,2 Prozent.<br><br>Mit einem Wähleranteil von 13,3 Prozent belegt die <b>SP</b> den dritten Platz (Veränderung gegenüber 2019: -0,5 Prozentpunkte).","L'<b>UDC</b> maintient sa première place à Degersheim et obtient 27,6 pour des voix (-6,2 points de pourcentage).<br><br>Le <b>Centre</b> progresse fortement: le parti améliore son résultat d'il y a quatre ans de +6,9 points de pourcentage et occupe désormais la deuxième place dans la commune. La proportion de voix du parti s'élève désormais à 22,2 %.<br><br>La troisième place est occupée par le <b>PS</b>. Le parti emmagasine 13,3 % des voix (-0,5 points de pourcentage par rapport à 2019) ","Il partito <b>UDC</b> è imbattuto a Degersheim, dove ha ottenuto il 27,6 percento dei voti (-6,2 punti percentuali).<br><br>Il partito <b>Centro</b> subisce una forte diminuzione a Degersheim. Perde +6,9 punti percentuali rispetto alle elezioni per il Consiglio Nazionale del 2019 ed è ora il secondo partito del comune con il 22,2 percento dei voti.<br><br>La terza posizione è occupata dal partito <b>PS</b>. Ottiene una percentuale di elettori del il 13,3. (-0,5 punti percentuali di differenza rispetto al 2019).","tab_h$tr£$td£SVP$/td£tab_r141tab_r2#547d34tab_r3$td£$b£27.6%$/b£$/td£§-6.2$/td£$/tr£$tr£$td£Mitte$/td£tab_r133tab_r2#f39f5etab_r3$td£$b£22.2%$/b£$/td£§+6.9$/td£$/tr£$tr£$td£SP$/td£tab_r120tab_r2#ea546ftab_r3$td£$b£13.3%$/b£$/td£§-0.5$/td£$/tr£$tr£$td£FDP$/td£tab_r120tab_r2#6268AFtab_r3$td£$b£13.2%$/b£$/td£§-0.4$/td£$/tr£$tr£$td£Grüne$/td£tab_r117tab_r2#26b300tab_r3$td£$b£11.3%$/b£$/td£§+4.9$/td£$/tr£$tr£$td£GLP$/td£tab_r110tab_r2#cbd401tab_r3$td£$b£6.5%$/b£$/td£§+2.6$/td£$/tr£$/table£$br£Gültige Wahlzettel: $b£1'134$/b£$br£Wahlbeteiligung: $b£45.3%$/b£ (-3.8%)","tab_h_fr$tr£$td£UDC$/td£tab_r141tab_r2#547d34tab_r3$td£$b£27.6%$/b£$/td£§-6.2$/td£$/tr£$tr£$td£Centre$/td£tab_r133tab_r2#f39f5etab_r3$td£$b£22.2%$/b£$/td£§+6.9$/td£$/tr£$tr£$td£PS$/td£tab_r120tab_r2#ea546ftab_r3$td£$b£13.3%$/b£$/td£§-0.5$/td£$/tr£$tr£$td£PLR$/td£tab_r120tab_r2#6268AFtab_r3$td£$b£13.2%$/b£$/td£§-0.4$/td£$/tr£$tr£$td£Vert-e-s$/td£tab_r117tab_r2#26b300tab_r3$td£$b£11.3%$/b£$/td£§+4.9$/td£$/tr£$tr£$td£PVL$/td£tab_r110tab_r2#cbd401tab_r3$td£$b£6.5%$/b£$/td£§+2.6$/td£$/tr£$/table£$br£Bulletins de vote valables: $b£1'134$/b£$br£Taux de participation: $b£45.3%$/b£ (-3.8%)","tab_h_it$tr£$td£UDC$/td£tab_r141tab_r2#547d34tab_r3$td£$b£27.6%$/b£$/td£§-6.2$/td£$/tr£$tr£$td£Centro$/td£tab_r133tab_r2#f39f5etab_r3$td£$b£22.2%$/b£$/td£§+6.9$/td£$/tr£$tr£$td£PS$/td£tab_r120tab_r2#ea546ftab_r3$td£$b£13.3%$/b£$/td£§-0.5$/td£$/tr£$tr£$td£PLR$/td£tab_r120tab_r2#6268AFtab_r3$td£$b£13.2%$/b£$/td£§-0.4$/td£$/tr£$tr£$td£Verdi$/td£tab_r117tab_r2#26b300tab_r3$td£$b£11.3%$/b£$/td£§+4.9$/td£$/tr£$tr£$td£PVL$/td£tab_r110tab_r2#cbd401tab_r3$td£$b£6.5%$/b£$/td£§+2.6$/td£$/tr£$/table£$br£Schede elettorali valide: $b£1'134$/b£$br£Tasso di partecipazione: $b£45.3%$/b£ (-3.8%)","SVP"
3402,"Flawil SG","Flawil (SG)","Flawil SG","Die <b>SVP</b> behauptet ihre Position als vorherrschende Partei in Flawil. Die Partei verzeichnet einen Wähleranteil von 26,2 Prozent (-6,9 Prozentpunkte).<br><br>Die <b>Mitte</b> belegt in der Gemeinde den zweiten Platz mit einem Wählerstimmenanteil von 18,6 Prozent (+3,5 Prozentpunkte).<br><br>Auf dem dritten Platz landet die <b>FDP</b> mit 17,5 Prozent der Stimmen. Das bedeutet eine Veränderung von +2,2 Prozentpunkten gegenüber 2019. ","L'<b>UDC</b> reste le parti le plus fort à Flawil. Le parti remporte 26,2 % des voix (-6,9 points de pourcentage).<br><br>Le deuxième rang est occupé par le <b>Centre</b> qui réalise 18,6 % des voix (+3,5 points de pourcentage par rapport à 2019).<br><br>Le <b><b>PL</b>R</b> se classe troisième. La formation obtient 17,5 % des voix (+2,2 points de pourcentage par rapport à 2019).","Il partito <b>UDC</b> rimane il più forte a Flawil, con il 26,2 percento dei voti (-6,9 punti percentuali).<br><br>Il secondo rango è occupato dal partito <b>Centro</b> che ottiene il 18,6 percento dei voti (+3,5 punti percentuali rispetto al 2019).<br><br>Al terzo posto troviamo il partito <b>PLR</b> con il 17,5 percento dei voti (+2,2).","tab_h$tr£$td£SVP$/td£tab_r139tab_r2#547d34tab_r3$td£$b£26.2%$/b£$/td£§-6.9$/td£$/tr£$tr£$td£Mitte$/td£tab_r128tab_r2#f39f5etab_r3$td£$b£18.6%$/b£$/td£§+3.5$/td£$/tr£$tr£$td£FDP$/td£tab_r126tab_r2#6268AFtab_r3$td£$b£17.5%$/b£$/td£§+2.2$/td£$/tr£$tr£$td£SP$/td£tab_r122tab_r2#ea546ftab_r3$td£$b£14.5%$/b£$/td£§-1.0$/td£$/tr£$tr£$td£Grüne$/td£tab_r117tab_r2#26b300tab_r3$td£$b£11.5%$/b£$/td£§+3.8$/td£$/tr£$tr£$td£GLP$/td£tab_r110tab_r2#cbd401tab_r3$td£$b£6.7%$/b£$/td£§+2.6$/td£$/tr£$/table£$br£Gültige Wahlzettel: $b£2'359$/b£$br£Wahlbeteiligung: $b£39.8%$/b£ (-6.1%)","tab_h_fr$tr£$td£UDC$/td£tab_r139tab_r2#547d34tab_r3$td£$b£26.2%$/b£$/td£§-6.9$/td£$/tr£$tr£$td£Centre$/td£tab_r128tab_r2#f39f5etab_r3$td£$b£18.6%$/b£$/td£§+3.5$/td£$/tr£$tr£$td£PLR$/td£tab_r126tab_r2#6268AFtab_r3$td£$b£17.5%$/b£$/td£§+2.2$/td£$/tr£$tr£$td£PS$/td£tab_r122tab_r2#ea546ftab_r3$td£$b£14.5%$/b£$/td£§-1.0$/td£$/tr£$tr£$td£Vert-e-s$/td£tab_r117tab_r2#26b300tab_r3$td£$b£11.5%$/b£$/td£§+3.8$/td£$/tr£$tr£$td£PVL$/td£tab_r110tab_r2#cbd401tab_r3$td£$b£6.7%$/b£$/td£§+2.6$/td£$/tr£$/table£$br£Bulletins de vote valables: $b£2'359$/b£$br£Taux de participation: $b£39.8%$/b£ (-6.1%)","tab_h_it$tr£$td£UDC$/td£tab_r139tab_r2#547d34tab_r3$td£$b£26.2%$/b£$/td£§-6.9$/td£$/tr£$tr£$td£Centro$/td£tab_r128tab_r2#f39f5etab_r3$td£$b£18.6%$/b£$/td£§+3.5$/td£$/tr£$tr£$td£PLR$/td£tab_r126tab_r2#6268AFtab_r3$td£$b£17.5%$/b£$/td£§+2.2$/td£$/tr£$tr£$td£PS$/td£tab_r122tab_r2#ea546ftab_r3$td£$b£14.5%$/b£$/td£§-1.0$/td£$/tr£$tr£$td£Verdi$/td£tab_r117tab_r2#26b300tab_r3$td£$b£11.5%$/b£$/td£§+3.8$/td£$/tr£$tr£$td£PVL$/td£tab_r110tab_r2#cbd401tab_r3$td£$b£6.7%$/b£$/td£§+2.6$/td£$/tr£$/table£$br£Schede elettorali valide: $b£2'359$/b£$br£Tasso di partecipazione: $b£39.8%$/b£ (-6.1%)","SVP"
3405,"Jonschwil SG","Jonschwil (SG)","Jonschwil SG","Die Spitzenplätze in Jonschwil bleiben gleich: Unverändert belegen die <b>SVP</b>, die <b>Mitte</b> und die <b>FDP</b> die ersten drei Plätze. Sie holen 36,9 Prozent (-2,6 Prozentpunkte), 22,1 Prozent (+1 Prozentpunkte) respektive 14,8 Prozent (+2,6 Prozentpunkte) der Stimmen.<br><br>","Le classement n'a pas changé depuis quatre ans à Jonschwil: l'<b>UDC</b> reste premier avec 36,9 % des voix. La formation devance le <b>Centre</b> (22,1 %, +1 points de pourcentage) et le <b><b>PL</b>R</b> (14,8 %, +2,6 points de pourcentage).<br><br>","Il trio di testa rimane invariato a Jonschwil: il partito <b>UDC</b> rimane primo con il 36,9 percento dei voti. Precede il partito <b>Centro</b> (22,1 percento, +1 punti percentuali) e il partito <b>PLR</b> (il 14,8 percento, +2,6 punti).<br><br>","tab_h$tr£$td£SVP$/td£tab_r155tab_r2#547d34tab_r3$td£$b£36.9%$/b£$/td£§-2.6$/td£$/tr£$tr£$td£Mitte$/td£tab_r133tab_r2#f39f5etab_r3$td£$b£22.1%$/b£$/td£§+1.0$/td£$/tr£$tr£$td£FDP$/td£tab_r122tab_r2#6268AFtab_r3$td£$b£14.8%$/b£$/td£§+2.6$/td£$/tr£$tr£$td£SP$/td£tab_r113tab_r2#ea546ftab_r3$td£$b£8.6%$/b£$/td£§+0.5$/td£$/tr£$tr£$td£Grüne$/td£tab_r110tab_r2#26b300tab_r3$td£$b£6.4%$/b£$/td£§+2.0$/td£$/tr£$tr£$td£GLP$/td£tab_r19tab_r2#cbd401tab_r3$td£$b£6.1%$/b£$/td£§+2.9$/td£$/tr£$/table£$br£Gültige Wahlzettel: $b£1'145$/b£$br£Wahlbeteiligung: $b£45.1%$/b£ (-5.3%)","tab_h_fr$tr£$td£UDC$/td£tab_r155tab_r2#547d34tab_r3$td£$b£36.9%$/b£$/td£§-2.6$/td£$/tr£$tr£$td£Centre$/td£tab_r133tab_r2#f39f5etab_r3$td£$b£22.1%$/b£$/td£§+1.0$/td£$/tr£$tr£$td£PLR$/td£tab_r122tab_r2#6268AFtab_r3$td£$b£14.8%$/b£$/td£§+2.6$/td£$/tr£$tr£$td£PS$/td£tab_r113tab_r2#ea546ftab_r3$td£$b£8.6%$/b£$/td£§+0.5$/td£$/tr£$tr£$td£Vert-e-s$/td£tab_r110tab_r2#26b300tab_r3$td£$b£6.4%$/b£$/td£§+2.0$/td£$/tr£$tr£$td£PVL$/td£tab_r19tab_r2#cbd401tab_r3$td£$b£6.1%$/b£$/td£§+2.9$/td£$/tr£$/table£$br£Bulletins de vote valables: $b£1'145$/b£$br£Taux de participation: $b£45.1%$/b£ (-5.3%)","tab_h_it$tr£$td£UDC$/td£tab_r155tab_r2#547d34tab_r3$td£$b£36.9%$/b£$/td£§-2.6$/td£$/tr£$tr£$td£Centro$/td£tab_r133tab_r2#f39f5etab_r3$td£$b£22.1%$/b£$/td£§+1.0$/td£$/tr£$tr£$td£PLR$/td£tab_r122tab_r2#6268AFtab_r3$td£$b£14.8%$/b£$/td£§+2.6$/td£$/tr£$tr£$td£PS$/td£tab_r113tab_r2#ea546ftab_r3$td£$b£8.6%$/b£$/td£§+0.5$/td£$/tr£$tr£$td£Verdi$/td£tab_r110tab_r2#26b300tab_r3$td£$b£6.4%$/b£$/td£§+2.0$/td£$/tr£$tr£$td£PVL$/td£tab_r19tab_r2#cbd401tab_r3$td£$b£6.1%$/b£$/td£§+2.9$/td£$/tr£$/table£$br£Schede elettorali valide: $b£1'145$/b£$br£Tasso di partecipazione: $b£45.1%$/b£ (-5.3%)","SVP"
