"ID","Gemeinde_de","Gemeinde_fr","Gemeinde_it","Text_de","Text_fr","Text_it","Tabelle_de","Tabelle_fr","Tabelle_it","Staerkste_Partei"
3762,"Scuol GR","Scuol (GR)","Scuol GR","Die <b>SVP</b> ist weiterhin die stärkste Kraft in Scuol. Mit 24,5 Prozent Wähleranteil verweist die Partei die <b>SP</b> allerdings nur mit 2,7 Prozentpunkten Abstand auf den zweiten Platz. Die zweitstärkste Partei holt 21,8 Prozent. Die Veränderungen gegenüber 2019: <b>SVP</b>: -0,8 Prozentpunkte; <b>SP</b>: -3 Prozentpunkte.<br><br>Viele Wählerstimmen eingebüsst hat die drittplatzierte BDP. Die Partei holt noch 14,6 Prozent, was einen Verlust von -8,8 Prozentpunkten bedeutet.","L'<b>UDC</b> reste en tête à Scuol (24,5 % des voix, -0,8 points de pourcentage). Son poursuivant, le <b>PS</b>, menace toutefois de lui ravir son fauteuil (21,8 % des suffrages, -3 points de pourcentage). L'écart entre les deux formations n'est que de 2,7 points. <br><br>Le PBD, troisième parti, a perdu beaucoup de voix. La formation obtient 14,6 % des voix, ce qui représente une perte de -8,8 points de pourcentage.","Con il 24,5 percento dei voti (-0,8 punti percentuali), il partito <b>UDC</b> rimane in testa a Scuol. Tuttavia, il partito <b>PS</b>, che ottiene il 21,8 percento dei voti (-3 punti percentuali), è in agguato. La differenza tra i due partiti è di 2,7 punti.<br><br>Il partito PBD perde -8,8 punti percentuali e si classifica ora al terzo posto con il 14,6 percento dei voti.","tab_h$tr£$td£SVP$/td£tab_r137tab_r2#547d34tab_r3$td£$b£24.5%$/b£$/td£§-0.8$/td£$/tr£$tr£$td£SP$/td£tab_r133tab_r2#ea546ftab_r3$td£$b£21.8%$/b£$/td£§-3.0$/td£$/tr£$tr£$td£BDP$/td£tab_r122tab_r2#abd0e7tab_r3$td£$b£14.6%$/b£$/td£§-8.8$/td£$/tr£$tr£$td£FDP$/td£tab_r121tab_r2#6268AFtab_r3$td£$b£13.7%$/b£$/td£§+1.4$/td£$/tr£$tr£$td£Grüne$/td£tab_r117tab_r2#26b300tab_r3$td£$b£11.5%$/b£$/td£§+11.5$/td£$/tr£$tr£$td£Mitte$/td£tab_r111tab_r2#f39f5etab_r3$td£$b£7.2%$/b£$/td£§+1.6$/td£$/tr£$tr£$td£GLP$/td£tab_r110tab_r2#cbd401tab_r3$td£$b£6.8%$/b£$/td£§-1.8$/td£$/tr£$/table£$br£Gültige Wahlzettel: $b£1'366$/b£$br£Wahlbeteiligung: $b£42.6%$/b£ (+2.8%)","tab_h_fr$tr£$td£UDC$/td£tab_r137tab_r2#547d34tab_r3$td£$b£24.5%$/b£$/td£§-0.8$/td£$/tr£$tr£$td£PS$/td£tab_r133tab_r2#ea546ftab_r3$td£$b£21.8%$/b£$/td£§-3.0$/td£$/tr£$tr£$td£PBD$/td£tab_r122tab_r2#abd0e7tab_r3$td£$b£14.6%$/b£$/td£§-8.8$/td£$/tr£$tr£$td£PLR$/td£tab_r121tab_r2#6268AFtab_r3$td£$b£13.7%$/b£$/td£§+1.4$/td£$/tr£$tr£$td£Vert-e-s$/td£tab_r117tab_r2#26b300tab_r3$td£$b£11.5%$/b£$/td£§+11.5$/td£$/tr£$tr£$td£Centre$/td£tab_r111tab_r2#f39f5etab_r3$td£$b£7.2%$/b£$/td£§+1.6$/td£$/tr£$tr£$td£PVL$/td£tab_r110tab_r2#cbd401tab_r3$td£$b£6.8%$/b£$/td£§-1.8$/td£$/tr£$/table£$br£Bulletins de vote valables: $b£1'366$/b£$br£Taux de participation: $b£42.6%$/b£ (+2.8%)","tab_h_it$tr£$td£UDC$/td£tab_r137tab_r2#547d34tab_r3$td£$b£24.5%$/b£$/td£§-0.8$/td£$/tr£$tr£$td£PS$/td£tab_r133tab_r2#ea546ftab_r3$td£$b£21.8%$/b£$/td£§-3.0$/td£$/tr£$tr£$td£PBD$/td£tab_r122tab_r2#abd0e7tab_r3$td£$b£14.6%$/b£$/td£§-8.8$/td£$/tr£$tr£$td£PLR$/td£tab_r121tab_r2#6268AFtab_r3$td£$b£13.7%$/b£$/td£§+1.4$/td£$/tr£$tr£$td£Verdi$/td£tab_r117tab_r2#26b300tab_r3$td£$b£11.5%$/b£$/td£§+11.5$/td£$/tr£$tr£$td£Centro$/td£tab_r111tab_r2#f39f5etab_r3$td£$b£7.2%$/b£$/td£§+1.6$/td£$/tr£$tr£$td£PVL$/td£tab_r110tab_r2#cbd401tab_r3$td£$b£6.8%$/b£$/td£§-1.8$/td£$/tr£$/table£$br£Schede elettorali valide: $b£1'366$/b£$br£Tasso di partecipazione: $b£42.6%$/b£ (+2.8%)","SVP"
3764,"Valsot GR","Valsot (GR)","Valsot GR","In Valsot bleibt die <b>SVP</b> die stimmenstärkste Partei. Die Partei holt 29 Prozent aller Stimmen (+3,4 Prozentpunkte).<br><br>Mit einem Wählerstimmenanteil von 20,6 Prozent (-4,9 Prozentpunkte) ist die <b>SP</b> die zweitstärkste Kraft in der Gemeinde.<br><br>Viele Wählerstimmen eingebüsst hat die drittplatzierte BDP. Die Partei holt noch 15,8 Prozent, was einen Verlust von -5,9 Prozentpunkten bedeutet.","L'<b>UDC</b> reste le parti le plus fort à Valsot. Le parti remporte 29 % des voix (+3,4 points de pourcentage).<br><br>Le <b>PS</b> arrive en deuxième position dans la commune, avec un pourcentage de votants de 20,6 (-4,9 points de pourcentage)<br><br>Le PBD perd -5,9 points de pourcentage. La formation n'arrive plus qu'en troisième position avec 15,8 % des voix.","Il partito <b>UDC</b> mantiene il primo posto a Valsot e ottiene il 29 percento dei voti (+3,4 punti percentuali).<br><br>Il partito <b>PS</b> è il secondo partito più forte a Valsot. Si è migliorato di -4,9 punti percentuali rispetto alle elezioni per il Consiglio nazionale del 2019.<br><br>Il partito PBD, terzo partito, ha perso molti voti, ricevendo il 15,8 percento dei voti, una perdita di -5,9 punti percentuali.","tab_h$tr£$td£SVP$/td£tab_r143tab_r2#547d34tab_r3$td£$b£29.0%$/b£$/td£§+3.4$/td£$/tr£$tr£$td£SP$/td£tab_r131tab_r2#ea546ftab_r3$td£$b£20.6%$/b£$/td£§-4.9$/td£$/tr£$tr£$td£BDP$/td£tab_r124tab_r2#abd0e7tab_r3$td£$b£15.8%$/b£$/td£§-5.9$/td£$/tr£$tr£$td£FDP$/td£tab_r116tab_r2#6268AFtab_r3$td£$b£10.8%$/b£$/td£§-2.8$/td£$/tr£$tr£$td£Grüne$/td£tab_r114tab_r2#26b300tab_r3$td£$b£9.2%$/b£$/td£§+9.2$/td£$/tr£$tr£$td£Mitte$/td£tab_r112tab_r2#f39f5etab_r3$td£$b£7.9%$/b£$/td£§+0.9$/td£$/tr£$tr£$td£GLP$/td£tab_r110tab_r2#cbd401tab_r3$td£$b£6.7%$/b£$/td£§+0.2$/td£$/tr£$/table£$br£Gültige Wahlzettel: $b£271$/b£$br£Wahlbeteiligung: $b£40.1%$/b£ (+4.2%)","tab_h_fr$tr£$td£UDC$/td£tab_r143tab_r2#547d34tab_r3$td£$b£29.0%$/b£$/td£§+3.4$/td£$/tr£$tr£$td£PS$/td£tab_r131tab_r2#ea546ftab_r3$td£$b£20.6%$/b£$/td£§-4.9$/td£$/tr£$tr£$td£PBD$/td£tab_r124tab_r2#abd0e7tab_r3$td£$b£15.8%$/b£$/td£§-5.9$/td£$/tr£$tr£$td£PLR$/td£tab_r116tab_r2#6268AFtab_r3$td£$b£10.8%$/b£$/td£§-2.8$/td£$/tr£$tr£$td£Vert-e-s$/td£tab_r114tab_r2#26b300tab_r3$td£$b£9.2%$/b£$/td£§+9.2$/td£$/tr£$tr£$td£Centre$/td£tab_r112tab_r2#f39f5etab_r3$td£$b£7.9%$/b£$/td£§+0.9$/td£$/tr£$tr£$td£PVL$/td£tab_r110tab_r2#cbd401tab_r3$td£$b£6.7%$/b£$/td£§+0.2$/td£$/tr£$/table£$br£Bulletins de vote valables: $b£271$/b£$br£Taux de participation: $b£40.1%$/b£ (+4.2%)","tab_h_it$tr£$td£UDC$/td£tab_r143tab_r2#547d34tab_r3$td£$b£29.0%$/b£$/td£§+3.4$/td£$/tr£$tr£$td£PS$/td£tab_r131tab_r2#ea546ftab_r3$td£$b£20.6%$/b£$/td£§-4.9$/td£$/tr£$tr£$td£PBD$/td£tab_r124tab_r2#abd0e7tab_r3$td£$b£15.8%$/b£$/td£§-5.9$/td£$/tr£$tr£$td£PLR$/td£tab_r116tab_r2#6268AFtab_r3$td£$b£10.8%$/b£$/td£§-2.8$/td£$/tr£$tr£$td£Verdi$/td£tab_r114tab_r2#26b300tab_r3$td£$b£9.2%$/b£$/td£§+9.2$/td£$/tr£$tr£$td£Centro$/td£tab_r112tab_r2#f39f5etab_r3$td£$b£7.9%$/b£$/td£§+0.9$/td£$/tr£$tr£$td£PVL$/td£tab_r110tab_r2#cbd401tab_r3$td£$b£6.7%$/b£$/td£§+0.2$/td£$/tr£$/table£$br£Schede elettorali valide: $b£271$/b£$br£Tasso di partecipazione: $b£40.1%$/b£ (+4.2%)","SVP"
3781,"Bever GR","Bever (GR)","Bever GR","Die <b>SP</b> kann sich in diesem Jahr von Rang zwei auf den Spitzenplatz in Bever verbessern. Die Partei holt 29,2 Prozent der Stimmen (+3,2 Prozentpunkte).<br><br>In der Gemeinde landet die <b>SVP</b> auf dem zweiten Platz. Die Partei erreicht einen Wählerstimmenanteil von 28,7 Prozent (+0,3 Prozentpunkte). <br><br>Die <b>FDP</b> sichert sich den dritten Platz, mit einem Wähleranteil von 18,2 Prozent (Veränderung gegenüber 2019: +2,6 Prozentpunkte).","Le <b>PS</b> grimpe sur la première place du podium à Bever. La formation était deux ème en 2019 et obtient cette année 29,2 % des voix.<br><br>L'<b>UDC</b> arrive en deuxième position.La formation obtient un pourcentage de voix de 28,7 (+0,3 points de pourcentage).<br><br>Le <b><b>PL</b>R</b> se classe troisième. La formation obtient 18,2 % des voix (+2,6 points de pourcentage par rapport à 2019).","Classificato al due posto nel 2019, il partito <b>PS</b> è ora il partito più forte a Bever. Ottiene il 29,2 percento dei voti.<br><br>Un aumento significativo di +0,3 punti percentuali permette al partito <b>UDC</b> di diventare il secondo partito del suo comune. Il partito raccoglie il 28,7 percento dei voti.<br><br>Il partito <b>PLR</b> completa il podio con il 18,2 percento dei voti (+2,6).","tab_h$tr£$td£SP$/td£tab_r144tab_r2#ea546ftab_r3$td£$b£29.2%$/b£$/td£§+3.2$/td£$/tr£$tr£$td£SVP$/td£tab_r143tab_r2#547d34tab_r3$td£$b£28.7%$/b£$/td£§+0.3$/td£$/tr£$tr£$td£FDP$/td£tab_r127tab_r2#6268AFtab_r3$td£$b£18.2%$/b£$/td£§+2.6$/td£$/tr£$tr£$td£BDP$/td£tab_r110tab_r2#abd0e7tab_r3$td£$b£6.8%$/b£$/td£§-7.6$/td£$/tr£$tr£$td£GLP$/td£tab_r110tab_r2#cbd401tab_r3$td£$b£6.4%$/b£$/td£§-2.3$/td£$/tr£$tr£$td£Mitte$/td£tab_r18tab_r2#f39f5etab_r3$td£$b£5.5%$/b£$/td£§-1.5$/td£$/tr£$tr£$td£Grüne$/td£tab_r18tab_r2#26b300tab_r3$td£$b£5.3%$/b£$/td£§+5.3$/td£$/tr£$/table£$br£Gültige Wahlzettel: $b£204$/b£$br£Wahlbeteiligung: $b£45.9%$/b£ (-6.0%)","tab_h_fr$tr£$td£PS$/td£tab_r144tab_r2#ea546ftab_r3$td£$b£29.2%$/b£$/td£§+3.2$/td£$/tr£$tr£$td£UDC$/td£tab_r143tab_r2#547d34tab_r3$td£$b£28.7%$/b£$/td£§+0.3$/td£$/tr£$tr£$td£PLR$/td£tab_r127tab_r2#6268AFtab_r3$td£$b£18.2%$/b£$/td£§+2.6$/td£$/tr£$tr£$td£PBD$/td£tab_r110tab_r2#abd0e7tab_r3$td£$b£6.8%$/b£$/td£§-7.6$/td£$/tr£$tr£$td£PVL$/td£tab_r110tab_r2#cbd401tab_r3$td£$b£6.4%$/b£$/td£§-2.3$/td£$/tr£$tr£$td£Centre$/td£tab_r18tab_r2#f39f5etab_r3$td£$b£5.5%$/b£$/td£§-1.5$/td£$/tr£$tr£$td£Vert-e-s$/td£tab_r18tab_r2#26b300tab_r3$td£$b£5.3%$/b£$/td£§+5.3$/td£$/tr£$/table£$br£Bulletins de vote valables: $b£204$/b£$br£Taux de participation: $b£45.9%$/b£ (-6.0%)","tab_h_it$tr£$td£PS$/td£tab_r144tab_r2#ea546ftab_r3$td£$b£29.2%$/b£$/td£§+3.2$/td£$/tr£$tr£$td£UDC$/td£tab_r143tab_r2#547d34tab_r3$td£$b£28.7%$/b£$/td£§+0.3$/td£$/tr£$tr£$td£PLR$/td£tab_r127tab_r2#6268AFtab_r3$td£$b£18.2%$/b£$/td£§+2.6$/td£$/tr£$tr£$td£PBD$/td£tab_r110tab_r2#abd0e7tab_r3$td£$b£6.8%$/b£$/td£§-7.6$/td£$/tr£$tr£$td£PVL$/td£tab_r110tab_r2#cbd401tab_r3$td£$b£6.4%$/b£$/td£§-2.3$/td£$/tr£$tr£$td£Centro$/td£tab_r18tab_r2#f39f5etab_r3$td£$b£5.5%$/b£$/td£§-1.5$/td£$/tr£$tr£$td£Verdi$/td£tab_r18tab_r2#26b300tab_r3$td£$b£5.3%$/b£$/td£§+5.3$/td£$/tr£$/table£$br£Schede elettorali valide: $b£204$/b£$br£Tasso di partecipazione: $b£45.9%$/b£ (-6.0%)","SP"
3782,"Celerina/Schlarigna GR","Celerina/Schlarigna (GR)","Celerina/Schlarigna GR","Die <b>SVP</b> kann sich in diesem Jahr von Rang zwei auf den Spitzenplatz in Celerina/Schlarigna verbessern. Die Partei holt 27,2 Prozent der Stimmen (+1,1 Prozentpunkte).<br><br>In der Gemeinde landet die <b>FDP</b> auf dem zweiten Platz. Die Partei erreicht einen Wählerstimmenanteil von 27,1 Prozent (-1,6 Prozentpunkte). <br><br>Den dritten Platz belegt die BDP. Die Partei erzielt einen Wähleranteil von 14,6 Prozent (Veränderung gegenüber 2019: -3,9 Prozentpunkte).","L'<b>UDC</b> grimpe sur la première place du podium à Celerina/Schlarigna. La formation était deux ème en 2019 et obtient cette année 27,2 % des voix.<br><br>Le deuxième rang est occupé par le <b><b>PL</b>R</b> qui réalise 27,1 % des voix (-1,6 points de pourcentage par rapport à 2019).<br><br>La troisième place est occupée par le PBD. Le parti emmagasine 14,6 % des voix (-3,9 points de pourcentage par rapport à 2019) ","Il partito <b>UDC</b> si posiziona al primo posto a Celerina/Schlarigna. Era al due esimo esimo posto nel 2019. Quest'anno ottiene il 27,2 percento dei voti.<br><br>Il partito <b>PLR</b> è il secondo partito più forte a Celerina/Schlarigna. Si è migliorato di -1,6 punti percentuali rispetto alle elezioni per il Consiglio nazionale del 2019.<br><br>Il partito PBD si posiziona terzo con il 14,6 percento dei voti. Questo rappresenta una variazione di -3,9 punti percentuali rispetto al 2019.","tab_h$tr£$td£SVP$/td£tab_r141tab_r2#547d34tab_r3$td£$b£27.2%$/b£$/td£§+1.1$/td£$/tr£$tr£$td£FDP$/td£tab_r141tab_r2#6268AFtab_r3$td£$b£27.1%$/b£$/td£§-1.6$/td£$/tr£$tr£$td£BDP$/td£tab_r122tab_r2#abd0e7tab_r3$td£$b£14.6%$/b£$/td£§-3.9$/td£$/tr£$tr£$td£SP$/td£tab_r122tab_r2#ea546ftab_r3$td£$b£14.4%$/b£$/td£§+2.3$/td£$/tr£$tr£$td£Mitte$/td£tab_r110tab_r2#f39f5etab_r3$td£$b£6.9%$/b£$/td£§+1.5$/td£$/tr£$tr£$td£GLP$/td£tab_r18tab_r2#cbd401tab_r3$td£$b£5.4%$/b£$/td£§-3.7$/td£$/tr£$tr£$td£Grüne$/td£tab_r17tab_r2#26b300tab_r3$td£$b£4.5%$/b£$/td£§+4.5$/td£$/tr£$/table£$br£Gültige Wahlzettel: $b£395$/b£$br£Wahlbeteiligung: $b£41.3%$/b£ (-1.3%)","tab_h_fr$tr£$td£UDC$/td£tab_r141tab_r2#547d34tab_r3$td£$b£27.2%$/b£$/td£§+1.1$/td£$/tr£$tr£$td£PLR$/td£tab_r141tab_r2#6268AFtab_r3$td£$b£27.1%$/b£$/td£§-1.6$/td£$/tr£$tr£$td£PBD$/td£tab_r122tab_r2#abd0e7tab_r3$td£$b£14.6%$/b£$/td£§-3.9$/td£$/tr£$tr£$td£PS$/td£tab_r122tab_r2#ea546ftab_r3$td£$b£14.4%$/b£$/td£§+2.3$/td£$/tr£$tr£$td£Centre$/td£tab_r110tab_r2#f39f5etab_r3$td£$b£6.9%$/b£$/td£§+1.5$/td£$/tr£$tr£$td£PVL$/td£tab_r18tab_r2#cbd401tab_r3$td£$b£5.4%$/b£$/td£§-3.7$/td£$/tr£$tr£$td£Vert-e-s$/td£tab_r17tab_r2#26b300tab_r3$td£$b£4.5%$/b£$/td£§+4.5$/td£$/tr£$/table£$br£Bulletins de vote valables: $b£395$/b£$br£Taux de participation: $b£41.3%$/b£ (-1.3%)","tab_h_it$tr£$td£UDC$/td£tab_r141tab_r2#547d34tab_r3$td£$b£27.2%$/b£$/td£§+1.1$/td£$/tr£$tr£$td£PLR$/td£tab_r141tab_r2#6268AFtab_r3$td£$b£27.1%$/b£$/td£§-1.6$/td£$/tr£$tr£$td£PBD$/td£tab_r122tab_r2#abd0e7tab_r3$td£$b£14.6%$/b£$/td£§-3.9$/td£$/tr£$tr£$td£PS$/td£tab_r122tab_r2#ea546ftab_r3$td£$b£14.4%$/b£$/td£§+2.3$/td£$/tr£$tr£$td£Centro$/td£tab_r110tab_r2#f39f5etab_r3$td£$b£6.9%$/b£$/td£§+1.5$/td£$/tr£$tr£$td£PVL$/td£tab_r18tab_r2#cbd401tab_r3$td£$b£5.4%$/b£$/td£§-3.7$/td£$/tr£$tr£$td£Verdi$/td£tab_r17tab_r2#26b300tab_r3$td£$b£4.5%$/b£$/td£§+4.5$/td£$/tr£$/table£$br£Schede elettorali valide: $b£395$/b£$br£Tasso di partecipazione: $b£41.3%$/b£ (-1.3%)","SVP"
3783,"Madulain GR","Madulain (GR)","Madulain GR","Die drei führenden Parteien in Madulain sind die <b>SVP</b> mit 102 Stimmen, die <b>SP</b> mit 65 Stimmen und die <b>FDP</b> mit 47 Stimmen.<br><br>","L'<b>UDC</b> obtient le plus de voix (102) à Madulain. Le parti est suivi par le <b>PS</b> avec 65 voix et <b><b>PL</b>R</b> avec 47 voix.<br><br>","La maggior parte dei voti sono distribuiti tra <b>UDC</b>, <b>PS</b> e <b>PLR</b> a Madulain. Ricevono rispettivamente 102, 65 e 47 voti.<br><br>","tab_h$tr£$td£SVP$/td£tab_r148tab_r2#547d34tab_r3$td£$b£31.9%$/b£$/td£§+4.7$/td£$/tr£$tr£$td£SP$/td£tab_r130tab_r2#ea546ftab_r3$td£$b£20.3%$/b£$/td£§-3.7$/td£$/tr£$tr£$td£FDP$/td£tab_r122tab_r2#6268AFtab_r3$td£$b£14.7%$/b£$/td£§+0.0$/td£$/tr£$tr£$td£BDP$/td£tab_r120tab_r2#abd0e7tab_r3$td£$b£13.1%$/b£$/td£§+0.1$/td£$/tr£$tr£$td£Grüne$/td£tab_r114tab_r2#26b300tab_r3$td£$b£9.1%$/b£$/td£§+9.1$/td£$/tr£$tr£$td£Mitte$/td£tab_r111tab_r2#f39f5etab_r3$td£$b£7.2%$/b£$/td£§+3.5$/td£$/tr£$tr£$td£GLP$/td£tab_r16tab_r2#cbd401tab_r3$td£$b£3.8%$/b£$/td£§-12.3$/td£$/tr£$/table£$br£Gültige Wahlzettel: $b£65$/b£$br£Wahlbeteiligung: $b£50.4%$/b£ (-5.5%)","tab_h_fr$tr£$td£UDC$/td£tab_r148tab_r2#547d34tab_r3$td£$b£31.9%$/b£$/td£§+4.7$/td£$/tr£$tr£$td£PS$/td£tab_r130tab_r2#ea546ftab_r3$td£$b£20.3%$/b£$/td£§-3.7$/td£$/tr£$tr£$td£PLR$/td£tab_r122tab_r2#6268AFtab_r3$td£$b£14.7%$/b£$/td£§+0.0$/td£$/tr£$tr£$td£PBD$/td£tab_r120tab_r2#abd0e7tab_r3$td£$b£13.1%$/b£$/td£§+0.1$/td£$/tr£$tr£$td£Vert-e-s$/td£tab_r114tab_r2#26b300tab_r3$td£$b£9.1%$/b£$/td£§+9.1$/td£$/tr£$tr£$td£Centre$/td£tab_r111tab_r2#f39f5etab_r3$td£$b£7.2%$/b£$/td£§+3.5$/td£$/tr£$tr£$td£PVL$/td£tab_r16tab_r2#cbd401tab_r3$td£$b£3.8%$/b£$/td£§-12.3$/td£$/tr£$/table£$br£Bulletins de vote valables: $b£65$/b£$br£Taux de participation: $b£50.4%$/b£ (-5.5%)","tab_h_it$tr£$td£UDC$/td£tab_r148tab_r2#547d34tab_r3$td£$b£31.9%$/b£$/td£§+4.7$/td£$/tr£$tr£$td£PS$/td£tab_r130tab_r2#ea546ftab_r3$td£$b£20.3%$/b£$/td£§-3.7$/td£$/tr£$tr£$td£PLR$/td£tab_r122tab_r2#6268AFtab_r3$td£$b£14.7%$/b£$/td£§+0.0$/td£$/tr£$tr£$td£PBD$/td£tab_r120tab_r2#abd0e7tab_r3$td£$b£13.1%$/b£$/td£§+0.1$/td£$/tr£$tr£$td£Verdi$/td£tab_r114tab_r2#26b300tab_r3$td£$b£9.1%$/b£$/td£§+9.1$/td£$/tr£$tr£$td£Centro$/td£tab_r111tab_r2#f39f5etab_r3$td£$b£7.2%$/b£$/td£§+3.5$/td£$/tr£$tr£$td£PVL$/td£tab_r16tab_r2#cbd401tab_r3$td£$b£3.8%$/b£$/td£§-12.3$/td£$/tr£$/table£$br£Schede elettorali valide: $b£65$/b£$br£Tasso di partecipazione: $b£50.4%$/b£ (-5.5%)","SVP"
3784,"Pontresina GR","Pontresina (GR)","Pontresina GR","Die <b>FDP</b> erhöht ihren Stimmenanteil in Pontresina um +6,4 Prozentpunkte deutlich und wird damit zur stärksten politischen Kraft. Am Ende holt die Partei 28,4 Prozent der Wählerstimmen.<br><br>Zweitstärkste Partei ist die <b>SVP</b> mit 26 Prozent (-4,9 Prozentpunkte gegenüber 2019).<br><br>Die BDP landet mit 13,3 Prozent auf dem dritten Platz (Veränderung gegenüber 2019: -4,8 Prozentpunkte).","Le <b><b>PL</b>R</b> réalise une forte progression (+6,4 points de pourcentage) La formation est désormais le parti le plus fort de Pontresina. Le parti obtient 28,4 %age des voix.<br><br>L'<b>UDC</b> arrive en deuxième position dans la commune avec un pourcentage de votants de 26 (-4,9 points de pourcentage).<br><br>La troisième place est occupée par le PBD. La formation obtient un pourcentage d'électeurs de 13,3. (-4,8 points de pourcentage de différence par rapport à 2019).","Il partito <b>PLR</b> realizza una forte progressione (+6,4 punti percentuali). Ora è il partito più forte di Pontresina, ottenendo il 28,4 percento dei voti.<br><br>Il partito <b>UDC</b> arriva in seconda posizione nel comune con una percentuale di votanti del 26 (-4,9 punti percentuali).<br><br>La terza posizione è occupata dal partito PBD. Ottiene una percentuale di elettori del il 13,3. (-4,8 punti percentuali di differenza rispetto al 2019).","tab_h$tr£$td£FDP$/td£tab_r143tab_r2#6268AFtab_r3$td£$b£28.4%$/b£$/td£§+6.4$/td£$/tr£$tr£$td£SVP$/td£tab_r139tab_r2#547d34tab_r3$td£$b£26.0%$/b£$/td£§-4.9$/td£$/tr£$tr£$td£BDP$/td£tab_r120tab_r2#abd0e7tab_r3$td£$b£13.3%$/b£$/td£§-4.8$/td£$/tr£$tr£$td£SP$/td£tab_r120tab_r2#ea546ftab_r3$td£$b£13.2%$/b£$/td£§-1.2$/td£$/tr£$tr£$td£GLP$/td£tab_r111tab_r2#cbd401tab_r3$td£$b£7.2%$/b£$/td£§+0.3$/td£$/tr£$tr£$td£Mitte$/td£tab_r110tab_r2#f39f5etab_r3$td£$b£6.9%$/b£$/td£§-0.7$/td£$/tr£$tr£$td£Grüne$/td£tab_r18tab_r2#26b300tab_r3$td£$b£5.0%$/b£$/td£§+5.0$/td£$/tr£$/table£$br£Gültige Wahlzettel: $b£531$/b£$br£Wahlbeteiligung: $b£44.2%$/b£ (-3.3%)","tab_h_fr$tr£$td£PLR$/td£tab_r143tab_r2#6268AFtab_r3$td£$b£28.4%$/b£$/td£§+6.4$/td£$/tr£$tr£$td£UDC$/td£tab_r139tab_r2#547d34tab_r3$td£$b£26.0%$/b£$/td£§-4.9$/td£$/tr£$tr£$td£PBD$/td£tab_r120tab_r2#abd0e7tab_r3$td£$b£13.3%$/b£$/td£§-4.8$/td£$/tr£$tr£$td£PS$/td£tab_r120tab_r2#ea546ftab_r3$td£$b£13.2%$/b£$/td£§-1.2$/td£$/tr£$tr£$td£PVL$/td£tab_r111tab_r2#cbd401tab_r3$td£$b£7.2%$/b£$/td£§+0.3$/td£$/tr£$tr£$td£Centre$/td£tab_r110tab_r2#f39f5etab_r3$td£$b£6.9%$/b£$/td£§-0.7$/td£$/tr£$tr£$td£Vert-e-s$/td£tab_r18tab_r2#26b300tab_r3$td£$b£5.0%$/b£$/td£§+5.0$/td£$/tr£$/table£$br£Bulletins de vote valables: $b£531$/b£$br£Taux de participation: $b£44.2%$/b£ (-3.3%)","tab_h_it$tr£$td£PLR$/td£tab_r143tab_r2#6268AFtab_r3$td£$b£28.4%$/b£$/td£§+6.4$/td£$/tr£$tr£$td£UDC$/td£tab_r139tab_r2#547d34tab_r3$td£$b£26.0%$/b£$/td£§-4.9$/td£$/tr£$tr£$td£PBD$/td£tab_r120tab_r2#abd0e7tab_r3$td£$b£13.3%$/b£$/td£§-4.8$/td£$/tr£$tr£$td£PS$/td£tab_r120tab_r2#ea546ftab_r3$td£$b£13.2%$/b£$/td£§-1.2$/td£$/tr£$tr£$td£PVL$/td£tab_r111tab_r2#cbd401tab_r3$td£$b£7.2%$/b£$/td£§+0.3$/td£$/tr£$tr£$td£Centro$/td£tab_r110tab_r2#f39f5etab_r3$td£$b£6.9%$/b£$/td£§-0.7$/td£$/tr£$tr£$td£Verdi$/td£tab_r18tab_r2#26b300tab_r3$td£$b£5.0%$/b£$/td£§+5.0$/td£$/tr£$/table£$br£Schede elettorali valide: $b£531$/b£$br£Tasso di partecipazione: $b£44.2%$/b£ (-3.3%)","FDP"
3785,"La Punt-Chamues-ch GR","La Punt-Chamues-ch (GR)","La Punt-Chamues-ch GR","In La Punt-Chamues-ch ist die <b>SVP</b> weiterhin mit deutlichem Abstand die grösste Partei. Sie holt 39,2 Prozent der Stimmen, 23,4 Prozentpunkte mehr als die nächstgrössere Partei.<br><br>Mit einem Wähleranteil von 13,4 Prozent belegt die BDP den dritten Platz (Veränderung gegenüber 2019: -3,2 Prozentpunkte).","L'<b>UDC</b> reste le parti préféré des électeurs de La Punt-Chamues-ch. La formation politique réalise 39,2 % des voix (+2,5 points de pourcentage par rapport à 2019). C'est 23,4 points de plus que le <b><b>PL</b>R</b> qui, avec 15,8 % des voix (-2,2 points de pourcentage), se classe en deuxième position dans cette commune.<br><br>La troisième place est occupée par le PBD. La formation obtient un pourcentage d'électeurs de 13,4. (-3,2 points de pourcentage de différence par rapport à 2019).","Il partito <b>UDC</b> è in una posizione di forza a La Punt-Chamues-ch. Ottiene il 39,2 percento dei voti (+2,5 punti percentuali). La differenza con il partito <b>PLR</b> è notevole (23,4 punti percentuali). Il secondo partito del comune ha convinto il 15,8 percento degli elettori (-2,2 punti percentuali).<br><br>Al terzo posto troviamo il partito PBD con il 13,4 percento dei voti (-3,2).","tab_h$tr£$td£SVP$/td£tab_r159tab_r2#547d34tab_r3$td£$b£39.2%$/b£$/td£§+2.5$/td£$/tr£$tr£$td£FDP$/td£tab_r124tab_r2#6268AFtab_r3$td£$b£15.8%$/b£$/td£§-2.2$/td£$/tr£$tr£$td£BDP$/td£tab_r120tab_r2#abd0e7tab_r3$td£$b£13.4%$/b£$/td£§-3.2$/td£$/tr£$tr£$td£SP$/td£tab_r119tab_r2#ea546ftab_r3$td£$b£12.6%$/b£$/td£§-2.6$/td£$/tr£$tr£$td£GLP$/td£tab_r111tab_r2#cbd401tab_r3$td£$b£7.1%$/b£$/td£§-1.1$/td£$/tr£$tr£$td£Grüne$/td£tab_r19tab_r2#26b300tab_r3$td£$b£6.1%$/b£$/td£§+6.1$/td£$/tr£$tr£$td£Mitte$/td£tab_r19tab_r2#f39f5etab_r3$td£$b£5.8%$/b£$/td£§+0.5$/td£$/tr£$/table£$br£Gültige Wahlzettel: $b£171$/b£$br£Wahlbeteiligung: $b£37.7%$/b£ (-1.0%)","tab_h_fr$tr£$td£UDC$/td£tab_r159tab_r2#547d34tab_r3$td£$b£39.2%$/b£$/td£§+2.5$/td£$/tr£$tr£$td£PLR$/td£tab_r124tab_r2#6268AFtab_r3$td£$b£15.8%$/b£$/td£§-2.2$/td£$/tr£$tr£$td£PBD$/td£tab_r120tab_r2#abd0e7tab_r3$td£$b£13.4%$/b£$/td£§-3.2$/td£$/tr£$tr£$td£PS$/td£tab_r119tab_r2#ea546ftab_r3$td£$b£12.6%$/b£$/td£§-2.6$/td£$/tr£$tr£$td£PVL$/td£tab_r111tab_r2#cbd401tab_r3$td£$b£7.1%$/b£$/td£§-1.1$/td£$/tr£$tr£$td£Vert-e-s$/td£tab_r19tab_r2#26b300tab_r3$td£$b£6.1%$/b£$/td£§+6.1$/td£$/tr£$tr£$td£Centre$/td£tab_r19tab_r2#f39f5etab_r3$td£$b£5.8%$/b£$/td£§+0.5$/td£$/tr£$/table£$br£Bulletins de vote valables: $b£171$/b£$br£Taux de participation: $b£37.7%$/b£ (-1.0%)","tab_h_it$tr£$td£UDC$/td£tab_r159tab_r2#547d34tab_r3$td£$b£39.2%$/b£$/td£§+2.5$/td£$/tr£$tr£$td£PLR$/td£tab_r124tab_r2#6268AFtab_r3$td£$b£15.8%$/b£$/td£§-2.2$/td£$/tr£$tr£$td£PBD$/td£tab_r120tab_r2#abd0e7tab_r3$td£$b£13.4%$/b£$/td£§-3.2$/td£$/tr£$tr£$td£PS$/td£tab_r119tab_r2#ea546ftab_r3$td£$b£12.6%$/b£$/td£§-2.6$/td£$/tr£$tr£$td£PVL$/td£tab_r111tab_r2#cbd401tab_r3$td£$b£7.1%$/b£$/td£§-1.1$/td£$/tr£$tr£$td£Verdi$/td£tab_r19tab_r2#26b300tab_r3$td£$b£6.1%$/b£$/td£§+6.1$/td£$/tr£$tr£$td£Centro$/td£tab_r19tab_r2#f39f5etab_r3$td£$b£5.8%$/b£$/td£§+0.5$/td£$/tr£$/table£$br£Schede elettorali valide: $b£171$/b£$br£Tasso di partecipazione: $b£37.7%$/b£ (-1.0%)","SVP"
