"ID","Gemeinde_de","Gemeinde_fr","Gemeinde_it","Text_de","Text_fr","Text_it","Tabelle_de","Tabelle_fr","Tabelle_it","Staerkste_Partei"
5527,"Morrens VD","Morrens (VD)","Morrens VD","In Morrens VD behält die <b>SVP</b> ihren Status als stärkste politische Kraft. Die Partei sichert sich einen Wähleranteil von 23,2 Prozent (-4,6 Prozentpunkte).<br><br>Zweitstärkste Partei sind die <b>Grünen</b>. Die Partei verbessert sich gegenüber den Wahlen 2019 um +7,3 Prozentpunkte deutlich und weist neu einen Wähleranteil von 19,2 Prozent auf.<br><br>Die <b>SP</b> landet mit 19 Prozent auf dem dritten Platz (Veränderung gegenüber 2019: -2,9 Prozentpunkte).","L'<b>UDC</b> reste le parti le plus fort à Morrens (VD). Le parti remporte 23,2 % des voix (-4,6 points de pourcentage).<br><br>Les <b>Vert-e-s</b> progressent fortement: le parti améliore son résultat d'il y a quatre ans de +7,3 points de pourcentage et occupe désormais la deuxième place dans la commune. La proportion de voix du parti s'élève désormais à 19,2 %.<br><br>Le <b>PS</b> arrive en troisième position avec 19 % des votes. Cela représente un changement de -2,9 points de pourcentage par rapport à 2019.","Gli elettori di Morrens VD non hanno cambiato idea dal 2019. Il partito <b>UDC</b> rimane il più forte nel loro comune, con il 23,2 percento dei voti (-4,6 punti percentuali).<br><br>Il partito <b>Verdi</b> subisce una forte diminuzione a Morrens VD. Perde +7,3 punti percentuali rispetto alle elezioni per il Consiglio Nazionale del 2019 ed è ora il secondo partito del comune con il 19,2 percento dei voti.<br><br>Al terzo posto troviamo il partito <b>PS</b> con il 19 percento dei voti (-2,9).","tab_h$tr£$td£SVP$/td£tab_r135tab_r2#547d34tab_r3$td£$b£23.2%$/b£$/td£§-4.6$/td£$/tr£$tr£$td£Grüne$/td£tab_r129tab_r2#26b300tab_r3$td£$b£19.2%$/b£$/td£§+7.3$/td£$/tr£$tr£$td£SP$/td£tab_r128tab_r2#ea546ftab_r3$td£$b£19.0%$/b£$/td£§-2.9$/td£$/tr£$tr£$td£FDP$/td£tab_r127tab_r2#6268AFtab_r3$td£$b£17.9%$/b£$/td£§-5.1$/td£$/tr£$tr£$td£GLP$/td£tab_r116tab_r2#cbd401tab_r3$td£$b£10.8%$/b£$/td£§+6.9$/td£$/tr£$tr£$td£PdA$/td£tab_r16tab_r2#792a8ftab_r3$td£$b£3.9%$/b£$/td£§+2.2$/td£$/tr£$/table£$br£Gültige Wahlzettel: $b£318$/b£$br£Wahlbeteiligung: $b£46.0%$/b£ (+0.6%)","tab_h_fr$tr£$td£UDC$/td£tab_r135tab_r2#547d34tab_r3$td£$b£23.2%$/b£$/td£§-4.6$/td£$/tr£$tr£$td£Vert-e-s$/td£tab_r129tab_r2#26b300tab_r3$td£$b£19.2%$/b£$/td£§+7.3$/td£$/tr£$tr£$td£PS$/td£tab_r128tab_r2#ea546ftab_r3$td£$b£19.0%$/b£$/td£§-2.9$/td£$/tr£$tr£$td£PLR$/td£tab_r127tab_r2#6268AFtab_r3$td£$b£17.9%$/b£$/td£§-5.1$/td£$/tr£$tr£$td£PVL$/td£tab_r116tab_r2#cbd401tab_r3$td£$b£10.8%$/b£$/td£§+6.9$/td£$/tr£$tr£$td£PST-POP$/td£tab_r16tab_r2#792a8ftab_r3$td£$b£3.9%$/b£$/td£§+2.2$/td£$/tr£$/table£$br£Bulletins de vote valables: $b£318$/b£$br£Taux de participation: $b£46.0%$/b£ (+0.6%)","tab_h_it$tr£$td£UDC$/td£tab_r135tab_r2#547d34tab_r3$td£$b£23.2%$/b£$/td£§-4.6$/td£$/tr£$tr£$td£Verdi$/td£tab_r129tab_r2#26b300tab_r3$td£$b£19.2%$/b£$/td£§+7.3$/td£$/tr£$tr£$td£PS$/td£tab_r128tab_r2#ea546ftab_r3$td£$b£19.0%$/b£$/td£§-2.9$/td£$/tr£$tr£$td£PLR$/td£tab_r127tab_r2#6268AFtab_r3$td£$b£17.9%$/b£$/td£§-5.1$/td£$/tr£$tr£$td£PVL$/td£tab_r116tab_r2#cbd401tab_r3$td£$b£10.8%$/b£$/td£§+6.9$/td£$/tr£$tr£$td£POP$/td£tab_r16tab_r2#792a8ftab_r3$td£$b£3.9%$/b£$/td£§+2.2$/td£$/tr£$/table£$br£Schede elettorali valide: $b£318$/b£$br£Tasso di partecipazione: $b£46.0%$/b£ (+0.6%)","SVP"
5529,"Oulens-sous-Echallens VD","Oulens-sous-Echallens (VD)","Oulens-sous-Echallens VD","Die <b>FDP</b> behauptet ihre Position als vorherrschende Partei in Oulens-sous-Echallens. Die Partei verzeichnet einen Wähleranteil von 28,6 Prozent (-3,1 Prozentpunkte).<br><br>Zweitstärkste Partei ist die <b>SVP</b> mit 25 Prozent (-0,1 Prozentpunkte gegenüber 2019).<br><br>Die <b>Grünen</b> sichern sich den dritten Platz, mit einem Wähleranteil von 15,1 Prozent (Veränderung gegenüber 2019: +4,3 Prozentpunkte).","Les électeurs d'Oulens-sous-Echallens maintiennent leur confiance au <b><b>PL</b>R</b>, qui termine en tête dans leur commune, comme en 2019, avec 28,6 % des voix (-3,1 points de pourcentage).<br><br>L'<b>UDC</b> se classe deuxième. La formation obtient 25 % des suffrages (-0,1 points de pourcentage) dans la commune.<br><br>Les <b>Vert-e-s</b> se classent troisième. La formation obtient 15,1 % des voix (+4,3 points de pourcentage par rapport à 2019).","Gli elettori di Oulens-sous-Echallens non hanno cambiato idea dal 2019. Il partito <b>PLR</b> rimane il più forte nel loro comune, con il 28,6 percento dei voti (-3,1 punti percentuali).<br><br>Il partito <b>UDC</b> è il secondo partito più forte a Oulens-sous-Echallens. Si è migliorato di -0,1 punti percentuali rispetto alle elezioni per il Consiglio nazionale del 2019.<br><br>Il partito <b>Verdi</b> si posiziona terzo con il 15,1 percento dei voti. Questo rappresenta una variazione di +4,3 punti percentuali rispetto al 2019.","tab_h$tr£$td£FDP$/td£tab_r143tab_r2#6268AFtab_r3$td£$b£28.6%$/b£$/td£§-3.1$/td£$/tr£$tr£$td£SVP$/td£tab_r138tab_r2#547d34tab_r3$td£$b£25.0%$/b£$/td£§-0.1$/td£$/tr£$tr£$td£Grüne$/td£tab_r123tab_r2#26b300tab_r3$td£$b£15.1%$/b£$/td£§+4.3$/td£$/tr£$tr£$td£SP$/td£tab_r119tab_r2#ea546ftab_r3$td£$b£12.4%$/b£$/td£§-0.1$/td£$/tr£$tr£$td£GLP$/td£tab_r116tab_r2#cbd401tab_r3$td£$b£10.8%$/b£$/td£§+5.0$/td£$/tr£$/table£$br£Gültige Wahlzettel: $b£197$/b£$br£Wahlbeteiligung: $b£51.6%$/b£ (-3.4%)","tab_h_fr$tr£$td£PLR$/td£tab_r143tab_r2#6268AFtab_r3$td£$b£28.6%$/b£$/td£§-3.1$/td£$/tr£$tr£$td£UDC$/td£tab_r138tab_r2#547d34tab_r3$td£$b£25.0%$/b£$/td£§-0.1$/td£$/tr£$tr£$td£Vert-e-s$/td£tab_r123tab_r2#26b300tab_r3$td£$b£15.1%$/b£$/td£§+4.3$/td£$/tr£$tr£$td£PS$/td£tab_r119tab_r2#ea546ftab_r3$td£$b£12.4%$/b£$/td£§-0.1$/td£$/tr£$tr£$td£PVL$/td£tab_r116tab_r2#cbd401tab_r3$td£$b£10.8%$/b£$/td£§+5.0$/td£$/tr£$/table£$br£Bulletins de vote valables: $b£197$/b£$br£Taux de participation: $b£51.6%$/b£ (-3.4%)","tab_h_it$tr£$td£PLR$/td£tab_r143tab_r2#6268AFtab_r3$td£$b£28.6%$/b£$/td£§-3.1$/td£$/tr£$tr£$td£UDC$/td£tab_r138tab_r2#547d34tab_r3$td£$b£25.0%$/b£$/td£§-0.1$/td£$/tr£$tr£$td£Verdi$/td£tab_r123tab_r2#26b300tab_r3$td£$b£15.1%$/b£$/td£§+4.3$/td£$/tr£$tr£$td£PS$/td£tab_r119tab_r2#ea546ftab_r3$td£$b£12.4%$/b£$/td£§-0.1$/td£$/tr£$tr£$td£PVL$/td£tab_r116tab_r2#cbd401tab_r3$td£$b£10.8%$/b£$/td£§+5.0$/td£$/tr£$/table£$br£Schede elettorali valide: $b£197$/b£$br£Tasso di partecipazione: $b£51.6%$/b£ (-3.4%)","FDP"
5530,"Pailly VD","Pailly (VD)","Pailly VD","Unverändert ist die <b>SVP</b> die stärkste Partei in Pailly mit 33,8 Prozent (+1 Prozentpunkte).<br><br>Zweitstärkste Partei ist die <b>FDP</b> mit 24,7 Prozent (-3,5 Prozentpunkte gegenüber 2019).<br><br>Auf dem dritten Platz landen die <b>Grünen</b> mit 10,9 Prozent der Stimmen. Das bedeutet eine Veränderung von +2,8 Prozentpunkten gegenüber 2019. ","Les électeurs de Pailly maintiennent leur confiance au <b>UDC</b>, qui termine en tête dans leur commune, comme en 2019, avec 33,8 % des voix (+1 points de pourcentage).<br><br>Le <b><b>PL</b>R</b> est le deuxième parti le plus fort avec 24,7 % des voix (-3,5 points de pourcentage par rapport à 2019).<br><br>Les <b>Vert-e-s</b> complètent le podium. La formation récolte 10,9 % des suffrages (+2,8).","Gli elettori di Pailly non hanno cambiato idea dal 2019. Il partito <b>UDC</b> rimane il più forte nel loro comune, con il 33,8 percento dei voti (+1 punti percentuali).<br><br>Il partito <b>PLR</b> arriva in seconda posizione nel comune con una percentuale di votanti del 24,7 (-3,5 punti percentuali).<br><br>La terza posizione è occupata dal partito <b>Verdi</b> che ottiene il 10,9 percento dei voti (+2,8 punti percentuali rispetto al 2019).","tab_h$tr£$td£SVP$/td£tab_r151tab_r2#547d34tab_r3$td£$b£33.8%$/b£$/td£§+1.0$/td£$/tr£$tr£$td£FDP$/td£tab_r137tab_r2#6268AFtab_r3$td£$b£24.7%$/b£$/td£§-3.5$/td£$/tr£$tr£$td£Grüne$/td£tab_r116tab_r2#26b300tab_r3$td£$b£10.9%$/b£$/td£§+2.8$/td£$/tr£$tr£$td£SP$/td£tab_r116tab_r2#ea546ftab_r3$td£$b£10.5%$/b£$/td£§-0.1$/td£$/tr£$tr£$td£GLP$/td£tab_r115tab_r2#cbd401tab_r3$td£$b£9.7%$/b£$/td£§+6.6$/td£$/tr£$tr£$td£Mitte$/td£tab_r16tab_r2#f39f5etab_r3$td£$b£3.8%$/b£$/td£§+1.0$/td£$/tr£$/table£$br£Gültige Wahlzettel: $b£167$/b£$br£Wahlbeteiligung: $b£44.8%$/b£ (+3.7%)","tab_h_fr$tr£$td£UDC$/td£tab_r151tab_r2#547d34tab_r3$td£$b£33.8%$/b£$/td£§+1.0$/td£$/tr£$tr£$td£PLR$/td£tab_r137tab_r2#6268AFtab_r3$td£$b£24.7%$/b£$/td£§-3.5$/td£$/tr£$tr£$td£Vert-e-s$/td£tab_r116tab_r2#26b300tab_r3$td£$b£10.9%$/b£$/td£§+2.8$/td£$/tr£$tr£$td£PS$/td£tab_r116tab_r2#ea546ftab_r3$td£$b£10.5%$/b£$/td£§-0.1$/td£$/tr£$tr£$td£PVL$/td£tab_r115tab_r2#cbd401tab_r3$td£$b£9.7%$/b£$/td£§+6.6$/td£$/tr£$tr£$td£Centre$/td£tab_r16tab_r2#f39f5etab_r3$td£$b£3.8%$/b£$/td£§+1.0$/td£$/tr£$/table£$br£Bulletins de vote valables: $b£167$/b£$br£Taux de participation: $b£44.8%$/b£ (+3.7%)","tab_h_it$tr£$td£UDC$/td£tab_r151tab_r2#547d34tab_r3$td£$b£33.8%$/b£$/td£§+1.0$/td£$/tr£$tr£$td£PLR$/td£tab_r137tab_r2#6268AFtab_r3$td£$b£24.7%$/b£$/td£§-3.5$/td£$/tr£$tr£$td£Verdi$/td£tab_r116tab_r2#26b300tab_r3$td£$b£10.9%$/b£$/td£§+2.8$/td£$/tr£$tr£$td£PS$/td£tab_r116tab_r2#ea546ftab_r3$td£$b£10.5%$/b£$/td£§-0.1$/td£$/tr£$tr£$td£PVL$/td£tab_r115tab_r2#cbd401tab_r3$td£$b£9.7%$/b£$/td£§+6.6$/td£$/tr£$tr£$td£Centro$/td£tab_r16tab_r2#f39f5etab_r3$td£$b£3.8%$/b£$/td£§+1.0$/td£$/tr£$/table£$br£Schede elettorali valide: $b£167$/b£$br£Tasso di partecipazione: $b£44.8%$/b£ (+3.7%)","SVP"
5531,"Penthéréaz VD","Penthéréaz (VD)","Penthéréaz VD","Mit einem grossen Sprung von +6 Prozentpunkten ist die <b>FDP</b> neu die stärkste Partei in Penthéréaz. Die Partei erhält 32 Prozent der Wählerstimmen.<br><br>Einen markanten Verlust muss die <b>SVP</b> hinnehmen: Die Partei verliert -12,8 Prozentpunkte gegenüber den Wahlen 2019 und liegt jetzt noch bei 16,2 Prozent Wähleranteil. Das bedeutet dennoch Rang 2.<br><br>Den dritten Platz in Penthéréaz teilen sich zwei Parteien: Die <b>Grünen</b> und die <b>GLP</b> sind genau gleich stark. Mit je 14,8 Prozent kommen beide Parteien auf den gleichen Wähleranteil.","Le <b><b>PL</b>R</b> réalise une forte progression (+6 points de pourcentage) La formation est désormais le parti le plus fort de Penthéréaz. Le parti obtient 32 %age des voix.<br><br>L'<b>UDC</b> perd beaucoup de voix. Le parti enregistre un recul de -12,8 points de pourcentage par rapport aux élections de 2019. Malgré cela, la formation reste en deuxième position avec un pourcentage d'électeurs de 16,2 %.<br><br>Deux partis se partagent la troisième place de Penthéréaz. Les <b>Vert-e-s</b> et le <b>PVL</b> obtiennent chacun 14,8 des voix.","Il partito <b>PLR</b> aumenta significativamente la sua percentuale di voti a Penthéréaz (+6 punti percentuali), diventando così la formazione più forte. Alla fine ottiene il 32 percento dei voti degli elettori.<br><br>Il partito <b>UDC</b> perde molti voti, registrando una perdita di -12,8 punti percentuali rispetto alle elezioni del 2019. Nonostante ciò, rimane in seconda posizione con una quota di elettori del 16,2 percento.<br><br>Due formazioni condividono il terzo posto a Penthéréaz. Il partito <b>Verdi</b> e il partito <b>PVL</b> ricevono entrambi il 14,8 dei voti.","tab_h$tr£$td£FDP$/td£tab_r148tab_r2#6268AFtab_r3$td£$b£32.0%$/b£$/td£§+6.0$/td£$/tr£$tr£$td£SVP$/td£tab_r124tab_r2#547d34tab_r3$td£$b£16.2%$/b£$/td£§-12.8$/td£$/tr£$tr£$td£Grüne$/td£tab_r122tab_r2#26b300tab_r3$td£$b£14.8%$/b£$/td£§+4.9$/td£$/tr£$tr£$td£GLP$/td£tab_r122tab_r2#cbd401tab_r3$td£$b£14.8%$/b£$/td£§+11.2$/td£$/tr£$tr£$td£SP$/td£tab_r121tab_r2#ea546ftab_r3$td£$b£14.1%$/b£$/td£§-6.6$/td£$/tr£$/table£$br£Gültige Wahlzettel: $b£148$/b£$br£Wahlbeteiligung: $b£49.3%$/b£ (-0.7%)","tab_h_fr$tr£$td£PLR$/td£tab_r148tab_r2#6268AFtab_r3$td£$b£32.0%$/b£$/td£§+6.0$/td£$/tr£$tr£$td£UDC$/td£tab_r124tab_r2#547d34tab_r3$td£$b£16.2%$/b£$/td£§-12.8$/td£$/tr£$tr£$td£Vert-e-s$/td£tab_r122tab_r2#26b300tab_r3$td£$b£14.8%$/b£$/td£§+4.9$/td£$/tr£$tr£$td£PVL$/td£tab_r122tab_r2#cbd401tab_r3$td£$b£14.8%$/b£$/td£§+11.2$/td£$/tr£$tr£$td£PS$/td£tab_r121tab_r2#ea546ftab_r3$td£$b£14.1%$/b£$/td£§-6.6$/td£$/tr£$/table£$br£Bulletins de vote valables: $b£148$/b£$br£Taux de participation: $b£49.3%$/b£ (-0.7%)","tab_h_it$tr£$td£PLR$/td£tab_r148tab_r2#6268AFtab_r3$td£$b£32.0%$/b£$/td£§+6.0$/td£$/tr£$tr£$td£UDC$/td£tab_r124tab_r2#547d34tab_r3$td£$b£16.2%$/b£$/td£§-12.8$/td£$/tr£$tr£$td£Verdi$/td£tab_r122tab_r2#26b300tab_r3$td£$b£14.8%$/b£$/td£§+4.9$/td£$/tr£$tr£$td£PVL$/td£tab_r122tab_r2#cbd401tab_r3$td£$b£14.8%$/b£$/td£§+11.2$/td£$/tr£$tr£$td£PS$/td£tab_r121tab_r2#ea546ftab_r3$td£$b£14.1%$/b£$/td£§-6.6$/td£$/tr£$/table£$br£Schede elettorali valide: $b£148$/b£$br£Tasso di partecipazione: $b£49.3%$/b£ (-0.7%)","FDP"
5533,"Poliez-Pittet VD","Poliez-Pittet (VD)","Poliez-Pittet VD","Die <b>SVP</b> ist weiterhin die stärkste Kraft in Poliez-Pittet. Mit 25,7 Prozent Wähleranteil verweist die Partei die <b>FDP</b> allerdings nur mit 2,4 Prozentpunkten Abstand auf den zweiten Platz. Die zweitstärkste Partei holt 23,3 Prozent. Die Veränderungen gegenüber 2019: <b>SVP</b>: -2,5 Prozentpunkte; <b>FDP</b>: -1,2 Prozentpunkte.<br><br>Der dritte Platz geht an die <b>SP</b>. Die Partei erreicht 14,2 Prozent der Stimmen (Veränderung von -3,2 Prozentpunkten gegenüber 2019).","Avec 25,7 % des voix (-2,5 points de pourcentage), l'<b>UDC</b> est toujours le parti le plus fort à Poliez-Pittet. Le <b><b>PL</b>R</b>, qui réalise 23,3 % des suffrages (-1,2 points de pourcentage), est cependant en embuscade. L'écart entre les deux formations politiques est de 2,4 points.<br><br>A la troisième place figure le <b>PS</b>, qui réalise 14,2 % des voix (-3,2).","Il partito <b>UDC</b> rimane in testa a Poliez-Pittet con il 25,7 percento dei voti (-2,5 punti percentuali). Il suo rivale, il partito <b>PLR</b>, minaccia però di sovrastarlo con il 25,7 percento dei voti (-1,2 punti percentuali). La differenza tra le due formazioni è solo di 2,4 punti.<br><br>Il partito <b>PS</b> completa il podio con il 14,2 percento dei voti (-3,2).","tab_h$tr£$td£SVP$/td£tab_r139tab_r2#547d34tab_r3$td£$b£25.7%$/b£$/td£§-2.5$/td£$/tr£$tr£$td£FDP$/td£tab_r135tab_r2#6268AFtab_r3$td£$b£23.3%$/b£$/td£§-1.2$/td£$/tr£$tr£$td£SP$/td£tab_r121tab_r2#ea546ftab_r3$td£$b£14.2%$/b£$/td£§-3.2$/td£$/tr£$tr£$td£Grüne$/td£tab_r119tab_r2#26b300tab_r3$td£$b£13.0%$/b£$/td£§+5.5$/td£$/tr£$tr£$td£Mitte$/td£tab_r115tab_r2#f39f5etab_r3$td£$b£10.0%$/b£$/td£§-3.9$/td£$/tr£$tr£$td£GLP$/td£tab_r114tab_r2#cbd401tab_r3$td£$b£9.1%$/b£$/td£§+5.4$/td£$/tr£$/table£$br£Gültige Wahlzettel: $b£234$/b£$br£Wahlbeteiligung: $b£42.5%$/b£ (-0.9%)","tab_h_fr$tr£$td£UDC$/td£tab_r139tab_r2#547d34tab_r3$td£$b£25.7%$/b£$/td£§-2.5$/td£$/tr£$tr£$td£PLR$/td£tab_r135tab_r2#6268AFtab_r3$td£$b£23.3%$/b£$/td£§-1.2$/td£$/tr£$tr£$td£PS$/td£tab_r121tab_r2#ea546ftab_r3$td£$b£14.2%$/b£$/td£§-3.2$/td£$/tr£$tr£$td£Vert-e-s$/td£tab_r119tab_r2#26b300tab_r3$td£$b£13.0%$/b£$/td£§+5.5$/td£$/tr£$tr£$td£Centre$/td£tab_r115tab_r2#f39f5etab_r3$td£$b£10.0%$/b£$/td£§-3.9$/td£$/tr£$tr£$td£PVL$/td£tab_r114tab_r2#cbd401tab_r3$td£$b£9.1%$/b£$/td£§+5.4$/td£$/tr£$/table£$br£Bulletins de vote valables: $b£234$/b£$br£Taux de participation: $b£42.5%$/b£ (-0.9%)","tab_h_it$tr£$td£UDC$/td£tab_r139tab_r2#547d34tab_r3$td£$b£25.7%$/b£$/td£§-2.5$/td£$/tr£$tr£$td£PLR$/td£tab_r135tab_r2#6268AFtab_r3$td£$b£23.3%$/b£$/td£§-1.2$/td£$/tr£$tr£$td£PS$/td£tab_r121tab_r2#ea546ftab_r3$td£$b£14.2%$/b£$/td£§-3.2$/td£$/tr£$tr£$td£Verdi$/td£tab_r119tab_r2#26b300tab_r3$td£$b£13.0%$/b£$/td£§+5.5$/td£$/tr£$tr£$td£Centro$/td£tab_r115tab_r2#f39f5etab_r3$td£$b£10.0%$/b£$/td£§-3.9$/td£$/tr£$tr£$td£PVL$/td£tab_r114tab_r2#cbd401tab_r3$td£$b£9.1%$/b£$/td£§+5.4$/td£$/tr£$/table£$br£Schede elettorali valide: $b£234$/b£$br£Tasso di partecipazione: $b£42.5%$/b£ (-0.9%)","SVP"
5534,"Rueyres VD","Rueyres (VD)","Rueyres VD","Ganz knapp bleibt die <b>SVP</b> die grösste Partei in Rueyres. Die Partei holt 31,5 Prozent der Stimmen und hält damit ihren Vorsprung, mit 2,7 Prozentpunkten, vor der <b>FDP</b>. Diese muss sich mit 28,8 Prozent und Platz zwei begnügen. Die Veränderungen gegenüber 2019: <b>SVP</b>: -7,9 Prozentpunkte; <b>FDP</b>: +7,5 Prozentpunkte.<br><br>Die <b>Grünen</b> verzeichnen einen deutlichen Zuwachs. Die Partei belegt nun den dritten Platz in der Gemeinde und erreicht neu einen Wähleranteil von 14,3 Prozent. Das sind +5,3 Prozentpunkte mehr als im Vergleich zu den letzten Wahlen.","Avec 31,5 % des voix (-7,9 points de pourcentage), l'<b>UDC</b> est toujours le parti le plus fort à Rueyres. Le <b><b>PL</b>R</b>, qui réalise 28,8 % des suffrages (+7,5 points de pourcentage), est cependant en embuscade. L'écart entre les deux formations politiques est de 2,7 points.<br><br>Une forte progression de +5,3 points de pourcentage par rapport aux dernières élections fédérales permet aux <b>Vert-e-s</b> de grimper à la troisième place dans la commune. Son pourcentage d'électeurs est désormais de 14,3 %.","Il partito <b>UDC</b> rimane in testa a Rueyres con il 31,5 percento dei voti (-7,9 punti percentuali). Il suo rivale, il partito <b>PLR</b>, minaccia però di sovrastarlo con il 31,5 percento dei voti (+7,5 punti percentuali). La differenza tra le due formazioni è solo di 2,7 punti.<br><br>Il partito <b>Verdi</b> registra una forte crescita. Ora si classifica terzo nel comune e riceve il 14,3 percento dei voti, ovvero +5,3 punti percentuali in più rispetto al 2019.","tab_h$tr£$td£SVP$/td£tab_r147tab_r2#547d34tab_r3$td£$b£31.5%$/b£$/td£§-7.9$/td£$/tr£$tr£$td£FDP$/td£tab_r143tab_r2#6268AFtab_r3$td£$b£28.8%$/b£$/td£§+7.5$/td£$/tr£$tr£$td£Grüne$/td£tab_r121tab_r2#26b300tab_r3$td£$b£14.3%$/b£$/td£§+5.3$/td£$/tr£$tr£$td£SP$/td£tab_r115tab_r2#ea546ftab_r3$td£$b£10.2%$/b£$/td£§+0.7$/td£$/tr£$tr£$td£GLP$/td£tab_r111tab_r2#cbd401tab_r3$td£$b£7.3%$/b£$/td£§+1.6$/td£$/tr£$/table£$br£Gültige Wahlzettel: $b£106$/b£$br£Wahlbeteiligung: $b£58.9%$/b£ (+5.0%)","tab_h_fr$tr£$td£UDC$/td£tab_r147tab_r2#547d34tab_r3$td£$b£31.5%$/b£$/td£§-7.9$/td£$/tr£$tr£$td£PLR$/td£tab_r143tab_r2#6268AFtab_r3$td£$b£28.8%$/b£$/td£§+7.5$/td£$/tr£$tr£$td£Vert-e-s$/td£tab_r121tab_r2#26b300tab_r3$td£$b£14.3%$/b£$/td£§+5.3$/td£$/tr£$tr£$td£PS$/td£tab_r115tab_r2#ea546ftab_r3$td£$b£10.2%$/b£$/td£§+0.7$/td£$/tr£$tr£$td£PVL$/td£tab_r111tab_r2#cbd401tab_r3$td£$b£7.3%$/b£$/td£§+1.6$/td£$/tr£$/table£$br£Bulletins de vote valables: $b£106$/b£$br£Taux de participation: $b£58.9%$/b£ (+5.0%)","tab_h_it$tr£$td£UDC$/td£tab_r147tab_r2#547d34tab_r3$td£$b£31.5%$/b£$/td£§-7.9$/td£$/tr£$tr£$td£PLR$/td£tab_r143tab_r2#6268AFtab_r3$td£$b£28.8%$/b£$/td£§+7.5$/td£$/tr£$tr£$td£Verdi$/td£tab_r121tab_r2#26b300tab_r3$td£$b£14.3%$/b£$/td£§+5.3$/td£$/tr£$tr£$td£PS$/td£tab_r115tab_r2#ea546ftab_r3$td£$b£10.2%$/b£$/td£§+0.7$/td£$/tr£$tr£$td£PVL$/td£tab_r111tab_r2#cbd401tab_r3$td£$b£7.3%$/b£$/td£§+1.6$/td£$/tr£$/table£$br£Schede elettorali valide: $b£106$/b£$br£Tasso di partecipazione: $b£58.9%$/b£ (+5.0%)","SVP"
5535,"Saint-Barthélemy VD","Saint-Barthélemy (VD)","Saint-Barthélemy VD","Unverändert ist die <b>SVP</b> die stärkste Partei in Saint-Barthélemy VD mit 30,8 Prozent (+2,4 Prozentpunkte).<br><br>In der Gemeinde landet die <b>FDP</b> auf dem zweiten Platz. Die Partei erreicht einen Wählerstimmenanteil von 16,4 Prozent (-1,7 Prozentpunkte). <br><br>Der dritte Platz geht an die <b>Mitte</b>. Die Partei erreicht 13,4 Prozent der Stimmen (Veränderung von +3,2 Prozentpunkten gegenüber 2019).<br><br>Besonders ist: Die <b>Mitte</b> erreicht in der Gemeinde das höchste Resultat des gesamten Kantons (ohne Kleinstgemeinden).","L'<b>UDC</b> maintient sa position de première force politique dans la commune de Saint-Barthélemy (VD). Le parti récolte 30,8 % des suffrages (+2,4 points de pourcentage).<br><br>Le <b><b>PL</b>R</b> arrive en deuxième position dans la commune, avec un pourcentage de votants de 16,4 (-1,7 points de pourcentage)<br><br>La troisième place est occupée par le <b>Centre</b>. La formation obtient un pourcentage d'électeurs de 13,4. (+3,2 points de pourcentage de différence par rapport à 2019).<br><br>Le <b>Centre</b> obtient dans la commune le résultat le plus élevé de tout le canton (sans tenir compte des petites communes).","Gli elettori di Saint-Barthélemy VD mantengono la loro fiducia nel partito <b>UDC</b>, che risulta il primo nel loro comune, come nel 2019, con il 30,8 percento dei voti (+2,4 punti percentuali).<br><br>Il secondo rango è occupato dal partito <b>PLR</b> che ottiene il 16,4 percento dei voti (-1,7 punti percentuali rispetto al 2019).<br><br>Il partito <b>Centro</b> completa il podio con il 13,4 percento dei voti (+3,2).<br><br>Il partito <b>Centro</b> ottiene nel comune il risultato più alto dell'intero cantone (senza considerare i piccoli comuni).","tab_h$tr£$td£SVP$/td£tab_r146tab_r2#547d34tab_r3$td£$b£30.8%$/b£$/td£§+2.4$/td£$/tr£$tr£$td£FDP$/td£tab_r125tab_r2#6268AFtab_r3$td£$b£16.4%$/b£$/td£§-1.7$/td£$/tr£$tr£$td£Mitte$/td£tab_r120tab_r2#f39f5etab_r3$td£$b£13.4%$/b£$/td£§+3.2$/td£$/tr£$tr£$td£SP$/td£tab_r120tab_r2#ea546ftab_r3$td£$b£13.1%$/b£$/td£§-7.6$/td£$/tr£$tr£$td£Grüne$/td£tab_r117tab_r2#26b300tab_r3$td£$b£11.6%$/b£$/td£§-0.3$/td£$/tr£$tr£$td£GLP$/td£tab_r111tab_r2#cbd401tab_r3$td£$b£7.1%$/b£$/td£§+5.3$/td£$/tr£$tr£$td£PdA$/td£tab_r16tab_r2#792a8ftab_r3$td£$b£4.1%$/b£$/td£§+2.0$/td£$/tr£$/table£$br£Gültige Wahlzettel: $b£222$/b£$br£Wahlbeteiligung: $b£39.7%$/b£ (-2.1%)","tab_h_fr$tr£$td£UDC$/td£tab_r146tab_r2#547d34tab_r3$td£$b£30.8%$/b£$/td£§+2.4$/td£$/tr£$tr£$td£PLR$/td£tab_r125tab_r2#6268AFtab_r3$td£$b£16.4%$/b£$/td£§-1.7$/td£$/tr£$tr£$td£Centre$/td£tab_r120tab_r2#f39f5etab_r3$td£$b£13.4%$/b£$/td£§+3.2$/td£$/tr£$tr£$td£PS$/td£tab_r120tab_r2#ea546ftab_r3$td£$b£13.1%$/b£$/td£§-7.6$/td£$/tr£$tr£$td£Vert-e-s$/td£tab_r117tab_r2#26b300tab_r3$td£$b£11.6%$/b£$/td£§-0.3$/td£$/tr£$tr£$td£PVL$/td£tab_r111tab_r2#cbd401tab_r3$td£$b£7.1%$/b£$/td£§+5.3$/td£$/tr£$tr£$td£PST-POP$/td£tab_r16tab_r2#792a8ftab_r3$td£$b£4.1%$/b£$/td£§+2.0$/td£$/tr£$/table£$br£Bulletins de vote valables: $b£222$/b£$br£Taux de participation: $b£39.7%$/b£ (-2.1%)","tab_h_it$tr£$td£UDC$/td£tab_r146tab_r2#547d34tab_r3$td£$b£30.8%$/b£$/td£§+2.4$/td£$/tr£$tr£$td£PLR$/td£tab_r125tab_r2#6268AFtab_r3$td£$b£16.4%$/b£$/td£§-1.7$/td£$/tr£$tr£$td£Centro$/td£tab_r120tab_r2#f39f5etab_r3$td£$b£13.4%$/b£$/td£§+3.2$/td£$/tr£$tr£$td£PS$/td£tab_r120tab_r2#ea546ftab_r3$td£$b£13.1%$/b£$/td£§-7.6$/td£$/tr£$tr£$td£Verdi$/td£tab_r117tab_r2#26b300tab_r3$td£$b£11.6%$/b£$/td£§-0.3$/td£$/tr£$tr£$td£PVL$/td£tab_r111tab_r2#cbd401tab_r3$td£$b£7.1%$/b£$/td£§+5.3$/td£$/tr£$tr£$td£POP$/td£tab_r16tab_r2#792a8ftab_r3$td£$b£4.1%$/b£$/td£§+2.0$/td£$/tr£$/table£$br£Schede elettorali valide: $b£222$/b£$br£Tasso di partecipazione: $b£39.7%$/b£ (-2.1%)","SVP"
