"ID","Gemeinde_de","Gemeinde_fr","Gemeinde_it","Text_de","Text_fr","Text_it","Tabelle_de","Tabelle_fr","Tabelle_it","Staerkste_Partei"
2862,"Tecknau BL","Tecknau (BL)","Tecknau BL","Mit grossem Abstand verteidigt die <b>SVP</b> ihre Position als grösste Partei in Tecknau, mit einem Wähleranteil von 40,6 Prozent (+2,5 Prozentpunkte). Der Abstand zur zweitgrößten Partei, der <b>SP</b>, beträgt 22,4 Prozentpunkte. Die <b>SP</b> erhält 18,2 Prozent der Stimmen (+1,2 Prozentpunkte).<br><br>Die <b>FDP</b> sichert sich den dritten Platz, mit einem Wähleranteil von 10,5 Prozent (Veränderung gegenüber 2019: -1,5 Prozentpunkte).","Avec 40,6 % des voix (+2,5 points de pourcentage), la position de leader du <b>UDC</b> est solide à Tecknau. L'avance atteint 22,4 points par rapport au parti suivant. En comparaison, le <b>PS</b> se classe à la deuxième place avec 18,2 % des suffrages (+1,2 points de pourcentage). <br><br>La troisième place est occupée par le <b><b>PL</b>R</b>. La formation obtient un pourcentage d'électeurs de 10,5. (-1,5 points de pourcentage de différence par rapport à 2019).","Il partito <b>UDC</b> è in una posizione di forza a Tecknau. Ottiene il 40,6 percento dei voti (+2,5 punti percentuali). La differenza con il partito <b>PS</b> è notevole (22,4 punti percentuali). Il secondo partito del comune ha convinto il 18,2 percento degli elettori (+1,2 punti percentuali).<br><br>Al terzo posto troviamo il partito <b>PLR</b> con il 10,5 percento dei voti (-1,5).","tab_h$tr£$td£SVP$/td£tab_r161tab_r2#547d34tab_r3$td£$b£40.6%$/b£$/td£§+2.5$/td£$/tr£$tr£$td£SP$/td£tab_r127tab_r2#ea546ftab_r3$td£$b£18.2%$/b£$/td£§+1.2$/td£$/tr£$tr£$td£FDP$/td£tab_r116tab_r2#6268AFtab_r3$td£$b£10.5%$/b£$/td£§-1.5$/td£$/tr£$tr£$td£Grüne$/td£tab_r114tab_r2#26b300tab_r3$td£$b£9.2%$/b£$/td£§-10.0$/td£$/tr£$tr£$td£Mitte$/td£tab_r113tab_r2#f39f5etab_r3$td£$b£8.7%$/b£$/td£§+1.5$/td£$/tr£$tr£$td£GLP$/td£tab_r111tab_r2#cbd401tab_r3$td£$b£7.1%$/b£$/td£§+2.9$/td£$/tr£$tr£$td£EVP$/td£tab_r15tab_r2#87bfdctab_r3$td£$b£3.1%$/b£$/td£§+0.8$/td£$/tr£$/table£$br£Gültige Wahlzettel: $b£177$/b£$br£Wahlbeteiligung: $b£39.3%$/b£ (+4.4%)","tab_h_fr$tr£$td£UDC$/td£tab_r161tab_r2#547d34tab_r3$td£$b£40.6%$/b£$/td£§+2.5$/td£$/tr£$tr£$td£PS$/td£tab_r127tab_r2#ea546ftab_r3$td£$b£18.2%$/b£$/td£§+1.2$/td£$/tr£$tr£$td£PLR$/td£tab_r116tab_r2#6268AFtab_r3$td£$b£10.5%$/b£$/td£§-1.5$/td£$/tr£$tr£$td£Vert-e-s$/td£tab_r114tab_r2#26b300tab_r3$td£$b£9.2%$/b£$/td£§-10.0$/td£$/tr£$tr£$td£Centre$/td£tab_r113tab_r2#f39f5etab_r3$td£$b£8.7%$/b£$/td£§+1.5$/td£$/tr£$tr£$td£PVL$/td£tab_r111tab_r2#cbd401tab_r3$td£$b£7.1%$/b£$/td£§+2.9$/td£$/tr£$tr£$td£PEV$/td£tab_r15tab_r2#87bfdctab_r3$td£$b£3.1%$/b£$/td£§+0.8$/td£$/tr£$/table£$br£Bulletins de vote valables: $b£177$/b£$br£Taux de participation: $b£39.3%$/b£ (+4.4%)","tab_h_it$tr£$td£UDC$/td£tab_r161tab_r2#547d34tab_r3$td£$b£40.6%$/b£$/td£§+2.5$/td£$/tr£$tr£$td£PS$/td£tab_r127tab_r2#ea546ftab_r3$td£$b£18.2%$/b£$/td£§+1.2$/td£$/tr£$tr£$td£PLR$/td£tab_r116tab_r2#6268AFtab_r3$td£$b£10.5%$/b£$/td£§-1.5$/td£$/tr£$tr£$td£Verdi$/td£tab_r114tab_r2#26b300tab_r3$td£$b£9.2%$/b£$/td£§-10.0$/td£$/tr£$tr£$td£Centro$/td£tab_r113tab_r2#f39f5etab_r3$td£$b£8.7%$/b£$/td£§+1.5$/td£$/tr£$tr£$td£PVL$/td£tab_r111tab_r2#cbd401tab_r3$td£$b£7.1%$/b£$/td£§+2.9$/td£$/tr£$tr£$td£PEV$/td£tab_r15tab_r2#87bfdctab_r3$td£$b£3.1%$/b£$/td£§+0.8$/td£$/tr£$/table£$br£Schede elettorali valide: $b£177$/b£$br£Tasso di partecipazione: $b£39.3%$/b£ (+4.4%)","SVP"
2863,"Tenniken BL","Tenniken (BL)","Tenniken BL","Mit einem grossen Sprung von +13,6 Prozentpunkten ist die <b>SVP</b> neu die stärkste Partei in Tenniken. Die Partei erhält 35 Prozent der Wählerstimmen.<br><br>Zweitstärkste Partei ist die <b>SP</b>. Die Partei verbessert sich gegenüber den Wahlen 2019 um +5,5 Prozentpunkte deutlich und weist neu einen Wähleranteil von 24,4 Prozent auf.<br><br>Den dritten Platz belegt die <b>Mitte</b>. Die Partei erzielt einen Wähleranteil von 11,1 Prozent (Veränderung gegenüber 2019: +4,7 Prozentpunkte).","L'<b>UDC</b> réalise une forte progression (+13,6 points de pourcentage) La formation est désormais le parti le plus fort de Tenniken. Le parti obtient 35 %age des voix.<br><br>Le <b>PS</b> progresse fortement: le parti améliore son résultat d'il y a quatre ans de +5,5 points de pourcentage et occupe désormais la deuxième place dans la commune. La proportion de voix du parti s'élève désormais à 24,4 %.<br><br>La troisième place est occupée par le <b>Centre</b>. La formation obtient un pourcentage d'électeurs de 11,1. (+4,7 points de pourcentage de différence par rapport à 2019).","Il partito <b>UDC</b> realizza una forte progressione (+13,6 punti percentuali). Ora è il partito più forte di Tenniken, ottenendo il 35 percento dei voti.<br><br>Il partito <b>PS</b> progredisce notevolmente: ha migliorato il suo risultato di quattro anni fa di +5,5 punti percentuali ed è ora al secondo posto nel comune. La proporzione di voti del partito è ora del 24,4 percento.<br><br>Il partito <b>Centro</b> si posiziona terzo con il 11,1 percento dei voti. Questo rappresenta una variazione di +4,7 punti percentuali rispetto al 2019.","tab_h$tr£$td£SVP$/td£tab_r153tab_r2#547d34tab_r3$td£$b£35.0%$/b£$/td£§+13.6$/td£$/tr£$tr£$td£SP$/td£tab_r137tab_r2#ea546ftab_r3$td£$b£24.4%$/b£$/td£§+5.5$/td£$/tr£$tr£$td£Mitte$/td£tab_r117tab_r2#f39f5etab_r3$td£$b£11.1%$/b£$/td£§+4.7$/td£$/tr£$tr£$td£FDP$/td£tab_r116tab_r2#6268AFtab_r3$td£$b£10.6%$/b£$/td£§-2.1$/td£$/tr£$tr£$td£Grüne$/td£tab_r113tab_r2#26b300tab_r3$td£$b£8.7%$/b£$/td£§-21.6$/td£$/tr£$tr£$td£GLP$/td£tab_r110tab_r2#cbd401tab_r3$td£$b£6.5%$/b£$/td£§+0.8$/td£$/tr£$/table£$br£Gültige Wahlzettel: $b£311$/b£$br£Wahlbeteiligung: $b£46.7%$/b£ (+8.0%)","tab_h_fr$tr£$td£UDC$/td£tab_r153tab_r2#547d34tab_r3$td£$b£35.0%$/b£$/td£§+13.6$/td£$/tr£$tr£$td£PS$/td£tab_r137tab_r2#ea546ftab_r3$td£$b£24.4%$/b£$/td£§+5.5$/td£$/tr£$tr£$td£Centre$/td£tab_r117tab_r2#f39f5etab_r3$td£$b£11.1%$/b£$/td£§+4.7$/td£$/tr£$tr£$td£PLR$/td£tab_r116tab_r2#6268AFtab_r3$td£$b£10.6%$/b£$/td£§-2.1$/td£$/tr£$tr£$td£Vert-e-s$/td£tab_r113tab_r2#26b300tab_r3$td£$b£8.7%$/b£$/td£§-21.6$/td£$/tr£$tr£$td£PVL$/td£tab_r110tab_r2#cbd401tab_r3$td£$b£6.5%$/b£$/td£§+0.8$/td£$/tr£$/table£$br£Bulletins de vote valables: $b£311$/b£$br£Taux de participation: $b£46.7%$/b£ (+8.0%)","tab_h_it$tr£$td£UDC$/td£tab_r153tab_r2#547d34tab_r3$td£$b£35.0%$/b£$/td£§+13.6$/td£$/tr£$tr£$td£PS$/td£tab_r137tab_r2#ea546ftab_r3$td£$b£24.4%$/b£$/td£§+5.5$/td£$/tr£$tr£$td£Centro$/td£tab_r117tab_r2#f39f5etab_r3$td£$b£11.1%$/b£$/td£§+4.7$/td£$/tr£$tr£$td£PLR$/td£tab_r116tab_r2#6268AFtab_r3$td£$b£10.6%$/b£$/td£§-2.1$/td£$/tr£$tr£$td£Verdi$/td£tab_r113tab_r2#26b300tab_r3$td£$b£8.7%$/b£$/td£§-21.6$/td£$/tr£$tr£$td£PVL$/td£tab_r110tab_r2#cbd401tab_r3$td£$b£6.5%$/b£$/td£§+0.8$/td£$/tr£$/table£$br£Schede elettorali valide: $b£311$/b£$br£Tasso di partecipazione: $b£46.7%$/b£ (+8.0%)","SVP"
2864,"Thürnen BL","Thürnen (BL)","Thürnen BL","Alles bleibt beim Alten in Thürnen: Die drei stärksten Parteien verteidigen ihre Spitzenplätze in unveränderter Reihenfolge: Die <b>SVP</b> geht mit 39,2 Prozent (+4,8 Prozentpunkte) wieder als stärkste Kraft aus den Nationalratswahlen. Zweitstärkste Partei ist die <b>SP</b> (22,3 Prozent, +2,7 Prozentpunkte), drittstärkste die <b>FDP</b> (16 Prozent, -2,7 Prozentpunkte).<br><br>In der Gemeinde Thürnen wohnt auch eine Nationalrätin: <b>Daniela Schneeberger (<b>FDP</b>)</b>.","Le trio de tête reste inchangé à Thürnen: l'<b>UDC</b> reste à la première place avec 39,2 % des voix. La formation devance le <b>PS</b> (22,3 %, +2,7 points de pourcentage) et le <b><b>PL</b>R</b> (16 %, -2,7 points). <br><br>Une conseillère nationale habite à Thürnen : <b>Daniela Schneeberger (<b><b>PL</b>R</b>)</b>.","Nulla è cambiato in quattro anni a Thürnen: i tre stessi partiti rimangono in cima. Il partito <b>UDC</b> mantiene la sua posizione al primo posto con il 39,2 percento dei voti. Precede il partito <b>PS</b> (22,3 percento, +2,7 punti percentuali) e il partito <b>PLR</b> (il 16 percento, -2,7 punti percentuali).<br><br>Anche una consigliera nazionale vive a Thürnen: <b>Daniela Schneeberger (<b>PLR</b>)</b>.","tab_h$tr£$td£SVP$/td£tab_r159tab_r2#547d34tab_r3$td£$b£39.2%$/b£$/td£§+4.8$/td£$/tr£$tr£$td£SP$/td£tab_r133tab_r2#ea546ftab_r3$td£$b£22.3%$/b£$/td£§+2.7$/td£$/tr£$tr£$td£FDP$/td£tab_r124tab_r2#6268AFtab_r3$td£$b£16.0%$/b£$/td£§-2.7$/td£$/tr£$tr£$td£Grüne$/td£tab_r113tab_r2#26b300tab_r3$td£$b£9.0%$/b£$/td£§-8.3$/td£$/tr£$tr£$td£Mitte$/td£tab_r19tab_r2#f39f5etab_r3$td£$b£6.3%$/b£$/td£§+2.8$/td£$/tr£$tr£$td£GLP$/td£tab_r16tab_r2#cbd401tab_r3$td£$b£3.9%$/b£$/td£§+0.1$/td£$/tr£$/table£$br£Gültige Wahlzettel: $b£442$/b£$br£Wahlbeteiligung: $b£46.7%$/b£ (+9.9%)","tab_h_fr$tr£$td£UDC$/td£tab_r159tab_r2#547d34tab_r3$td£$b£39.2%$/b£$/td£§+4.8$/td£$/tr£$tr£$td£PS$/td£tab_r133tab_r2#ea546ftab_r3$td£$b£22.3%$/b£$/td£§+2.7$/td£$/tr£$tr£$td£PLR$/td£tab_r124tab_r2#6268AFtab_r3$td£$b£16.0%$/b£$/td£§-2.7$/td£$/tr£$tr£$td£Vert-e-s$/td£tab_r113tab_r2#26b300tab_r3$td£$b£9.0%$/b£$/td£§-8.3$/td£$/tr£$tr£$td£Centre$/td£tab_r19tab_r2#f39f5etab_r3$td£$b£6.3%$/b£$/td£§+2.8$/td£$/tr£$tr£$td£PVL$/td£tab_r16tab_r2#cbd401tab_r3$td£$b£3.9%$/b£$/td£§+0.1$/td£$/tr£$/table£$br£Bulletins de vote valables: $b£442$/b£$br£Taux de participation: $b£46.7%$/b£ (+9.9%)","tab_h_it$tr£$td£UDC$/td£tab_r159tab_r2#547d34tab_r3$td£$b£39.2%$/b£$/td£§+4.8$/td£$/tr£$tr£$td£PS$/td£tab_r133tab_r2#ea546ftab_r3$td£$b£22.3%$/b£$/td£§+2.7$/td£$/tr£$tr£$td£PLR$/td£tab_r124tab_r2#6268AFtab_r3$td£$b£16.0%$/b£$/td£§-2.7$/td£$/tr£$tr£$td£Verdi$/td£tab_r113tab_r2#26b300tab_r3$td£$b£9.0%$/b£$/td£§-8.3$/td£$/tr£$tr£$td£Centro$/td£tab_r19tab_r2#f39f5etab_r3$td£$b£6.3%$/b£$/td£§+2.8$/td£$/tr£$tr£$td£PVL$/td£tab_r16tab_r2#cbd401tab_r3$td£$b£3.9%$/b£$/td£§+0.1$/td£$/tr£$/table£$br£Schede elettorali valide: $b£442$/b£$br£Tasso di partecipazione: $b£46.7%$/b£ (+9.9%)","SVP"
2865,"Wenslingen BL","Wenslingen (BL)","Wenslingen BL","Die <b>SVP</b> behauptet ihre Position als vorherrschende Partei in Wenslingen. Die Partei verzeichnet einen Wähleranteil von 37,2 Prozent (+5,9 Prozentpunkte).<br><br>Die <b>SP</b> steigert sich mit einem Plus von +5,7 Prozentpunkte stark. Die Partei belegt nun den zweiten Platz in der Gemeinde. Der Wählerstimmenanteil beträgt neu 20,1 Prozent.<br><br>Die <b>Grünen</b> verlieren -10,3 Prozentpunkte und damit so viele Stimmen, dass sie mit einem Wähleranteil von 14,1 Prozent nur noch auf dem dritten Platz landet.","Aucune formation politique ne parvient à prendre la place de numéro un au <b>UDC</b> à Wenslingen. Le parti obtient 37,2 % des suffrages (+5,9 points de pourcentage).<br><br>Le <b>PS</b> est le deuxième parti le plus fort à Wenslingen. La formation s'est améliorée de +5,7 points de pourcentage par rapport aux élections pour le Conseil national de 2019.<br><br>Les <b>Vert-e-s</b> doivent se contenter de la troisième place. Le parti n'obtient plus que 14,1 % des voix, soit -10,3 points de pourcentage de moins qu'il y a quatre ans.","Gli elettori di Wenslingen mantengono la loro fiducia nel partito <b>UDC</b>, che risulta il primo nel loro comune, come nel 2019, con il 37,2 percento dei voti (+5,9 punti percentuali).<br><br>Il partito <b>PS</b> perde molte preferenze. Il partito registra una diminuzione di +5,7 punti percentuali rispetto alle elezioni del 2019. Nonostante ciò, rimane in seconda posizione con una percentuale di elettori del 20,1 percento.<br><br>Il partito <b>Verdi</b> deve accontentarsi del terzo posto, ricevendo solo il 14,1 percento dei voti, ovvero -10,3 punti percentuali in meno rispetto a quattro anni fa.","tab_h$tr£$td£SVP$/td£tab_r156tab_r2#547d34tab_r3$td£$b£37.2%$/b£$/td£§+5.9$/td£$/tr£$tr£$td£SP$/td£tab_r130tab_r2#ea546ftab_r3$td£$b£20.1%$/b£$/td£§+5.7$/td£$/tr£$tr£$td£Grüne$/td£tab_r121tab_r2#26b300tab_r3$td£$b£14.1%$/b£$/td£§-10.3$/td£$/tr£$tr£$td£FDP$/td£tab_r114tab_r2#6268AFtab_r3$td£$b£9.7%$/b£$/td£§-4.2$/td£$/tr£$tr£$td£EVP$/td£tab_r19tab_r2#87bfdctab_r3$td£$b£6.1%$/b£$/td£§-1.3$/td£$/tr£$tr£$td£Mitte$/td£tab_r17tab_r2#f39f5etab_r3$td£$b£4.6%$/b£$/td£§-0.8$/td£$/tr£$tr£$td£GLP$/td£tab_r15tab_r2#cbd401tab_r3$td£$b£3.4%$/b£$/td£§+0.1$/td£$/tr£$/table£$br£Gültige Wahlzettel: $b£329$/b£$br£Wahlbeteiligung: $b£57.3%$/b£ (+2.9%)","tab_h_fr$tr£$td£UDC$/td£tab_r156tab_r2#547d34tab_r3$td£$b£37.2%$/b£$/td£§+5.9$/td£$/tr£$tr£$td£PS$/td£tab_r130tab_r2#ea546ftab_r3$td£$b£20.1%$/b£$/td£§+5.7$/td£$/tr£$tr£$td£Vert-e-s$/td£tab_r121tab_r2#26b300tab_r3$td£$b£14.1%$/b£$/td£§-10.3$/td£$/tr£$tr£$td£PLR$/td£tab_r114tab_r2#6268AFtab_r3$td£$b£9.7%$/b£$/td£§-4.2$/td£$/tr£$tr£$td£PEV$/td£tab_r19tab_r2#87bfdctab_r3$td£$b£6.1%$/b£$/td£§-1.3$/td£$/tr£$tr£$td£Centre$/td£tab_r17tab_r2#f39f5etab_r3$td£$b£4.6%$/b£$/td£§-0.8$/td£$/tr£$tr£$td£PVL$/td£tab_r15tab_r2#cbd401tab_r3$td£$b£3.4%$/b£$/td£§+0.1$/td£$/tr£$/table£$br£Bulletins de vote valables: $b£329$/b£$br£Taux de participation: $b£57.3%$/b£ (+2.9%)","tab_h_it$tr£$td£UDC$/td£tab_r156tab_r2#547d34tab_r3$td£$b£37.2%$/b£$/td£§+5.9$/td£$/tr£$tr£$td£PS$/td£tab_r130tab_r2#ea546ftab_r3$td£$b£20.1%$/b£$/td£§+5.7$/td£$/tr£$tr£$td£Verdi$/td£tab_r121tab_r2#26b300tab_r3$td£$b£14.1%$/b£$/td£§-10.3$/td£$/tr£$tr£$td£PLR$/td£tab_r114tab_r2#6268AFtab_r3$td£$b£9.7%$/b£$/td£§-4.2$/td£$/tr£$tr£$td£PEV$/td£tab_r19tab_r2#87bfdctab_r3$td£$b£6.1%$/b£$/td£§-1.3$/td£$/tr£$tr£$td£Centro$/td£tab_r17tab_r2#f39f5etab_r3$td£$b£4.6%$/b£$/td£§-0.8$/td£$/tr£$tr£$td£PVL$/td£tab_r15tab_r2#cbd401tab_r3$td£$b£3.4%$/b£$/td£§+0.1$/td£$/tr£$/table£$br£Schede elettorali valide: $b£329$/b£$br£Tasso di partecipazione: $b£57.3%$/b£ (+2.9%)","SVP"
2866,"Wintersingen BL","Wintersingen (BL)","Wintersingen BL","Kein Weg führt in Wintersingen an der <b>SVP</b> vorbei. Die Partei holt mehr als die Hälfte der Stimmen und damit eine absolute Mehrheit.<br><br>Die <b>FDP</b> belegt in der Gemeinde den zweiten Platz mit einem Wählerstimmenanteil von 12,4 Prozent (-3,4 Prozentpunkte).<br><br>Auf dem dritten Platz landet die <b>SP</b> mit 11,9 Prozent der Stimmen. Das bedeutet eine Veränderung von -0,5 Prozentpunkten gegenüber 2019. ","L'<b>UDC</b> est incontournable à Wintersingen. Le parti a remporté plus de la moitié des voix et donc obtenu la majorité absolue.<br><br>Le <b><b>PL</b>R</b> est le deuxième parti le plus fort avec 12,4 % des voix (-3,4 points de pourcentage par rapport à 2019).<br><br>Le <b>PS</b> arrive en troisième position avec 11,9 % des votes. Cela représente un changement de -0,5 points de pourcentage par rapport à 2019.","Il partito <b>UDC</b> è il leader indiscusso a Wintersingen, ottenendo la maggioranza assoluta nel comune.<br><br>Un aumento significativo di -3,4 punti percentuali permette al partito <b>PLR</b> di diventare il secondo partito del suo comune. Il partito raccoglie il 12,4 percento dei voti.<br><br>Il partito <b>PS</b> si posiziona terzo con il 11,9 percento dei voti. Questo rappresenta una variazione di -0,5 punti percentuali rispetto al 2019.","tab_h$tr£$td£SVP$/td£tab_r178tab_r2#547d34tab_r3$td£$b£51.7%$/b£$/td£§+11.9$/td£$/tr£$tr£$td£FDP$/td£tab_r119tab_r2#6268AFtab_r3$td£$b£12.4%$/b£$/td£§-3.4$/td£$/tr£$tr£$td£SP$/td£tab_r118tab_r2#ea546ftab_r3$td£$b£11.9%$/b£$/td£§-0.5$/td£$/tr£$tr£$td£Grüne$/td£tab_r113tab_r2#26b300tab_r3$td£$b£9.0%$/b£$/td£§-12.2$/td£$/tr£$tr£$td£Mitte$/td£tab_r19tab_r2#f39f5etab_r3$td£$b£6.0%$/b£$/td£§+2.5$/td£$/tr£$tr£$td£GLP$/td£tab_r18tab_r2#cbd401tab_r3$td£$b£5.1%$/b£$/td£§-0.7$/td£$/tr£$/table£$br£Gültige Wahlzettel: $b£229$/b£$br£Wahlbeteiligung: $b£51.1%$/b£ (+2.9%)","tab_h_fr$tr£$td£UDC$/td£tab_r178tab_r2#547d34tab_r3$td£$b£51.7%$/b£$/td£§+11.9$/td£$/tr£$tr£$td£PLR$/td£tab_r119tab_r2#6268AFtab_r3$td£$b£12.4%$/b£$/td£§-3.4$/td£$/tr£$tr£$td£PS$/td£tab_r118tab_r2#ea546ftab_r3$td£$b£11.9%$/b£$/td£§-0.5$/td£$/tr£$tr£$td£Vert-e-s$/td£tab_r113tab_r2#26b300tab_r3$td£$b£9.0%$/b£$/td£§-12.2$/td£$/tr£$tr£$td£Centre$/td£tab_r19tab_r2#f39f5etab_r3$td£$b£6.0%$/b£$/td£§+2.5$/td£$/tr£$tr£$td£PVL$/td£tab_r18tab_r2#cbd401tab_r3$td£$b£5.1%$/b£$/td£§-0.7$/td£$/tr£$/table£$br£Bulletins de vote valables: $b£229$/b£$br£Taux de participation: $b£51.1%$/b£ (+2.9%)","tab_h_it$tr£$td£UDC$/td£tab_r178tab_r2#547d34tab_r3$td£$b£51.7%$/b£$/td£§+11.9$/td£$/tr£$tr£$td£PLR$/td£tab_r119tab_r2#6268AFtab_r3$td£$b£12.4%$/b£$/td£§-3.4$/td£$/tr£$tr£$td£PS$/td£tab_r118tab_r2#ea546ftab_r3$td£$b£11.9%$/b£$/td£§-0.5$/td£$/tr£$tr£$td£Verdi$/td£tab_r113tab_r2#26b300tab_r3$td£$b£9.0%$/b£$/td£§-12.2$/td£$/tr£$tr£$td£Centro$/td£tab_r19tab_r2#f39f5etab_r3$td£$b£6.0%$/b£$/td£§+2.5$/td£$/tr£$tr£$td£PVL$/td£tab_r18tab_r2#cbd401tab_r3$td£$b£5.1%$/b£$/td£§-0.7$/td£$/tr£$/table£$br£Schede elettorali valide: $b£229$/b£$br£Tasso di partecipazione: $b£51.1%$/b£ (+2.9%)","SVP"
2867,"Wittinsburg BL","Wittinsburg (BL)","Wittinsburg BL","In Wittinsburg baut die <b>SVP</b> ihre Vormachtstellung nochmals aus. Die Partei legt im Vergleich zu den Wahlen 2019 um +8,7 Prozentpunkte zu und kommt neu auf einen Wähleranteil von 40,7 Prozent.<br><br>Die <b>SP</b> steigert sich mit einem Plus von +5,7 Prozentpunkte stark. Die Partei belegt nun den zweiten Platz in der Gemeinde. Der Wählerstimmenanteil beträgt neu 22,4 Prozent.<br><br>Viele Wählerstimmen eingebüsst hat die drittplatzierte <b>FDP</b>. Die Partei holt noch 11,7 Prozent, was einen Verlust von -5,3 Prozentpunkten bedeutet.","L'<b>UDC</b> renforce encore sa suprématie à Wittinsburg. Le parti progresse de +8,7 points de pourcentage par rapport aux élections de 2019. Il convainc désormais 40,7 % des électeurs de la commune.<br><br>Le <b>PS</b> progresse fortement: le parti améliore son résultat d'il y a quatre ans de +5,7 points de pourcentage et occupe désormais la deuxième place dans la commune. La proportion de voix du parti s'élève désormais à 22,4 %.<br><br>Le <b><b>PL</b>R</b> doit se contenter de la troisième place. Le parti n'obtient plus que 11,7 % des voix, soit -5,3 points de pourcentage de moins qu'il y a quatre ans.","Il partito <b>UDC</b> rafforza ulteriormente la sua posizione a Wittinsburg, aumentando i propri voti di +8,7 punti percentuali rispetto alle elezioni del 2019 e convincendo il 40,7 percento degli elettori del comune.<br><br>Il partito <b>PS</b> perde molte preferenze. Il partito registra una diminuzione di +5,7 punti percentuali rispetto alle elezioni del 2019. Nonostante ciò, rimane in seconda posizione con una percentuale di elettori del 22,4 percento.<br><br>Il partito <b>PLR</b> deve accontentarsi del terzo posto, ricevendo solo il 11,7 percento dei voti, ovvero -5,3 punti percentuali in meno rispetto a quattro anni fa.","tab_h$tr£$td£SVP$/td£tab_r161tab_r2#547d34tab_r3$td£$b£40.7%$/b£$/td£§+8.7$/td£$/tr£$tr£$td£SP$/td£tab_r134tab_r2#ea546ftab_r3$td£$b£22.4%$/b£$/td£§+5.7$/td£$/tr£$tr£$td£FDP$/td£tab_r117tab_r2#6268AFtab_r3$td£$b£11.7%$/b£$/td£§-5.3$/td£$/tr£$tr£$td£Grüne$/td£tab_r113tab_r2#26b300tab_r3$td£$b£8.8%$/b£$/td£§-10.9$/td£$/tr£$tr£$td£Mitte$/td£tab_r111tab_r2#f39f5etab_r3$td£$b£7.2%$/b£$/td£§+2.1$/td£$/tr£$tr£$td£GLP$/td£tab_r17tab_r2#cbd401tab_r3$td£$b£4.6%$/b£$/td£§+2.3$/td£$/tr£$tr£$td£EVP$/td£tab_r15tab_r2#87bfdctab_r3$td£$b£3.3%$/b£$/td£§-3.8$/td£$/tr£$/table£$br£Gültige Wahlzettel: $b£210$/b£$br£Wahlbeteiligung: $b£58.3%$/b£ (+1.6%)","tab_h_fr$tr£$td£UDC$/td£tab_r161tab_r2#547d34tab_r3$td£$b£40.7%$/b£$/td£§+8.7$/td£$/tr£$tr£$td£PS$/td£tab_r134tab_r2#ea546ftab_r3$td£$b£22.4%$/b£$/td£§+5.7$/td£$/tr£$tr£$td£PLR$/td£tab_r117tab_r2#6268AFtab_r3$td£$b£11.7%$/b£$/td£§-5.3$/td£$/tr£$tr£$td£Vert-e-s$/td£tab_r113tab_r2#26b300tab_r3$td£$b£8.8%$/b£$/td£§-10.9$/td£$/tr£$tr£$td£Centre$/td£tab_r111tab_r2#f39f5etab_r3$td£$b£7.2%$/b£$/td£§+2.1$/td£$/tr£$tr£$td£PVL$/td£tab_r17tab_r2#cbd401tab_r3$td£$b£4.6%$/b£$/td£§+2.3$/td£$/tr£$tr£$td£PEV$/td£tab_r15tab_r2#87bfdctab_r3$td£$b£3.3%$/b£$/td£§-3.8$/td£$/tr£$/table£$br£Bulletins de vote valables: $b£210$/b£$br£Taux de participation: $b£58.3%$/b£ (+1.6%)","tab_h_it$tr£$td£UDC$/td£tab_r161tab_r2#547d34tab_r3$td£$b£40.7%$/b£$/td£§+8.7$/td£$/tr£$tr£$td£PS$/td£tab_r134tab_r2#ea546ftab_r3$td£$b£22.4%$/b£$/td£§+5.7$/td£$/tr£$tr£$td£PLR$/td£tab_r117tab_r2#6268AFtab_r3$td£$b£11.7%$/b£$/td£§-5.3$/td£$/tr£$tr£$td£Verdi$/td£tab_r113tab_r2#26b300tab_r3$td£$b£8.8%$/b£$/td£§-10.9$/td£$/tr£$tr£$td£Centro$/td£tab_r111tab_r2#f39f5etab_r3$td£$b£7.2%$/b£$/td£§+2.1$/td£$/tr£$tr£$td£PVL$/td£tab_r17tab_r2#cbd401tab_r3$td£$b£4.6%$/b£$/td£§+2.3$/td£$/tr£$tr£$td£PEV$/td£tab_r15tab_r2#87bfdctab_r3$td£$b£3.3%$/b£$/td£§-3.8$/td£$/tr£$/table£$br£Schede elettorali valide: $b£210$/b£$br£Tasso di partecipazione: $b£58.3%$/b£ (+1.6%)","SVP"
2868,"Zeglingen BL","Zeglingen (BL)","Zeglingen BL","In Zeglingen behält die <b>SVP</b> ihren Status als stärkste politische Kraft. Die Partei sichert sich einen Wähleranteil von 34,6 Prozent (+0,1 Prozentpunkte).<br><br>Auf dem zweiten Platz in der Gemeinde liegt die <b>SP</b>. Die Partei erreicht einen Wählerstimmenanteil von 22 Prozent (+2,7 Prozentpunkte).<br><br>Die <b>Grünen</b> verlieren -6,8 Prozentpunkte und damit so viele Stimmen, dass sie mit einem Wähleranteil von 16,2 Prozent nur noch auf dem dritten Platz landet.","Les électeurs de Zeglingen maintiennent leur confiance au <b>UDC</b>, qui termine en tête dans leur commune, comme en 2019, avec 34,6 % des voix (+0,1 points de pourcentage).<br><br>Le <b>PS</b> se classe à la deuxième place. La formation obtient 22 % des suffrages (+2,7 points de pourcentage) dans la commune.<br><br>Les <b>Vert-e-s</b>, troisième parti de la commune, a perdu beaucoup de voix. La formation obtient 16,2 % des voix, ce qui représente une perte de -6,8 points de pourcentage.","Il partito <b>UDC</b> mantiene il primo posto a Zeglingen e ottiene il 34,6 percento dei voti (+0,1 punti percentuali).<br><br>Il partito <b>PS</b> arriva in seconda posizione nel comune con una percentuale di votanti del 22 (+2,7 punti percentuali).<br><br>Il partito <b>Verdi</b>, terzo partito, ha perso molti voti, ricevendo il 16,2 percento dei voti, una perdita di -6,8 punti percentuali.","tab_h$tr£$td£SVP$/td£tab_r152tab_r2#547d34tab_r3$td£$b£34.6%$/b£$/td£§+0.1$/td£$/tr£$tr£$td£SP$/td£tab_r133tab_r2#ea546ftab_r3$td£$b£22.0%$/b£$/td£§+2.7$/td£$/tr£$tr£$td£Grüne$/td£tab_r124tab_r2#26b300tab_r3$td£$b£16.2%$/b£$/td£§-6.8$/td£$/tr£$tr£$td£FDP$/td£tab_r118tab_r2#6268AFtab_r3$td£$b£12.2%$/b£$/td£§-0.5$/td£$/tr£$tr£$td£Mitte$/td£tab_r111tab_r2#f39f5etab_r3$td£$b£7.5%$/b£$/td£§+3.4$/td£$/tr£$tr£$td£GLP$/td£tab_r18tab_r2#cbd401tab_r3$td£$b£5.3%$/b£$/td£§+0.8$/td£$/tr£$/table£$br£Gültige Wahlzettel: $b£226$/b£$br£Wahlbeteiligung: $b£56.9%$/b£ (+1.5%)","tab_h_fr$tr£$td£UDC$/td£tab_r152tab_r2#547d34tab_r3$td£$b£34.6%$/b£$/td£§+0.1$/td£$/tr£$tr£$td£PS$/td£tab_r133tab_r2#ea546ftab_r3$td£$b£22.0%$/b£$/td£§+2.7$/td£$/tr£$tr£$td£Vert-e-s$/td£tab_r124tab_r2#26b300tab_r3$td£$b£16.2%$/b£$/td£§-6.8$/td£$/tr£$tr£$td£PLR$/td£tab_r118tab_r2#6268AFtab_r3$td£$b£12.2%$/b£$/td£§-0.5$/td£$/tr£$tr£$td£Centre$/td£tab_r111tab_r2#f39f5etab_r3$td£$b£7.5%$/b£$/td£§+3.4$/td£$/tr£$tr£$td£PVL$/td£tab_r18tab_r2#cbd401tab_r3$td£$b£5.3%$/b£$/td£§+0.8$/td£$/tr£$/table£$br£Bulletins de vote valables: $b£226$/b£$br£Taux de participation: $b£56.9%$/b£ (+1.5%)","tab_h_it$tr£$td£UDC$/td£tab_r152tab_r2#547d34tab_r3$td£$b£34.6%$/b£$/td£§+0.1$/td£$/tr£$tr£$td£PS$/td£tab_r133tab_r2#ea546ftab_r3$td£$b£22.0%$/b£$/td£§+2.7$/td£$/tr£$tr£$td£Verdi$/td£tab_r124tab_r2#26b300tab_r3$td£$b£16.2%$/b£$/td£§-6.8$/td£$/tr£$tr£$td£PLR$/td£tab_r118tab_r2#6268AFtab_r3$td£$b£12.2%$/b£$/td£§-0.5$/td£$/tr£$tr£$td£Centro$/td£tab_r111tab_r2#f39f5etab_r3$td£$b£7.5%$/b£$/td£§+3.4$/td£$/tr£$tr£$td£PVL$/td£tab_r18tab_r2#cbd401tab_r3$td£$b£5.3%$/b£$/td£§+0.8$/td£$/tr£$/table£$br£Schede elettorali valide: $b£226$/b£$br£Tasso di partecipazione: $b£56.9%$/b£ (+1.5%)","SVP"
