"ID","Gemeinde_de","Gemeinde_fr","Gemeinde_it","Text_de","Text_fr","Text_it","Tabelle_de","Tabelle_fr","Tabelle_it","Staerkste_Partei"
2787,"Laufen BL","Laufon (BL)","Laufen BL","Die <b>SVP</b> kann ihre Position als dominierende politische Kraft in Laufen beibehalten, mit einem Wähleranteil von 27,1 Prozent (+3,9 Prozentpunkte).<br><br>In der Gemeinde landet die <b>Mitte</b> auf dem zweiten Platz. Die Partei erreicht einen Wählerstimmenanteil von 19,4 Prozent (-1,3 Prozentpunkte). <br><br>Auf dem dritten Platz landet die <b>SP</b> mit 19,2 Prozent der Stimmen. Das bedeutet eine Veränderung von -1,5 Prozentpunkten gegenüber 2019. ","L'<b>UDC</b> maintient sa première place à Laufon avec 27,1 pour des voix (+3,9 points de pourcentage).<br><br>Le <b>Centre</b> est le deuxième parti le plus fort avec 19,4 % des voix (-1,3 points de pourcentage par rapport à 2019).<br><br>La troisième place est occupée par le <b>PS</b>. Le parti emmagasine 19,2 % des voix (-1,5 points de pourcentage par rapport à 2019) ","Gli elettori di Laufen mantengono la loro fiducia nel partito <b>UDC</b>, che risulta il primo nel loro comune, come nel 2019, con il 27,1 percento dei voti (+3,9 punti percentuali).<br><br>Il partito <b>Centro</b> arriva in seconda posizione nel comune con una percentuale di votanti del 19,4 (-1,3 punti percentuali).<br><br>Il partito <b>PS</b> completa il podio con il 19,2 percento dei voti (-1,5).","tab_h$tr£$td£SVP$/td£tab_r141tab_r2#547d34tab_r3$td£$b£27.1%$/b£$/td£§+3.9$/td£$/tr£$tr£$td£Mitte$/td£tab_r129tab_r2#f39f5etab_r3$td£$b£19.4%$/b£$/td£§-1.3$/td£$/tr£$tr£$td£SP$/td£tab_r129tab_r2#ea546ftab_r3$td£$b£19.2%$/b£$/td£§-1.5$/td£$/tr£$tr£$td£FDP$/td£tab_r122tab_r2#6268AFtab_r3$td£$b£14.8%$/b£$/td£§+0.4$/td£$/tr£$tr£$td£Grüne$/td£tab_r114tab_r2#26b300tab_r3$td£$b£9.6%$/b£$/td£§-4.5$/td£$/tr£$tr£$td£GLP$/td£tab_r19tab_r2#cbd401tab_r3$td£$b£6.0%$/b£$/td£§+1.3$/td£$/tr£$/table£$br£Gültige Wahlzettel: $b£1'583$/b£$br£Wahlbeteiligung: $b£43.0%$/b£ (+1.9%)","tab_h_fr$tr£$td£UDC$/td£tab_r141tab_r2#547d34tab_r3$td£$b£27.1%$/b£$/td£§+3.9$/td£$/tr£$tr£$td£Centre$/td£tab_r129tab_r2#f39f5etab_r3$td£$b£19.4%$/b£$/td£§-1.3$/td£$/tr£$tr£$td£PS$/td£tab_r129tab_r2#ea546ftab_r3$td£$b£19.2%$/b£$/td£§-1.5$/td£$/tr£$tr£$td£PLR$/td£tab_r122tab_r2#6268AFtab_r3$td£$b£14.8%$/b£$/td£§+0.4$/td£$/tr£$tr£$td£Vert-e-s$/td£tab_r114tab_r2#26b300tab_r3$td£$b£9.6%$/b£$/td£§-4.5$/td£$/tr£$tr£$td£PVL$/td£tab_r19tab_r2#cbd401tab_r3$td£$b£6.0%$/b£$/td£§+1.3$/td£$/tr£$/table£$br£Bulletins de vote valables: $b£1'583$/b£$br£Taux de participation: $b£43.0%$/b£ (+1.9%)","tab_h_it$tr£$td£UDC$/td£tab_r141tab_r2#547d34tab_r3$td£$b£27.1%$/b£$/td£§+3.9$/td£$/tr£$tr£$td£Centro$/td£tab_r129tab_r2#f39f5etab_r3$td£$b£19.4%$/b£$/td£§-1.3$/td£$/tr£$tr£$td£PS$/td£tab_r129tab_r2#ea546ftab_r3$td£$b£19.2%$/b£$/td£§-1.5$/td£$/tr£$tr£$td£PLR$/td£tab_r122tab_r2#6268AFtab_r3$td£$b£14.8%$/b£$/td£§+0.4$/td£$/tr£$tr£$td£Verdi$/td£tab_r114tab_r2#26b300tab_r3$td£$b£9.6%$/b£$/td£§-4.5$/td£$/tr£$tr£$td£PVL$/td£tab_r19tab_r2#cbd401tab_r3$td£$b£6.0%$/b£$/td£§+1.3$/td£$/tr£$/table£$br£Schede elettorali valide: $b£1'583$/b£$br£Tasso di partecipazione: $b£43.0%$/b£ (+1.9%)","SVP"
2788,"Liesberg BL","Liesberg (BL)","Liesberg BL","In Liesberg bleibt die <b>SVP</b> unangefochten die stärkste Partei. Sie vereinigt bei den Nationalratswahlen 46,4 Prozent der Stimmen (+6,1 Prozentpunkte) auf sich, 27,3 Prozentpunkte mehr als die zweitplatzierte <b>Mitte</b> (19,1 Prozent, -3,2 Prozentpunkte).<br><br>Der dritte Platz geht an die <b>SP</b>. Die Partei erreicht 12,7 Prozent der Stimmen (Veränderung von -0,2 Prozentpunkten gegenüber 2019).","L'<b>UDC</b> maintient sa position de plus grand parti dans la commune de Liesberg, avec un pourcentage d'électeurs de 46,4 (+6,1 points de pourcentage). L'écart avec le deuxième plus grand parti, le <b>Centre</b>, est de 27,3 points de pourcentage. <b>Centre</b> obtient 19,1 pourcent des voix (-3,2 points de pourcentage).<br><br>Le <b>PS</b> complète le podium. La formation récolte 12,7 % des suffrages (-0,2).","Il partito <b>UDC</b> è in una posizione di forza a Liesberg. Ottiene il 46,4 percento dei voti (+6,1 punti percentuali). La differenza con il partito <b>Centro</b> è notevole (27,3 punti percentuali). Il secondo partito del comune ha convinto il 19,1 percento degli elettori (-3,2 punti percentuali).<br><br>La terza posizione è occupata dal partito <b>PS</b> che ottiene il 12,7 percento dei voti (-0,2 punti percentuali rispetto al 2019).","tab_h$tr£$td£SVP$/td£tab_r170tab_r2#547d34tab_r3$td£$b£46.4%$/b£$/td£§+6.1$/td£$/tr£$tr£$td£Mitte$/td£tab_r129tab_r2#f39f5etab_r3$td£$b£19.1%$/b£$/td£§-3.2$/td£$/tr£$tr£$td£SP$/td£tab_r119tab_r2#ea546ftab_r3$td£$b£12.7%$/b£$/td£§-0.2$/td£$/tr£$tr£$td£FDP$/td£tab_r114tab_r2#6268AFtab_r3$td£$b£9.1%$/b£$/td£§+2.2$/td£$/tr£$tr£$td£Grüne$/td£tab_r19tab_r2#26b300tab_r3$td£$b£5.9%$/b£$/td£§-8.1$/td£$/tr£$tr£$td£GLP$/td£tab_r17tab_r2#cbd401tab_r3$td£$b£4.7%$/b£$/td£§+2.3$/td£$/tr£$/table£$br£Gültige Wahlzettel: $b£372$/b£$br£Wahlbeteiligung: $b£45.6%$/b£ (+5.0%)","tab_h_fr$tr£$td£UDC$/td£tab_r170tab_r2#547d34tab_r3$td£$b£46.4%$/b£$/td£§+6.1$/td£$/tr£$tr£$td£Centre$/td£tab_r129tab_r2#f39f5etab_r3$td£$b£19.1%$/b£$/td£§-3.2$/td£$/tr£$tr£$td£PS$/td£tab_r119tab_r2#ea546ftab_r3$td£$b£12.7%$/b£$/td£§-0.2$/td£$/tr£$tr£$td£PLR$/td£tab_r114tab_r2#6268AFtab_r3$td£$b£9.1%$/b£$/td£§+2.2$/td£$/tr£$tr£$td£Vert-e-s$/td£tab_r19tab_r2#26b300tab_r3$td£$b£5.9%$/b£$/td£§-8.1$/td£$/tr£$tr£$td£PVL$/td£tab_r17tab_r2#cbd401tab_r3$td£$b£4.7%$/b£$/td£§+2.3$/td£$/tr£$/table£$br£Bulletins de vote valables: $b£372$/b£$br£Taux de participation: $b£45.6%$/b£ (+5.0%)","tab_h_it$tr£$td£UDC$/td£tab_r170tab_r2#547d34tab_r3$td£$b£46.4%$/b£$/td£§+6.1$/td£$/tr£$tr£$td£Centro$/td£tab_r129tab_r2#f39f5etab_r3$td£$b£19.1%$/b£$/td£§-3.2$/td£$/tr£$tr£$td£PS$/td£tab_r119tab_r2#ea546ftab_r3$td£$b£12.7%$/b£$/td£§-0.2$/td£$/tr£$tr£$td£PLR$/td£tab_r114tab_r2#6268AFtab_r3$td£$b£9.1%$/b£$/td£§+2.2$/td£$/tr£$tr£$td£Verdi$/td£tab_r19tab_r2#26b300tab_r3$td£$b£5.9%$/b£$/td£§-8.1$/td£$/tr£$tr£$td£PVL$/td£tab_r17tab_r2#cbd401tab_r3$td£$b£4.7%$/b£$/td£§+2.3$/td£$/tr£$/table£$br£Schede elettorali valide: $b£372$/b£$br£Tasso di partecipazione: $b£45.6%$/b£ (+5.0%)","SVP"
2789,"Nenzlingen BL","Nenzlingen (BL)","Nenzlingen BL","Mit deutlichem Abstand bleibt die <b>SVP</b> die grösste Partei in Nenzlingen. Ihre Parteistärke beträgt 44,4 Prozent (+0,5 Prozentpunkte). Der Vorsprung auf die nächstgrössere Partei, die <b>SP</b>, ist gross: 27,4 Prozentpunkte. Die <b>SP</b> holt 17 Prozent (+4,6 Prozentpunkte).<br><br>Auf dem dritten Platz landen die <b>Grünen</b> mit 10,2 Prozent der Stimmen. Das bedeutet eine Veränderung von -1,2 Prozentpunkten gegenüber 2019. ","L'<b>UDC</b> reste le parti préféré des électeurs de Nenzlingen. La formation politique réalise 44,4 % des voix (+0,5 points de pourcentage par rapport à 2019). C'est 27,4 points de plus que le <b>PS</b>, à la deuxième place dans cette commune avec 17 % des voix (+4,6 points de pourcentage).<br><br>Les <b>Vert-e-s</b> se classent à la troisième place. La formation obtient 10,2 % des voix (-1,2 points de pourcentage par rapport à 2019).","Con il 44,4 percento dei voti (+0,5 punti percentuali), la posizione di leader del partito <b>UDC</b> è solida a Nenzlingen. La differenza è di 27,4 punti rispetto al partito successivo. In confronto, il partito <b>PS</b> si classifica al secondo posto con il 17 percento dei voti (+4,6 punti percentuali).<br><br>La terza posizione è occupata dal partito <b>Verdi</b>. Ottiene una percentuale di elettori del il 10,2. (-1,2 punti percentuali di differenza rispetto al 2019).","tab_h$tr£$td£SVP$/td£tab_r167tab_r2#547d34tab_r3$td£$b£44.4%$/b£$/td£§+0.5$/td£$/tr£$tr£$td£SP$/td£tab_r126tab_r2#ea546ftab_r3$td£$b£17.0%$/b£$/td£§+4.6$/td£$/tr£$tr£$td£Grüne$/td£tab_r115tab_r2#26b300tab_r3$td£$b£10.2%$/b£$/td£§-1.2$/td£$/tr£$tr£$td£FDP$/td£tab_r113tab_r2#6268AFtab_r3$td£$b£8.7%$/b£$/td£§-3.1$/td£$/tr£$tr£$td£Mitte$/td£tab_r113tab_r2#f39f5etab_r3$td£$b£8.5%$/b£$/td£§-3.7$/td£$/tr£$tr£$td£weitere$/td£tab_r18tab_r2#bebebetab_r3$td£$b£5.2%$/b£$/td£§+4.8$/td£$/tr£$tr£$td£GLP$/td£tab_r15tab_r2#cbd401tab_r3$td£$b£3.6%$/b£$/td£§+2.3$/td£$/tr£$/table£$br£Gültige Wahlzettel: $b£144$/b£$br£Wahlbeteiligung: $b£42.0%$/b£ (+3.0%)","tab_h_fr$tr£$td£UDC$/td£tab_r167tab_r2#547d34tab_r3$td£$b£44.4%$/b£$/td£§+0.5$/td£$/tr£$tr£$td£PS$/td£tab_r126tab_r2#ea546ftab_r3$td£$b£17.0%$/b£$/td£§+4.6$/td£$/tr£$tr£$td£Vert-e-s$/td£tab_r115tab_r2#26b300tab_r3$td£$b£10.2%$/b£$/td£§-1.2$/td£$/tr£$tr£$td£PLR$/td£tab_r113tab_r2#6268AFtab_r3$td£$b£8.7%$/b£$/td£§-3.1$/td£$/tr£$tr£$td£Centre$/td£tab_r113tab_r2#f39f5etab_r3$td£$b£8.5%$/b£$/td£§-3.7$/td£$/tr£$tr£$td£Divers$/td£tab_r18tab_r2#bebebetab_r3$td£$b£5.2%$/b£$/td£§+4.8$/td£$/tr£$tr£$td£PVL$/td£tab_r15tab_r2#cbd401tab_r3$td£$b£3.6%$/b£$/td£§+2.3$/td£$/tr£$/table£$br£Bulletins de vote valables: $b£144$/b£$br£Taux de participation: $b£42.0%$/b£ (+3.0%)","tab_h_it$tr£$td£UDC$/td£tab_r167tab_r2#547d34tab_r3$td£$b£44.4%$/b£$/td£§+0.5$/td£$/tr£$tr£$td£PS$/td£tab_r126tab_r2#ea546ftab_r3$td£$b£17.0%$/b£$/td£§+4.6$/td£$/tr£$tr£$td£Verdi$/td£tab_r115tab_r2#26b300tab_r3$td£$b£10.2%$/b£$/td£§-1.2$/td£$/tr£$tr£$td£PLR$/td£tab_r113tab_r2#6268AFtab_r3$td£$b£8.7%$/b£$/td£§-3.1$/td£$/tr£$tr£$td£Centro$/td£tab_r113tab_r2#f39f5etab_r3$td£$b£8.5%$/b£$/td£§-3.7$/td£$/tr£$tr£$td£altro$/td£tab_r18tab_r2#bebebetab_r3$td£$b£5.2%$/b£$/td£§+4.8$/td£$/tr£$tr£$td£PVL$/td£tab_r15tab_r2#cbd401tab_r3$td£$b£3.6%$/b£$/td£§+2.3$/td£$/tr£$/table£$br£Schede elettorali valide: $b£144$/b£$br£Tasso di partecipazione: $b£42.0%$/b£ (+3.0%)","SVP"
2790,"Roggenburg BL","Roggenburg (BL)","Roggenburg BL","Roggenburg ist unbestrittenes Territorium der <b>SVP</b>. Die Partei holt die absolute Mehrheit der Stimmen.<br><br>Die <b>SP</b> belegt in der Gemeinde den zweiten Platz mit einem Wählerstimmenanteil von 12,8 Prozent (+3,7 Prozentpunkte).<br><br>Den dritten Platz belegen die <b>Grünen</b>. Die Partei erzielt einen Wähleranteil von 8,1 Prozent (Veränderung gegenüber 2019: -4,9 Prozentpunkte).","L'<b>UDC</b> règne en maître à Roggenburg. Le parti remporte la majorité absolue des voix.<br><br>Le <b>PS</b> se classe à la deuxième place. La formation obtient 12,8 % des suffrages (+3,7 points de pourcentage) dans la commune.<br><br>Les <b>Vert-e-s</b> complètent le podium. La formation récolte 8,1 % des suffrages (-4,9).","Il partito <b>UDC</b> è il leader indiscusso a Roggenburg, ottenendo la maggioranza assoluta nel comune.<br><br>Il partito <b>PS</b> si classifica al secondo posto. Ottiene il 12,8 percento dei voti (+3,7 punti percentuali) nel comune.<br><br>Il partito <b>Verdi</b> si posiziona terzo con il 8,1 percento dei voti. Questo rappresenta una variazione di -4,9 punti percentuali rispetto al 2019.","tab_h$tr£$td£SVP$/td£tab_r191tab_r2#547d34tab_r3$td£$b£60.8%$/b£$/td£§-1.9$/td£$/tr£$tr£$td£SP$/td£tab_r119tab_r2#ea546ftab_r3$td£$b£12.8%$/b£$/td£§+3.7$/td£$/tr£$tr£$td£Grüne$/td£tab_r112tab_r2#26b300tab_r3$td£$b£8.1%$/b£$/td£§-4.9$/td£$/tr£$tr£$td£FDP$/td£tab_r110tab_r2#6268AFtab_r3$td£$b£6.9%$/b£$/td£§+3.5$/td£$/tr£$tr£$td£weitere$/td£tab_r18tab_r2#bebebetab_r3$td£$b£5.0%$/b£$/td£§+5.0$/td£$/tr£$tr£$td£Mitte$/td£tab_r15tab_r2#f39f5etab_r3$td£$b£3.5%$/b£$/td£§-4.1$/td£$/tr£$/table£$br£Gültige Wahlzettel: $b£97$/b£$br£Wahlbeteiligung: $b£41.6%$/b£ (+5.9%)","tab_h_fr$tr£$td£UDC$/td£tab_r191tab_r2#547d34tab_r3$td£$b£60.8%$/b£$/td£§-1.9$/td£$/tr£$tr£$td£PS$/td£tab_r119tab_r2#ea546ftab_r3$td£$b£12.8%$/b£$/td£§+3.7$/td£$/tr£$tr£$td£Vert-e-s$/td£tab_r112tab_r2#26b300tab_r3$td£$b£8.1%$/b£$/td£§-4.9$/td£$/tr£$tr£$td£PLR$/td£tab_r110tab_r2#6268AFtab_r3$td£$b£6.9%$/b£$/td£§+3.5$/td£$/tr£$tr£$td£Divers$/td£tab_r18tab_r2#bebebetab_r3$td£$b£5.0%$/b£$/td£§+5.0$/td£$/tr£$tr£$td£Centre$/td£tab_r15tab_r2#f39f5etab_r3$td£$b£3.5%$/b£$/td£§-4.1$/td£$/tr£$/table£$br£Bulletins de vote valables: $b£97$/b£$br£Taux de participation: $b£41.6%$/b£ (+5.9%)","tab_h_it$tr£$td£UDC$/td£tab_r191tab_r2#547d34tab_r3$td£$b£60.8%$/b£$/td£§-1.9$/td£$/tr£$tr£$td£PS$/td£tab_r119tab_r2#ea546ftab_r3$td£$b£12.8%$/b£$/td£§+3.7$/td£$/tr£$tr£$td£Verdi$/td£tab_r112tab_r2#26b300tab_r3$td£$b£8.1%$/b£$/td£§-4.9$/td£$/tr£$tr£$td£PLR$/td£tab_r110tab_r2#6268AFtab_r3$td£$b£6.9%$/b£$/td£§+3.5$/td£$/tr£$tr£$td£altro$/td£tab_r18tab_r2#bebebetab_r3$td£$b£5.0%$/b£$/td£§+5.0$/td£$/tr£$tr£$td£Centro$/td£tab_r15tab_r2#f39f5etab_r3$td£$b£3.5%$/b£$/td£§-4.1$/td£$/tr£$/table£$br£Schede elettorali valide: $b£97$/b£$br£Tasso di partecipazione: $b£41.6%$/b£ (+5.9%)","SVP"
2791,"Röschenz BL","Röschenz (BL)","Röschenz BL","In Röschenz bleibt die <b>SVP</b> unangefochten die stärkste Partei. Sie vereinigt bei den Nationalratswahlen 40 Prozent der Stimmen (+5 Prozentpunkte) auf sich, 23,2 Prozentpunkte mehr als die zweitplatzierte <b>Mitte</b> (16,7 Prozent, -7 Prozentpunkte).<br><br>Mit einem Wähleranteil von 15,9 Prozent belegt die <b>SP</b> den dritten Platz (Veränderung gegenüber 2019: +1,5 Prozentpunkte).","Avec 40 % des voix (+5 points de pourcentage), la position de leader du <b>UDC</b> est solide à Röschenz. L'avance atteint 23,2 points par rapport au parti suivant. En comparaison, le <b>Centre</b> se classe à la deuxième place avec 16,7 % des suffrages (-7 points de pourcentage). <br><br>Le <b>PS</b> complète le podium. La formation récolte 15,9 % des suffrages (+1,5).","Il partito <b>UDC</b> mantiene la sua posizione come la formazione più grande nel comune di Röschenz, con una percentuale di elettori del 40 (+5 punti percentuali). La differenza con il secondo partito più grande, il partito <b>Centro</b>, è di 23,2 punti percentuali. Il partito <b>Centro</b> ottiene il 16,7 percento dei voti (-7 punti percentuali).<br><br>Il partito <b>PS</b> completa il podio con il 15,9 percento dei voti (+1,5).","tab_h$tr£$td£SVP$/td£tab_r160tab_r2#547d34tab_r3$td£$b£40.0%$/b£$/td£§+5.0$/td£$/tr£$tr£$td£Mitte$/td£tab_r125tab_r2#f39f5etab_r3$td£$b£16.7%$/b£$/td£§-7.0$/td£$/tr£$tr£$td£SP$/td£tab_r124tab_r2#ea546ftab_r3$td£$b£15.9%$/b£$/td£§+1.5$/td£$/tr£$tr£$td£FDP$/td£tab_r122tab_r2#6268AFtab_r3$td£$b£14.4%$/b£$/td£§+3.5$/td£$/tr£$tr£$td£Grüne$/td£tab_r18tab_r2#26b300tab_r3$td£$b£5.4%$/b£$/td£§-5.1$/td£$/tr£$tr£$td£GLP$/td£tab_r18tab_r2#cbd401tab_r3$td£$b£5.3%$/b£$/td£§+1.6$/td£$/tr£$/table£$br£Gültige Wahlzettel: $b£693$/b£$br£Wahlbeteiligung: $b£48.9%$/b£ (+1.6%)","tab_h_fr$tr£$td£UDC$/td£tab_r160tab_r2#547d34tab_r3$td£$b£40.0%$/b£$/td£§+5.0$/td£$/tr£$tr£$td£Centre$/td£tab_r125tab_r2#f39f5etab_r3$td£$b£16.7%$/b£$/td£§-7.0$/td£$/tr£$tr£$td£PS$/td£tab_r124tab_r2#ea546ftab_r3$td£$b£15.9%$/b£$/td£§+1.5$/td£$/tr£$tr£$td£PLR$/td£tab_r122tab_r2#6268AFtab_r3$td£$b£14.4%$/b£$/td£§+3.5$/td£$/tr£$tr£$td£Vert-e-s$/td£tab_r18tab_r2#26b300tab_r3$td£$b£5.4%$/b£$/td£§-5.1$/td£$/tr£$tr£$td£PVL$/td£tab_r18tab_r2#cbd401tab_r3$td£$b£5.3%$/b£$/td£§+1.6$/td£$/tr£$/table£$br£Bulletins de vote valables: $b£693$/b£$br£Taux de participation: $b£48.9%$/b£ (+1.6%)","tab_h_it$tr£$td£UDC$/td£tab_r160tab_r2#547d34tab_r3$td£$b£40.0%$/b£$/td£§+5.0$/td£$/tr£$tr£$td£Centro$/td£tab_r125tab_r2#f39f5etab_r3$td£$b£16.7%$/b£$/td£§-7.0$/td£$/tr£$tr£$td£PS$/td£tab_r124tab_r2#ea546ftab_r3$td£$b£15.9%$/b£$/td£§+1.5$/td£$/tr£$tr£$td£PLR$/td£tab_r122tab_r2#6268AFtab_r3$td£$b£14.4%$/b£$/td£§+3.5$/td£$/tr£$tr£$td£Verdi$/td£tab_r18tab_r2#26b300tab_r3$td£$b£5.4%$/b£$/td£§-5.1$/td£$/tr£$tr£$td£PVL$/td£tab_r18tab_r2#cbd401tab_r3$td£$b£5.3%$/b£$/td£§+1.6$/td£$/tr£$/table£$br£Schede elettorali valide: $b£693$/b£$br£Tasso di partecipazione: $b£48.9%$/b£ (+1.6%)","SVP"
2792,"Wahlen BL","Wahlen (BL)","Wahlen BL","Nach wie vor ist die <b>SVP</b> in Wahlen unangefochten die grösste Partei, mit einem Wähleranteil von 48,1 Prozent (+6,6 Prozentpunkte). Der Vorsprung auf die zweitstärkste Partei, die <b>Mitte</b>, ist beträchtlich - nämlich 33,7 Prozentpunkte. Die <b>Mitte</b> erreicht einen Wähleranteil von 14,5 Prozent (-2,9 Prozentpunkte). <br><br>Mit einem Wähleranteil von 12,8 Prozent belegt die <b>SP</b> den dritten Platz (Veränderung gegenüber 2019: -0,3 Prozentpunkte).","Avec 48,1 % des voix (+6,6 points de pourcentage), la position de leader du <b>UDC</b> est solide à Wahlen. L'avance atteint 33,7 points par rapport au parti suivant. En comparaison, le <b>Centre</b> se classe à la deuxième place avec 14,5 % des suffrages (-2,9 points de pourcentage). <br><br>La troisième place est occupée par le <b>PS</b>. La formation obtient un pourcentage d'électeurs de 12,8. (-0,3 points de pourcentage de différence par rapport à 2019).","Il partito <b>UDC</b> mantiene la sua posizione come la formazione più grande nel comune di Wahlen, con una percentuale di elettori del 48,1 (+6,6 punti percentuali). La differenza con il secondo partito più grande, il partito <b>Centro</b>, è di 33,7 punti percentuali. Il partito <b>Centro</b> ottiene il 14,5 percento dei voti (-2,9 punti percentuali).<br><br>La terza posizione è occupata dal partito <b>PS</b>. Ottiene una percentuale di elettori del il 12,8. (-0,3 punti percentuali di differenza rispetto al 2019).","tab_h$tr£$td£SVP$/td£tab_r172tab_r2#547d34tab_r3$td£$b£48.1%$/b£$/td£§+6.6$/td£$/tr£$tr£$td£Mitte$/td£tab_r122tab_r2#f39f5etab_r3$td£$b£14.5%$/b£$/td£§-2.9$/td£$/tr£$tr£$td£SP$/td£tab_r119tab_r2#ea546ftab_r3$td£$b£12.8%$/b£$/td£§-0.3$/td£$/tr£$tr£$td£FDP$/td£tab_r116tab_r2#6268AFtab_r3$td£$b£10.4%$/b£$/td£§-1.9$/td£$/tr£$tr£$td£Grüne$/td£tab_r110tab_r2#26b300tab_r3$td£$b£6.9%$/b£$/td£§-4.3$/td£$/tr£$tr£$td£GLP$/td£tab_r18tab_r2#cbd401tab_r3$td£$b£5.0%$/b£$/td£§+1.8$/td£$/tr£$/table£$br£Gültige Wahlzettel: $b£399$/b£$br£Wahlbeteiligung: $b£38.0%$/b£ (+1.4%)","tab_h_fr$tr£$td£UDC$/td£tab_r172tab_r2#547d34tab_r3$td£$b£48.1%$/b£$/td£§+6.6$/td£$/tr£$tr£$td£Centre$/td£tab_r122tab_r2#f39f5etab_r3$td£$b£14.5%$/b£$/td£§-2.9$/td£$/tr£$tr£$td£PS$/td£tab_r119tab_r2#ea546ftab_r3$td£$b£12.8%$/b£$/td£§-0.3$/td£$/tr£$tr£$td£PLR$/td£tab_r116tab_r2#6268AFtab_r3$td£$b£10.4%$/b£$/td£§-1.9$/td£$/tr£$tr£$td£Vert-e-s$/td£tab_r110tab_r2#26b300tab_r3$td£$b£6.9%$/b£$/td£§-4.3$/td£$/tr£$tr£$td£PVL$/td£tab_r18tab_r2#cbd401tab_r3$td£$b£5.0%$/b£$/td£§+1.8$/td£$/tr£$/table£$br£Bulletins de vote valables: $b£399$/b£$br£Taux de participation: $b£38.0%$/b£ (+1.4%)","tab_h_it$tr£$td£UDC$/td£tab_r172tab_r2#547d34tab_r3$td£$b£48.1%$/b£$/td£§+6.6$/td£$/tr£$tr£$td£Centro$/td£tab_r122tab_r2#f39f5etab_r3$td£$b£14.5%$/b£$/td£§-2.9$/td£$/tr£$tr£$td£PS$/td£tab_r119tab_r2#ea546ftab_r3$td£$b£12.8%$/b£$/td£§-0.3$/td£$/tr£$tr£$td£PLR$/td£tab_r116tab_r2#6268AFtab_r3$td£$b£10.4%$/b£$/td£§-1.9$/td£$/tr£$tr£$td£Verdi$/td£tab_r110tab_r2#26b300tab_r3$td£$b£6.9%$/b£$/td£§-4.3$/td£$/tr£$tr£$td£PVL$/td£tab_r18tab_r2#cbd401tab_r3$td£$b£5.0%$/b£$/td£§+1.8$/td£$/tr£$/table£$br£Schede elettorali valide: $b£399$/b£$br£Tasso di partecipazione: $b£38.0%$/b£ (+1.4%)","SVP"
2793,"Zwingen BL","Zwingen (BL)","Zwingen BL","Mit deutlichem Abstand bleibt die <b>SVP</b> die grösste Partei in Zwingen. Ihre Parteistärke beträgt 41,5 Prozent (+8,1 Prozentpunkte). Der Vorsprung auf die nächstgrössere Partei, die <b>Mitte</b>, ist gross: 22,8 Prozentpunkte. Die <b>Mitte</b> holt 18,7 Prozent (-3 Prozentpunkte).<br><br>Mit einem Wähleranteil von 17,3 Prozent belegt die <b>SP</b> den dritten Platz (Veränderung gegenüber 2019: -2,6 Prozentpunkte).","L'<b>UDC</b> maintient sa position de plus grand parti dans la commune de Zwingen, avec un pourcentage d'électeurs de 41,5 (+8,1 points de pourcentage). L'écart avec le deuxième plus grand parti, le <b>Centre</b>, est de 22,8 points de pourcentage. <b>Centre</b> obtient 18,7 pourcent des voix (-3 points de pourcentage).<br><br>Le <b>PS</b> arrive en troisième position avec 17,3 % des votes. Cela représente un changement de -2,6 points de pourcentage par rapport à 2019.","Il partito <b>UDC</b> rimane nettamente il partito più forte a Zwingen, con il 41,5 percento dei voti (+8,1 punti percentuali). Il vantaggio sul partito <b>Centro</b>, che ottiene il 18,7 percento dei voti (-3 punti percentuali), è notevole. La differenza è di 22,8 punti percentuali.<br><br>Il partito <b>PS</b> completa il podio con il 17,3 percento dei voti (-2,6).","tab_h$tr£$td£SVP$/td£tab_r162tab_r2#547d34tab_r3$td£$b£41.5%$/b£$/td£§+8.1$/td£$/tr£$tr£$td£Mitte$/td£tab_r128tab_r2#f39f5etab_r3$td£$b£18.7%$/b£$/td£§-3.0$/td£$/tr£$tr£$td£SP$/td£tab_r126tab_r2#ea546ftab_r3$td£$b£17.3%$/b£$/td£§-2.6$/td£$/tr£$tr£$td£FDP$/td£tab_r115tab_r2#6268AFtab_r3$td£$b£10.1%$/b£$/td£§-1.3$/td£$/tr£$tr£$td£GLP$/td£tab_r16tab_r2#cbd401tab_r3$td£$b£4.2%$/b£$/td£§+1.6$/td£$/tr£$tr£$td£Grüne$/td£tab_r16tab_r2#26b300tab_r3$td£$b£4.1%$/b£$/td£§-4.3$/td£$/tr£$/table£$br£Gültige Wahlzettel: $b£540$/b£$br£Wahlbeteiligung: $b£31.9%$/b£ (+0.1%)","tab_h_fr$tr£$td£UDC$/td£tab_r162tab_r2#547d34tab_r3$td£$b£41.5%$/b£$/td£§+8.1$/td£$/tr£$tr£$td£Centre$/td£tab_r128tab_r2#f39f5etab_r3$td£$b£18.7%$/b£$/td£§-3.0$/td£$/tr£$tr£$td£PS$/td£tab_r126tab_r2#ea546ftab_r3$td£$b£17.3%$/b£$/td£§-2.6$/td£$/tr£$tr£$td£PLR$/td£tab_r115tab_r2#6268AFtab_r3$td£$b£10.1%$/b£$/td£§-1.3$/td£$/tr£$tr£$td£PVL$/td£tab_r16tab_r2#cbd401tab_r3$td£$b£4.2%$/b£$/td£§+1.6$/td£$/tr£$tr£$td£Vert-e-s$/td£tab_r16tab_r2#26b300tab_r3$td£$b£4.1%$/b£$/td£§-4.3$/td£$/tr£$/table£$br£Bulletins de vote valables: $b£540$/b£$br£Taux de participation: $b£31.9%$/b£ (+0.1%)","tab_h_it$tr£$td£UDC$/td£tab_r162tab_r2#547d34tab_r3$td£$b£41.5%$/b£$/td£§+8.1$/td£$/tr£$tr£$td£Centro$/td£tab_r128tab_r2#f39f5etab_r3$td£$b£18.7%$/b£$/td£§-3.0$/td£$/tr£$tr£$td£PS$/td£tab_r126tab_r2#ea546ftab_r3$td£$b£17.3%$/b£$/td£§-2.6$/td£$/tr£$tr£$td£PLR$/td£tab_r115tab_r2#6268AFtab_r3$td£$b£10.1%$/b£$/td£§-1.3$/td£$/tr£$tr£$td£PVL$/td£tab_r16tab_r2#cbd401tab_r3$td£$b£4.2%$/b£$/td£§+1.6$/td£$/tr£$tr£$td£Verdi$/td£tab_r16tab_r2#26b300tab_r3$td£$b£4.1%$/b£$/td£§-4.3$/td£$/tr£$/table£$br£Schede elettorali valide: $b£540$/b£$br£Tasso di partecipazione: $b£31.9%$/b£ (+0.1%)","SVP"
