"ID","Gemeinde_de","Gemeinde_fr","Gemeinde_it","Text_de","Text_fr","Text_it","Tabelle_de","Tabelle_fr","Tabelle_it","Staerkste_Partei"
2761,"Aesch BL","Aesch (BL)","Aesch BL","Alles bleibt beim Alten in Aesch BL: Die drei stärksten Parteien verteidigen ihre Spitzenplätze in unveränderter Reihenfolge: Die <b>SVP</b> geht mit 29,9 Prozent (+4,7 Prozentpunkte) wieder als stärkste Kraft aus den Nationalratswahlen. Zweitstärkste Partei ist die <b>SP</b> (24,6 Prozent, +2,9 Prozentpunkte), drittstärkste die <b>FDP</b> (15 Prozent, -2,7 Prozentpunkte).<br><br>","Le trio de tête reste inchangé à Aesch (BL): l'<b>UDC</b> reste à la première place avec 29,9 % des voix. La formation devance le <b>PS</b> (24,6 %, +2,9 points de pourcentage) et le <b><b>PL</b>R</b> (15 %, -2,7 points). <br><br>","La classifica non è cambiata negli ultimi quattro anni a Aesch BL: il partito <b>UDC</b> rimane primo con il 29,9 percento dei voti. Precede il partito <b>PS</b> (24,6 percento, +2,9 punti percentuali) e il partito <b>PLR</b> (il 15 percento, -2,7 punti percentuali).<br><br>","tab_h$tr£$td£SVP$/td£tab_r145tab_r2#547d34tab_r3$td£$b£29.9%$/b£$/td£§+4.7$/td£$/tr£$tr£$td£SP$/td£tab_r137tab_r2#ea546ftab_r3$td£$b£24.6%$/b£$/td£§+2.9$/td£$/tr£$tr£$td£FDP$/td£tab_r122tab_r2#6268AFtab_r3$td£$b£15.0%$/b£$/td£§-2.7$/td£$/tr£$tr£$td£Mitte$/td£tab_r120tab_r2#f39f5etab_r3$td£$b£13.1%$/b£$/td£§-1.4$/td£$/tr£$tr£$td£Grüne$/td£tab_r112tab_r2#26b300tab_r3$td£$b£8.1%$/b£$/td£§-7.1$/td£$/tr£$tr£$td£GLP$/td£tab_r18tab_r2#cbd401tab_r3$td£$b£5.0%$/b£$/td£§+0.9$/td£$/tr£$/table£$br£Gültige Wahlzettel: $b£2'546$/b£$br£Wahlbeteiligung: $b£38.5%$/b£ (+2.9%)","tab_h_fr$tr£$td£UDC$/td£tab_r145tab_r2#547d34tab_r3$td£$b£29.9%$/b£$/td£§+4.7$/td£$/tr£$tr£$td£PS$/td£tab_r137tab_r2#ea546ftab_r3$td£$b£24.6%$/b£$/td£§+2.9$/td£$/tr£$tr£$td£PLR$/td£tab_r122tab_r2#6268AFtab_r3$td£$b£15.0%$/b£$/td£§-2.7$/td£$/tr£$tr£$td£Centre$/td£tab_r120tab_r2#f39f5etab_r3$td£$b£13.1%$/b£$/td£§-1.4$/td£$/tr£$tr£$td£Vert-e-s$/td£tab_r112tab_r2#26b300tab_r3$td£$b£8.1%$/b£$/td£§-7.1$/td£$/tr£$tr£$td£PVL$/td£tab_r18tab_r2#cbd401tab_r3$td£$b£5.0%$/b£$/td£§+0.9$/td£$/tr£$/table£$br£Bulletins de vote valables: $b£2'546$/b£$br£Taux de participation: $b£38.5%$/b£ (+2.9%)","tab_h_it$tr£$td£UDC$/td£tab_r145tab_r2#547d34tab_r3$td£$b£29.9%$/b£$/td£§+4.7$/td£$/tr£$tr£$td£PS$/td£tab_r137tab_r2#ea546ftab_r3$td£$b£24.6%$/b£$/td£§+2.9$/td£$/tr£$tr£$td£PLR$/td£tab_r122tab_r2#6268AFtab_r3$td£$b£15.0%$/b£$/td£§-2.7$/td£$/tr£$tr£$td£Centro$/td£tab_r120tab_r2#f39f5etab_r3$td£$b£13.1%$/b£$/td£§-1.4$/td£$/tr£$tr£$td£Verdi$/td£tab_r112tab_r2#26b300tab_r3$td£$b£8.1%$/b£$/td£§-7.1$/td£$/tr£$tr£$td£PVL$/td£tab_r18tab_r2#cbd401tab_r3$td£$b£5.0%$/b£$/td£§+0.9$/td£$/tr£$/table£$br£Schede elettorali valide: $b£2'546$/b£$br£Tasso di partecipazione: $b£38.5%$/b£ (+2.9%)","SVP"
2762,"Allschwil BL","Allschwil (BL)","Allschwil BL","Keine Änderung an der Spitze in Allschwil: Die <b>SP</b> holt wie vor vier Jahren die meisten Stimmen (29,2 Prozent, +3,6 Prozentpunkte).<br><br>Mit einem Wählerstimmenanteil von 23,8 Prozent (+3,8 Prozentpunkte) ist die <b>SVP</b> die zweitstärkste Kraft in der Gemeinde.<br><br>Den dritten Platz belegt die <b>FDP</b>. Die Partei erzielt einen Wähleranteil von 13,3 Prozent (Veränderung gegenüber 2019: -3,6 Prozentpunkte).","Les électeurs d'Allschwil n'ont pas retourné leur veste depuis 2019. Le parti le plus fort dans leur commune reste le <b>PS</b>, avec 29,2 % des suffrages (+3,6 points de pourcentage).<br><br>L'<b>UDC</b> se classe à la deuxième place. La formation obtient 23,8 % des suffrages (+3,8 points de pourcentage) dans la commune.<br><br>A la troisième place figure le <b><b>PL</b>R</b>, qui réalise 13,3 % des voix (-3,6).","Il partito <b>PS</b> mantiene il primo posto a Allschwil e ottiene il 29,2 percento dei voti (+3,6 punti percentuali).<br><br>Il partito <b>UDC</b> si classifica al secondo posto. Ottiene il 23,8 percento dei voti (+3,8 punti percentuali) nel comune.<br><br>Il partito <b>PLR</b> si posiziona terzo con il 13,3 percento dei voti. Questo rappresenta una variazione di -3,6 punti percentuali rispetto al 2019.","tab_h$tr£$td£SP$/td£tab_r144tab_r2#ea546ftab_r3$td£$b£29.2%$/b£$/td£§+3.6$/td£$/tr£$tr£$td£SVP$/td£tab_r136tab_r2#547d34tab_r3$td£$b£23.8%$/b£$/td£§+3.8$/td£$/tr£$tr£$td£FDP$/td£tab_r120tab_r2#6268AFtab_r3$td£$b£13.3%$/b£$/td£§-3.6$/td£$/tr£$tr£$td£Mitte$/td£tab_r119tab_r2#f39f5etab_r3$td£$b£12.5%$/b£$/td£§+1.4$/td£$/tr£$tr£$td£Grüne$/td£tab_r114tab_r2#26b300tab_r3$td£$b£9.4%$/b£$/td£§-7.6$/td£$/tr£$tr£$td£GLP$/td£tab_r111tab_r2#cbd401tab_r3$td£$b£7.6%$/b£$/td£§+1.6$/td£$/tr£$/table£$br£Gültige Wahlzettel: $b£5'289$/b£$br£Wahlbeteiligung: $b£40.4%$/b£ (+2.7%)","tab_h_fr$tr£$td£PS$/td£tab_r144tab_r2#ea546ftab_r3$td£$b£29.2%$/b£$/td£§+3.6$/td£$/tr£$tr£$td£UDC$/td£tab_r136tab_r2#547d34tab_r3$td£$b£23.8%$/b£$/td£§+3.8$/td£$/tr£$tr£$td£PLR$/td£tab_r120tab_r2#6268AFtab_r3$td£$b£13.3%$/b£$/td£§-3.6$/td£$/tr£$tr£$td£Centre$/td£tab_r119tab_r2#f39f5etab_r3$td£$b£12.5%$/b£$/td£§+1.4$/td£$/tr£$tr£$td£Vert-e-s$/td£tab_r114tab_r2#26b300tab_r3$td£$b£9.4%$/b£$/td£§-7.6$/td£$/tr£$tr£$td£PVL$/td£tab_r111tab_r2#cbd401tab_r3$td£$b£7.6%$/b£$/td£§+1.6$/td£$/tr£$/table£$br£Bulletins de vote valables: $b£5'289$/b£$br£Taux de participation: $b£40.4%$/b£ (+2.7%)","tab_h_it$tr£$td£PS$/td£tab_r144tab_r2#ea546ftab_r3$td£$b£29.2%$/b£$/td£§+3.6$/td£$/tr£$tr£$td£UDC$/td£tab_r136tab_r2#547d34tab_r3$td£$b£23.8%$/b£$/td£§+3.8$/td£$/tr£$tr£$td£PLR$/td£tab_r120tab_r2#6268AFtab_r3$td£$b£13.3%$/b£$/td£§-3.6$/td£$/tr£$tr£$td£Centro$/td£tab_r119tab_r2#f39f5etab_r3$td£$b£12.5%$/b£$/td£§+1.4$/td£$/tr£$tr£$td£Verdi$/td£tab_r114tab_r2#26b300tab_r3$td£$b£9.4%$/b£$/td£§-7.6$/td£$/tr£$tr£$td£PVL$/td£tab_r111tab_r2#cbd401tab_r3$td£$b£7.6%$/b£$/td£§+1.6$/td£$/tr£$/table£$br£Schede elettorali valide: $b£5'289$/b£$br£Tasso di partecipazione: $b£40.4%$/b£ (+2.7%)","SP"
2763,"Arlesheim BL","Arlesheim (BL)","Arlesheim BL","Mit einem grossen Sprung von +5,2 Prozentpunkten ist die <b>SP</b> neu die stärkste Partei in Arlesheim. Die Partei erhält 25,9 Prozent der Wählerstimmen.<br><br>Die <b>FDP</b> verliert mit einem Minus von -5,9 Prozentpunkten gegenüber den Wahlen 2019 sehr viele Wählerstimmen. Trotzdem liegt die Partei mit einem Wähleranteil von 18 Prozent noch auf dem zweiten Platz.<br><br>Den dritten Platz belegt die <b>SVP</b>. Die Partei erzielt einen Wähleranteil von 17,8 Prozent (Veränderung gegenüber 2019: +3,8 Prozentpunkte).<br><br>Speziell: In keiner anderen Gemeinde des Kantons schneidet die <b>SVP</b> schwächer ab (ohne Kleinstgemeinden).","Le <b>PS</b> réalise une forte progression (+5,2 points de pourcentage) La formation est désormais le parti le plus fort d'Arlesheim. Le parti obtient 25,9 %age des voix.<br><br>Malgré un recul de -5,9 points de pourcentage par rapport aux élections de 2019, le <b><b>PL</b>R</b> occupe toujours la deuxième place. La formation engrange 18 % des voix.<br><br>A la troisième place figure l'<b>UDC</b>, qui réalise 17,8 % des voix (+3,8).<br><br>L'<b>UDC</b> a enregistré dans cette commune son moins bon résultat cantonal (sans tenir compte des petites communes).","Il partito <b>PS</b> realizza una forte progressione (+5,2 punti percentuali). Ora è il partito più forte di Arlesheim, ottenendo il 25,9 percento dei voti.<br><br>Il partito <b>PLR</b> perde molti voti, registrando una perdita di -5,9 punti percentuali rispetto alle elezioni del 2019. Nonostante ciò, rimane in seconda posizione con una quota di elettori del 18 percento.<br><br>Al terzo posto troviamo il partito <b>UDC</b> con il 17,8 percento dei voti (+3,8).<br><br>Il partito <b>UDC</b> ha registrato in questo comune il suo peggior risultato a livello cantonale (senza considerare i piccoli comuni).","tab_h$tr£$td£SP$/td£tab_r139tab_r2#ea546ftab_r3$td£$b£25.9%$/b£$/td£§+5.2$/td£$/tr£$tr£$td£FDP$/td£tab_r127tab_r2#6268AFtab_r3$td£$b£18.0%$/b£$/td£§-5.9$/td£$/tr£$tr£$td£SVP$/td£tab_r127tab_r2#547d34tab_r3$td£$b£17.8%$/b£$/td£§+3.8$/td£$/tr£$tr£$td£Grüne$/td£tab_r123tab_r2#26b300tab_r3$td£$b£15.4%$/b£$/td£§-8.4$/td£$/tr£$tr£$td£Mitte$/td£tab_r116tab_r2#f39f5etab_r3$td£$b£10.7%$/b£$/td£§+1.2$/td£$/tr£$tr£$td£GLP$/td£tab_r112tab_r2#cbd401tab_r3$td£$b£8.0%$/b£$/td£§+2.2$/td£$/tr£$/table£$br£Gültige Wahlzettel: $b£3'025$/b£$br£Wahlbeteiligung: $b£48.7%$/b£ (+0.2%)","tab_h_fr$tr£$td£PS$/td£tab_r139tab_r2#ea546ftab_r3$td£$b£25.9%$/b£$/td£§+5.2$/td£$/tr£$tr£$td£PLR$/td£tab_r127tab_r2#6268AFtab_r3$td£$b£18.0%$/b£$/td£§-5.9$/td£$/tr£$tr£$td£UDC$/td£tab_r127tab_r2#547d34tab_r3$td£$b£17.8%$/b£$/td£§+3.8$/td£$/tr£$tr£$td£Vert-e-s$/td£tab_r123tab_r2#26b300tab_r3$td£$b£15.4%$/b£$/td£§-8.4$/td£$/tr£$tr£$td£Centre$/td£tab_r116tab_r2#f39f5etab_r3$td£$b£10.7%$/b£$/td£§+1.2$/td£$/tr£$tr£$td£PVL$/td£tab_r112tab_r2#cbd401tab_r3$td£$b£8.0%$/b£$/td£§+2.2$/td£$/tr£$/table£$br£Bulletins de vote valables: $b£3'025$/b£$br£Taux de participation: $b£48.7%$/b£ (+0.2%)","tab_h_it$tr£$td£PS$/td£tab_r139tab_r2#ea546ftab_r3$td£$b£25.9%$/b£$/td£§+5.2$/td£$/tr£$tr£$td£PLR$/td£tab_r127tab_r2#6268AFtab_r3$td£$b£18.0%$/b£$/td£§-5.9$/td£$/tr£$tr£$td£UDC$/td£tab_r127tab_r2#547d34tab_r3$td£$b£17.8%$/b£$/td£§+3.8$/td£$/tr£$tr£$td£Verdi$/td£tab_r123tab_r2#26b300tab_r3$td£$b£15.4%$/b£$/td£§-8.4$/td£$/tr£$tr£$td£Centro$/td£tab_r116tab_r2#f39f5etab_r3$td£$b£10.7%$/b£$/td£§+1.2$/td£$/tr£$tr£$td£PVL$/td£tab_r112tab_r2#cbd401tab_r3$td£$b£8.0%$/b£$/td£§+2.2$/td£$/tr£$/table£$br£Schede elettorali valide: $b£3'025$/b£$br£Tasso di partecipazione: $b£48.7%$/b£ (+0.2%)","SP"
2764,"Biel-Benken BL","Biel-Benken (BL)","Biel-Benken BL","Keine Änderung an der Spitze in Biel-Benken: Die <b>SVP</b> holt wie vor vier Jahren die meisten Stimmen (27,8 Prozent, +2,1 Prozentpunkte).<br><br>Die <b>SP</b> ist die zweitstärkste Kraft in der Gemeinde. Die Partei kommt auf 19,2 Prozent (+4,7 Prozentpunkte).<br><br>Auf dem dritten Platz landet die <b>Mitte</b> mit 17,5 Prozent der Stimmen. Das bedeutet eine Veränderung von +2,6 Prozentpunkten gegenüber 2019. <br><br>In der Gemeinde Biel-Benken wohnt auch eine Nationalrätin: <b>Elisabeth Schneider-Schneiter (<b>Mitte</b>)</b>.","L'<b>UDC</b> reste le parti le plus fort à Biel-Benken. Le parti remporte 27,8 % des voix (+2,1 points de pourcentage).<br><br>Le <b>PS</b> est le deuxième parti le plus fort avec 19,2 % des voix (+4,7 points de pourcentage par rapport à 2019).<br><br>Le <b>Centre</b> complète le podium. La formation récolte 17,5 % des suffrages (+2,6).<br><br>Une conseillère nationale habite à Biel-Benken : <b>Elisabeth Schneider-Schneiter (<b>Centre</b>)</b>.","Il partito <b>UDC</b> rimane il più forte a Biel-Benken, con il 27,8 percento dei voti (+2,1 punti percentuali).<br><br>Un aumento significativo di +4,7 punti percentuali permette al partito <b>PS</b> di diventare il secondo partito del suo comune. Il partito raccoglie il 19,2 percento dei voti.<br><br>La terza posizione è occupata dal partito <b>Centro</b>. Ottiene una percentuale di elettori del il 17,5. (+2,6 punti percentuali di differenza rispetto al 2019).<br><br>Anche una consigliera nazionale vive a Biel-Benken: <b>Elisabeth Schneider-Schneiter (<b>Centro</b>)</b>.","tab_h$tr£$td£SVP$/td£tab_r142tab_r2#547d34tab_r3$td£$b£27.8%$/b£$/td£§+2.1$/td£$/tr£$tr£$td£SP$/td£tab_r129tab_r2#ea546ftab_r3$td£$b£19.2%$/b£$/td£§+4.7$/td£$/tr£$tr£$td£Mitte$/td£tab_r126tab_r2#f39f5etab_r3$td£$b£17.5%$/b£$/td£§+2.6$/td£$/tr£$tr£$td£FDP$/td£tab_r123tab_r2#6268AFtab_r3$td£$b£15.4%$/b£$/td£§-4.4$/td£$/tr£$tr£$td£Grüne$/td£tab_r113tab_r2#26b300tab_r3$td£$b£8.9%$/b£$/td£§-6.8$/td£$/tr£$tr£$td£GLP$/td£tab_r113tab_r2#cbd401tab_r3$td£$b£8.5%$/b£$/td£§+1.5$/td£$/tr£$/table£$br£Gültige Wahlzettel: $b£1'307$/b£$br£Wahlbeteiligung: $b£52.1%$/b£ (+3.0%)","tab_h_fr$tr£$td£UDC$/td£tab_r142tab_r2#547d34tab_r3$td£$b£27.8%$/b£$/td£§+2.1$/td£$/tr£$tr£$td£PS$/td£tab_r129tab_r2#ea546ftab_r3$td£$b£19.2%$/b£$/td£§+4.7$/td£$/tr£$tr£$td£Centre$/td£tab_r126tab_r2#f39f5etab_r3$td£$b£17.5%$/b£$/td£§+2.6$/td£$/tr£$tr£$td£PLR$/td£tab_r123tab_r2#6268AFtab_r3$td£$b£15.4%$/b£$/td£§-4.4$/td£$/tr£$tr£$td£Vert-e-s$/td£tab_r113tab_r2#26b300tab_r3$td£$b£8.9%$/b£$/td£§-6.8$/td£$/tr£$tr£$td£PVL$/td£tab_r113tab_r2#cbd401tab_r3$td£$b£8.5%$/b£$/td£§+1.5$/td£$/tr£$/table£$br£Bulletins de vote valables: $b£1'307$/b£$br£Taux de participation: $b£52.1%$/b£ (+3.0%)","tab_h_it$tr£$td£UDC$/td£tab_r142tab_r2#547d34tab_r3$td£$b£27.8%$/b£$/td£§+2.1$/td£$/tr£$tr£$td£PS$/td£tab_r129tab_r2#ea546ftab_r3$td£$b£19.2%$/b£$/td£§+4.7$/td£$/tr£$tr£$td£Centro$/td£tab_r126tab_r2#f39f5etab_r3$td£$b£17.5%$/b£$/td£§+2.6$/td£$/tr£$tr£$td£PLR$/td£tab_r123tab_r2#6268AFtab_r3$td£$b£15.4%$/b£$/td£§-4.4$/td£$/tr£$tr£$td£Verdi$/td£tab_r113tab_r2#26b300tab_r3$td£$b£8.9%$/b£$/td£§-6.8$/td£$/tr£$tr£$td£PVL$/td£tab_r113tab_r2#cbd401tab_r3$td£$b£8.5%$/b£$/td£§+1.5$/td£$/tr£$/table£$br£Schede elettorali valide: $b£1'307$/b£$br£Tasso di partecipazione: $b£52.1%$/b£ (+3.0%)","SVP"
2765,"Binningen BL","Binningen (BL)","Binningen BL","Mit einem grossen Sprung von +5,3 Prozentpunkten ist die <b>SP</b> neu die stärkste Partei in Binningen. Die Partei erhält 26,2 Prozent der Wählerstimmen.<br><br>Auf dem zweiten Platz in der Gemeinde liegt die <b>SVP</b>. Die Partei erreicht einen Wählerstimmenanteil von 21 Prozent (+1,7 Prozentpunkte).<br><br>Die <b>FDP</b> landet mit 19,9 Prozent auf dem dritten Platz (Veränderung gegenüber 2019: -2,9 Prozentpunkte).<br><br>In der Gemeinde Binningen wohnt auch eine Nationalrätin: <b>Samira Marti (<b>SP</b>)</b>.","Le <b>PS</b> réalise une forte progression (+5,3 points de pourcentage) La formation est désormais le parti le plus fort de Binningen. Le parti obtient 26,2 %age des voix.<br><br>L'<b>UDC</b> arrive en deuxième position dans la commune, avec un pourcentage de votants de 21 (+1,7 points de pourcentage)<br><br>Le <b><b>PL</b>R</b> arrive en troisième position avec 19,9 % des votes. Cela représente un changement de -2,9 points de pourcentage par rapport à 2019.<br><br>Une conseillère nationale habite à Binningen : <b>Samira Marti (<b>PS</b>)</b>.","Il partito <b>PS</b> realizza una forte progressione (+5,3 punti percentuali). Ora è il partito più forte di Binningen, ottenendo il 26,2 percento dei voti.<br><br>Il partito <b>UDC</b> si classifica al secondo posto. Ottiene il 21 percento dei voti (+1,7 punti percentuali) nel comune.<br><br>Al terzo posto troviamo il partito <b>PLR</b> con il 19,9 percento dei voti (-2,9).<br><br>Anche una consigliera nazionale vive a Binningen: <b>Samira Marti (<b>PS</b>)</b>.","tab_h$tr£$td£SP$/td£tab_r139tab_r2#ea546ftab_r3$td£$b£26.2%$/b£$/td£§+5.3$/td£$/tr£$tr£$td£SVP$/td£tab_r131tab_r2#547d34tab_r3$td£$b£21.0%$/b£$/td£§+1.7$/td£$/tr£$tr£$td£FDP$/td£tab_r130tab_r2#6268AFtab_r3$td£$b£19.9%$/b£$/td£§-2.9$/td£$/tr£$tr£$td£Mitte$/td£tab_r116tab_r2#f39f5etab_r3$td£$b£10.8%$/b£$/td£§+1.1$/td£$/tr£$tr£$td£Grüne$/td£tab_r115tab_r2#26b300tab_r3$td£$b£10.3%$/b£$/td£§-7.9$/td£$/tr£$tr£$td£GLP$/td£tab_r113tab_r2#cbd401tab_r3$td£$b£8.5%$/b£$/td£§+1.6$/td£$/tr£$/table£$br£Gültige Wahlzettel: $b£4'841$/b£$br£Wahlbeteiligung: $b£50.5%$/b£ (+2.9%)","tab_h_fr$tr£$td£PS$/td£tab_r139tab_r2#ea546ftab_r3$td£$b£26.2%$/b£$/td£§+5.3$/td£$/tr£$tr£$td£UDC$/td£tab_r131tab_r2#547d34tab_r3$td£$b£21.0%$/b£$/td£§+1.7$/td£$/tr£$tr£$td£PLR$/td£tab_r130tab_r2#6268AFtab_r3$td£$b£19.9%$/b£$/td£§-2.9$/td£$/tr£$tr£$td£Centre$/td£tab_r116tab_r2#f39f5etab_r3$td£$b£10.8%$/b£$/td£§+1.1$/td£$/tr£$tr£$td£Vert-e-s$/td£tab_r115tab_r2#26b300tab_r3$td£$b£10.3%$/b£$/td£§-7.9$/td£$/tr£$tr£$td£PVL$/td£tab_r113tab_r2#cbd401tab_r3$td£$b£8.5%$/b£$/td£§+1.6$/td£$/tr£$/table£$br£Bulletins de vote valables: $b£4'841$/b£$br£Taux de participation: $b£50.5%$/b£ (+2.9%)","tab_h_it$tr£$td£PS$/td£tab_r139tab_r2#ea546ftab_r3$td£$b£26.2%$/b£$/td£§+5.3$/td£$/tr£$tr£$td£UDC$/td£tab_r131tab_r2#547d34tab_r3$td£$b£21.0%$/b£$/td£§+1.7$/td£$/tr£$tr£$td£PLR$/td£tab_r130tab_r2#6268AFtab_r3$td£$b£19.9%$/b£$/td£§-2.9$/td£$/tr£$tr£$td£Centro$/td£tab_r116tab_r2#f39f5etab_r3$td£$b£10.8%$/b£$/td£§+1.1$/td£$/tr£$tr£$td£Verdi$/td£tab_r115tab_r2#26b300tab_r3$td£$b£10.3%$/b£$/td£§-7.9$/td£$/tr£$tr£$td£PVL$/td£tab_r113tab_r2#cbd401tab_r3$td£$b£8.5%$/b£$/td£§+1.6$/td£$/tr£$/table£$br£Schede elettorali valide: $b£4'841$/b£$br£Tasso di partecipazione: $b£50.5%$/b£ (+2.9%)","SP"
2766,"Birsfelden BL","Birsfelden (BL)","Birsfelden BL","Keine Änderung an der Spitze in Birsfelden: Die <b>SP</b> holt wie vor vier Jahren die meisten Stimmen (36,7 Prozent, +3,4 Prozentpunkte).<br><br>In der Gemeinde landet die <b>SVP</b> auf dem zweiten Platz. Die Partei erreicht einen Wählerstimmenanteil von 23,5 Prozent (+1,6 Prozentpunkte). <br><br>Die <b>Grünen</b> verlieren -6,6 Prozentpunkte und damit so viele Stimmen, dass sie mit einem Wähleranteil von 9,4 Prozent nur noch auf dem dritten Platz landet.<br><br>Besonders ist: Die <b>SP</b> erreicht in der Gemeinde das höchste Resultat des gesamten Kantons (ohne Kleinstgemeinden).","Le <b>PS</b> maintient sa première place à Birsfelden avec 36,7 pour des voix (+3,4 points de pourcentage).<br><br>L'<b>UDC</b> arrive en deuxième position dans la commune avec un pourcentage de votants de 23,5 (+1,6 points de pourcentage).<br><br>Les <b>Vert-e-s</b>, troisième parti de la commune, a perdu beaucoup de voix. La formation obtient 9,4 % des voix, ce qui représente une perte de -6,6 points de pourcentage.<br><br>Le <b>PS</b> obtient dans cette commune le résultat le plus élevé de tout le canton (sans tenir compte des petites communes).","Gli elettori di Birsfelden non hanno cambiato idea dal 2019. Il partito <b>PS</b> rimane il più forte nel loro comune, con il 36,7 percento dei voti (+3,4 punti percentuali).<br><br>Il partito <b>UDC</b> si classifica al secondo posto. Ottiene il 23,5 percento dei voti (+1,6 punti percentuali) nel comune.<br><br>Il partito <b>Verdi</b>, terzo partito, ha perso molti voti, ricevendo il 9,4 percento dei voti, una perdita di -6,6 punti percentuali.<br><br>Il partito <b>PS</b> ottiene nel comune il risultato più alto dell'intero cantone (senza considerare i piccoli comuni).","tab_h$tr£$td£SP$/td£tab_r155tab_r2#ea546ftab_r3$td£$b£36.7%$/b£$/td£§+3.4$/td£$/tr£$tr£$td£SVP$/td£tab_r135tab_r2#547d34tab_r3$td£$b£23.5%$/b£$/td£§+1.6$/td£$/tr£$tr£$td£Grüne$/td£tab_r114tab_r2#26b300tab_r3$td£$b£9.4%$/b£$/td£§-6.6$/td£$/tr£$tr£$td£Mitte$/td£tab_r113tab_r2#f39f5etab_r3$td£$b£8.8%$/b£$/td£§-0.9$/td£$/tr£$tr£$td£FDP$/td£tab_r113tab_r2#6268AFtab_r3$td£$b£8.7%$/b£$/td£§-1.6$/td£$/tr£$tr£$td£GLP$/td£tab_r19tab_r2#cbd401tab_r3$td£$b£5.8%$/b£$/td£§+2.8$/td£$/tr£$tr£$td£EVP$/td£tab_r16tab_r2#87bfdctab_r3$td£$b£4.1%$/b£$/td£§-1.3$/td£$/tr£$/table£$br£Gültige Wahlzettel: $b£2'187$/b£$br£Wahlbeteiligung: $b£37.0%$/b£ (+1.9%)","tab_h_fr$tr£$td£PS$/td£tab_r155tab_r2#ea546ftab_r3$td£$b£36.7%$/b£$/td£§+3.4$/td£$/tr£$tr£$td£UDC$/td£tab_r135tab_r2#547d34tab_r3$td£$b£23.5%$/b£$/td£§+1.6$/td£$/tr£$tr£$td£Vert-e-s$/td£tab_r114tab_r2#26b300tab_r3$td£$b£9.4%$/b£$/td£§-6.6$/td£$/tr£$tr£$td£Centre$/td£tab_r113tab_r2#f39f5etab_r3$td£$b£8.8%$/b£$/td£§-0.9$/td£$/tr£$tr£$td£PLR$/td£tab_r113tab_r2#6268AFtab_r3$td£$b£8.7%$/b£$/td£§-1.6$/td£$/tr£$tr£$td£PVL$/td£tab_r19tab_r2#cbd401tab_r3$td£$b£5.8%$/b£$/td£§+2.8$/td£$/tr£$tr£$td£PEV$/td£tab_r16tab_r2#87bfdctab_r3$td£$b£4.1%$/b£$/td£§-1.3$/td£$/tr£$/table£$br£Bulletins de vote valables: $b£2'187$/b£$br£Taux de participation: $b£37.0%$/b£ (+1.9%)","tab_h_it$tr£$td£PS$/td£tab_r155tab_r2#ea546ftab_r3$td£$b£36.7%$/b£$/td£§+3.4$/td£$/tr£$tr£$td£UDC$/td£tab_r135tab_r2#547d34tab_r3$td£$b£23.5%$/b£$/td£§+1.6$/td£$/tr£$tr£$td£Verdi$/td£tab_r114tab_r2#26b300tab_r3$td£$b£9.4%$/b£$/td£§-6.6$/td£$/tr£$tr£$td£Centro$/td£tab_r113tab_r2#f39f5etab_r3$td£$b£8.8%$/b£$/td£§-0.9$/td£$/tr£$tr£$td£PLR$/td£tab_r113tab_r2#6268AFtab_r3$td£$b£8.7%$/b£$/td£§-1.6$/td£$/tr£$tr£$td£PVL$/td£tab_r19tab_r2#cbd401tab_r3$td£$b£5.8%$/b£$/td£§+2.8$/td£$/tr£$tr£$td£PEV$/td£tab_r16tab_r2#87bfdctab_r3$td£$b£4.1%$/b£$/td£§-1.3$/td£$/tr£$/table£$br£Schede elettorali valide: $b£2'187$/b£$br£Tasso di partecipazione: $b£37.0%$/b£ (+1.9%)","SP"
2767,"Bottmingen BL","Bottmingen (BL)","Bottmingen BL","Neue stärkste Kraft in Bottmingen: Die <b>SVP</b> holt mit 24,3 Prozent (+2,5 Prozentpunkte) die meisten Stimmen. Die Partei verbessert sich damit von Rang zwei auf den ersten Platz.<br><br>Die <b>FDP</b> belegt in der Gemeinde den zweiten Platz mit einem Wählerstimmenanteil von 21,9 Prozent (-2,8 Prozentpunkte).<br><br>Die <b>SP</b> landet mit 21,3 Prozent auf dem dritten Platz (Veränderung gegenüber 2019: +2,6 Prozentpunkte).<br><br>Besonders ist: Die <b>FDP</b> erreicht in der Gemeinde das höchste Resultat des gesamten Kantons (ohne Kleinstgemeinden).","L'<b>UDC</b> progresse. La formation passe du rang numero deux à la première place à Bottmingen. Le parti remporte 24,3 pourcent des voix (+2,5 points de pourcentage).<br><br>Le <b><b>PL</b>R</b> arrive en deuxième position.La formation obtient un pourcentage de voix de 21,9 (-2,8 points de pourcentage).<br><br>Le <b>PS</b> complète le podium. La formation récolte 21,3 % des suffrages (+2,6).<br><br>Le <b><b>PL</b>R</b> obtient dans cette commune le résultat le plus élevé de tout le canton (sans tenir compte des petites communes).","Il partito <b>UDC</b> progredisce. Passa dal due esimo posto al primo a Bottmingen, ottenendo il 24,3 percento dei voti (+2,5 punti percentuali).<br><br>Il secondo rango è occupato dal partito <b>PLR</b> che ottiene il 21,9 percento dei voti (-2,8 punti percentuali rispetto al 2019).<br><br>Il partito <b>PS</b> si posiziona terzo con il 21,3 percento dei voti. Questo rappresenta una variazione di +2,6 punti percentuali rispetto al 2019.<br><br>Il partito <b>PLR</b> ottiene nel comune il risultato più alto dell'intero cantone (senza considerare i piccoli comuni).","tab_h$tr£$td£SVP$/td£tab_r136tab_r2#547d34tab_r3$td£$b£24.3%$/b£$/td£§+2.5$/td£$/tr£$tr£$td£FDP$/td£tab_r133tab_r2#6268AFtab_r3$td£$b£21.9%$/b£$/td£§-2.8$/td£$/tr£$tr£$td£SP$/td£tab_r132tab_r2#ea546ftab_r3$td£$b£21.3%$/b£$/td£§+2.6$/td£$/tr£$tr£$td£Mitte$/td£tab_r117tab_r2#f39f5etab_r3$td£$b£11.3%$/b£$/td£§+1.5$/td£$/tr£$tr£$td£GLP$/td£tab_r114tab_r2#cbd401tab_r3$td£$b£9.2%$/b£$/td£§+1.6$/td£$/tr£$tr£$td£Grüne$/td£tab_r113tab_r2#26b300tab_r3$td£$b£8.9%$/b£$/td£§-5.6$/td£$/tr£$/table£$br£Gültige Wahlzettel: $b£2'161$/b£$br£Wahlbeteiligung: $b£51.6%$/b£ (+1.3%)","tab_h_fr$tr£$td£UDC$/td£tab_r136tab_r2#547d34tab_r3$td£$b£24.3%$/b£$/td£§+2.5$/td£$/tr£$tr£$td£PLR$/td£tab_r133tab_r2#6268AFtab_r3$td£$b£21.9%$/b£$/td£§-2.8$/td£$/tr£$tr£$td£PS$/td£tab_r132tab_r2#ea546ftab_r3$td£$b£21.3%$/b£$/td£§+2.6$/td£$/tr£$tr£$td£Centre$/td£tab_r117tab_r2#f39f5etab_r3$td£$b£11.3%$/b£$/td£§+1.5$/td£$/tr£$tr£$td£PVL$/td£tab_r114tab_r2#cbd401tab_r3$td£$b£9.2%$/b£$/td£§+1.6$/td£$/tr£$tr£$td£Vert-e-s$/td£tab_r113tab_r2#26b300tab_r3$td£$b£8.9%$/b£$/td£§-5.6$/td£$/tr£$/table£$br£Bulletins de vote valables: $b£2'161$/b£$br£Taux de participation: $b£51.6%$/b£ (+1.3%)","tab_h_it$tr£$td£UDC$/td£tab_r136tab_r2#547d34tab_r3$td£$b£24.3%$/b£$/td£§+2.5$/td£$/tr£$tr£$td£PLR$/td£tab_r133tab_r2#6268AFtab_r3$td£$b£21.9%$/b£$/td£§-2.8$/td£$/tr£$tr£$td£PS$/td£tab_r132tab_r2#ea546ftab_r3$td£$b£21.3%$/b£$/td£§+2.6$/td£$/tr£$tr£$td£Centro$/td£tab_r117tab_r2#f39f5etab_r3$td£$b£11.3%$/b£$/td£§+1.5$/td£$/tr£$tr£$td£PVL$/td£tab_r114tab_r2#cbd401tab_r3$td£$b£9.2%$/b£$/td£§+1.6$/td£$/tr£$tr£$td£Verdi$/td£tab_r113tab_r2#26b300tab_r3$td£$b£8.9%$/b£$/td£§-5.6$/td£$/tr£$/table£$br£Schede elettorali valide: $b£2'161$/b£$br£Tasso di partecipazione: $b£51.6%$/b£ (+1.3%)","SVP"
