"ID","Gemeinde_de","Gemeinde_fr","Gemeinde_it","Text_de","Text_fr","Text_it","Tabelle_de","Tabelle_fr","Tabelle_it","Staerkste_Partei"
1701,"Baar ZG","Baar (ZG)","Baar ZG","Die Reihenfolge der Parteien in Baar bleibt im Vergleich zu den Wahlen 2019 gleich: Die <b>SVP</b> bleibt mit 31,5 Prozent die stärkste Kraft, gefolgt von der <b>Mitte</b> (24 Prozent, +1,3 Prozentpunkte) und den <b>Grünen</b> (17 Prozent, -2,7 Prozentpunkte).<br><br>","Le trio de tête reste inchangé à Baar: l'<b>UDC</b> reste premier avec 31,5 % des voix. La formation devance le <b>Centre</b> (24 %, +1,3 points de pourcentage) et les <b>Vert-e-s</b> (17 %, -2,7 points). <br><br>","Il trio di testa rimane invariato a Baar: il partito <b>UDC</b> rimane primo con il 31,5 percento dei voti. Precede il partito <b>Centro</b> (24 percento, +1,3 punti percentuali) e il partito <b>Verdi</b> (il 17 percento, -2,7 punti).<br><br>","tab_h$tr£$td£SVP$/td£tab_r147tab_r2#547d34tab_r3$td£$b£31.5%$/b£$/td£§+3.3$/td£$/tr£$tr£$td£Mitte$/td£tab_r136tab_r2#f39f5etab_r3$td£$b£24.0%$/b£$/td£§+1.3$/td£$/tr£$tr£$td£Grüne$/td£tab_r125tab_r2#26b300tab_r3$td£$b£17.0%$/b£$/td£§-2.7$/td£$/tr£$tr£$td£FDP$/td£tab_r118tab_r2#6268AFtab_r3$td£$b£11.8%$/b£$/td£§-1.5$/td£$/tr£$tr£$td£GLP$/td£tab_r19tab_r2#cbd401tab_r3$td£$b£6.3%$/b£$/td£§+0.9$/td£$/tr£$tr£$td£SP$/td£tab_r19tab_r2#ea546ftab_r3$td£$b£5.8%$/b£$/td£§-4.3$/td£$/tr£$tr£$td£weitere$/td£tab_r15tab_r2#bebebetab_r3$td£$b£3.1%$/b£$/td£§+3.1$/td£$/tr£$/table£$br£Gültige Wahlzettel: $b£7'303$/b£$br£Wahlbeteiligung: $b£51.4%$/b£ (+1.1%)","tab_h_fr$tr£$td£UDC$/td£tab_r147tab_r2#547d34tab_r3$td£$b£31.5%$/b£$/td£§+3.3$/td£$/tr£$tr£$td£Centre$/td£tab_r136tab_r2#f39f5etab_r3$td£$b£24.0%$/b£$/td£§+1.3$/td£$/tr£$tr£$td£Vert-e-s$/td£tab_r125tab_r2#26b300tab_r3$td£$b£17.0%$/b£$/td£§-2.7$/td£$/tr£$tr£$td£PLR$/td£tab_r118tab_r2#6268AFtab_r3$td£$b£11.8%$/b£$/td£§-1.5$/td£$/tr£$tr£$td£PVL$/td£tab_r19tab_r2#cbd401tab_r3$td£$b£6.3%$/b£$/td£§+0.9$/td£$/tr£$tr£$td£PS$/td£tab_r19tab_r2#ea546ftab_r3$td£$b£5.8%$/b£$/td£§-4.3$/td£$/tr£$tr£$td£Divers$/td£tab_r15tab_r2#bebebetab_r3$td£$b£3.1%$/b£$/td£§+3.1$/td£$/tr£$/table£$br£Bulletins de vote valables: $b£7'303$/b£$br£Taux de participation: $b£51.4%$/b£ (+1.1%)","tab_h_it$tr£$td£UDC$/td£tab_r147tab_r2#547d34tab_r3$td£$b£31.5%$/b£$/td£§+3.3$/td£$/tr£$tr£$td£Centro$/td£tab_r136tab_r2#f39f5etab_r3$td£$b£24.0%$/b£$/td£§+1.3$/td£$/tr£$tr£$td£Verdi$/td£tab_r125tab_r2#26b300tab_r3$td£$b£17.0%$/b£$/td£§-2.7$/td£$/tr£$tr£$td£PLR$/td£tab_r118tab_r2#6268AFtab_r3$td£$b£11.8%$/b£$/td£§-1.5$/td£$/tr£$tr£$td£PVL$/td£tab_r19tab_r2#cbd401tab_r3$td£$b£6.3%$/b£$/td£§+0.9$/td£$/tr£$tr£$td£PS$/td£tab_r19tab_r2#ea546ftab_r3$td£$b£5.8%$/b£$/td£§-4.3$/td£$/tr£$tr£$td£altro$/td£tab_r15tab_r2#bebebetab_r3$td£$b£3.1%$/b£$/td£§+3.1$/td£$/tr£$/table£$br£Schede elettorali valide: $b£7'303$/b£$br£Tasso di partecipazione: $b£51.4%$/b£ (+1.1%)","SVP"
1702,"Cham ZG","Cham (ZG)","Cham ZG","Resultat liegt noch nicht vor.","Résultats non encore disponibles.","Risultato non ancora disponibile.","Resultat liegt noch nicht vor.","Résultats non encore disponibles.","Risultato non ancora disponibile.","no_data"
1703,"Hünenberg ZG","Hünenberg (ZG)","Hünenberg ZG","Ganz knapp bleibt die <b>SVP</b> die grösste Partei in Hünenberg. Die Partei holt 28,5 Prozent der Stimmen und hält damit ihren Vorsprung, mit 1,7 Prozentpunkten, vor der <b>Mitte</b>. Diese muss sich mit 26,8 Prozent und Platz zwei begnügen. Die Veränderungen gegenüber 2019: <b>SVP</b>: +3,9 Prozentpunkte; <b>Mitte</b>: +2,3 Prozentpunkte.<br><br>Der dritte Platz geht an die <b>Grünen</b>. Die Partei erreicht 15,8 Prozent der Stimmen (Veränderung von -3,4 Prozentpunkten gegenüber 2019).","Avec 28,5 % des voix (+3,9 points de pourcentage), l'<b>UDC</b> est toujours le parti le plus fort à Hünenberg. Le <b>Centre</b>, qui réalise 26,8 % des suffrages (+2,3 points de pourcentage), est cependant en embuscade. L'écart entre les deux formations politiques est de 1,7 points.<br><br>Les <b>Vert-e-s</b> se classent troisième. La formation obtient 15,8 % des voix (-3,4 points de pourcentage par rapport à 2019).","Il partito <b>UDC</b> rimane in testa a Hünenberg con il 28,5 percento dei voti (+3,9 punti percentuali). Il suo rivale, il partito <b>Centro</b>, minaccia però di sovrastarlo con il 28,5 percento dei voti (+2,3 punti percentuali). La differenza tra le due formazioni è solo di 1,7 punti.<br><br>Il partito <b>Verdi</b> si posiziona terzo con il 15,8 percento dei voti. Questo rappresenta una variazione di -3,4 punti percentuali rispetto al 2019.","tab_h$tr£$td£SVP$/td£tab_r143tab_r2#547d34tab_r3$td£$b£28.5%$/b£$/td£§+3.9$/td£$/tr£$tr£$td£Mitte$/td£tab_r140tab_r2#f39f5etab_r3$td£$b£26.8%$/b£$/td£§+2.3$/td£$/tr£$tr£$td£Grüne$/td£tab_r124tab_r2#26b300tab_r3$td£$b£15.8%$/b£$/td£§-3.4$/td£$/tr£$tr£$td£FDP$/td£tab_r120tab_r2#6268AFtab_r3$td£$b£13.6%$/b£$/td£§-3.3$/td£$/tr£$tr£$td£GLP$/td£tab_r111tab_r2#cbd401tab_r3$td£$b£7.6%$/b£$/td£§+1.0$/td£$/tr£$tr£$td£SP$/td£tab_r16tab_r2#ea546ftab_r3$td£$b£4.1%$/b£$/td£§-3.3$/td£$/tr£$tr£$td£weitere$/td£tab_r15tab_r2#bebebetab_r3$td£$b£3.2%$/b£$/td£§+3.2$/td£$/tr£$/table£$br£Gültige Wahlzettel: $b£3'419$/b£$br£Wahlbeteiligung: $b£57.7%$/b£ (+1.6%)","tab_h_fr$tr£$td£UDC$/td£tab_r143tab_r2#547d34tab_r3$td£$b£28.5%$/b£$/td£§+3.9$/td£$/tr£$tr£$td£Centre$/td£tab_r140tab_r2#f39f5etab_r3$td£$b£26.8%$/b£$/td£§+2.3$/td£$/tr£$tr£$td£Vert-e-s$/td£tab_r124tab_r2#26b300tab_r3$td£$b£15.8%$/b£$/td£§-3.4$/td£$/tr£$tr£$td£PLR$/td£tab_r120tab_r2#6268AFtab_r3$td£$b£13.6%$/b£$/td£§-3.3$/td£$/tr£$tr£$td£PVL$/td£tab_r111tab_r2#cbd401tab_r3$td£$b£7.6%$/b£$/td£§+1.0$/td£$/tr£$tr£$td£PS$/td£tab_r16tab_r2#ea546ftab_r3$td£$b£4.1%$/b£$/td£§-3.3$/td£$/tr£$tr£$td£Divers$/td£tab_r15tab_r2#bebebetab_r3$td£$b£3.2%$/b£$/td£§+3.2$/td£$/tr£$/table£$br£Bulletins de vote valables: $b£3'419$/b£$br£Taux de participation: $b£57.7%$/b£ (+1.6%)","tab_h_it$tr£$td£UDC$/td£tab_r143tab_r2#547d34tab_r3$td£$b£28.5%$/b£$/td£§+3.9$/td£$/tr£$tr£$td£Centro$/td£tab_r140tab_r2#f39f5etab_r3$td£$b£26.8%$/b£$/td£§+2.3$/td£$/tr£$tr£$td£Verdi$/td£tab_r124tab_r2#26b300tab_r3$td£$b£15.8%$/b£$/td£§-3.4$/td£$/tr£$tr£$td£PLR$/td£tab_r120tab_r2#6268AFtab_r3$td£$b£13.6%$/b£$/td£§-3.3$/td£$/tr£$tr£$td£PVL$/td£tab_r111tab_r2#cbd401tab_r3$td£$b£7.6%$/b£$/td£§+1.0$/td£$/tr£$tr£$td£PS$/td£tab_r16tab_r2#ea546ftab_r3$td£$b£4.1%$/b£$/td£§-3.3$/td£$/tr£$tr£$td£altro$/td£tab_r15tab_r2#bebebetab_r3$td£$b£3.2%$/b£$/td£§+3.2$/td£$/tr£$/table£$br£Schede elettorali valide: $b£3'419$/b£$br£Tasso di partecipazione: $b£57.7%$/b£ (+1.6%)","SVP"
1704,"Menzingen ZG","Menzingen (ZG)","Menzingen ZG","In Menzingen behält die <b>SVP</b> ihren Status als stärkste politische Kraft. Die Partei sichert sich einen Wähleranteil von 38 Prozent (+5,1 Prozentpunkte).<br><br>Mit einem Wählerstimmenanteil von 28,4 Prozent (-3,4 Prozentpunkte) ist die <b>Mitte</b> die zweitstärkste Kraft in der Gemeinde.<br><br>Der dritte Platz geht an die <b>Grünen</b>. Die Partei erreicht 13,3 Prozent der Stimmen (Veränderung von -3 Prozentpunkten gegenüber 2019).","Les électeurs de Menzingen n'ont pas retourné leur veste depuis 2019. Le parti le plus fort dans leur commune reste l'<b>UDC</b>, avec 38 % des suffrages (+5,1 points de pourcentage).<br><br>Le <b>Centre</b> est le deuxième parti le plus fort avec 28,4 % des voix (-3,4 points de pourcentage par rapport à 2019).<br><br>La troisième place est occupée par les <b>Vert-e-s</b>. Le parti emmagasine 13,3 % des voix (-3 points de pourcentage par rapport à 2019) ","Il partito <b>UDC</b> mantiene il primo posto a Menzingen e ottiene il 38 percento dei voti (+5,1 punti percentuali).<br><br>Il partito <b>Centro</b> è il secondo partito più forte a Menzingen. Si è migliorato di -3,4 punti percentuali rispetto alle elezioni per il Consiglio nazionale del 2019.<br><br>Il partito <b>Verdi</b> si posiziona terzo con il 13,3 percento dei voti. Questo rappresenta una variazione di -3 punti percentuali rispetto al 2019.","tab_h$tr£$td£SVP$/td£tab_r157tab_r2#547d34tab_r3$td£$b£38.0%$/b£$/td£§+5.1$/td£$/tr£$tr£$td£Mitte$/td£tab_r143tab_r2#f39f5etab_r3$td£$b£28.4%$/b£$/td£§-3.4$/td£$/tr£$tr£$td£Grüne$/td£tab_r120tab_r2#26b300tab_r3$td£$b£13.3%$/b£$/td£§-3.0$/td£$/tr£$tr£$td£FDP$/td£tab_r112tab_r2#6268AFtab_r3$td£$b£8.3%$/b£$/td£§-1.1$/td£$/tr£$tr£$td£weitere$/td£tab_r17tab_r2#bebebetab_r3$td£$b£4.7%$/b£$/td£§+4.7$/td£$/tr£$tr£$td£GLP$/td£tab_r17tab_r2#cbd401tab_r3$td£$b£4.3%$/b£$/td£§+0.8$/td£$/tr£$/table£$br£Gültige Wahlzettel: $b£1'772$/b£$br£Wahlbeteiligung: $b£56.9%$/b£ (+1.2%)","tab_h_fr$tr£$td£UDC$/td£tab_r157tab_r2#547d34tab_r3$td£$b£38.0%$/b£$/td£§+5.1$/td£$/tr£$tr£$td£Centre$/td£tab_r143tab_r2#f39f5etab_r3$td£$b£28.4%$/b£$/td£§-3.4$/td£$/tr£$tr£$td£Vert-e-s$/td£tab_r120tab_r2#26b300tab_r3$td£$b£13.3%$/b£$/td£§-3.0$/td£$/tr£$tr£$td£PLR$/td£tab_r112tab_r2#6268AFtab_r3$td£$b£8.3%$/b£$/td£§-1.1$/td£$/tr£$tr£$td£Divers$/td£tab_r17tab_r2#bebebetab_r3$td£$b£4.7%$/b£$/td£§+4.7$/td£$/tr£$tr£$td£PVL$/td£tab_r17tab_r2#cbd401tab_r3$td£$b£4.3%$/b£$/td£§+0.8$/td£$/tr£$/table£$br£Bulletins de vote valables: $b£1'772$/b£$br£Taux de participation: $b£56.9%$/b£ (+1.2%)","tab_h_it$tr£$td£UDC$/td£tab_r157tab_r2#547d34tab_r3$td£$b£38.0%$/b£$/td£§+5.1$/td£$/tr£$tr£$td£Centro$/td£tab_r143tab_r2#f39f5etab_r3$td£$b£28.4%$/b£$/td£§-3.4$/td£$/tr£$tr£$td£Verdi$/td£tab_r120tab_r2#26b300tab_r3$td£$b£13.3%$/b£$/td£§-3.0$/td£$/tr£$tr£$td£PLR$/td£tab_r112tab_r2#6268AFtab_r3$td£$b£8.3%$/b£$/td£§-1.1$/td£$/tr£$tr£$td£altro$/td£tab_r17tab_r2#bebebetab_r3$td£$b£4.7%$/b£$/td£§+4.7$/td£$/tr£$tr£$td£PVL$/td£tab_r17tab_r2#cbd401tab_r3$td£$b£4.3%$/b£$/td£§+0.8$/td£$/tr£$/table£$br£Schede elettorali valide: $b£1'772$/b£$br£Tasso di partecipazione: $b£56.9%$/b£ (+1.2%)","SVP"
1705,"Neuheim ZG","Neuheim (ZG)","Neuheim ZG","Die <b>SVP</b> behauptet ihre Position als vorherrschende Partei in Neuheim. Die Partei verzeichnet einen Wähleranteil von 37 Prozent (+2,3 Prozentpunkte).<br><br>Zweitstärkste Partei ist die <b>Mitte</b> mit 26,3 Prozent (+1,6 Prozentpunkte gegenüber 2019).<br><br>Der dritte Platz geht an die <b>FDP</b>. Die Partei erreicht 12,5 Prozent der Stimmen (Veränderung von -0,9 Prozentpunkten gegenüber 2019).","Aucune formation politique ne parvient à prendre la place de numéro un au <b>UDC</b> à Neuheim. Le parti obtient 37 % des suffrages (+2,3 points de pourcentage).<br><br>Le <b>Centre</b> arrive en deuxième position.La formation obtient un pourcentage de voix de 26,3 (+1,6 points de pourcentage).<br><br>A la troisième place figure le <b><b>PL</b>R</b>, qui réalise 12,5 % des voix (-0,9).","Il partito <b>UDC</b> mantiene il primo posto a Neuheim e ottiene il 37 percento dei voti (+2,3 punti percentuali).<br><br>Il partito <b>Centro</b> è la seconda formazione più forte con il 26,3 percento dei voti (+1,6 punti percentuali rispetto al 2019).<br><br>La terza posizione è occupata dal partito <b>PLR</b>. Ottiene una percentuale di elettori del il 12,5. (-0,9 punti percentuali di differenza rispetto al 2019).","tab_h$tr£$td£SVP$/td£tab_r156tab_r2#547d34tab_r3$td£$b£37.0%$/b£$/td£§+2.3$/td£$/tr£$tr£$td£Mitte$/td£tab_r139tab_r2#f39f5etab_r3$td£$b£26.3%$/b£$/td£§+1.6$/td£$/tr£$tr£$td£FDP$/td£tab_r119tab_r2#6268AFtab_r3$td£$b£12.5%$/b£$/td£§-0.9$/td£$/tr£$tr£$td£Grüne$/td£tab_r117tab_r2#26b300tab_r3$td£$b£11.0%$/b£$/td£§-3.9$/td£$/tr£$tr£$td£GLP$/td£tab_r18tab_r2#cbd401tab_r3$td£$b£5.3%$/b£$/td£§+0.0$/td£$/tr£$tr£$td£weitere$/td£tab_r17tab_r2#bebebetab_r3$td£$b£4.9%$/b£$/td£§+4.9$/td£$/tr£$/table£$br£Gültige Wahlzettel: $b£833$/b£$br£Wahlbeteiligung: $b£57.8%$/b£ (+3.3%)","tab_h_fr$tr£$td£UDC$/td£tab_r156tab_r2#547d34tab_r3$td£$b£37.0%$/b£$/td£§+2.3$/td£$/tr£$tr£$td£Centre$/td£tab_r139tab_r2#f39f5etab_r3$td£$b£26.3%$/b£$/td£§+1.6$/td£$/tr£$tr£$td£PLR$/td£tab_r119tab_r2#6268AFtab_r3$td£$b£12.5%$/b£$/td£§-0.9$/td£$/tr£$tr£$td£Vert-e-s$/td£tab_r117tab_r2#26b300tab_r3$td£$b£11.0%$/b£$/td£§-3.9$/td£$/tr£$tr£$td£PVL$/td£tab_r18tab_r2#cbd401tab_r3$td£$b£5.3%$/b£$/td£§+0.0$/td£$/tr£$tr£$td£Divers$/td£tab_r17tab_r2#bebebetab_r3$td£$b£4.9%$/b£$/td£§+4.9$/td£$/tr£$/table£$br£Bulletins de vote valables: $b£833$/b£$br£Taux de participation: $b£57.8%$/b£ (+3.3%)","tab_h_it$tr£$td£UDC$/td£tab_r156tab_r2#547d34tab_r3$td£$b£37.0%$/b£$/td£§+2.3$/td£$/tr£$tr£$td£Centro$/td£tab_r139tab_r2#f39f5etab_r3$td£$b£26.3%$/b£$/td£§+1.6$/td£$/tr£$tr£$td£PLR$/td£tab_r119tab_r2#6268AFtab_r3$td£$b£12.5%$/b£$/td£§-0.9$/td£$/tr£$tr£$td£Verdi$/td£tab_r117tab_r2#26b300tab_r3$td£$b£11.0%$/b£$/td£§-3.9$/td£$/tr£$tr£$td£PVL$/td£tab_r18tab_r2#cbd401tab_r3$td£$b£5.3%$/b£$/td£§+0.0$/td£$/tr£$tr£$td£altro$/td£tab_r17tab_r2#bebebetab_r3$td£$b£4.9%$/b£$/td£§+4.9$/td£$/tr£$/table£$br£Schede elettorali valide: $b£833$/b£$br£Tasso di partecipazione: $b£57.8%$/b£ (+3.3%)","SVP"
1706,"Oberägeri ZG","Oberägeri (ZG)","Oberägeri ZG","Die <b>SVP</b> erhöht ihren Stimmenanteil in Oberägeri um +7,1 Prozentpunkte deutlich. Die Partei wird damit zur stärksten politischen Kraft und holt am Ende 37,1 Prozent der Wählerstimmen.<br><br>Einen markanten Verlust muss die <b>Mitte</b> hinnehmen: Die Partei verliert -7,4 Prozentpunkte gegenüber den Wahlen 2019 und liegt jetzt noch bei 31,5 Prozent Wähleranteil. Das bedeutet dennoch Rang 2.<br><br>Mit einem Wähleranteil von 12,7 Prozent belegt die <b>FDP</b> den dritten Platz (Veränderung gegenüber 2019: +1,1 Prozentpunkte).","L'<b>UDC</b> réalise une forte progression (+7,1 points de pourcentage) La formation est désormais le parti le plus fort d'Oberägeri. Le parti obtient 37,1 %age des voix.<br><br>Malgré un recul de -7,4 points de pourcentage par rapport aux élections de 2019, le <b>Centre</b> occupe toujours la deuxième place. La formation engrange 31,5 % des voix.<br><br>Le <b><b>PL</b>R</b> arrive en troisième position avec 12,7 % des votes. Cela représente un changement de +1,1 points de pourcentage par rapport à 2019.","Il partito <b>UDC</b> aumenta significativamente la sua percentuale di voti a Oberägeri (+7,1 punti percentuali), diventando così la formazione più forte. Alla fine ottiene il 37,1 percento dei voti degli elettori.<br><br>Nonostante una diminuzione di -7,4 punti percentuali rispetto alle elezioni del 2019, il partito <b>Centro</b> mantiene sempre la seconda posizione. Raccoglie il 31,5 percento dei voti.<br><br>Il partito <b>PLR</b> completa il podio con il 12,7 percento dei voti (+1,1).","tab_h$tr£$td£SVP$/td£tab_r156tab_r2#547d34tab_r3$td£$b£37.1%$/b£$/td£§+7.1$/td£$/tr£$tr£$td£Mitte$/td£tab_r147tab_r2#f39f5etab_r3$td£$b£31.5%$/b£$/td£§-7.4$/td£$/tr£$tr£$td£FDP$/td£tab_r119tab_r2#6268AFtab_r3$td£$b£12.7%$/b£$/td£§+1.1$/td£$/tr£$tr£$td£Grüne$/td£tab_r114tab_r2#26b300tab_r3$td£$b£9.6%$/b£$/td£§-1.5$/td£$/tr£$tr£$td£GLP$/td£tab_r15tab_r2#cbd401tab_r3$td£$b£3.4%$/b£$/td£§+0.3$/td£$/tr£$/table£$br£Gültige Wahlzettel: $b£2'226$/b£$br£Wahlbeteiligung: $b£59.2%$/b£ (+1.7%)","tab_h_fr$tr£$td£UDC$/td£tab_r156tab_r2#547d34tab_r3$td£$b£37.1%$/b£$/td£§+7.1$/td£$/tr£$tr£$td£Centre$/td£tab_r147tab_r2#f39f5etab_r3$td£$b£31.5%$/b£$/td£§-7.4$/td£$/tr£$tr£$td£PLR$/td£tab_r119tab_r2#6268AFtab_r3$td£$b£12.7%$/b£$/td£§+1.1$/td£$/tr£$tr£$td£Vert-e-s$/td£tab_r114tab_r2#26b300tab_r3$td£$b£9.6%$/b£$/td£§-1.5$/td£$/tr£$tr£$td£PVL$/td£tab_r15tab_r2#cbd401tab_r3$td£$b£3.4%$/b£$/td£§+0.3$/td£$/tr£$/table£$br£Bulletins de vote valables: $b£2'226$/b£$br£Taux de participation: $b£59.2%$/b£ (+1.7%)","tab_h_it$tr£$td£UDC$/td£tab_r156tab_r2#547d34tab_r3$td£$b£37.1%$/b£$/td£§+7.1$/td£$/tr£$tr£$td£Centro$/td£tab_r147tab_r2#f39f5etab_r3$td£$b£31.5%$/b£$/td£§-7.4$/td£$/tr£$tr£$td£PLR$/td£tab_r119tab_r2#6268AFtab_r3$td£$b£12.7%$/b£$/td£§+1.1$/td£$/tr£$tr£$td£Verdi$/td£tab_r114tab_r2#26b300tab_r3$td£$b£9.6%$/b£$/td£§-1.5$/td£$/tr£$tr£$td£PVL$/td£tab_r15tab_r2#cbd401tab_r3$td£$b£3.4%$/b£$/td£§+0.3$/td£$/tr£$/table£$br£Schede elettorali valide: $b£2'226$/b£$br£Tasso di partecipazione: $b£59.2%$/b£ (+1.7%)","SVP"
1707,"Risch ZG","Risch (ZG)","Risch ZG","Resultat liegt noch nicht vor.","Résultats non encore disponibles.","Risultato non ancora disponibile.","Resultat liegt noch nicht vor.","Résultats non encore disponibles.","Risultato non ancora disponibile.","no_data"
1708,"Steinhausen ZG","Steinhausen (ZG)","Steinhausen ZG","Resultat liegt noch nicht vor.","Résultats non encore disponibles.","Risultato non ancora disponibile.","Resultat liegt noch nicht vor.","Résultats non encore disponibles.","Risultato non ancora disponibile.","no_data"
1709,"Unterägeri ZG","Unterägeri (ZG)","Unterägeri ZG","Resultat liegt noch nicht vor.","Résultats non encore disponibles.","Risultato non ancora disponibile.","Resultat liegt noch nicht vor.","Résultats non encore disponibles.","Risultato non ancora disponibile.","no_data"
1710,"Walchwil ZG","Walchwil (ZG)","Walchwil ZG","Die <b>Mitte</b> erhöht ihren Stimmenanteil in Walchwil um +10,9 Prozentpunkte deutlich. Die Partei wird damit zur stärksten politischen Kraft und holt am Ende 35,7 Prozent der Wählerstimmen.<br><br>Zweitstärkste Partei ist die <b>SVP</b> mit 33,3 Prozent (-1,9 Prozentpunkte gegenüber 2019).<br><br>Den dritten Platz belegt die <b>FDP</b>. Die Partei erzielt einen Wähleranteil von 11,3 Prozent (Veränderung gegenüber 2019: -3,3 Prozentpunkte).","Le <b>Centre</b> réalise un bond un avant (+10,9 points de pourcentage). Le voilà le parti le plus fort de Walchwil, avec 35,7 % des voix.<br><br>L'<b>UDC</b> arrive en deuxième position.La formation obtient un pourcentage de voix de 33,3 (-1,9 points de pourcentage).<br><br>Le <b><b>PL</b>R</b> arrive en troisième position avec 11,3 % des votes. Cela représente un changement de -3,3 points de pourcentage par rapport à 2019.","Il partito <b>Centro</b> realizza una forte progressione (+10,9 punti percentuali). Ora è il partito più forte di Walchwil, ottenendo il 35,7 percento dei voti.<br><br>Il secondo rango è occupato dal partito <b>UDC</b> che ottiene il 33,3 percento dei voti (-1,9 punti percentuali rispetto al 2019).<br><br>La terza posizione è occupata dal partito <b>PLR</b> che ottiene il 11,3 percento dei voti (-3,3 punti percentuali rispetto al 2019).","tab_h$tr£$td£Mitte$/td£tab_r154tab_r2#f39f5etab_r3$td£$b£35.7%$/b£$/td£§+10.9$/td£$/tr£$tr£$td£SVP$/td£tab_r150tab_r2#547d34tab_r3$td£$b£33.3%$/b£$/td£§-1.9$/td£$/tr£$tr£$td£FDP$/td£tab_r117tab_r2#6268AFtab_r3$td£$b£11.3%$/b£$/td£§-3.3$/td£$/tr£$tr£$td£Grüne$/td£tab_r115tab_r2#26b300tab_r3$td£$b£9.9%$/b£$/td£§-0.4$/td£$/tr£$tr£$td£GLP$/td£tab_r15tab_r2#cbd401tab_r3$td£$b£3.5%$/b£$/td£§-1.8$/td£$/tr£$tr£$td£SP$/td£tab_r15tab_r2#ea546ftab_r3$td£$b£3.4%$/b£$/td£§-6.0$/td£$/tr£$/table£$br£Gültige Wahlzettel: $b£1'329$/b£$br£Wahlbeteiligung: $b£61.9%$/b£ (+1.8%)","tab_h_fr$tr£$td£Centre$/td£tab_r154tab_r2#f39f5etab_r3$td£$b£35.7%$/b£$/td£§+10.9$/td£$/tr£$tr£$td£UDC$/td£tab_r150tab_r2#547d34tab_r3$td£$b£33.3%$/b£$/td£§-1.9$/td£$/tr£$tr£$td£PLR$/td£tab_r117tab_r2#6268AFtab_r3$td£$b£11.3%$/b£$/td£§-3.3$/td£$/tr£$tr£$td£Vert-e-s$/td£tab_r115tab_r2#26b300tab_r3$td£$b£9.9%$/b£$/td£§-0.4$/td£$/tr£$tr£$td£PVL$/td£tab_r15tab_r2#cbd401tab_r3$td£$b£3.5%$/b£$/td£§-1.8$/td£$/tr£$tr£$td£PS$/td£tab_r15tab_r2#ea546ftab_r3$td£$b£3.4%$/b£$/td£§-6.0$/td£$/tr£$/table£$br£Bulletins de vote valables: $b£1'329$/b£$br£Taux de participation: $b£61.9%$/b£ (+1.8%)","tab_h_it$tr£$td£Centro$/td£tab_r154tab_r2#f39f5etab_r3$td£$b£35.7%$/b£$/td£§+10.9$/td£$/tr£$tr£$td£UDC$/td£tab_r150tab_r2#547d34tab_r3$td£$b£33.3%$/b£$/td£§-1.9$/td£$/tr£$tr£$td£PLR$/td£tab_r117tab_r2#6268AFtab_r3$td£$b£11.3%$/b£$/td£§-3.3$/td£$/tr£$tr£$td£Verdi$/td£tab_r115tab_r2#26b300tab_r3$td£$b£9.9%$/b£$/td£§-0.4$/td£$/tr£$tr£$td£PVL$/td£tab_r15tab_r2#cbd401tab_r3$td£$b£3.5%$/b£$/td£§-1.8$/td£$/tr£$tr£$td£PS$/td£tab_r15tab_r2#ea546ftab_r3$td£$b£3.4%$/b£$/td£§-6.0$/td£$/tr£$/table£$br£Schede elettorali valide: $b£1'329$/b£$br£Tasso di partecipazione: $b£61.9%$/b£ (+1.8%)","Mitte"
1711,"Zug ZG","Zoug (ZG)","Zugo ZG","Die <b>SVP</b> kann sich in diesem Jahr von Rang zwei auf den Spitzenplatz in Zug verbessern. Die Partei holt 25 Prozent der Stimmen (+4,3 Prozentpunkte).<br><br>Mit einem Wählerstimmenanteil von 20,5 Prozent (+2 Prozentpunkte) ist die <b>Mitte</b> die zweitstärkste Kraft in der Gemeinde.<br><br>Den dritten Platz belegen die <b>Grünen</b>. Die Partei erzielt einen Wähleranteil von 19,6 Prozent (Veränderung gegenüber 2019: -3,9 Prozentpunkte).","L'<b>UDC</b> progresse. La formation passe du rang numero deux à la première place à Zoug. Le parti remporte 25 pourcent des voix (+4,3 points de pourcentage).<br><br>Le <b>Centre</b> arrive en deuxième position.La formation obtient un pourcentage de voix de 20,5 (+2 points de pourcentage).<br><br>A la troisième place figurent les <b>Vert-e-s</b>, qui réalisent 19,6 % des voix (-3,9).","Il partito <b>UDC</b> si posiziona al primo posto a Zugo. Era al due esimo esimo posto nel 2019. Quest'anno ottiene il 25 percento dei voti.<br><br>Il secondo rango è occupato dal partito <b>Centro</b> che ottiene il 20,5 percento dei voti (+2 punti percentuali rispetto al 2019).<br><br>La terza posizione è occupata dal partito <b>Verdi</b>. Ottiene una percentuale di elettori del il 19,6. (-3,9 punti percentuali di differenza rispetto al 2019).","tab_h$tr£$td£SVP$/td£tab_r137tab_r2#547d34tab_r3$td£$b£25.0%$/b£$/td£§+4.3$/td£$/tr£$tr£$td£Mitte$/td£tab_r131tab_r2#f39f5etab_r3$td£$b£20.5%$/b£$/td£§+2.0$/td£$/tr£$tr£$td£Grüne$/td£tab_r129tab_r2#26b300tab_r3$td£$b£19.6%$/b£$/td£§-3.9$/td£$/tr£$tr£$td£FDP$/td£tab_r123tab_r2#6268AFtab_r3$td£$b£15.2%$/b£$/td£§-3.1$/td£$/tr£$tr£$td£SP$/td£tab_r111tab_r2#ea546ftab_r3$td£$b£7.2%$/b£$/td£§-5.5$/td£$/tr£$tr£$td£GLP$/td£tab_r111tab_r2#cbd401tab_r3$td£$b£7.1%$/b£$/td£§+1.4$/td£$/tr£$tr£$td£weitere$/td£tab_r17tab_r2#bebebetab_r3$td£$b£4.9%$/b£$/td£§+4.9$/td£$/tr£$/table£$br£Gültige Wahlzettel: $b£9'207$/b£$br£Wahlbeteiligung: $b£53.2%$/b£ (-1.3%)","tab_h_fr$tr£$td£UDC$/td£tab_r137tab_r2#547d34tab_r3$td£$b£25.0%$/b£$/td£§+4.3$/td£$/tr£$tr£$td£Centre$/td£tab_r131tab_r2#f39f5etab_r3$td£$b£20.5%$/b£$/td£§+2.0$/td£$/tr£$tr£$td£Vert-e-s$/td£tab_r129tab_r2#26b300tab_r3$td£$b£19.6%$/b£$/td£§-3.9$/td£$/tr£$tr£$td£PLR$/td£tab_r123tab_r2#6268AFtab_r3$td£$b£15.2%$/b£$/td£§-3.1$/td£$/tr£$tr£$td£PS$/td£tab_r111tab_r2#ea546ftab_r3$td£$b£7.2%$/b£$/td£§-5.5$/td£$/tr£$tr£$td£PVL$/td£tab_r111tab_r2#cbd401tab_r3$td£$b£7.1%$/b£$/td£§+1.4$/td£$/tr£$tr£$td£Divers$/td£tab_r17tab_r2#bebebetab_r3$td£$b£4.9%$/b£$/td£§+4.9$/td£$/tr£$/table£$br£Bulletins de vote valables: $b£9'207$/b£$br£Taux de participation: $b£53.2%$/b£ (-1.3%)","tab_h_it$tr£$td£UDC$/td£tab_r137tab_r2#547d34tab_r3$td£$b£25.0%$/b£$/td£§+4.3$/td£$/tr£$tr£$td£Centro$/td£tab_r131tab_r2#f39f5etab_r3$td£$b£20.5%$/b£$/td£§+2.0$/td£$/tr£$tr£$td£Verdi$/td£tab_r129tab_r2#26b300tab_r3$td£$b£19.6%$/b£$/td£§-3.9$/td£$/tr£$tr£$td£PLR$/td£tab_r123tab_r2#6268AFtab_r3$td£$b£15.2%$/b£$/td£§-3.1$/td£$/tr£$tr£$td£PS$/td£tab_r111tab_r2#ea546ftab_r3$td£$b£7.2%$/b£$/td£§-5.5$/td£$/tr£$tr£$td£PVL$/td£tab_r111tab_r2#cbd401tab_r3$td£$b£7.1%$/b£$/td£§+1.4$/td£$/tr£$tr£$td£altro$/td£tab_r17tab_r2#bebebetab_r3$td£$b£4.9%$/b£$/td£§+4.9$/td£$/tr£$/table£$br£Schede elettorali valide: $b£9'207$/b£$br£Tasso di partecipazione: $b£53.2%$/b£ (-1.3%)","SVP"
