"ID","Gemeinde_de","Gemeinde_fr","Gemeinde_it","Text_de","Text_fr","Text_it","Tabelle_de","Tabelle_fr","Tabelle_it","Staerkste_Partei"
5654,"Vullierens VD","Vullierens (VD)","Vullierens VD","Die <b>SVP</b> ist weiterhin die stärkste Kraft in Vullierens. Mit 26,4 Prozent Wähleranteil verweist die Partei die <b>FDP</b> allerdings nur mit 2,9 Prozentpunkten Abstand auf den zweiten Platz. Die zweitstärkste Partei holt 23,5 Prozent. Die Veränderungen gegenüber 2019: <b>SVP</b>: -2 Prozentpunkte; <b>FDP</b>: +1,1 Prozentpunkte.<br><br>Auf dem dritten Platz landet die <b>SP</b> mit 18,6 Prozent der Stimmen. Das bedeutet eine Veränderung von -4,3 Prozentpunkten gegenüber 2019. ","Avec 26,4 % des voix (-2 points de pourcentage), l'<b>UDC</b> est toujours le parti le plus fort à Vullierens. Le <b><b>PL</b>R</b>, qui réalise 23,5 % des suffrages (+1,1 points de pourcentage), est cependant en embuscade. L'écart entre les deux formations politiques est de 2,9 points.<br><br>Le <b>PS</b> arrive en troisième position avec 18,6 % des votes. Cela représente un changement de -4,3 points de pourcentage par rapport à 2019.","Con il 26,4 percento dei voti (-2 punti percentuali), il partito <b>UDC</b> rimane in testa a Vullierens. Tuttavia, il partito <b>PLR</b>, che ottiene il 23,5 percento dei voti (+1,1 punti percentuali), è in agguato. La differenza tra i due partiti è di 2,9 punti.<br><br>Al terzo posto troviamo il partito <b>PS</b> con il 18,6 percento dei voti (-4,3).","tab_h$tr£$td£SVP$/td£tab_r140tab_r2#547d34tab_r3$td£$b£26.4%$/b£$/td£§-2.0$/td£$/tr£$tr£$td£FDP$/td£tab_r135tab_r2#6268AFtab_r3$td£$b£23.5%$/b£$/td£§+1.1$/td£$/tr£$tr£$td£SP$/td£tab_r128tab_r2#ea546ftab_r3$td£$b£18.6%$/b£$/td£§-4.3$/td£$/tr£$tr£$td£Grüne$/td£tab_r121tab_r2#26b300tab_r3$td£$b£14.3%$/b£$/td£§+7.0$/td£$/tr£$tr£$td£GLP$/td£tab_r117tab_r2#cbd401tab_r3$td£$b£11.2%$/b£$/td£§+3.9$/td£$/tr£$/table£$br£Gültige Wahlzettel: $b£171$/b£$br£Wahlbeteiligung: $b£51.5%$/b£ (-4.9%)","tab_h_fr$tr£$td£UDC$/td£tab_r140tab_r2#547d34tab_r3$td£$b£26.4%$/b£$/td£§-2.0$/td£$/tr£$tr£$td£PLR$/td£tab_r135tab_r2#6268AFtab_r3$td£$b£23.5%$/b£$/td£§+1.1$/td£$/tr£$tr£$td£PS$/td£tab_r128tab_r2#ea546ftab_r3$td£$b£18.6%$/b£$/td£§-4.3$/td£$/tr£$tr£$td£Vert-e-s$/td£tab_r121tab_r2#26b300tab_r3$td£$b£14.3%$/b£$/td£§+7.0$/td£$/tr£$tr£$td£PVL$/td£tab_r117tab_r2#cbd401tab_r3$td£$b£11.2%$/b£$/td£§+3.9$/td£$/tr£$/table£$br£Bulletins de vote valables: $b£171$/b£$br£Taux de participation: $b£51.5%$/b£ (-4.9%)","tab_h_it$tr£$td£UDC$/td£tab_r140tab_r2#547d34tab_r3$td£$b£26.4%$/b£$/td£§-2.0$/td£$/tr£$tr£$td£PLR$/td£tab_r135tab_r2#6268AFtab_r3$td£$b£23.5%$/b£$/td£§+1.1$/td£$/tr£$tr£$td£PS$/td£tab_r128tab_r2#ea546ftab_r3$td£$b£18.6%$/b£$/td£§-4.3$/td£$/tr£$tr£$td£Verdi$/td£tab_r121tab_r2#26b300tab_r3$td£$b£14.3%$/b£$/td£§+7.0$/td£$/tr£$tr£$td£PVL$/td£tab_r117tab_r2#cbd401tab_r3$td£$b£11.2%$/b£$/td£§+3.9$/td£$/tr£$/table£$br£Schede elettorali valide: $b£171$/b£$br£Tasso di partecipazione: $b£51.5%$/b£ (-4.9%)","SVP"
5655,"Yens VD","Yens (VD)","Yens VD","Unverändert ist die <b>FDP</b> die stärkste Partei in Yens mit 31,8 Prozent (-6,5 Prozentpunkte).<br><br>Mit einer markanten Verbesserung um +9,1 Prozentpunkte sind die <b>Grünen</b> die zweitstärkste Kraft in der Gemeinde. Der Wählerstimmenanteil der Partei liegt neu bei 18,3 Prozent.<br><br>Mit einem Wähleranteil von 17,6 Prozent belegt die <b>SVP</b> den dritten Platz (Veränderung gegenüber 2019: -3,9 Prozentpunkte).","Les électeurs de Yens n'ont pas retourné leur veste depuis 2019. Le parti le plus fort dans leur commune reste le <b><b>PL</b>R</b>, avec 31,8 % des suffrages (-6,5 points de pourcentage).<br><br>Les <b>Vert-e-s</b> progressent fortement: le parti améliore son résultat d'il y a quatre ans de +9,1 points de pourcentage et occupe désormais la deuxième place dans la commune. La proportion de voix du parti s'élève désormais à 18,3 %.<br><br>L'<b>UDC</b> se classe troisième. La formation obtient 17,6 % des voix (-3,9 points de pourcentage par rapport à 2019).","Il partito <b>PLR</b> mantiene la sua posizione come principale forza politica nel comune di Yens, ottenendo il 31,8 percento dei voti (-6,5 punti percentuali).<br><br>Il partito <b>Verdi</b> progredisce notevolmente: ha migliorato il suo risultato di quattro anni fa di +9,1 punti percentuali ed è ora al secondo posto nel comune. La proporzione di voti del partito è ora del 18,3 percento.<br><br>La terza posizione è occupata dal partito <b>UDC</b>. Ottiene una percentuale di elettori del il 17,6. (-3,9 punti percentuali di differenza rispetto al 2019).","tab_h$tr£$td£FDP$/td£tab_r148tab_r2#6268AFtab_r3$td£$b£31.8%$/b£$/td£§-6.5$/td£$/tr£$tr£$td£Grüne$/td£tab_r127tab_r2#26b300tab_r3$td£$b£18.3%$/b£$/td£§+9.1$/td£$/tr£$tr£$td£SVP$/td£tab_r126tab_r2#547d34tab_r3$td£$b£17.6%$/b£$/td£§-3.9$/td£$/tr£$tr£$td£SP$/td£tab_r121tab_r2#ea546ftab_r3$td£$b£14.0%$/b£$/td£§-1.6$/td£$/tr£$tr£$td£GLP$/td£tab_r117tab_r2#cbd401tab_r3$td£$b£11.5%$/b£$/td£§+6.5$/td£$/tr£$/table£$br£Gültige Wahlzettel: $b£436$/b£$br£Wahlbeteiligung: $b£51.5%$/b£ (-2.5%)","tab_h_fr$tr£$td£PLR$/td£tab_r148tab_r2#6268AFtab_r3$td£$b£31.8%$/b£$/td£§-6.5$/td£$/tr£$tr£$td£Vert-e-s$/td£tab_r127tab_r2#26b300tab_r3$td£$b£18.3%$/b£$/td£§+9.1$/td£$/tr£$tr£$td£UDC$/td£tab_r126tab_r2#547d34tab_r3$td£$b£17.6%$/b£$/td£§-3.9$/td£$/tr£$tr£$td£PS$/td£tab_r121tab_r2#ea546ftab_r3$td£$b£14.0%$/b£$/td£§-1.6$/td£$/tr£$tr£$td£PVL$/td£tab_r117tab_r2#cbd401tab_r3$td£$b£11.5%$/b£$/td£§+6.5$/td£$/tr£$/table£$br£Bulletins de vote valables: $b£436$/b£$br£Taux de participation: $b£51.5%$/b£ (-2.5%)","tab_h_it$tr£$td£PLR$/td£tab_r148tab_r2#6268AFtab_r3$td£$b£31.8%$/b£$/td£§-6.5$/td£$/tr£$tr£$td£Verdi$/td£tab_r127tab_r2#26b300tab_r3$td£$b£18.3%$/b£$/td£§+9.1$/td£$/tr£$tr£$td£UDC$/td£tab_r126tab_r2#547d34tab_r3$td£$b£17.6%$/b£$/td£§-3.9$/td£$/tr£$tr£$td£PS$/td£tab_r121tab_r2#ea546ftab_r3$td£$b£14.0%$/b£$/td£§-1.6$/td£$/tr£$tr£$td£PVL$/td£tab_r117tab_r2#cbd401tab_r3$td£$b£11.5%$/b£$/td£§+6.5$/td£$/tr£$/table£$br£Schede elettorali valide: $b£436$/b£$br£Tasso di partecipazione: $b£51.5%$/b£ (-2.5%)","FDP"
5661,"Boulens VD","Boulens (VD)","Boulens VD","Mit einem grossen Sprung von +11,8 Prozentpunkten sind die <b>Grünen</b> neu die stärkste Partei in Boulens. Die Partei erhält 26,5 Prozent der Wählerstimmen.<br><br>Zweitstärkste Partei ist die <b>FDP</b> mit 21,6 Prozent (-2 Prozentpunkte gegenüber 2019).<br><br>Die <b>SVP</b> verliert -6 Prozentpunkte und damit so viele Stimmen, dass sie mit einem Wähleranteil von 21 Prozent nur noch auf dem dritten Platz landet.","Les <b>Vert-e-s</b> réalisent un bond un avant (+11,8 points de pourcentage). Le voilà le parti le plus fort de Boulens, avec 26,5 %age des voix.<br><br>Le <b><b>PL</b>R</b> est le deuxième parti le plus fort avec 21,6 % des voix (-2 points de pourcentage par rapport à 2019).<br><br>L'<b>UDC</b> perd -6 points de pourcentage. La formation n'arrive plus qu'en troisième position avec 21 % des voix.","Il partito <b>Verdi</b> aumenta significativamente la sua percentuale di voti a Boulens (+11,8 punti percentuali), diventando così la formazione più forte. Alla fine ottiene il 26,5 percento dei voti degli elettori.<br><br>Il secondo rango è occupato dal partito <b>PLR</b> che ottiene il 21,6 percento dei voti (-2 punti percentuali rispetto al 2019).<br><br>Il partito <b>UDC</b> perde -6 punti percentuali e si classifica ora al terzo posto con il 21 percento dei voti.","tab_h$tr£$td£Grüne$/td£tab_r140tab_r2#26b300tab_r3$td£$b£26.5%$/b£$/td£§+11.8$/td£$/tr£$tr£$td£FDP$/td£tab_r132tab_r2#6268AFtab_r3$td£$b£21.6%$/b£$/td£§-2.0$/td£$/tr£$tr£$td£SVP$/td£tab_r131tab_r2#547d34tab_r3$td£$b£21.0%$/b£$/td£§-6.0$/td£$/tr£$tr£$td£SP$/td£tab_r118tab_r2#ea546ftab_r3$td£$b£12.1%$/b£$/td£§-4.3$/td£$/tr£$tr£$td£GLP$/td£tab_r112tab_r2#cbd401tab_r3$td£$b£7.9%$/b£$/td£§-1.1$/td£$/tr£$tr£$td£PdA$/td£tab_r17tab_r2#792a8ftab_r3$td£$b£4.7%$/b£$/td£§+2.8$/td£$/tr£$/table£$br£Gültige Wahlzettel: $b£118$/b£$br£Wahlbeteiligung: $b£47.0%$/b£ (+1.6%)","tab_h_fr$tr£$td£Vert-e-s$/td£tab_r140tab_r2#26b300tab_r3$td£$b£26.5%$/b£$/td£§+11.8$/td£$/tr£$tr£$td£PLR$/td£tab_r132tab_r2#6268AFtab_r3$td£$b£21.6%$/b£$/td£§-2.0$/td£$/tr£$tr£$td£UDC$/td£tab_r131tab_r2#547d34tab_r3$td£$b£21.0%$/b£$/td£§-6.0$/td£$/tr£$tr£$td£PS$/td£tab_r118tab_r2#ea546ftab_r3$td£$b£12.1%$/b£$/td£§-4.3$/td£$/tr£$tr£$td£PVL$/td£tab_r112tab_r2#cbd401tab_r3$td£$b£7.9%$/b£$/td£§-1.1$/td£$/tr£$tr£$td£PST-POP$/td£tab_r17tab_r2#792a8ftab_r3$td£$b£4.7%$/b£$/td£§+2.8$/td£$/tr£$/table£$br£Bulletins de vote valables: $b£118$/b£$br£Taux de participation: $b£47.0%$/b£ (+1.6%)","tab_h_it$tr£$td£Verdi$/td£tab_r140tab_r2#26b300tab_r3$td£$b£26.5%$/b£$/td£§+11.8$/td£$/tr£$tr£$td£PLR$/td£tab_r132tab_r2#6268AFtab_r3$td£$b£21.6%$/b£$/td£§-2.0$/td£$/tr£$tr£$td£UDC$/td£tab_r131tab_r2#547d34tab_r3$td£$b£21.0%$/b£$/td£§-6.0$/td£$/tr£$tr£$td£PS$/td£tab_r118tab_r2#ea546ftab_r3$td£$b£12.1%$/b£$/td£§-4.3$/td£$/tr£$tr£$td£PVL$/td£tab_r112tab_r2#cbd401tab_r3$td£$b£7.9%$/b£$/td£§-1.1$/td£$/tr£$tr£$td£POP$/td£tab_r17tab_r2#792a8ftab_r3$td£$b£4.7%$/b£$/td£§+2.8$/td£$/tr£$/table£$br£Schede elettorali valide: $b£118$/b£$br£Tasso di partecipazione: $b£47.0%$/b£ (+1.6%)","Grüne"
5663,"Bussy-sur-Moudon VD","Bussy-sur-Moudon (VD)","Bussy-sur-Moudon VD","Die <b>SVP</b> erhöht ihren Stimmenanteil in Bussy-sur-Moudon um +6,2 Prozentpunkte deutlich und wird damit zur stärksten politischen Kraft. Am Ende holt die Partei 30,7 Prozent der Wählerstimmen.<br><br>Auf dem zweiten Platz in der Gemeinde liegt die <b>FDP</b>. Die Partei erreicht einen Wählerstimmenanteil von 20,7 Prozent (-5 Prozentpunkte).<br><br>Mit einem deutlichen Anstieg von +7,9 Prozentpunkten gegenüber den letzten Wahlen können sich die <b>Grünen</b> ihren Platz als drittgrösste Partei in der Gemeinde sichern. Der Wähleranteil liegt nun bei 20,6 Prozent.","L'<b>UDC</b> réalise un bond un avant (+6,2 points de pourcentage). Le voilà le parti le plus fort de Bussy-sur-Moudon, avec 30,7 %age des voix.<br><br>Le deuxième rang est occupé par le <b><b>PL</b>R</b> qui réalise 20,7 % des voix (-5 points de pourcentage par rapport à 2019).<br><br>Une forte progression de +7,9 points de pourcentage par rapport aux dernières élections fédérales permet aux <b>Vert-e-s</b> de grimper à la troisième place dans la commune. Son pourcentage d'électeurs est désormais de 20,6 %.","Il partito <b>UDC</b> aumenta significativamente la sua percentuale di voti a Bussy-sur-Moudon (+6,2 punti percentuali), diventando così la formazione più forte. Alla fine ottiene il 30,7 percento dei voti degli elettori.<br><br>Il partito <b>PLR</b> si classifica al secondo posto. Ottiene il 20,7 percento dei voti (-5 punti percentuali) nel comune.<br><br>Il partito <b>Verdi</b> ha fatto notevoli progressi, diventando la terza forza elettorale del comune e ottenendo il 20,6 percento dei voti, un aumento di +7,9 punti percentuali rispetto al 2019.","tab_h$tr£$td£SVP$/td£tab_r146tab_r2#547d34tab_r3$td£$b£30.7%$/b£$/td£§+6.2$/td£$/tr£$tr£$td£FDP$/td£tab_r131tab_r2#6268AFtab_r3$td£$b£20.7%$/b£$/td£§-5.0$/td£$/tr£$tr£$td£Grüne$/td£tab_r131tab_r2#26b300tab_r3$td£$b£20.6%$/b£$/td£§+7.9$/td£$/tr£$tr£$td£SP$/td£tab_r127tab_r2#ea546ftab_r3$td£$b£18.1%$/b£$/td£§+0.0$/td£$/tr£$tr£$td£GLP$/td£tab_r19tab_r2#cbd401tab_r3$td£$b£5.7%$/b£$/td£§+5.4$/td£$/tr£$/table£$br£Gültige Wahlzettel: $b£67$/b£$br£Wahlbeteiligung: $b£44.2%$/b£ (+3.7%)","tab_h_fr$tr£$td£UDC$/td£tab_r146tab_r2#547d34tab_r3$td£$b£30.7%$/b£$/td£§+6.2$/td£$/tr£$tr£$td£PLR$/td£tab_r131tab_r2#6268AFtab_r3$td£$b£20.7%$/b£$/td£§-5.0$/td£$/tr£$tr£$td£Vert-e-s$/td£tab_r131tab_r2#26b300tab_r3$td£$b£20.6%$/b£$/td£§+7.9$/td£$/tr£$tr£$td£PS$/td£tab_r127tab_r2#ea546ftab_r3$td£$b£18.1%$/b£$/td£§+0.0$/td£$/tr£$tr£$td£PVL$/td£tab_r19tab_r2#cbd401tab_r3$td£$b£5.7%$/b£$/td£§+5.4$/td£$/tr£$/table£$br£Bulletins de vote valables: $b£67$/b£$br£Taux de participation: $b£44.2%$/b£ (+3.7%)","tab_h_it$tr£$td£UDC$/td£tab_r146tab_r2#547d34tab_r3$td£$b£30.7%$/b£$/td£§+6.2$/td£$/tr£$tr£$td£PLR$/td£tab_r131tab_r2#6268AFtab_r3$td£$b£20.7%$/b£$/td£§-5.0$/td£$/tr£$tr£$td£Verdi$/td£tab_r131tab_r2#26b300tab_r3$td£$b£20.6%$/b£$/td£§+7.9$/td£$/tr£$tr£$td£PS$/td£tab_r127tab_r2#ea546ftab_r3$td£$b£18.1%$/b£$/td£§+0.0$/td£$/tr£$tr£$td£PVL$/td£tab_r19tab_r2#cbd401tab_r3$td£$b£5.7%$/b£$/td£§+5.4$/td£$/tr£$/table£$br£Schede elettorali valide: $b£67$/b£$br£Tasso di partecipazione: $b£44.2%$/b£ (+3.7%)","SVP"
5665,"Chavannes-sur-Moudon VD","Chavannes-sur-Moudon (VD)","Chavannes-sur-Moudon VD","In Chavannes-sur-Moudon behält die <b>SVP</b> ihren Status als stärkste politische Kraft. Die Partei sichert sich einen Wähleranteil von 43,8 Prozent (-0,5 Prozentpunkte).<br><br>Auf dem zweiten Platz in der Gemeinde liegt die <b>FDP</b>. Die Partei erreicht einen Wählerstimmenanteil von 29,4 Prozent (-0,7 Prozentpunkte).<br><br>Der dritte Platz geht an die <b>Grünen</b>. Die Partei erreicht 10,3 Prozent der Stimmen (Veränderung von +1,2 Prozentpunkten gegenüber 2019).","Aucune formation politique ne parvient à prendre la place de numéro un au <b>UDC</b> à Chavannes-sur-Moudon. Le parti obtient 43,8 % des suffrages (-0,5 points de pourcentage).<br><br>Le <b><b>PL</b>R</b> arrive en deuxième position dans la commune avec un pourcentage de votants de 29,4 (-0,7 points de pourcentage).<br><br>Les <b>Vert-e-s</b> se classent troisième. La formation obtient 10,3 % des voix (+1,2 points de pourcentage par rapport à 2019).","Il partito <b>UDC</b> mantiene il primo posto a Chavannes-sur-Moudon e ottiene il 43,8 percento dei voti (-0,5 punti percentuali).<br><br>Il secondo rango è occupato dal partito <b>PLR</b> che ottiene il 29,4 percento dei voti (-0,7 punti percentuali rispetto al 2019).<br><br>La terza posizione è occupata dal partito <b>Verdi</b>. Ottiene una percentuale di elettori del il 10,3. (+1,2 punti percentuali di differenza rispetto al 2019).","tab_h$tr£$td£SVP$/td£tab_r166tab_r2#547d34tab_r3$td£$b£43.8%$/b£$/td£§-0.5$/td£$/tr£$tr£$td£FDP$/td£tab_r144tab_r2#6268AFtab_r3$td£$b£29.4%$/b£$/td£§-0.7$/td£$/tr£$tr£$td£Grüne$/td£tab_r115tab_r2#26b300tab_r3$td£$b£10.3%$/b£$/td£§+1.2$/td£$/tr£$tr£$td£SP$/td£tab_r114tab_r2#ea546ftab_r3$td£$b£9.0%$/b£$/td£§-1.2$/td£$/tr£$/table£$br£Gültige Wahlzettel: $b£87$/b£$br£Wahlbeteiligung: $b£55.0%$/b£ (+2.0%)","tab_h_fr$tr£$td£UDC$/td£tab_r166tab_r2#547d34tab_r3$td£$b£43.8%$/b£$/td£§-0.5$/td£$/tr£$tr£$td£PLR$/td£tab_r144tab_r2#6268AFtab_r3$td£$b£29.4%$/b£$/td£§-0.7$/td£$/tr£$tr£$td£Vert-e-s$/td£tab_r115tab_r2#26b300tab_r3$td£$b£10.3%$/b£$/td£§+1.2$/td£$/tr£$tr£$td£PS$/td£tab_r114tab_r2#ea546ftab_r3$td£$b£9.0%$/b£$/td£§-1.2$/td£$/tr£$/table£$br£Bulletins de vote valables: $b£87$/b£$br£Taux de participation: $b£55.0%$/b£ (+2.0%)","tab_h_it$tr£$td£UDC$/td£tab_r166tab_r2#547d34tab_r3$td£$b£43.8%$/b£$/td£§-0.5$/td£$/tr£$tr£$td£PLR$/td£tab_r144tab_r2#6268AFtab_r3$td£$b£29.4%$/b£$/td£§-0.7$/td£$/tr£$tr£$td£Verdi$/td£tab_r115tab_r2#26b300tab_r3$td£$b£10.3%$/b£$/td£§+1.2$/td£$/tr£$tr£$td£PS$/td£tab_r114tab_r2#ea546ftab_r3$td£$b£9.0%$/b£$/td£§-1.2$/td£$/tr£$/table£$br£Schede elettorali valide: $b£87$/b£$br£Tasso di partecipazione: $b£55.0%$/b£ (+2.0%)","SVP"
5669,"Curtilles VD","Curtilles (VD)","Curtilles VD","Ganz knapp bleibt die <b>SVP</b> die grösste Partei in Curtilles. Die Partei holt 26,2 Prozent der Stimmen und hält damit ihren Vorsprung, mit 1,1 Prozentpunkten, vor den <b>Grünen</b>. Diese müssen sich mit 25 Prozent und Platz zwei begnügen. Die Veränderungen gegenüber 2019: <b>SVP</b>: -2,9 Prozentpunkte; Grüne: +16,1 Prozentpunkte.<br><br>Die <b>FDP</b> landet mit 23 Prozent auf dem dritten Platz (Veränderung gegenüber 2019: -4,1 Prozentpunkte).","Avec 26,2 % des voix (-2,9 points de pourcentage), l'<b>UDC</b> est toujours le parti le plus fort à Curtilles. Les <b>Vert-e-s</b>, qui réalisent 25 % des suffrages (+16,1 points de pourcentage), est cependant en embuscade. L'écart entre les deux formations politiques est de 1,1 points.<br><br>La troisième place est occupée par le <b><b>PL</b>R</b>. Le parti emmagasine 23 % des voix (-4,1 points de pourcentage par rapport à 2019) ","Il partito <b>UDC</b> rimane in testa a Curtilles con il 26,2 percento dei voti (-2,9 punti percentuali). Il suo rivale, il partito <b>Verdi</b>, minaccia però di sovrastarlo con il 26,2 percento dei voti (+16,1 punti percentuali). La differenza tra le due formazioni è solo di 1,1 punti.<br><br>Il partito <b>PLR</b> completa il podio con il 23 percento dei voti (-4,1).","tab_h$tr£$td£SVP$/td£tab_r139tab_r2#547d34tab_r3$td£$b£26.2%$/b£$/td£§-2.9$/td£$/tr£$tr£$td£Grüne$/td£tab_r138tab_r2#26b300tab_r3$td£$b£25.0%$/b£$/td£§+16.1$/td£$/tr£$tr£$td£FDP$/td£tab_r135tab_r2#6268AFtab_r3$td£$b£23.0%$/b£$/td£§-4.1$/td£$/tr£$tr£$td£SP$/td£tab_r122tab_r2#ea546ftab_r3$td£$b£14.6%$/b£$/td£§-2.6$/td£$/tr£$tr£$td£weitere$/td£tab_r19tab_r2#bebebetab_r3$td£$b£6.3%$/b£$/td£§-1.8$/td£$/tr£$/table£$br£Gültige Wahlzettel: $b£106$/b£$br£Wahlbeteiligung: $b£47.1%$/b£ (+2.4%)","tab_h_fr$tr£$td£UDC$/td£tab_r139tab_r2#547d34tab_r3$td£$b£26.2%$/b£$/td£§-2.9$/td£$/tr£$tr£$td£Vert-e-s$/td£tab_r138tab_r2#26b300tab_r3$td£$b£25.0%$/b£$/td£§+16.1$/td£$/tr£$tr£$td£PLR$/td£tab_r135tab_r2#6268AFtab_r3$td£$b£23.0%$/b£$/td£§-4.1$/td£$/tr£$tr£$td£PS$/td£tab_r122tab_r2#ea546ftab_r3$td£$b£14.6%$/b£$/td£§-2.6$/td£$/tr£$tr£$td£Divers$/td£tab_r19tab_r2#bebebetab_r3$td£$b£6.3%$/b£$/td£§-1.8$/td£$/tr£$/table£$br£Bulletins de vote valables: $b£106$/b£$br£Taux de participation: $b£47.1%$/b£ (+2.4%)","tab_h_it$tr£$td£UDC$/td£tab_r139tab_r2#547d34tab_r3$td£$b£26.2%$/b£$/td£§-2.9$/td£$/tr£$tr£$td£Verdi$/td£tab_r138tab_r2#26b300tab_r3$td£$b£25.0%$/b£$/td£§+16.1$/td£$/tr£$tr£$td£PLR$/td£tab_r135tab_r2#6268AFtab_r3$td£$b£23.0%$/b£$/td£§-4.1$/td£$/tr£$tr£$td£PS$/td£tab_r122tab_r2#ea546ftab_r3$td£$b£14.6%$/b£$/td£§-2.6$/td£$/tr£$tr£$td£altro$/td£tab_r19tab_r2#bebebetab_r3$td£$b£6.3%$/b£$/td£§-1.8$/td£$/tr£$/table£$br£Schede elettorali valide: $b£106$/b£$br£Tasso di partecipazione: $b£47.1%$/b£ (+2.4%)","SVP"
5671,"Dompierre VD","Dompierre (VD)","Dompierre VD","Die <b>SVP</b> kann ihre Position als dominierende politische Kraft in Dompierre VD beibehalten, mit einem Wähleranteil von 39,3 Prozent (+0,1 Prozentpunkte).<br><br>Zweitstärkste Partei ist die <b>FDP</b> mit 23 Prozent (+0,1 Prozentpunkte gegenüber 2019).<br><br>Die <b>Grünen</b> verzeichnen einen deutlichen Zuwachs. Die Partei belegt nun den dritten Platz in der Gemeinde und erreicht neu einen Wähleranteil von 17,2 Prozent. Das sind +8,5 Prozentpunkte mehr als im Vergleich zu den letzten Wahlen.","Aucune formation politique ne parvient à prendre la place de numéro un au <b>UDC</b> à Dompierre (VD). Le parti obtient 39,3 % des suffrages (+0,1 points de pourcentage).<br><br>Le <b><b>PL</b>R</b> arrive en deuxième position dans la commune avec un pourcentage de votants de 23 (+0,1 points de pourcentage).<br><br>Une forte progression de +8,5 points de pourcentage par rapport aux dernières élections fédérales permet aux <b>Vert-e-s</b> de grimper à la troisième place dans la commune. Son pourcentage d'électeurs est désormais de 17,2 %.","Il partito <b>UDC</b> rimane il più forte a Dompierre VD, con il 39,3 percento dei voti (+0,1 punti percentuali).<br><br>Il secondo rango è occupato dal partito <b>PLR</b> che ottiene il 23 percento dei voti (+0,1 punti percentuali rispetto al 2019).<br><br>Grazie a un notevole aumento di +8,5 punti percentuali rispetto alle ultime elezioni federali, il partito <b>Verdi</b> raggiunge il terzo posto nel comune. Ora ha una percentuale di elettori del 17,2 percento.","tab_h$tr£$td£SVP$/td£tab_r159tab_r2#547d34tab_r3$td£$b£39.3%$/b£$/td£§+0.1$/td£$/tr£$tr£$td£FDP$/td£tab_r135tab_r2#6268AFtab_r3$td£$b£23.0%$/b£$/td£§+0.1$/td£$/tr£$tr£$td£Grüne$/td£tab_r126tab_r2#26b300tab_r3$td£$b£17.2%$/b£$/td£§+8.5$/td£$/tr£$tr£$td£SP$/td£tab_r18tab_r2#ea546ftab_r3$td£$b£5.2%$/b£$/td£§+0.4$/td£$/tr£$tr£$td£PdA$/td£tab_r17tab_r2#792a8ftab_r3$td£$b£4.5%$/b£$/td£§-0.2$/td£$/tr£$tr£$td£EVP$/td£tab_r15tab_r2#87bfdctab_r3$td£$b£3.4%$/b£$/td£§+0.2$/td£$/tr£$/table£$br£Gültige Wahlzettel: $b£95$/b£$br£Wahlbeteiligung: $b£53.6%$/b£ (-3.4%)","tab_h_fr$tr£$td£UDC$/td£tab_r159tab_r2#547d34tab_r3$td£$b£39.3%$/b£$/td£§+0.1$/td£$/tr£$tr£$td£PLR$/td£tab_r135tab_r2#6268AFtab_r3$td£$b£23.0%$/b£$/td£§+0.1$/td£$/tr£$tr£$td£Vert-e-s$/td£tab_r126tab_r2#26b300tab_r3$td£$b£17.2%$/b£$/td£§+8.5$/td£$/tr£$tr£$td£PS$/td£tab_r18tab_r2#ea546ftab_r3$td£$b£5.2%$/b£$/td£§+0.4$/td£$/tr£$tr£$td£PST-POP$/td£tab_r17tab_r2#792a8ftab_r3$td£$b£4.5%$/b£$/td£§-0.2$/td£$/tr£$tr£$td£PEV$/td£tab_r15tab_r2#87bfdctab_r3$td£$b£3.4%$/b£$/td£§+0.2$/td£$/tr£$/table£$br£Bulletins de vote valables: $b£95$/b£$br£Taux de participation: $b£53.6%$/b£ (-3.4%)","tab_h_it$tr£$td£UDC$/td£tab_r159tab_r2#547d34tab_r3$td£$b£39.3%$/b£$/td£§+0.1$/td£$/tr£$tr£$td£PLR$/td£tab_r135tab_r2#6268AFtab_r3$td£$b£23.0%$/b£$/td£§+0.1$/td£$/tr£$tr£$td£Verdi$/td£tab_r126tab_r2#26b300tab_r3$td£$b£17.2%$/b£$/td£§+8.5$/td£$/tr£$tr£$td£PS$/td£tab_r18tab_r2#ea546ftab_r3$td£$b£5.2%$/b£$/td£§+0.4$/td£$/tr£$tr£$td£POP$/td£tab_r17tab_r2#792a8ftab_r3$td£$b£4.5%$/b£$/td£§-0.2$/td£$/tr£$tr£$td£PEV$/td£tab_r15tab_r2#87bfdctab_r3$td£$b£3.4%$/b£$/td£§+0.2$/td£$/tr£$/table£$br£Schede elettorali valide: $b£95$/b£$br£Tasso di partecipazione: $b£53.6%$/b£ (-3.4%)","SVP"
5673,"Hermenches VD","Hermenches (VD)","Hermenches VD","Unverändert ist die <b>SVP</b> die stärkste Partei in Hermenches mit 33,5 Prozent (-7,8 Prozentpunkte).<br><br>Auf dem zweiten Platz in der Gemeinde liegt die <b>FDP</b>. Die Partei erreicht einen Wählerstimmenanteil von 29,9 Prozent (+1,3 Prozentpunkte).<br><br>Die <b>Grünen</b> verzeichnen einen deutlichen Zuwachs. Die Partei belegt nun den dritten Platz in der Gemeinde und erreicht neu einen Wähleranteil von 13,3 Prozent. Das sind +7,2 Prozentpunkte mehr als im Vergleich zu den letzten Wahlen.","Les électeurs d'Hermenches n'ont pas retourné leur veste depuis 2019. Le parti le plus fort dans leur commune reste l'<b>UDC</b>, avec 33,5 % des suffrages (-7,8 points de pourcentage).<br><br>Le deuxième rang est occupé par le <b><b>PL</b>R</b> qui réalise 29,9 % des voix (+1,3 points de pourcentage par rapport à 2019).<br><br>Les <b>Vert-e-s</b> enregistrent une nette progression. La formation occupe désormais la troisième place dans la commune et obtient désormais 13,3 % des voix. Cela représente +7,2 points de pourcentage de plus qu'en 2019.","Il partito <b>UDC</b> mantiene il primo posto a Hermenches e ottiene il 33,5 percento dei voti (-7,8 punti percentuali).<br><br>Il secondo rango è occupato dal partito <b>PLR</b> che ottiene il 29,9 percento dei voti (+1,3 punti percentuali rispetto al 2019).<br><br>Il partito <b>Verdi</b> registra una forte crescita. Ora si classifica terzo nel comune e riceve il 13,3 percento dei voti, ovvero +7,2 punti percentuali in più rispetto al 2019.","tab_h$tr£$td£SVP$/td£tab_r150tab_r2#547d34tab_r3$td£$b£33.5%$/b£$/td£§-7.8$/td£$/tr£$tr£$td£FDP$/td£tab_r145tab_r2#6268AFtab_r3$td£$b£29.9%$/b£$/td£§+1.3$/td£$/tr£$tr£$td£Grüne$/td£tab_r120tab_r2#26b300tab_r3$td£$b£13.3%$/b£$/td£§+7.2$/td£$/tr£$tr£$td£SP$/td£tab_r119tab_r2#ea546ftab_r3$td£$b£12.5%$/b£$/td£§-0.6$/td£$/tr£$tr£$td£GLP$/td£tab_r18tab_r2#cbd401tab_r3$td£$b£5.4%$/b£$/td£§+2.7$/td£$/tr£$/table£$br£Gültige Wahlzettel: $b£119$/b£$br£Wahlbeteiligung: $b£48.0%$/b£ (+6.4%)","tab_h_fr$tr£$td£UDC$/td£tab_r150tab_r2#547d34tab_r3$td£$b£33.5%$/b£$/td£§-7.8$/td£$/tr£$tr£$td£PLR$/td£tab_r145tab_r2#6268AFtab_r3$td£$b£29.9%$/b£$/td£§+1.3$/td£$/tr£$tr£$td£Vert-e-s$/td£tab_r120tab_r2#26b300tab_r3$td£$b£13.3%$/b£$/td£§+7.2$/td£$/tr£$tr£$td£PS$/td£tab_r119tab_r2#ea546ftab_r3$td£$b£12.5%$/b£$/td£§-0.6$/td£$/tr£$tr£$td£PVL$/td£tab_r18tab_r2#cbd401tab_r3$td£$b£5.4%$/b£$/td£§+2.7$/td£$/tr£$/table£$br£Bulletins de vote valables: $b£119$/b£$br£Taux de participation: $b£48.0%$/b£ (+6.4%)","tab_h_it$tr£$td£UDC$/td£tab_r150tab_r2#547d34tab_r3$td£$b£33.5%$/b£$/td£§-7.8$/td£$/tr£$tr£$td£PLR$/td£tab_r145tab_r2#6268AFtab_r3$td£$b£29.9%$/b£$/td£§+1.3$/td£$/tr£$tr£$td£Verdi$/td£tab_r120tab_r2#26b300tab_r3$td£$b£13.3%$/b£$/td£§+7.2$/td£$/tr£$tr£$td£PS$/td£tab_r119tab_r2#ea546ftab_r3$td£$b£12.5%$/b£$/td£§-0.6$/td£$/tr£$tr£$td£PVL$/td£tab_r18tab_r2#cbd401tab_r3$td£$b£5.4%$/b£$/td£§+2.7$/td£$/tr£$/table£$br£Schede elettorali valide: $b£119$/b£$br£Tasso di partecipazione: $b£48.0%$/b£ (+6.4%)","SVP"
