"ID","Gemeinde_de","Gemeinde_fr","Gemeinde_it","Text_de","Text_fr","Text_it","Tabelle_de","Tabelle_fr","Tabelle_it","Staerkste_Partei"
5763,"Valeyres-sous-Rances VD","Valeyres-sous-Rances (VD)","Valeyres-sous-Rances VD","Ganz knapp bleibt die <b>SVP</b> die grösste Partei in Valeyres-sous-Rances. Die Partei holt 27,1 Prozent der Stimmen und hält damit ihren Vorsprung, mit 1,2 Prozentpunkten, vor der <b>FDP</b>. Diese muss sich mit 25,8 Prozent und Platz zwei begnügen. Die Veränderungen gegenüber 2019: <b>SVP</b>: -10,9 Prozentpunkte; <b>FDP</b>: +3,6 Prozentpunkte.<br><br>Mit einem deutlichen Anstieg von +7 Prozentpunkten gegenüber den letzten Wahlen können sich die <b>Grünen</b> ihren Platz als drittgrösste Partei in der Gemeinde sichern. Der Wähleranteil liegt nun bei 15,4 Prozent.","Avec 27,1 % des voix (-10,9 points de pourcentage), l'<b>UDC</b> est toujours le parti le plus fort à Valeyres-sous-Rances. Le <b><b>PL</b>R</b>, qui réalise 25,8 % des suffrages (+3,6 points de pourcentage), est cependant en embuscade. L'écart entre les deux formations politiques est de 1,2 points.<br><br>Les <b>Vert-e-s</b> ont nettement progressé. Le parti devient la troisième force électorale de la commune et obtient 15,4 % des voix, ce qui correspond à une augmentation de +7 points de pourcentage par rapport à 2019.","Con il 27,1 percento dei voti (-10,9 punti percentuali), il partito <b>UDC</b> rimane in testa a Valeyres-sous-Rances. Tuttavia, il partito <b>PLR</b>, che ottiene il 25,8 percento dei voti (+3,6 punti percentuali), è in agguato. La differenza tra i due partiti è di 1,2 punti.<br><br>Il partito <b>Verdi</b> ha fatto notevoli progressi, diventando la terza forza elettorale del comune e ottenendo il 15,4 percento dei voti, un aumento di +7 punti percentuali rispetto al 2019.","tab_h$tr£$td£SVP$/td£tab_r141tab_r2#547d34tab_r3$td£$b£27.1%$/b£$/td£§-10.9$/td£$/tr£$tr£$td£FDP$/td£tab_r139tab_r2#6268AFtab_r3$td£$b£25.8%$/b£$/td£§+3.6$/td£$/tr£$tr£$td£Grüne$/td£tab_r123tab_r2#26b300tab_r3$td£$b£15.4%$/b£$/td£§+7.0$/td£$/tr£$tr£$td£SP$/td£tab_r120tab_r2#ea546ftab_r3$td£$b£13.6%$/b£$/td£§-3.5$/td£$/tr£$tr£$td£GLP$/td£tab_r116tab_r2#cbd401tab_r3$td£$b£10.9%$/b£$/td£§+7.3$/td£$/tr£$/table£$br£Gültige Wahlzettel: $b£187$/b£$br£Wahlbeteiligung: $b£49.0%$/b£ (+2.4%)","tab_h_fr$tr£$td£UDC$/td£tab_r141tab_r2#547d34tab_r3$td£$b£27.1%$/b£$/td£§-10.9$/td£$/tr£$tr£$td£PLR$/td£tab_r139tab_r2#6268AFtab_r3$td£$b£25.8%$/b£$/td£§+3.6$/td£$/tr£$tr£$td£Vert-e-s$/td£tab_r123tab_r2#26b300tab_r3$td£$b£15.4%$/b£$/td£§+7.0$/td£$/tr£$tr£$td£PS$/td£tab_r120tab_r2#ea546ftab_r3$td£$b£13.6%$/b£$/td£§-3.5$/td£$/tr£$tr£$td£PVL$/td£tab_r116tab_r2#cbd401tab_r3$td£$b£10.9%$/b£$/td£§+7.3$/td£$/tr£$/table£$br£Bulletins de vote valables: $b£187$/b£$br£Taux de participation: $b£49.0%$/b£ (+2.4%)","tab_h_it$tr£$td£UDC$/td£tab_r141tab_r2#547d34tab_r3$td£$b£27.1%$/b£$/td£§-10.9$/td£$/tr£$tr£$td£PLR$/td£tab_r139tab_r2#6268AFtab_r3$td£$b£25.8%$/b£$/td£§+3.6$/td£$/tr£$tr£$td£Verdi$/td£tab_r123tab_r2#26b300tab_r3$td£$b£15.4%$/b£$/td£§+7.0$/td£$/tr£$tr£$td£PS$/td£tab_r120tab_r2#ea546ftab_r3$td£$b£13.6%$/b£$/td£§-3.5$/td£$/tr£$tr£$td£PVL$/td£tab_r116tab_r2#cbd401tab_r3$td£$b£10.9%$/b£$/td£§+7.3$/td£$/tr£$/table£$br£Schede elettorali valide: $b£187$/b£$br£Tasso di partecipazione: $b£49.0%$/b£ (+2.4%)","SVP"
5764,"Vallorbe VD","Vallorbe (VD)","Vallorbe VD","Neue stärkste Kraft in Vallorbe: Die <b>FDP</b> holt mit 28 Prozent (+0,5 Prozentpunkte) die meisten Stimmen. Die Partei verbessert sich damit von Rang zwei auf den ersten Platz.<br><br>Auf dem zweiten Platz in der Gemeinde liegt die <b>SVP</b>. Die Partei erreicht einen Wählerstimmenanteil von 25,2 Prozent (-3,4 Prozentpunkte).<br><br>Die <b>SP</b> landet mit 23,7 Prozent auf dem dritten Platz (Veränderung gegenüber 2019: -0,7 Prozentpunkte).","Classé au deux ème rang en 2019, le <b><b>PL</b>R</b> est le nouveau parti le plus fort à Vallorbe. La formation obtient 28 % des suffrages.<br><br>Le deuxième rang est occupé par l'<b>UDC</b> qui réalise 25,2 % des voix (-3,4 points de pourcentage par rapport à 2019).<br><br>Le <b>PS</b> se classe troisième. La formation obtient 23,7 % des voix (-0,7 points de pourcentage par rapport à 2019).","Le preferenze degli elettori di Vallorbe sono cambiate in quattro anni. Il partito <b>PLR</b> ottiene il numero più alto di voti con il 28 % (+0,5 punti percentuali) e passa così dal due esimo posto al primo.<br><br>Il partito <b>UDC</b> è il secondo partito più forte a Vallorbe. Si è migliorato di -3,4 punti percentuali rispetto alle elezioni per il Consiglio nazionale del 2019.<br><br>Il partito <b>PS</b> completa il podio con il 23,7 percento dei voti (-0,7).","tab_h$tr£$td£FDP$/td£tab_r142tab_r2#6268AFtab_r3$td£$b£28.0%$/b£$/td£§+0.5$/td£$/tr£$tr£$td£SVP$/td£tab_r138tab_r2#547d34tab_r3$td£$b£25.2%$/b£$/td£§-3.4$/td£$/tr£$tr£$td£SP$/td£tab_r136tab_r2#ea546ftab_r3$td£$b£23.7%$/b£$/td£§-0.7$/td£$/tr£$tr£$td£Grüne$/td£tab_r116tab_r2#26b300tab_r3$td£$b£10.6%$/b£$/td£§+4.0$/td£$/tr£$tr£$td£weitere$/td£tab_r15tab_r2#bebebetab_r3$td£$b£3.2%$/b£$/td£§-1.1$/td£$/tr£$tr£$td£GLP$/td£tab_r15tab_r2#cbd401tab_r3$td£$b£3.0%$/b£$/td£§+1.8$/td£$/tr£$/table£$br£Gültige Wahlzettel: $b£754$/b£$br£Wahlbeteiligung: $b£36.8%$/b£ (-2.1%)","tab_h_fr$tr£$td£PLR$/td£tab_r142tab_r2#6268AFtab_r3$td£$b£28.0%$/b£$/td£§+0.5$/td£$/tr£$tr£$td£UDC$/td£tab_r138tab_r2#547d34tab_r3$td£$b£25.2%$/b£$/td£§-3.4$/td£$/tr£$tr£$td£PS$/td£tab_r136tab_r2#ea546ftab_r3$td£$b£23.7%$/b£$/td£§-0.7$/td£$/tr£$tr£$td£Vert-e-s$/td£tab_r116tab_r2#26b300tab_r3$td£$b£10.6%$/b£$/td£§+4.0$/td£$/tr£$tr£$td£Divers$/td£tab_r15tab_r2#bebebetab_r3$td£$b£3.2%$/b£$/td£§-1.1$/td£$/tr£$tr£$td£PVL$/td£tab_r15tab_r2#cbd401tab_r3$td£$b£3.0%$/b£$/td£§+1.8$/td£$/tr£$/table£$br£Bulletins de vote valables: $b£754$/b£$br£Taux de participation: $b£36.8%$/b£ (-2.1%)","tab_h_it$tr£$td£PLR$/td£tab_r142tab_r2#6268AFtab_r3$td£$b£28.0%$/b£$/td£§+0.5$/td£$/tr£$tr£$td£UDC$/td£tab_r138tab_r2#547d34tab_r3$td£$b£25.2%$/b£$/td£§-3.4$/td£$/tr£$tr£$td£PS$/td£tab_r136tab_r2#ea546ftab_r3$td£$b£23.7%$/b£$/td£§-0.7$/td£$/tr£$tr£$td£Verdi$/td£tab_r116tab_r2#26b300tab_r3$td£$b£10.6%$/b£$/td£§+4.0$/td£$/tr£$tr£$td£altro$/td£tab_r15tab_r2#bebebetab_r3$td£$b£3.2%$/b£$/td£§-1.1$/td£$/tr£$tr£$td£PVL$/td£tab_r15tab_r2#cbd401tab_r3$td£$b£3.0%$/b£$/td£§+1.8$/td£$/tr£$/table£$br£Schede elettorali valide: $b£754$/b£$br£Tasso di partecipazione: $b£36.8%$/b£ (-2.1%)","FDP"
5765,"Vaulion VD","Vaulion (VD)","Vaulion VD","Die <b>FDP</b> kann sich in diesem Jahr von Rang zwei auf den Spitzenplatz in Vaulion verbessern. Die Partei holt 30,6 Prozent der Stimmen (+2,1 Prozentpunkte).<br><br>Auf dem zweiten Platz in der Gemeinde liegt die <b>SVP</b>. Die Partei erreicht einen Wählerstimmenanteil von 28,8 Prozent (-0,7 Prozentpunkte).<br><br>Die <b>SP</b> landet mit 14,3 Prozent auf dem dritten Platz (Veränderung gegenüber 2019: +0,2 Prozentpunkte).","Le <b><b>PL</b>R</b> grimpe sur la première place du podium à Vaulion. La formation était deux ème en 2019 et obtient cette année 30,6 % des voix.<br><br>L'<b>UDC</b> arrive en deuxième position dans la commune avec un pourcentage de votants de 28,8 (-0,7 points de pourcentage).<br><br>A la troisième place figure le <b>PS</b>, qui réalise 14,3 % des voix (+0,2).","Il partito <b>PLR</b> progredisce. Passa dal due esimo posto al primo a Vaulion, ottenendo il 30,6 percento dei voti (+2,1 punti percentuali).<br><br>Il partito <b>UDC</b> è la seconda formazione più forte con il 28,8 percento dei voti (-0,7 punti percentuali rispetto al 2019).<br><br>Il partito <b>PS</b> si posiziona terzo con il 14,3 percento dei voti. Questo rappresenta una variazione di +0,2 punti percentuali rispetto al 2019.","tab_h$tr£$td£FDP$/td£tab_r146tab_r2#6268AFtab_r3$td£$b£30.6%$/b£$/td£§+2.1$/td£$/tr£$tr£$td£SVP$/td£tab_r143tab_r2#547d34tab_r3$td£$b£28.8%$/b£$/td£§-0.7$/td£$/tr£$tr£$td£SP$/td£tab_r121tab_r2#ea546ftab_r3$td£$b£14.3%$/b£$/td£§+0.2$/td£$/tr£$tr£$td£Grüne$/td£tab_r118tab_r2#26b300tab_r3$td£$b£12.0%$/b£$/td£§+0.0$/td£$/tr£$tr£$td£PdA$/td£tab_r16tab_r2#792a8ftab_r3$td£$b£4.0%$/b£$/td£§+1.1$/td£$/tr£$tr£$td£weitere$/td£tab_r16tab_r2#bebebetab_r3$td£$b£3.8%$/b£$/td£§-0.6$/td£$/tr£$tr£$td£GLP$/td£tab_r15tab_r2#cbd401tab_r3$td£$b£3.2%$/b£$/td£§+1.1$/td£$/tr£$/table£$br£Gültige Wahlzettel: $b£146$/b£$br£Wahlbeteiligung: $b£42.3%$/b£ (-8.6%)","tab_h_fr$tr£$td£PLR$/td£tab_r146tab_r2#6268AFtab_r3$td£$b£30.6%$/b£$/td£§+2.1$/td£$/tr£$tr£$td£UDC$/td£tab_r143tab_r2#547d34tab_r3$td£$b£28.8%$/b£$/td£§-0.7$/td£$/tr£$tr£$td£PS$/td£tab_r121tab_r2#ea546ftab_r3$td£$b£14.3%$/b£$/td£§+0.2$/td£$/tr£$tr£$td£Vert-e-s$/td£tab_r118tab_r2#26b300tab_r3$td£$b£12.0%$/b£$/td£§+0.0$/td£$/tr£$tr£$td£PST-POP$/td£tab_r16tab_r2#792a8ftab_r3$td£$b£4.0%$/b£$/td£§+1.1$/td£$/tr£$tr£$td£Divers$/td£tab_r16tab_r2#bebebetab_r3$td£$b£3.8%$/b£$/td£§-0.6$/td£$/tr£$tr£$td£PVL$/td£tab_r15tab_r2#cbd401tab_r3$td£$b£3.2%$/b£$/td£§+1.1$/td£$/tr£$/table£$br£Bulletins de vote valables: $b£146$/b£$br£Taux de participation: $b£42.3%$/b£ (-8.6%)","tab_h_it$tr£$td£PLR$/td£tab_r146tab_r2#6268AFtab_r3$td£$b£30.6%$/b£$/td£§+2.1$/td£$/tr£$tr£$td£UDC$/td£tab_r143tab_r2#547d34tab_r3$td£$b£28.8%$/b£$/td£§-0.7$/td£$/tr£$tr£$td£PS$/td£tab_r121tab_r2#ea546ftab_r3$td£$b£14.3%$/b£$/td£§+0.2$/td£$/tr£$tr£$td£Verdi$/td£tab_r118tab_r2#26b300tab_r3$td£$b£12.0%$/b£$/td£§+0.0$/td£$/tr£$tr£$td£POP$/td£tab_r16tab_r2#792a8ftab_r3$td£$b£4.0%$/b£$/td£§+1.1$/td£$/tr£$tr£$td£altro$/td£tab_r16tab_r2#bebebetab_r3$td£$b£3.8%$/b£$/td£§-0.6$/td£$/tr£$tr£$td£PVL$/td£tab_r15tab_r2#cbd401tab_r3$td£$b£3.2%$/b£$/td£§+1.1$/td£$/tr£$/table£$br£Schede elettorali valide: $b£146$/b£$br£Tasso di partecipazione: $b£42.3%$/b£ (-8.6%)","FDP"
5766,"Vuiteboeuf VD","Vuiteboeuf (VD)","Vuiteboeuf VD","In Vuiteboeuf bleibt die <b>SVP</b> die stimmenstärkste Partei. Die Partei holt 24,8 Prozent aller Stimmen (-7,2 Prozentpunkte).<br><br>Die <b>FDP</b> steigert sich mit einem Plus von +6,7 Prozentpunkte stark. Die Partei belegt nun den zweiten Platz in der Gemeinde. Der Wählerstimmenanteil beträgt neu 21,5 Prozent.<br><br>Mit einem deutlichen Anstieg von +7,8 Prozentpunkten gegenüber den letzten Wahlen können sich die <b>Grünen</b> ihren Platz als drittgrösste Partei in der Gemeinde sichern. Der Wähleranteil liegt nun bei 19,6 Prozent.","L'<b>UDC</b> maintient sa position de première force politique dans la commune de Vuiteboeuf. Le parti récolte 24,8 % des suffrages (-7,2 points de pourcentage).<br><br>Le <b><b>PL</b>R</b> progresse fortement: le parti améliore son résultat d'il y a quatre ans de +6,7 points de pourcentage et occupe désormais la deuxième place dans la commune. La proportion de voix du parti s'élève désormais à 21,5 %.<br><br>Les <b>Vert-e-s</b> ont nettement progressé. Le parti devient la troisième force électorale de la commune et obtient 19,6 % des voix, ce qui correspond à une augmentation de +7,8 points de pourcentage par rapport à 2019.","Il partito <b>UDC</b> mantiene il primo posto a Vuiteboeuf e ottiene il 24,8 percento dei voti (-7,2 punti percentuali).<br><br>Il partito <b>PLR</b> progredisce notevolmente: ha migliorato il suo risultato di quattro anni fa di +6,7 punti percentuali ed è ora al secondo posto nel comune. La proporzione di voti del partito è ora del 21,5 percento.<br><br>Grazie a un notevole aumento di +7,8 punti percentuali rispetto alle ultime elezioni federali, il partito <b>Verdi</b> raggiunge il terzo posto nel comune. Ora ha una percentuale di elettori del 19,6 percento.","tab_h$tr£$td£SVP$/td£tab_r137tab_r2#547d34tab_r3$td£$b£24.8%$/b£$/td£§-7.2$/td£$/tr£$tr£$td£FDP$/td£tab_r132tab_r2#6268AFtab_r3$td£$b£21.5%$/b£$/td£§+6.7$/td£$/tr£$tr£$td£Grüne$/td£tab_r129tab_r2#26b300tab_r3$td£$b£19.6%$/b£$/td£§+7.8$/td£$/tr£$tr£$td£SP$/td£tab_r125tab_r2#ea546ftab_r3$td£$b£16.9%$/b£$/td£§+2.5$/td£$/tr£$tr£$td£EVP$/td£tab_r17tab_r2#87bfdctab_r3$td£$b£4.8%$/b£$/td£§+3.4$/td£$/tr£$tr£$td£GLP$/td£tab_r16tab_r2#cbd401tab_r3$td£$b£4.2%$/b£$/td£§+2.1$/td£$/tr£$/table£$br£Gültige Wahlzettel: $b£142$/b£$br£Wahlbeteiligung: $b£38.5%$/b£ (-6.2%)","tab_h_fr$tr£$td£UDC$/td£tab_r137tab_r2#547d34tab_r3$td£$b£24.8%$/b£$/td£§-7.2$/td£$/tr£$tr£$td£PLR$/td£tab_r132tab_r2#6268AFtab_r3$td£$b£21.5%$/b£$/td£§+6.7$/td£$/tr£$tr£$td£Vert-e-s$/td£tab_r129tab_r2#26b300tab_r3$td£$b£19.6%$/b£$/td£§+7.8$/td£$/tr£$tr£$td£PS$/td£tab_r125tab_r2#ea546ftab_r3$td£$b£16.9%$/b£$/td£§+2.5$/td£$/tr£$tr£$td£PEV$/td£tab_r17tab_r2#87bfdctab_r3$td£$b£4.8%$/b£$/td£§+3.4$/td£$/tr£$tr£$td£PVL$/td£tab_r16tab_r2#cbd401tab_r3$td£$b£4.2%$/b£$/td£§+2.1$/td£$/tr£$/table£$br£Bulletins de vote valables: $b£142$/b£$br£Taux de participation: $b£38.5%$/b£ (-6.2%)","tab_h_it$tr£$td£UDC$/td£tab_r137tab_r2#547d34tab_r3$td£$b£24.8%$/b£$/td£§-7.2$/td£$/tr£$tr£$td£PLR$/td£tab_r132tab_r2#6268AFtab_r3$td£$b£21.5%$/b£$/td£§+6.7$/td£$/tr£$tr£$td£Verdi$/td£tab_r129tab_r2#26b300tab_r3$td£$b£19.6%$/b£$/td£§+7.8$/td£$/tr£$tr£$td£PS$/td£tab_r125tab_r2#ea546ftab_r3$td£$b£16.9%$/b£$/td£§+2.5$/td£$/tr£$tr£$td£PEV$/td£tab_r17tab_r2#87bfdctab_r3$td£$b£4.8%$/b£$/td£§+3.4$/td£$/tr£$tr£$td£PVL$/td£tab_r16tab_r2#cbd401tab_r3$td£$b£4.2%$/b£$/td£§+2.1$/td£$/tr£$/table£$br£Schede elettorali valide: $b£142$/b£$br£Tasso di partecipazione: $b£38.5%$/b£ (-6.2%)","SVP"
5785,"Corcelles-le-Jorat VD","Corcelles-le-Jorat (VD)","Corcelles-le-Jorat VD","In Corcelles-le-Jorat bleibt die <b>FDP</b> unangefochten die stärkste Partei. Sie vereinigt bei den Nationalratswahlen 44,9 Prozent der Stimmen (-3,6 Prozentpunkte) auf sich, 26,4 Prozentpunkte mehr als die zweitplatzierte <b>SVP</b> (18,5 Prozent, -3,3 Prozentpunkte).<br><br>Deutlich zulegen können die <b>Grünen</b>. Die Partei ist die drittstärkste Kraft in der Gemeinde und kommt neu auf einen Wähleranteil von 14,6 Prozent, was einer Zunahme von +7,3 Prozentpunkten gegenüber der letzten Wahl entspricht.","Le <b><b>PL</b>R</b> reste le parti préféré des électeurs de Corcelles-le-Jorat. La formation politique réalise 44,9 % des voix (-3,6 points de pourcentage par rapport à 2019). C'est 26,4 points de plus que l'<b>UDC</b> qui, avec 18,5 % des voix (-3,3 points de pourcentage), se classe en deuxième position dans cette commune.<br><br>Les <b>Vert-e-s</b> enregistrent une nette progression. La formation occupe désormais la troisième place dans la commune et obtient désormais 14,6 % des voix. Cela représente +7,3 points de pourcentage de plus qu'en 2019.","Con il 44,9 percento dei voti (-3,6 punti percentuali), la posizione di leader del partito <b>PLR</b> è solida a Corcelles-le-Jorat. La differenza è di 26,4 punti rispetto al partito successivo. In confronto, il partito <b>UDC</b> si classifica al secondo posto con il 18,5 percento dei voti (-3,3 punti percentuali).<br><br>Il partito <b>Verdi</b> registra una forte crescita. Ora si classifica terzo nel comune e riceve il 14,6 percento dei voti, ovvero +7,3 punti percentuali in più rispetto al 2019.","tab_h$tr£$td£FDP$/td£tab_r167tab_r2#6268AFtab_r3$td£$b£44.9%$/b£$/td£§-3.6$/td£$/tr£$tr£$td£SVP$/td£tab_r128tab_r2#547d34tab_r3$td£$b£18.5%$/b£$/td£§-3.3$/td£$/tr£$tr£$td£Grüne$/td£tab_r122tab_r2#26b300tab_r3$td£$b£14.6%$/b£$/td£§+7.3$/td£$/tr£$tr£$td£SP$/td£tab_r111tab_r2#ea546ftab_r3$td£$b£7.3%$/b£$/td£§-3.8$/td£$/tr£$tr£$td£GLP$/td£tab_r111tab_r2#cbd401tab_r3$td£$b£7.0%$/b£$/td£§+4.3$/td£$/tr£$tr£$td£PdA$/td£tab_r15tab_r2#792a8ftab_r3$td£$b£3.4%$/b£$/td£§+1.3$/td£$/tr£$/table£$br£Gültige Wahlzettel: $b£182$/b£$br£Wahlbeteiligung: $b£60.0%$/b£ (-5.2%)","tab_h_fr$tr£$td£PLR$/td£tab_r167tab_r2#6268AFtab_r3$td£$b£44.9%$/b£$/td£§-3.6$/td£$/tr£$tr£$td£UDC$/td£tab_r128tab_r2#547d34tab_r3$td£$b£18.5%$/b£$/td£§-3.3$/td£$/tr£$tr£$td£Vert-e-s$/td£tab_r122tab_r2#26b300tab_r3$td£$b£14.6%$/b£$/td£§+7.3$/td£$/tr£$tr£$td£PS$/td£tab_r111tab_r2#ea546ftab_r3$td£$b£7.3%$/b£$/td£§-3.8$/td£$/tr£$tr£$td£PVL$/td£tab_r111tab_r2#cbd401tab_r3$td£$b£7.0%$/b£$/td£§+4.3$/td£$/tr£$tr£$td£PST-POP$/td£tab_r15tab_r2#792a8ftab_r3$td£$b£3.4%$/b£$/td£§+1.3$/td£$/tr£$/table£$br£Bulletins de vote valables: $b£182$/b£$br£Taux de participation: $b£60.0%$/b£ (-5.2%)","tab_h_it$tr£$td£PLR$/td£tab_r167tab_r2#6268AFtab_r3$td£$b£44.9%$/b£$/td£§-3.6$/td£$/tr£$tr£$td£UDC$/td£tab_r128tab_r2#547d34tab_r3$td£$b£18.5%$/b£$/td£§-3.3$/td£$/tr£$tr£$td£Verdi$/td£tab_r122tab_r2#26b300tab_r3$td£$b£14.6%$/b£$/td£§+7.3$/td£$/tr£$tr£$td£PS$/td£tab_r111tab_r2#ea546ftab_r3$td£$b£7.3%$/b£$/td£§-3.8$/td£$/tr£$tr£$td£PVL$/td£tab_r111tab_r2#cbd401tab_r3$td£$b£7.0%$/b£$/td£§+4.3$/td£$/tr£$tr£$td£POP$/td£tab_r15tab_r2#792a8ftab_r3$td£$b£3.4%$/b£$/td£§+1.3$/td£$/tr£$/table£$br£Schede elettorali valide: $b£182$/b£$br£Tasso di partecipazione: $b£60.0%$/b£ (-5.2%)","FDP"
5788,"Essertes VD","Essertes (VD)","Essertes VD","In Essertes steht eine neue Partei auf dem Spitzenplatz: Die <b>FDP</b> holt 25,1 Prozent der Stimmen (-0,5 Prozentpunkte) und verbessert sich damit von Rang zwei auf den ersten Platz.<br><br>Trotz einem Minus von -8,5 Prozentpunkten gegenüber den Wahlen 2019 belegt die <b>SVP</b> immer noch den zweiten Platz. Dies dank eines Wähleranteils von 24,7 Prozent.<br><br>Auf dem dritten Platz landet die <b>SP</b> mit 19,4 Prozent der Stimmen. Das bedeutet eine Veränderung von +3,2 Prozentpunkten gegenüber 2019. ","Les préférences des électeurs d'Essertes ont changé en quatre ans. Le <b><b>PL</b>R</b> obtient le plus grand nombre de voix avec 25,1 % (-0,5 points de pourcentage) et passe ainsi du rang deux à la première place.<br><br>L'<b>UDC</b> perd beaucoup de voix. Le parti enregistre un recul de -8,5 points de pourcentage par rapport aux élections de 2019. Malgré cela, la formation reste en deuxième position avec un pourcentage d'électeurs de 24,7 %.<br><br>La troisième place est occupée par le <b>PS</b>. Le parti emmagasine 19,4 % des voix (+3,2 points de pourcentage par rapport à 2019) ","Classificato al due posto nel 2019, il partito <b>PLR</b> è ora il partito più forte a Essertes. Ottiene il 25,1 percento dei voti.<br><br>Il partito <b>UDC</b> perde molti voti, registrando una perdita di -8,5 punti percentuali rispetto alle elezioni del 2019. Nonostante ciò, rimane in seconda posizione con una quota di elettori del 24,7 percento.<br><br>Il partito <b>PS</b> si posiziona terzo con il 19,4 percento dei voti. Questo rappresenta una variazione di +3,2 punti percentuali rispetto al 2019.","tab_h$tr£$td£FDP$/td£tab_r138tab_r2#6268AFtab_r3$td£$b£25.1%$/b£$/td£§-0.5$/td£$/tr£$tr£$td£SVP$/td£tab_r137tab_r2#547d34tab_r3$td£$b£24.7%$/b£$/td£§-8.5$/td£$/tr£$tr£$td£SP$/td£tab_r129tab_r2#ea546ftab_r3$td£$b£19.4%$/b£$/td£§+3.2$/td£$/tr£$tr£$td£Grüne$/td£tab_r128tab_r2#26b300tab_r3$td£$b£18.7%$/b£$/td£§+10.1$/td£$/tr£$tr£$td£GLP$/td£tab_r19tab_r2#cbd401tab_r3$td£$b£6.3%$/b£$/td£§+5.0$/td£$/tr£$/table£$br£Gültige Wahlzettel: $b£123$/b£$br£Wahlbeteiligung: $b£51.4%$/b£ (-1.0%)","tab_h_fr$tr£$td£PLR$/td£tab_r138tab_r2#6268AFtab_r3$td£$b£25.1%$/b£$/td£§-0.5$/td£$/tr£$tr£$td£UDC$/td£tab_r137tab_r2#547d34tab_r3$td£$b£24.7%$/b£$/td£§-8.5$/td£$/tr£$tr£$td£PS$/td£tab_r129tab_r2#ea546ftab_r3$td£$b£19.4%$/b£$/td£§+3.2$/td£$/tr£$tr£$td£Vert-e-s$/td£tab_r128tab_r2#26b300tab_r3$td£$b£18.7%$/b£$/td£§+10.1$/td£$/tr£$tr£$td£PVL$/td£tab_r19tab_r2#cbd401tab_r3$td£$b£6.3%$/b£$/td£§+5.0$/td£$/tr£$/table£$br£Bulletins de vote valables: $b£123$/b£$br£Taux de participation: $b£51.4%$/b£ (-1.0%)","tab_h_it$tr£$td£PLR$/td£tab_r138tab_r2#6268AFtab_r3$td£$b£25.1%$/b£$/td£§-0.5$/td£$/tr£$tr£$td£UDC$/td£tab_r137tab_r2#547d34tab_r3$td£$b£24.7%$/b£$/td£§-8.5$/td£$/tr£$tr£$td£PS$/td£tab_r129tab_r2#ea546ftab_r3$td£$b£19.4%$/b£$/td£§+3.2$/td£$/tr£$tr£$td£Verdi$/td£tab_r128tab_r2#26b300tab_r3$td£$b£18.7%$/b£$/td£§+10.1$/td£$/tr£$tr£$td£PVL$/td£tab_r19tab_r2#cbd401tab_r3$td£$b£6.3%$/b£$/td£§+5.0$/td£$/tr£$/table£$br£Schede elettorali valide: $b£123$/b£$br£Tasso di partecipazione: $b£51.4%$/b£ (-1.0%)","FDP"
5790,"Maracon VD","Maracon (VD)","Maracon VD","Die <b>SVP</b> ist weiterhin die stärkste Kraft in Maracon. Mit 23,3 Prozent Wähleranteil verweist die Partei die <b>Grünen</b> allerdings nur mit 0,6 Prozentpunkten Abstand auf den zweiten Platz. Die zweitstärkste Partei holt 22,7 Prozent. Die Veränderungen gegenüber 2019: <b>SVP</b>: -3,3 Prozentpunkte; Grüne: +8,1 Prozentpunkte.<br><br>Mit einem Wähleranteil von 16 Prozent belegt die <b>SP</b> den dritten Platz (Veränderung gegenüber 2019: +0,1 Prozentpunkte).","Avec 23,3 % des voix (-3,3 points de pourcentage), l'<b>UDC</b> est toujours le parti le plus fort à Maracon. Les <b>Vert-e-s</b>, qui réalisent 22,7 % des suffrages (+8,1 points de pourcentage), est cependant en embuscade. L'écart entre les deux formations politiques est de 0,6 points.<br><br>La troisième place est occupée par le <b>PS</b>. La formation obtient un pourcentage d'électeurs de 16. (+0,1 points de pourcentage de différence par rapport à 2019).","Con il 23,3 percento dei voti (-3,3 punti percentuali), il partito <b>UDC</b> rimane in testa a Maracon. Tuttavia, il partito <b>Verdi</b>, che ottiene il 22,7 percento dei voti (+8,1 punti percentuali), è in agguato. La differenza tra i due partiti è di 0,6 punti.<br><br>Al terzo posto troviamo il partito <b>PS</b> con il 16 percento dei voti (+0,1).","tab_h$tr£$td£SVP$/td£tab_r135tab_r2#547d34tab_r3$td£$b£23.3%$/b£$/td£§-3.3$/td£$/tr£$tr£$td£Grüne$/td£tab_r134tab_r2#26b300tab_r3$td£$b£22.7%$/b£$/td£§+8.1$/td£$/tr£$tr£$td£SP$/td£tab_r124tab_r2#ea546ftab_r3$td£$b£16.0%$/b£$/td£§+0.1$/td£$/tr£$tr£$td£FDP$/td£tab_r120tab_r2#6268AFtab_r3$td£$b£13.6%$/b£$/td£§-6.3$/td£$/tr£$tr£$td£GLP$/td£tab_r113tab_r2#cbd401tab_r3$td£$b£8.9%$/b£$/td£§+5.8$/td£$/tr£$tr£$td£PdA$/td£tab_r17tab_r2#792a8ftab_r3$td£$b£4.8%$/b£$/td£§+2.6$/td£$/tr£$tr£$td£weitere$/td£tab_r17tab_r2#bebebetab_r3$td£$b£4.4%$/b£$/td£§+2.3$/td£$/tr£$tr£$td£EVP$/td£tab_r15tab_r2#87bfdctab_r3$td£$b£3.1%$/b£$/td£§-1.3$/td£$/tr£$/table£$br£Gültige Wahlzettel: $b£178$/b£$br£Wahlbeteiligung: $b£51.8%$/b£ (-5.2%)","tab_h_fr$tr£$td£UDC$/td£tab_r135tab_r2#547d34tab_r3$td£$b£23.3%$/b£$/td£§-3.3$/td£$/tr£$tr£$td£Vert-e-s$/td£tab_r134tab_r2#26b300tab_r3$td£$b£22.7%$/b£$/td£§+8.1$/td£$/tr£$tr£$td£PS$/td£tab_r124tab_r2#ea546ftab_r3$td£$b£16.0%$/b£$/td£§+0.1$/td£$/tr£$tr£$td£PLR$/td£tab_r120tab_r2#6268AFtab_r3$td£$b£13.6%$/b£$/td£§-6.3$/td£$/tr£$tr£$td£PVL$/td£tab_r113tab_r2#cbd401tab_r3$td£$b£8.9%$/b£$/td£§+5.8$/td£$/tr£$tr£$td£PST-POP$/td£tab_r17tab_r2#792a8ftab_r3$td£$b£4.8%$/b£$/td£§+2.6$/td£$/tr£$tr£$td£Divers$/td£tab_r17tab_r2#bebebetab_r3$td£$b£4.4%$/b£$/td£§+2.3$/td£$/tr£$tr£$td£PEV$/td£tab_r15tab_r2#87bfdctab_r3$td£$b£3.1%$/b£$/td£§-1.3$/td£$/tr£$/table£$br£Bulletins de vote valables: $b£178$/b£$br£Taux de participation: $b£51.8%$/b£ (-5.2%)","tab_h_it$tr£$td£UDC$/td£tab_r135tab_r2#547d34tab_r3$td£$b£23.3%$/b£$/td£§-3.3$/td£$/tr£$tr£$td£Verdi$/td£tab_r134tab_r2#26b300tab_r3$td£$b£22.7%$/b£$/td£§+8.1$/td£$/tr£$tr£$td£PS$/td£tab_r124tab_r2#ea546ftab_r3$td£$b£16.0%$/b£$/td£§+0.1$/td£$/tr£$tr£$td£PLR$/td£tab_r120tab_r2#6268AFtab_r3$td£$b£13.6%$/b£$/td£§-6.3$/td£$/tr£$tr£$td£PVL$/td£tab_r113tab_r2#cbd401tab_r3$td£$b£8.9%$/b£$/td£§+5.8$/td£$/tr£$tr£$td£POP$/td£tab_r17tab_r2#792a8ftab_r3$td£$b£4.8%$/b£$/td£§+2.6$/td£$/tr£$tr£$td£altro$/td£tab_r17tab_r2#bebebetab_r3$td£$b£4.4%$/b£$/td£§+2.3$/td£$/tr£$tr£$td£PEV$/td£tab_r15tab_r2#87bfdctab_r3$td£$b£3.1%$/b£$/td£§-1.3$/td£$/tr£$/table£$br£Schede elettorali valide: $b£178$/b£$br£Tasso di partecipazione: $b£51.8%$/b£ (-5.2%)","SVP"
