"ID","Gemeinde_de","Gemeinde_fr","Gemeinde_it","Text_de","Text_fr","Text_it","Tabelle_de","Tabelle_fr","Tabelle_it","Staerkste_Partei"
6435,"La Chaux-du-Milieu NE","La Chaux-du-Milieu (NE)","La Chaux-du-Milieu NE","In  La Chaux-du-Milieu steht die <b>Grünen</b> mit 164 Stimmen an erster Stelle. Dahinter folgen die <b>Grünen</b> mit 150 Stimmen und die <b>Grünen</b> mit 133 Stimmen.<br><br>","Le podium de La Chaux-du-Milieu est constitué des <b>Vert-e-s</b> (164 voix), des <b>Vert-e-s</b> (150 voix) et des <b>Vert-e-s</b> (133 voix).<br><br>","La maggior parte dei voti sono distribuiti tra <b>Verdi</b>, <b>Verdi</b> e <b>Verdi</b> a La Chaux-du-Milieu. Ricevono rispettivamente 164, 150 e 133 voti.<br><br>","tab_h$tr£$td£PdA$/td£tab_r133tab_r2#792a8ftab_r3$td£$b£21.7%$/b£$/td£§+0.5$/td£$/tr£$tr£$td£FDP$/td£tab_r130tab_r2#6268AFtab_r3$td£$b£19.9%$/b£$/td£§-0.5$/td£$/tr£$tr£$td£Grüne$/td£tab_r126tab_r2#26b300tab_r3$td£$b£17.6%$/b£$/td£§+13.1$/td£$/tr£$tr£$td£SVP$/td£tab_r123tab_r2#547d34tab_r3$td£$b£15.2%$/b£$/td£§-12.3$/td£$/tr£$tr£$td£SP$/td£tab_r115tab_r2#ea546ftab_r3$td£$b£9.9%$/b£$/td£§-9.8$/td£$/tr£$tr£$td£GLP$/td£tab_r113tab_r2#cbd401tab_r3$td£$b£8.6%$/b£$/td£§+7.2$/td£$/tr£$tr£$td£Mitte$/td£tab_r111tab_r2#f39f5etab_r3$td£$b£7.0%$/b£$/td£§+4.4$/td£$/tr£$/table£$br£Gültige Wahlzettel: $b£192$/b£$br£Wahlbeteiligung: $b£51.9%$/b£ (-1.8%)","tab_h_fr$tr£$td£PST-POP$/td£tab_r133tab_r2#792a8ftab_r3$td£$b£21.7%$/b£$/td£§+0.5$/td£$/tr£$tr£$td£PLR$/td£tab_r130tab_r2#6268AFtab_r3$td£$b£19.9%$/b£$/td£§-0.5$/td£$/tr£$tr£$td£Vert-e-s$/td£tab_r126tab_r2#26b300tab_r3$td£$b£17.6%$/b£$/td£§+13.1$/td£$/tr£$tr£$td£UDC$/td£tab_r123tab_r2#547d34tab_r3$td£$b£15.2%$/b£$/td£§-12.3$/td£$/tr£$tr£$td£PS$/td£tab_r115tab_r2#ea546ftab_r3$td£$b£9.9%$/b£$/td£§-9.8$/td£$/tr£$tr£$td£PVL$/td£tab_r113tab_r2#cbd401tab_r3$td£$b£8.6%$/b£$/td£§+7.2$/td£$/tr£$tr£$td£Centre$/td£tab_r111tab_r2#f39f5etab_r3$td£$b£7.0%$/b£$/td£§+4.4$/td£$/tr£$/table£$br£Bulletins de vote valables: $b£192$/b£$br£Taux de participation: $b£51.9%$/b£ (-1.8%)","tab_h_it$tr£$td£POP$/td£tab_r133tab_r2#792a8ftab_r3$td£$b£21.7%$/b£$/td£§+0.5$/td£$/tr£$tr£$td£PLR$/td£tab_r130tab_r2#6268AFtab_r3$td£$b£19.9%$/b£$/td£§-0.5$/td£$/tr£$tr£$td£Verdi$/td£tab_r126tab_r2#26b300tab_r3$td£$b£17.6%$/b£$/td£§+13.1$/td£$/tr£$tr£$td£UDC$/td£tab_r123tab_r2#547d34tab_r3$td£$b£15.2%$/b£$/td£§-12.3$/td£$/tr£$tr£$td£PS$/td£tab_r115tab_r2#ea546ftab_r3$td£$b£9.9%$/b£$/td£§-9.8$/td£$/tr£$tr£$td£PVL$/td£tab_r113tab_r2#cbd401tab_r3$td£$b£8.6%$/b£$/td£§+7.2$/td£$/tr£$tr£$td£Centro$/td£tab_r111tab_r2#f39f5etab_r3$td£$b£7.0%$/b£$/td£§+4.4$/td£$/tr£$/table£$br£Schede elettorali valide: $b£192$/b£$br£Tasso di partecipazione: $b£51.9%$/b£ (-1.8%)","PdA"
6436,"Le Locle NE","Le Locle (NE)","Le Locle NE","Die <b>Grünen</b> können ihre Position als dominierende politische Kraft in Le Locle beibehalten, mit einem Wähleranteil von 33,3 Prozent (+1,1 Prozentpunkte).<br><br>Zweitstärkste Partei sind die <b>Grünen</b> mit 18,2 Prozent (-1,4 Prozentpunkte gegenüber 2019).<br><br>Die <b>Grünen</b> verzeichnen einen deutlichen Zuwachs. Die Partei belegt nun den dritten Platz in der Gemeinde und erreicht neu einen Wähleranteil von 16,4 Prozent. Das sind +8,4 Prozentpunkte mehr als im Vergleich bei den letzten Wahlen.","Aucune formation politique ne parvient à prendre la place de numéro un aux <b>Vert-e-s</b> au Locle. Le parti obtient 33,3 pour cent des suffrages (+1,1 points de pourcentage).<br><br>Les <b>Vert-e-s</b> se classent deuxième. Il obtient 18,2 pour cent des suffrages (-1,4 points de pourcentage) dans la commune.<br><br>Les <b>Vert-e-s</b> ont nettement progressé. Le parti devient la troisième force électorale de la commune et obtient 16,4 pour cent des voix, ce qui correspond à une augmentation de +8,4 points de pourcentage par rapport à 2019.","Il partito <b>Verdi</b> è imbattuto a Le Locle, dove ha ottenuto il 33,3 percento dei voti (#Party_change punti percentuali).<br><br>Il partito <b>Verdi</b> arriva in seconda posizione nel comune con una percentuale di votanti del 18,2 (-1,4 punti percentuali).<br><br>Il partito <b>Verdi</b> registra una forte crescita. Ora si classifica terzo nel comune e riceve il 16,4 percento dei voti, ovvero +8,4 punti percentuali in più rispetto al 2019.","tab_h$tr£$td£PdA$/td£tab_r150tab_r2#792a8ftab_r3$td£$b£33.3%$/b£$/td£§+1.1$/td£$/tr£$tr£$td£FDP$/td£tab_r127tab_r2#6268AFtab_r3$td£$b£18.2%$/b£$/td£§-1.4$/td£$/tr£$tr£$td£Grüne$/td£tab_r125tab_r2#26b300tab_r3$td£$b£16.4%$/b£$/td£§+8.4$/td£$/tr£$tr£$td£SVP$/td£tab_r118tab_r2#547d34tab_r3$td£$b£11.8%$/b£$/td£§-4.0$/td£$/tr£$tr£$td£SP$/td£tab_r117tab_r2#ea546ftab_r3$td£$b£11.6%$/b£$/td£§-6.0$/td£$/tr£$tr£$td£GLP$/td£tab_r17tab_r2#cbd401tab_r3$td£$b£4.6%$/b£$/td£§+2.7$/td£$/tr£$tr£$td£Mitte$/td£tab_r16tab_r2#f39f5etab_r3$td£$b£3.9%$/b£$/td£§+1.3$/td£$/tr£$/table£$br£Gültige Wahlzettel: $b£2'399$/b£$br£Wahlbeteiligung: $b£38.4%$/b£ (-1.3%)","tab_h_fr$tr£$td£PST-POP$/td£tab_r150tab_r2#792a8ftab_r3$td£$b£33.3%$/b£$/td£§+1.1$/td£$/tr£$tr£$td£PLR$/td£tab_r127tab_r2#6268AFtab_r3$td£$b£18.2%$/b£$/td£§-1.4$/td£$/tr£$tr£$td£Vert-e-s$/td£tab_r125tab_r2#26b300tab_r3$td£$b£16.4%$/b£$/td£§+8.4$/td£$/tr£$tr£$td£UDC$/td£tab_r118tab_r2#547d34tab_r3$td£$b£11.8%$/b£$/td£§-4.0$/td£$/tr£$tr£$td£PS$/td£tab_r117tab_r2#ea546ftab_r3$td£$b£11.6%$/b£$/td£§-6.0$/td£$/tr£$tr£$td£PVL$/td£tab_r17tab_r2#cbd401tab_r3$td£$b£4.6%$/b£$/td£§+2.7$/td£$/tr£$tr£$td£Centre$/td£tab_r16tab_r2#f39f5etab_r3$td£$b£3.9%$/b£$/td£§+1.3$/td£$/tr£$/table£$br£Bulletins de vote valables: $b£2'399$/b£$br£Taux de participation: $b£38.4%$/b£ (-1.3%)","tab_h_it$tr£$td£POP$/td£tab_r150tab_r2#792a8ftab_r3$td£$b£33.3%$/b£$/td£§+1.1$/td£$/tr£$tr£$td£PLR$/td£tab_r127tab_r2#6268AFtab_r3$td£$b£18.2%$/b£$/td£§-1.4$/td£$/tr£$tr£$td£Verdi$/td£tab_r125tab_r2#26b300tab_r3$td£$b£16.4%$/b£$/td£§+8.4$/td£$/tr£$tr£$td£UDC$/td£tab_r118tab_r2#547d34tab_r3$td£$b£11.8%$/b£$/td£§-4.0$/td£$/tr£$tr£$td£PS$/td£tab_r117tab_r2#ea546ftab_r3$td£$b£11.6%$/b£$/td£§-6.0$/td£$/tr£$tr£$td£PVL$/td£tab_r17tab_r2#cbd401tab_r3$td£$b£4.6%$/b£$/td£§+2.7$/td£$/tr£$tr£$td£Centro$/td£tab_r16tab_r2#f39f5etab_r3$td£$b£3.9%$/b£$/td£§+1.3$/td£$/tr£$/table£$br£Schede elettorali valide: $b£2'399$/b£$br£Tasso di partecipazione: $b£38.4%$/b£ (-1.3%)","PdA"
6437,"Les Ponts-de-Martel NE","Les Ponts-de-Martel (NE)","Les Ponts-de-Martel NE","Mit einem grossen Sprung von +6,6 Prozentpunkten sind die <b>Grünen</b> neu die stärkste Partei in Les Ponts-de-Martel. Die Partei erhält 29,7 Prozent der Wählerstimmen.<br><br>Die <b>Grünen</b> belegen in der Gemeinde den zweiten Platz mit einem Wählerstimmenanteil von 27,8 Prozent (-1,8 Prozentpunkte).<br><br>Mit einem deutlichen Anstieg von +7,2 Prozentpunkten gegenüber den letzten Wahlen können sich die <b>Grünen</b> ihren Platz als drittgrösste Partei in der Gemeinde sichern. Der Wähleranteil liegt nun bei zwölf Prozent.","Les <b>Vert-e-s</b> réalisent un bond un avant (+6,6 points de pourcentage). Le voilà le parti le plus fort des Ponts-de-Martel, avec 29,7 pour centage des voix.<br><br>Les <b>Vert-e-s</b> arrivent en deuxième position dans la commune, avec un pourcentage de votants de 27,8 (-1,8 points de pourcentage)<br><br>Les <b>Vert-e-s</b> ont nettement progressé. Le parti devient la troisième force électorale de la commune et obtient douze pour cent des voix, ce qui correspond à une augmentation de +7,2 points de pourcentage par rapport à 2019.","Il partito <b>Verdi</b> aumenta significativamente la sua percentuale di voti a Les Ponts-de-Martel (+6,6 punti percentuali), diventando così la formazione più forte. Alla fine ottiene il 29,7 percento dei voti degli elettori.<br><br>Il partito <b>Verdi</b> è il secondo partito più forte a Les Ponts-de-Martel. Si è migliorato di -1,8 punti percentuali rispetto alle elezioni per il Consiglio nazionale del 2019.<br><br>Grazie a un notevole aumento di +7,2 punti percentuali rispetto alle ultime elezioni federali, il partito <b>Verdi</b> raggiunge il terzo posto nel comune. Ora ha una percentuale di elettori del dodici percento.","tab_h$tr£$td£FDP$/td£tab_r145tab_r2#6268AFtab_r3$td£$b£29.7%$/b£$/td£§+6.6$/td£$/tr£$tr£$td£SVP$/td£tab_r142tab_r2#547d34tab_r3$td£$b£27.8%$/b£$/td£§-1.8$/td£$/tr£$tr£$td£Grüne$/td£tab_r118tab_r2#26b300tab_r3$td£$b£12.0%$/b£$/td£§+7.2$/td£$/tr£$tr£$td£PdA$/td£tab_r117tab_r2#792a8ftab_r3$td£$b£11.6%$/b£$/td£§+3.8$/td£$/tr£$tr£$td£SP$/td£tab_r115tab_r2#ea546ftab_r3$td£$b£9.7%$/b£$/td£§-19.4$/td£$/tr£$tr£$td£GLP$/td£tab_r17tab_r2#cbd401tab_r3$td£$b£4.7%$/b£$/td£§+3.7$/td£$/tr£$tr£$td£Mitte$/td£tab_r17tab_r2#f39f5etab_r3$td£$b£4.5%$/b£$/td£§+1.9$/td£$/tr£$/table£$br£Gültige Wahlzettel: $b£494$/b£$br£Wahlbeteiligung: $b£50.5%$/b£ (-2.1%)","tab_h_fr$tr£$td£PLR$/td£tab_r145tab_r2#6268AFtab_r3$td£$b£29.7%$/b£$/td£§+6.6$/td£$/tr£$tr£$td£UDC$/td£tab_r142tab_r2#547d34tab_r3$td£$b£27.8%$/b£$/td£§-1.8$/td£$/tr£$tr£$td£Vert-e-s$/td£tab_r118tab_r2#26b300tab_r3$td£$b£12.0%$/b£$/td£§+7.2$/td£$/tr£$tr£$td£PST-POP$/td£tab_r117tab_r2#792a8ftab_r3$td£$b£11.6%$/b£$/td£§+3.8$/td£$/tr£$tr£$td£PS$/td£tab_r115tab_r2#ea546ftab_r3$td£$b£9.7%$/b£$/td£§-19.4$/td£$/tr£$tr£$td£PVL$/td£tab_r17tab_r2#cbd401tab_r3$td£$b£4.7%$/b£$/td£§+3.7$/td£$/tr£$tr£$td£Centre$/td£tab_r17tab_r2#f39f5etab_r3$td£$b£4.5%$/b£$/td£§+1.9$/td£$/tr£$/table£$br£Bulletins de vote valables: $b£494$/b£$br£Taux de participation: $b£50.5%$/b£ (-2.1%)","tab_h_it$tr£$td£PLR$/td£tab_r145tab_r2#6268AFtab_r3$td£$b£29.7%$/b£$/td£§+6.6$/td£$/tr£$tr£$td£UDC$/td£tab_r142tab_r2#547d34tab_r3$td£$b£27.8%$/b£$/td£§-1.8$/td£$/tr£$tr£$td£Verdi$/td£tab_r118tab_r2#26b300tab_r3$td£$b£12.0%$/b£$/td£§+7.2$/td£$/tr£$tr£$td£POP$/td£tab_r117tab_r2#792a8ftab_r3$td£$b£11.6%$/b£$/td£§+3.8$/td£$/tr£$tr£$td£PS$/td£tab_r115tab_r2#ea546ftab_r3$td£$b£9.7%$/b£$/td£§-19.4$/td£$/tr£$tr£$td£PVL$/td£tab_r17tab_r2#cbd401tab_r3$td£$b£4.7%$/b£$/td£§+3.7$/td£$/tr£$tr£$td£Centro$/td£tab_r17tab_r2#f39f5etab_r3$td£$b£4.5%$/b£$/td£§+1.9$/td£$/tr£$/table£$br£Schede elettorali valide: $b£494$/b£$br£Tasso di partecipazione: $b£50.5%$/b£ (-2.1%)","FDP"
6451,"Cornaux NE","Cornaux (NE)","Cornaux NE","In Cornaux bleiben die <b>Grünen</b> die stimmenstärkste Partei. Die Partei holte 28,3 Prozent aller Stimmen (-2,2 Prozentpunkte).<br><br>Zweitstärkste Partei sind die <b>Grünen</b> mit 19,1 Prozent (-1,4 Prozentpunkte gegenüber 2019).<br><br>Die <b>Grünen</b> müssen sich sich mit dem dritten Platz begnügen. Die Partei erreicht nur noch 18,3 Prozent der Stimmen und damit -11,9 Prozentpunkte weniger als vor vier Jahren.","Les <b>Vert-e-s</b> maintiennent leur position de première force politique dans la commune de Cornaux. Le parti récolte 28,3 pour cent des suffrages (-2,2 points de pourcentage).<br><br>Les <b>Vert-e-s</b> se classent deuxième. Il obtient 19,1 pour cent des suffrages (-1,4 points de pourcentage) dans la commune.<br><br>Les <b>Vert-e-s</b> perdent -11,9 points de pourcentage. Il n'arrive plus qu'en troisième position avec 18,3 pour cent des voix.","Gli elettori di Cornaux non hanno cambiato idea dal 2019. Il partito <b>Verdi</b> rimane il più forte nel loro comune, con il 28,3 percento dei voti (-2,2 punti percentuali).<br><br>Un aumento significativo di -1,4 punti percentuali permette al partito <b>Verdi</b> di diventare il secondo partito del suo comune. Il partito raccoglie il 19,1 percento dei voti.<br><br>Il partito <b>Verdi</b> perde -11,9 punti percentuali e si classifica ora al terzo posto con il 18,3 percento dei voti.","tab_h$tr£$td£FDP$/td£tab_r142tab_r2#6268AFtab_r3$td£$b£28.3%$/b£$/td£§-2.2$/td£$/tr£$tr£$td£SP$/td£tab_r129tab_r2#ea546ftab_r3$td£$b£19.1%$/b£$/td£§-1.4$/td£$/tr£$tr£$td£SVP$/td£tab_r127tab_r2#547d34tab_r3$td£$b£18.3%$/b£$/td£§-11.9$/td£$/tr£$tr£$td£Grüne$/td£tab_r127tab_r2#26b300tab_r3$td£$b£17.8%$/b£$/td£§+12.4$/td£$/tr£$tr£$td£PdA$/td£tab_r111tab_r2#792a8ftab_r3$td£$b£7.0%$/b£$/td£§+2.2$/td£$/tr£$tr£$td£GLP$/td£tab_r19tab_r2#cbd401tab_r3$td£$b£5.9%$/b£$/td£§+4.3$/td£$/tr£$tr£$td£Mitte$/td£tab_r15tab_r2#f39f5etab_r3$td£$b£3.3%$/b£$/td£§-1.1$/td£$/tr£$/table£$br£Gültige Wahlzettel: $b£378$/b£$br£Wahlbeteiligung: $b£38.1%$/b£ (-6.0%)","tab_h_fr$tr£$td£PLR$/td£tab_r142tab_r2#6268AFtab_r3$td£$b£28.3%$/b£$/td£§-2.2$/td£$/tr£$tr£$td£PS$/td£tab_r129tab_r2#ea546ftab_r3$td£$b£19.1%$/b£$/td£§-1.4$/td£$/tr£$tr£$td£UDC$/td£tab_r127tab_r2#547d34tab_r3$td£$b£18.3%$/b£$/td£§-11.9$/td£$/tr£$tr£$td£Vert-e-s$/td£tab_r127tab_r2#26b300tab_r3$td£$b£17.8%$/b£$/td£§+12.4$/td£$/tr£$tr£$td£PST-POP$/td£tab_r111tab_r2#792a8ftab_r3$td£$b£7.0%$/b£$/td£§+2.2$/td£$/tr£$tr£$td£PVL$/td£tab_r19tab_r2#cbd401tab_r3$td£$b£5.9%$/b£$/td£§+4.3$/td£$/tr£$tr£$td£Centre$/td£tab_r15tab_r2#f39f5etab_r3$td£$b£3.3%$/b£$/td£§-1.1$/td£$/tr£$/table£$br£Bulletins de vote valables: $b£378$/b£$br£Taux de participation: $b£38.1%$/b£ (-6.0%)","tab_h_it$tr£$td£PLR$/td£tab_r142tab_r2#6268AFtab_r3$td£$b£28.3%$/b£$/td£§-2.2$/td£$/tr£$tr£$td£PS$/td£tab_r129tab_r2#ea546ftab_r3$td£$b£19.1%$/b£$/td£§-1.4$/td£$/tr£$tr£$td£UDC$/td£tab_r127tab_r2#547d34tab_r3$td£$b£18.3%$/b£$/td£§-11.9$/td£$/tr£$tr£$td£Verdi$/td£tab_r127tab_r2#26b300tab_r3$td£$b£17.8%$/b£$/td£§+12.4$/td£$/tr£$tr£$td£POP$/td£tab_r111tab_r2#792a8ftab_r3$td£$b£7.0%$/b£$/td£§+2.2$/td£$/tr£$tr£$td£PVL$/td£tab_r19tab_r2#cbd401tab_r3$td£$b£5.9%$/b£$/td£§+4.3$/td£$/tr£$tr£$td£Centro$/td£tab_r15tab_r2#f39f5etab_r3$td£$b£3.3%$/b£$/td£§-1.1$/td£$/tr£$/table£$br£Schede elettorali valide: $b£378$/b£$br£Tasso di partecipazione: $b£38.1%$/b£ (-6.0%)","FDP"
6452,"Cressier NE","Cressier (NE)","Cressier NE","In Cressier NE verlieren die <b>Grünen</b> zwar deutlich an Stimmen. Die Partei bleibt aber dennoch die stärkste Kraft und kommt neu auf einen Wähleranteil von 29,1 Prozent (-10,9 Prozentpunkte).<br><br>Mit einer markanten Verbesserung um +14,9 Prozentpunkte sind die <b>Grünen</b> die zweitstärkste Kraft in der Gemeinde. Der Wählerstimmenanteil der Partei liegt neu bei 19,9 Prozent.<br><br>Die <b>Grünen</b> verlieren -7,2 Prozentpunkte und damit so viele Stimmen, dass die Partei mit einem Wähleranteil von 14,2 Prozent nur noch auf dem dritten Platz landet.","Les <b>Vert-e-s</b> perdent beaucoup de voix à Cressier (NE). Le parti reste néanmoins la force la plus importante et obtient quand même 29,1 des voix (-10,9 points de pourcentage).<br><br>Les <b>Vert-e-s</b> progressent fortement: le parti améliore son résultat d'il y a quatre ans de +14,9 points de pourcentage et occupe désormais la deuxième place dans la commune. La proportion de voix du parti s'élève désormais à 19,9 pour cent.<br><br>Les <b>Vert-e-s</b>, troisième parti, ont perdu beaucoup de voix. La formation obtient 14,2 pour cent des voix, ce qui représente une perte de -7,2 points de pourcentage.","Il partito <b>Verdi</b> perde molte preferenze a Cressier NE. Tuttavia, rimane la forza più influente e ottiene ancora il 29,1 percento dei voti (-10,9 punti percentuali).<br><br>Il partito <b>Verdi</b> progredisce notevolmente: ha migliorato il suo risultato di quattro anni fa di +14,9 punti percentuali ed è ora al secondo posto nel comune. La proporzione di voti del partito è ora del 19,9 percento.<br><br>Il partito <b>Verdi</b> perde -7,2 punti percentuali e si classifica ora al terzo posto con il 14,2 percento dei voti.","tab_h$tr£$td£FDP$/td£tab_r144tab_r2#6268AFtab_r3$td£$b£29.1%$/b£$/td£§-10.9$/td£$/tr£$tr£$td£Grüne$/td£tab_r130tab_r2#26b300tab_r3$td£$b£19.9%$/b£$/td£§+14.9$/td£$/tr£$tr£$td£SP$/td£tab_r121tab_r2#ea546ftab_r3$td£$b£14.2%$/b£$/td£§-7.2$/td£$/tr£$tr£$td£SVP$/td£tab_r119tab_r2#547d34tab_r3$td£$b£12.5%$/b£$/td£§-3.3$/td£$/tr£$tr£$td£PdA$/td£tab_r114tab_r2#792a8ftab_r3$td£$b£9.2%$/b£$/td£§+3.6$/td£$/tr£$tr£$td£GLP$/td£tab_r113tab_r2#cbd401tab_r3$td£$b£8.5%$/b£$/td£§+7.2$/td£$/tr£$tr£$td£Mitte$/td£tab_r19tab_r2#f39f5etab_r3$td£$b£6.2%$/b£$/td£§-1.0$/td£$/tr£$/table£$br£Gültige Wahlzettel: $b£498$/b£$br£Wahlbeteiligung: $b£43.8%$/b£ (-1.6%)","tab_h_fr$tr£$td£PLR$/td£tab_r144tab_r2#6268AFtab_r3$td£$b£29.1%$/b£$/td£§-10.9$/td£$/tr£$tr£$td£Vert-e-s$/td£tab_r130tab_r2#26b300tab_r3$td£$b£19.9%$/b£$/td£§+14.9$/td£$/tr£$tr£$td£PS$/td£tab_r121tab_r2#ea546ftab_r3$td£$b£14.2%$/b£$/td£§-7.2$/td£$/tr£$tr£$td£UDC$/td£tab_r119tab_r2#547d34tab_r3$td£$b£12.5%$/b£$/td£§-3.3$/td£$/tr£$tr£$td£PST-POP$/td£tab_r114tab_r2#792a8ftab_r3$td£$b£9.2%$/b£$/td£§+3.6$/td£$/tr£$tr£$td£PVL$/td£tab_r113tab_r2#cbd401tab_r3$td£$b£8.5%$/b£$/td£§+7.2$/td£$/tr£$tr£$td£Centre$/td£tab_r19tab_r2#f39f5etab_r3$td£$b£6.2%$/b£$/td£§-1.0$/td£$/tr£$/table£$br£Bulletins de vote valables: $b£498$/b£$br£Taux de participation: $b£43.8%$/b£ (-1.6%)","tab_h_it$tr£$td£PLR$/td£tab_r144tab_r2#6268AFtab_r3$td£$b£29.1%$/b£$/td£§-10.9$/td£$/tr£$tr£$td£Verdi$/td£tab_r130tab_r2#26b300tab_r3$td£$b£19.9%$/b£$/td£§+14.9$/td£$/tr£$tr£$td£PS$/td£tab_r121tab_r2#ea546ftab_r3$td£$b£14.2%$/b£$/td£§-7.2$/td£$/tr£$tr£$td£UDC$/td£tab_r119tab_r2#547d34tab_r3$td£$b£12.5%$/b£$/td£§-3.3$/td£$/tr£$tr£$td£POP$/td£tab_r114tab_r2#792a8ftab_r3$td£$b£9.2%$/b£$/td£§+3.6$/td£$/tr£$tr£$td£PVL$/td£tab_r113tab_r2#cbd401tab_r3$td£$b£8.5%$/b£$/td£§+7.2$/td£$/tr£$tr£$td£Centro$/td£tab_r19tab_r2#f39f5etab_r3$td£$b£6.2%$/b£$/td£§-1.0$/td£$/tr£$/table£$br£Schede elettorali valide: $b£498$/b£$br£Tasso di partecipazione: $b£43.8%$/b£ (-1.6%)","FDP"
6453,"Enges NE","Enges (NE)","Enges NE","Die Stimmberechtigten der Gemeinde  Enges geben am meisten Stimmen den <b>Grünen</b> (104 Stimmen). Dahinter folgen die <b>Grünen</b> (86 Stimmen) und die <b>Grünen</b> (64 Stimmen).<br><br>Aussergewöhnlich ist: Die Gemeinde kann die höchste Wahlbeteiligung des ganzen Kantons verzeichnen: 52,1 Prozent.","Les <b>Vert-e-s</b>, les <b>Vert-e-s</b> et les <b>Vert-e-s</b> sont les trois partis ayant obtenu le plus de votes à Enges. Ils obtiennent respectivement 104, 86 et 64 voix.<br><br>Cette commune enregistre le taux de participation le plus élevé de tout le canton (52,1 pour cent).","Il partito <b>Verdi</b> riceve il maggior numero di voti (104) a Enges. Seguono partito <b>Verdi</b> con 86 voti e partito <b>Verdi</b> con 64 voti.<br><br>Questo comune registra il tasso di partecipazione più alto di tutto il cantone (52,1 percento).","tab_h$tr£$td£Grüne$/td£tab_r140tab_r2#26b300tab_r3$td£$b£26.5%$/b£$/td£§+16.2$/td£$/tr£$tr£$td£FDP$/td£tab_r133tab_r2#6268AFtab_r3$td£$b£21.9%$/b£$/td£§-11.2$/td£$/tr£$tr£$td£SP$/td£tab_r124tab_r2#ea546ftab_r3$td£$b£16.3%$/b£$/td£§-2.2$/td£$/tr£$tr£$td£SVP$/td£tab_r118tab_r2#547d34tab_r3$td£$b£12.2%$/b£$/td£§-7.7$/td£$/tr£$tr£$td£GLP$/td£tab_r118tab_r2#cbd401tab_r3$td£$b£12.2%$/b£$/td£§+3.1$/td£$/tr£$tr£$td£PdA$/td£tab_r111tab_r2#792a8ftab_r3$td£$b£7.1%$/b£$/td£§+3.3$/td£$/tr£$tr£$td£Mitte$/td£tab_r15tab_r2#f39f5etab_r3$td£$b£3.6%$/b£$/td£§+1.1$/td£$/tr£$/table£$br£Gültige Wahlzettel: $b£99$/b£$br£Wahlbeteiligung: $b£52.1%$/b£ (-1.8%)","tab_h_fr$tr£$td£Vert-e-s$/td£tab_r140tab_r2#26b300tab_r3$td£$b£26.5%$/b£$/td£§+16.2$/td£$/tr£$tr£$td£PLR$/td£tab_r133tab_r2#6268AFtab_r3$td£$b£21.9%$/b£$/td£§-11.2$/td£$/tr£$tr£$td£PS$/td£tab_r124tab_r2#ea546ftab_r3$td£$b£16.3%$/b£$/td£§-2.2$/td£$/tr£$tr£$td£UDC$/td£tab_r118tab_r2#547d34tab_r3$td£$b£12.2%$/b£$/td£§-7.7$/td£$/tr£$tr£$td£PVL$/td£tab_r118tab_r2#cbd401tab_r3$td£$b£12.2%$/b£$/td£§+3.1$/td£$/tr£$tr£$td£PST-POP$/td£tab_r111tab_r2#792a8ftab_r3$td£$b£7.1%$/b£$/td£§+3.3$/td£$/tr£$tr£$td£Centre$/td£tab_r15tab_r2#f39f5etab_r3$td£$b£3.6%$/b£$/td£§+1.1$/td£$/tr£$/table£$br£Bulletins de vote valables: $b£99$/b£$br£Taux de participation: $b£52.1%$/b£ (-1.8%)","tab_h_it$tr£$td£Verdi$/td£tab_r140tab_r2#26b300tab_r3$td£$b£26.5%$/b£$/td£§+16.2$/td£$/tr£$tr£$td£PLR$/td£tab_r133tab_r2#6268AFtab_r3$td£$b£21.9%$/b£$/td£§-11.2$/td£$/tr£$tr£$td£PS$/td£tab_r124tab_r2#ea546ftab_r3$td£$b£16.3%$/b£$/td£§-2.2$/td£$/tr£$tr£$td£UDC$/td£tab_r118tab_r2#547d34tab_r3$td£$b£12.2%$/b£$/td£§-7.7$/td£$/tr£$tr£$td£PVL$/td£tab_r118tab_r2#cbd401tab_r3$td£$b£12.2%$/b£$/td£§+3.1$/td£$/tr£$tr£$td£POP$/td£tab_r111tab_r2#792a8ftab_r3$td£$b£7.1%$/b£$/td£§+3.3$/td£$/tr£$tr£$td£Centro$/td£tab_r15tab_r2#f39f5etab_r3$td£$b£3.6%$/b£$/td£§+1.1$/td£$/tr£$/table£$br£Schede elettorali valide: $b£99$/b£$br£Tasso di partecipazione: $b£52.1%$/b£ (-1.8%)","Grüne"
6454,"Hauterive NE","Hauterive (NE)","Hauterive NE","In Hauterive NE bleiben die <b>Grünen</b> die stimmenstärkste Partei. Die Partei holte 34,6 Prozent aller Stimmen (-1,4 Prozentpunkte).<br><br>Mit einer markanten Verbesserung um +10,6 Prozentpunkte sind die <b>Grünen</b> die zweitstärkste Kraft in der Gemeinde. Der Wählerstimmenanteil der Partei liegt neu bei 18,6 Prozent.<br><br>Die <b>Grünen</b> verlieren -6,3 Prozentpunkte und damit so viele Stimmen, dass die Partei mit einem Wähleranteil von 16,2 Prozent nur noch auf dem dritten Platz landet.","Les <b>Vert-e-s</b> restent le parti le plus fort à Hauterive (NE). Le parti remporte 34,6 pour cent des voix (-1,4 points de pourcentage).<br><br>Les <b>Vert-e-s</b> sont le deuxième parti le plus fort à Hauterive (NE). Il s'est amélioré de +10,6 points de pourcentage par rapport aux élections pour le Conseil national de 2019.<br><br>Les <b>Vert-e-s</b> perdent -6,3 points de pourcentage. Il n'arrive plus qu'en troisième position avec 16,2 pour cent des voix.","Il partito <b>Verdi</b> rimane il più forte a Hauterive NE, con il 34,6 percento dei voti (-1,4 punti percentuali).<br><br>Il partito <b>Verdi</b> perde molte preferenze. Il partito registra una diminuzione di +10,6 punti percentuali rispetto alle elezioni del 2019. Nonostante ciò, rimane in seconda posizione con una percentuale di elettori del 18,6 percento.<br><br>Il partito <b>Verdi</b> perde -6,3 punti percentuali e si classifica ora al terzo posto con il 16,2 percento dei voti.","tab_h$tr£$td£FDP$/td£tab_r152tab_r2#6268AFtab_r3$td£$b£34.6%$/b£$/td£§-1.4$/td£$/tr£$tr£$td£Grüne$/td£tab_r128tab_r2#26b300tab_r3$td£$b£18.6%$/b£$/td£§+10.6$/td£$/tr£$tr£$td£SP$/td£tab_r124tab_r2#ea546ftab_r3$td£$b£16.2%$/b£$/td£§-6.3$/td£$/tr£$tr£$td£GLP$/td£tab_r117tab_r2#cbd401tab_r3$td£$b£11.1%$/b£$/td£§+6.6$/td£$/tr£$tr£$td£SVP$/td£tab_r115tab_r2#547d34tab_r3$td£$b£10.0%$/b£$/td£§-7.5$/td£$/tr£$tr£$td£PdA$/td£tab_r111tab_r2#792a8ftab_r3$td£$b£7.0%$/b£$/td£§+1.9$/td£$/tr£$/table£$br£Gültige Wahlzettel: $b£761$/b£$br£Wahlbeteiligung: $b£46.4%$/b£ (-0.8%)","tab_h_fr$tr£$td£PLR$/td£tab_r152tab_r2#6268AFtab_r3$td£$b£34.6%$/b£$/td£§-1.4$/td£$/tr£$tr£$td£Vert-e-s$/td£tab_r128tab_r2#26b300tab_r3$td£$b£18.6%$/b£$/td£§+10.6$/td£$/tr£$tr£$td£PS$/td£tab_r124tab_r2#ea546ftab_r3$td£$b£16.2%$/b£$/td£§-6.3$/td£$/tr£$tr£$td£PVL$/td£tab_r117tab_r2#cbd401tab_r3$td£$b£11.1%$/b£$/td£§+6.6$/td£$/tr£$tr£$td£UDC$/td£tab_r115tab_r2#547d34tab_r3$td£$b£10.0%$/b£$/td£§-7.5$/td£$/tr£$tr£$td£PST-POP$/td£tab_r111tab_r2#792a8ftab_r3$td£$b£7.0%$/b£$/td£§+1.9$/td£$/tr£$/table£$br£Bulletins de vote valables: $b£761$/b£$br£Taux de participation: $b£46.4%$/b£ (-0.8%)","tab_h_it$tr£$td£PLR$/td£tab_r152tab_r2#6268AFtab_r3$td£$b£34.6%$/b£$/td£§-1.4$/td£$/tr£$tr£$td£Verdi$/td£tab_r128tab_r2#26b300tab_r3$td£$b£18.6%$/b£$/td£§+10.6$/td£$/tr£$tr£$td£PS$/td£tab_r124tab_r2#ea546ftab_r3$td£$b£16.2%$/b£$/td£§-6.3$/td£$/tr£$tr£$td£PVL$/td£tab_r117tab_r2#cbd401tab_r3$td£$b£11.1%$/b£$/td£§+6.6$/td£$/tr£$tr£$td£UDC$/td£tab_r115tab_r2#547d34tab_r3$td£$b£10.0%$/b£$/td£§-7.5$/td£$/tr£$tr£$td£POP$/td£tab_r111tab_r2#792a8ftab_r3$td£$b£7.0%$/b£$/td£§+1.9$/td£$/tr£$/table£$br£Schede elettorali valide: $b£761$/b£$br£Tasso di partecipazione: $b£46.4%$/b£ (-0.8%)","FDP"
