"ID","Gemeinde_de","Gemeinde_fr","Gemeinde_it","Text_de","Text_fr","Text_it","Tabelle_de","Tabelle_fr","Tabelle_it","Staerkste_Partei"
6421,"La Chaux-de-Fonds NE","La Chaux-de-Fonds (NE)","La Chaux-de-Fonds NE","Grüne behauptet ihre Position als vorherrschende Partei in La Chaux-de-Fonds. Die Partei verzeichnet einen Wähleranteil von 26,2 Prozent (+2,4 Prozentpunkte).<br><br>Zweitstärkste Partei sind die <b>Grünen</b>. Die Partei verbessert sich gegenüber den Wahlen 2019 um +9,4 Prozentpunkte deutlich und weist neu einen Wähleranteil von 21,4 Prozent auf.<br><br>Viele Wählerstimmen eingebüsst hat die drittplatzierte Grüne. Die Partei holt noch 15,6 Prozent, was einen Verlust von -6,7 Prozentpunkte bedeutet.","Les électeurs de La Chaux-de-Fonds maintiennent leur confiance aux <b>Vert-e-s</b>, qui terminent en tête dans leur commune, comme en 2019, avec 26,2 pour cent des voix (+2,4 points de pourcentage).<br><br>Les <b>Vert-e-s</b> progressent fortement: le parti améliore son résultat d'il y a quatre ans de +9,4 points de pourcentage et occupe désormais la deuxième place dans la commune. La proportion de voix du parti s'élève désormais à 21,4 pour cent.<br><br>Les <b>Vert-e-s</b> perdent -6,7 points de pourcentage. Il n'arrive plus qu'en troisième position avec 15,6 pour cent des voix.","Gli elettori di La Chaux-de-Fonds mantengono la loro fiducia nel partito <b>Verdi</b>, che risulta il primo nel loro comune, come nel 2019, con il 26,2 percento dei voti (+2,4 punti percentuali).<br><br>Il partito <b>Verdi</b> perde molte preferenze. Il partito registra una diminuzione di +9,4 punti percentuali rispetto alle elezioni del 2019. Nonostante ciò, rimane in seconda posizione con una percentuale di elettori del 21,4 percento.<br><br>Il partito <b>Verdi</b> perde -6,7 punti percentuali e si classifica ora al terzo posto con il 15,6 percento dei voti.","tab_h$tr£$td£PdA$/td£tab_r139tab_r2#792a8ftab_r3$td£$b£26.2%$/b£$/td£§+2.4$/td£$/tr£$tr£$td£Grüne$/td£tab_r132tab_r2#26b300tab_r3$td£$b£21.4%$/b£$/td£§+9.4$/td£$/tr£$tr£$td£SP$/td£tab_r123tab_r2#ea546ftab_r3$td£$b£15.6%$/b£$/td£§-6.7$/td£$/tr£$tr£$td£FDP$/td£tab_r120tab_r2#6268AFtab_r3$td£$b£13.5%$/b£$/td£§+1.0$/td£$/tr£$tr£$td£SVP$/td£tab_r118tab_r2#547d34tab_r3$td£$b£12.0%$/b£$/td£§-9.5$/td£$/tr£$tr£$td£Mitte$/td£tab_r19tab_r2#f39f5etab_r3$td£$b£6.2%$/b£$/td£§+3.6$/td£$/tr£$tr£$td£GLP$/td£tab_r17tab_r2#cbd401tab_r3$td£$b£4.9%$/b£$/td£§+2.9$/td£$/tr£$/table£$br£Gültige Wahlzettel: $b£8'161$/b£$br£Wahlbeteiligung: $b£37.3%$/b£ (-1.6%)","tab_h_fr$tr£$td£PST-POP$/td£tab_r139tab_r2#792a8ftab_r3$td£$b£26.2%$/b£$/td£§+2.4$/td£$/tr£$tr£$td£Vert-e-s$/td£tab_r132tab_r2#26b300tab_r3$td£$b£21.4%$/b£$/td£§+9.4$/td£$/tr£$tr£$td£PS$/td£tab_r123tab_r2#ea546ftab_r3$td£$b£15.6%$/b£$/td£§-6.7$/td£$/tr£$tr£$td£PLR$/td£tab_r120tab_r2#6268AFtab_r3$td£$b£13.5%$/b£$/td£§+1.0$/td£$/tr£$tr£$td£UDC$/td£tab_r118tab_r2#547d34tab_r3$td£$b£12.0%$/b£$/td£§-9.5$/td£$/tr£$tr£$td£Centre$/td£tab_r19tab_r2#f39f5etab_r3$td£$b£6.2%$/b£$/td£§+3.6$/td£$/tr£$tr£$td£PVL$/td£tab_r17tab_r2#cbd401tab_r3$td£$b£4.9%$/b£$/td£§+2.9$/td£$/tr£$/table£$br£Bulletins de vote valables: $b£8'161$/b£$br£Taux de participation: $b£37.3%$/b£ (-1.6%)","tab_h_it$tr£$td£POP$/td£tab_r139tab_r2#792a8ftab_r3$td£$b£26.2%$/b£$/td£§+2.4$/td£$/tr£$tr£$td£Verdi$/td£tab_r132tab_r2#26b300tab_r3$td£$b£21.4%$/b£$/td£§+9.4$/td£$/tr£$tr£$td£PS$/td£tab_r123tab_r2#ea546ftab_r3$td£$b£15.6%$/b£$/td£§-6.7$/td£$/tr£$tr£$td£PLR$/td£tab_r120tab_r2#6268AFtab_r3$td£$b£13.5%$/b£$/td£§+1.0$/td£$/tr£$tr£$td£UDC$/td£tab_r118tab_r2#547d34tab_r3$td£$b£12.0%$/b£$/td£§-9.5$/td£$/tr£$tr£$td£Centro$/td£tab_r19tab_r2#f39f5etab_r3$td£$b£6.2%$/b£$/td£§+3.6$/td£$/tr£$tr£$td£PVL$/td£tab_r17tab_r2#cbd401tab_r3$td£$b£4.9%$/b£$/td£§+2.9$/td£$/tr£$/table£$br£Schede elettorali valide: $b£8'161$/b£$br£Tasso di partecipazione: $b£37.3%$/b£ (-1.6%)","PdA"
6422,"Les Planchettes NE","Les Planchettes (NE)","Les Planchettes NE","Die drei führenden Parteien in  Les Planchettes sind die <b>Grünen</b> mit 101 Stimmen, die <b>Grünen</b> mit 59 Stimmen und die <b>Grünen</b> mit 57 Stimmen.<br><br>","Les <b>Vert-e-s</b> sont premier aux Planchettes avec 101 voix. Il est suivi par les <b>Vert-e-s</b> avec 59 voix et les <b>Vert-e-s</b> avec 57 voix.<br><br>","La maggior parte dei voti sono distribuiti tra <b>Verdi</b>, <b>Verdi</b> e <b>Verdi</b> a Les Planchettes. Ricevono rispettivamente 101, 59 e 57 voti.<br><br>","tab_h$tr£$td£SVP$/td£tab_r151tab_r2#547d34tab_r3$td£$b£34.0%$/b£$/td£§+4.6$/td£$/tr£$tr£$td£PdA$/td£tab_r130tab_r2#792a8ftab_r3$td£$b£19.9%$/b£$/td£§+4.0$/td£$/tr£$tr£$td£Grüne$/td£tab_r129tab_r2#26b300tab_r3$td£$b£19.2%$/b£$/td£§+8.4$/td£$/tr£$tr£$td£FDP$/td£tab_r125tab_r2#6268AFtab_r3$td£$b£16.5%$/b£$/td£§-2.4$/td£$/tr£$tr£$td£SP$/td£tab_r19tab_r2#ea546ftab_r3$td£$b£6.1%$/b£$/td£§-12.2$/td£$/tr£$tr£$td£Mitte$/td£tab_r16tab_r2#f39f5etab_r3$td£$b£4.0%$/b£$/td£§+3.4$/td£$/tr£$/table£$br£Gültige Wahlzettel: $b£75$/b£$br£Wahlbeteiligung: $b£51.6%$/b£ (+6.6%)","tab_h_fr$tr£$td£UDC$/td£tab_r151tab_r2#547d34tab_r3$td£$b£34.0%$/b£$/td£§+4.6$/td£$/tr£$tr£$td£PST-POP$/td£tab_r130tab_r2#792a8ftab_r3$td£$b£19.9%$/b£$/td£§+4.0$/td£$/tr£$tr£$td£Vert-e-s$/td£tab_r129tab_r2#26b300tab_r3$td£$b£19.2%$/b£$/td£§+8.4$/td£$/tr£$tr£$td£PLR$/td£tab_r125tab_r2#6268AFtab_r3$td£$b£16.5%$/b£$/td£§-2.4$/td£$/tr£$tr£$td£PS$/td£tab_r19tab_r2#ea546ftab_r3$td£$b£6.1%$/b£$/td£§-12.2$/td£$/tr£$tr£$td£Centre$/td£tab_r16tab_r2#f39f5etab_r3$td£$b£4.0%$/b£$/td£§+3.4$/td£$/tr£$/table£$br£Bulletins de vote valables: $b£75$/b£$br£Taux de participation: $b£51.6%$/b£ (+6.6%)","tab_h_it$tr£$td£UDC$/td£tab_r151tab_r2#547d34tab_r3$td£$b£34.0%$/b£$/td£§+4.6$/td£$/tr£$tr£$td£POP$/td£tab_r130tab_r2#792a8ftab_r3$td£$b£19.9%$/b£$/td£§+4.0$/td£$/tr£$tr£$td£Verdi$/td£tab_r129tab_r2#26b300tab_r3$td£$b£19.2%$/b£$/td£§+8.4$/td£$/tr£$tr£$td£PLR$/td£tab_r125tab_r2#6268AFtab_r3$td£$b£16.5%$/b£$/td£§-2.4$/td£$/tr£$tr£$td£PS$/td£tab_r19tab_r2#ea546ftab_r3$td£$b£6.1%$/b£$/td£§-12.2$/td£$/tr£$tr£$td£Centro$/td£tab_r16tab_r2#f39f5etab_r3$td£$b£4.0%$/b£$/td£§+3.4$/td£$/tr£$/table£$br£Schede elettorali valide: $b£75$/b£$br£Tasso di partecipazione: $b£51.6%$/b£ (+6.6%)","SVP"
6423,"La SagNE","La Sagne (NE)","La SagNE","Die <b>Grünen</b> erhöhen ihren Stimmenanteil in La Sagne um +5,1 Prozentpunkte deutlich und wird damit zur stärksten politischen Kraft. Am Ende holt die Partei 29 Prozent der Wählerstimmen.<br><br>Trotz einem Minus von -9,2 Prozentpunkten gegenüber den Wahlen 2019 belegen die <b>Grünen</b> immer noch den zweiten Platz. Dies dank eines Wähleranteils von 20,7 Prozent.<br><br>Mit einem Wähleranteil von 16,7 Prozent belegen die <b>Grünen</b> den dritten Platz (Veränderung gegenüber 2019: +3,7 Prozentpunkte).","Les <b>Vert-e-s</b> réalisent une forte progression (+5,1 points de pourcentage) Il est désormais le parti le plus fort de La Sagne. Le parti obtient 29 pour centage des voix.<br><br>Les <b>Vert-e-s</b> connaissent un fort recul à La Sagne. Il perd -9,2 points de pourcentage par rapport aux élections pour le Conseil national de 2019 et est désormais le deuxième parti de la commune avec 20,7 pour cent des suffrages.<br><br>Les <b>Vert-e-s</b> complètent le podium. Il récolte 16,7 pour cent des suffrages (+3,7).","Il partito <b>Verdi</b> realizza una forte progressione (+5,1 punti percentuali). Ora è il partito più forte di La Sagne, ottenendo il 29 percento dei voti.<br><br>Nonostante una perdita di -9,2 punti percentuali rispetto alle elezioni del 2019, il partito <b>Verdi</b> occupa ancora il secondo posto. Raccoglie il 20,7 percento dei voti.<br><br>Il partito <b>Verdi</b> si classifica terzo, ottenendo il 16,7 percento dei voti (+3,7 punti percentuali rispetto al 2019).","tab_h$tr£$td£FDP$/td£tab_r143tab_r2#6268AFtab_r3$td£$b£29.0%$/b£$/td£§+5.1$/td£$/tr£$tr£$td£SVP$/td£tab_r131tab_r2#547d34tab_r3$td£$b£20.7%$/b£$/td£§-9.2$/td£$/tr£$tr£$td£PdA$/td£tab_r125tab_r2#792a8ftab_r3$td£$b£16.7%$/b£$/td£§+3.7$/td£$/tr£$tr£$td£Grüne$/td£tab_r123tab_r2#26b300tab_r3$td£$b£15.2%$/b£$/td£§+6.3$/td£$/tr£$tr£$td£SP$/td£tab_r112tab_r2#ea546ftab_r3$td£$b£7.7%$/b£$/td£§-9.0$/td£$/tr£$tr£$td£GLP$/td£tab_r111tab_r2#cbd401tab_r3$td£$b£7.6%$/b£$/td£§+4.7$/td£$/tr£$tr£$td£Mitte$/td£tab_r15tab_r2#f39f5etab_r3$td£$b£3.2%$/b£$/td£§+0.9$/td£$/tr£$/table£$br£Gültige Wahlzettel: $b£377$/b£$br£Wahlbeteiligung: $b£43.6%$/b£ (+0.1%)","tab_h_fr$tr£$td£PLR$/td£tab_r143tab_r2#6268AFtab_r3$td£$b£29.0%$/b£$/td£§+5.1$/td£$/tr£$tr£$td£UDC$/td£tab_r131tab_r2#547d34tab_r3$td£$b£20.7%$/b£$/td£§-9.2$/td£$/tr£$tr£$td£PST-POP$/td£tab_r125tab_r2#792a8ftab_r3$td£$b£16.7%$/b£$/td£§+3.7$/td£$/tr£$tr£$td£Vert-e-s$/td£tab_r123tab_r2#26b300tab_r3$td£$b£15.2%$/b£$/td£§+6.3$/td£$/tr£$tr£$td£PS$/td£tab_r112tab_r2#ea546ftab_r3$td£$b£7.7%$/b£$/td£§-9.0$/td£$/tr£$tr£$td£PVL$/td£tab_r111tab_r2#cbd401tab_r3$td£$b£7.6%$/b£$/td£§+4.7$/td£$/tr£$tr£$td£Centre$/td£tab_r15tab_r2#f39f5etab_r3$td£$b£3.2%$/b£$/td£§+0.9$/td£$/tr£$/table£$br£Bulletins de vote valables: $b£377$/b£$br£Taux de participation: $b£43.6%$/b£ (+0.1%)","tab_h_it$tr£$td£PLR$/td£tab_r143tab_r2#6268AFtab_r3$td£$b£29.0%$/b£$/td£§+5.1$/td£$/tr£$tr£$td£UDC$/td£tab_r131tab_r2#547d34tab_r3$td£$b£20.7%$/b£$/td£§-9.2$/td£$/tr£$tr£$td£POP$/td£tab_r125tab_r2#792a8ftab_r3$td£$b£16.7%$/b£$/td£§+3.7$/td£$/tr£$tr£$td£Verdi$/td£tab_r123tab_r2#26b300tab_r3$td£$b£15.2%$/b£$/td£§+6.3$/td£$/tr£$tr£$td£PS$/td£tab_r112tab_r2#ea546ftab_r3$td£$b£7.7%$/b£$/td£§-9.0$/td£$/tr£$tr£$td£PVL$/td£tab_r111tab_r2#cbd401tab_r3$td£$b£7.6%$/b£$/td£§+4.7$/td£$/tr£$tr£$td£Centro$/td£tab_r15tab_r2#f39f5etab_r3$td£$b£3.2%$/b£$/td£§+0.9$/td£$/tr£$/table£$br£Schede elettorali valide: $b£377$/b£$br£Tasso di partecipazione: $b£43.6%$/b£ (+0.1%)","FDP"
6431,"Les Brenets NE","Les Brenets (NE)","Les Brenets NE","In Les Brenets steht eine neue Partei auf dem Spitzenplatz: Die <b>Grünen</b> holen  22,6 Prozent der Stimmen (-3,4 Prozentpunkte) und verbessert sich damit von Rang zwei auf den ersten Platz.<br><br>Zweitstärkste Partei sind die <b>Grünen</b> mit 22,4 Prozent (-3,7 Prozentpunkte gegenüber 2019).<br><br>Die <b>Grünen</b> sichern sich den dritten Platz, mit einem Wähleranteil von 18,6 Prozent (Veränderung gegenüber 2019: +0,5 Prozentpunkte).","Les préférences des électeurs des Brenets ont changé en quatre ans. Les <b>Vert-e-s</b> obtiennent le plus grand nombre de voix avec 22,6 % (-3,4 points de pourcentage) et passe ainsi du rang deux à la première place.<br><br>Les <b>Vert-e-s</b> se classent deuxième. Il obtient 22,4 pour cent des suffrages (-3,7 points de pourcentage) dans la commune.<br><br>A la troisième place figurent les <b>Vert-e-s</b>, qui réalisent 18,6 pour cent des voix (+0,5).","Il partito <b>Verdi</b> si posiziona al primo posto a Les Brenets. Era al due esimo esimo posto nel 2019. Quest'anno ottiene il 22,6 percento dei voti.<br><br>Il partito <b>Verdi</b> è la seconda formazione più forte con il 22,4 percento dei voti (-3,7 punti percentuali rispetto al 2019).<br><br>Il partito <b>Verdi</b> si classifica terzo, ottenendo il 18,6 percento dei voti (+0,5 punti percentuali rispetto al 2019).","tab_h$tr£$td£PdA$/td£tab_r134tab_r2#792a8ftab_r3$td£$b£22.6%$/b£$/td£§-3.4$/td£$/tr£$tr£$td£SVP$/td£tab_r134tab_r2#547d34tab_r3$td£$b£22.4%$/b£$/td£§-3.7$/td£$/tr£$tr£$td£FDP$/td£tab_r128tab_r2#6268AFtab_r3$td£$b£18.6%$/b£$/td£§+0.5$/td£$/tr£$tr£$td£Grüne$/td£tab_r120tab_r2#26b300tab_r3$td£$b£13.2%$/b£$/td£§+6.0$/td£$/tr£$tr£$td£SP$/td£tab_r119tab_r2#ea546ftab_r3$td£$b£12.6%$/b£$/td£§-1.7$/td£$/tr£$tr£$td£Mitte$/td£tab_r18tab_r2#f39f5etab_r3$td£$b£5.3%$/b£$/td£§+3.2$/td£$/tr£$tr£$td£GLP$/td£tab_r18tab_r2#cbd401tab_r3$td£$b£5.3%$/b£$/td£§+3.8$/td£$/tr£$/table£$br£Gültige Wahlzettel: $b£341$/b£$br£Wahlbeteiligung: $b£42.2%$/b£ (-3.8%)","tab_h_fr$tr£$td£PST-POP$/td£tab_r134tab_r2#792a8ftab_r3$td£$b£22.6%$/b£$/td£§-3.4$/td£$/tr£$tr£$td£UDC$/td£tab_r134tab_r2#547d34tab_r3$td£$b£22.4%$/b£$/td£§-3.7$/td£$/tr£$tr£$td£PLR$/td£tab_r128tab_r2#6268AFtab_r3$td£$b£18.6%$/b£$/td£§+0.5$/td£$/tr£$tr£$td£Vert-e-s$/td£tab_r120tab_r2#26b300tab_r3$td£$b£13.2%$/b£$/td£§+6.0$/td£$/tr£$tr£$td£PS$/td£tab_r119tab_r2#ea546ftab_r3$td£$b£12.6%$/b£$/td£§-1.7$/td£$/tr£$tr£$td£Centre$/td£tab_r18tab_r2#f39f5etab_r3$td£$b£5.3%$/b£$/td£§+3.2$/td£$/tr£$tr£$td£PVL$/td£tab_r18tab_r2#cbd401tab_r3$td£$b£5.3%$/b£$/td£§+3.8$/td£$/tr£$/table£$br£Bulletins de vote valables: $b£341$/b£$br£Taux de participation: $b£42.2%$/b£ (-3.8%)","tab_h_it$tr£$td£POP$/td£tab_r134tab_r2#792a8ftab_r3$td£$b£22.6%$/b£$/td£§-3.4$/td£$/tr£$tr£$td£UDC$/td£tab_r134tab_r2#547d34tab_r3$td£$b£22.4%$/b£$/td£§-3.7$/td£$/tr£$tr£$td£PLR$/td£tab_r128tab_r2#6268AFtab_r3$td£$b£18.6%$/b£$/td£§+0.5$/td£$/tr£$tr£$td£Verdi$/td£tab_r120tab_r2#26b300tab_r3$td£$b£13.2%$/b£$/td£§+6.0$/td£$/tr£$tr£$td£PS$/td£tab_r119tab_r2#ea546ftab_r3$td£$b£12.6%$/b£$/td£§-1.7$/td£$/tr£$tr£$td£Centro$/td£tab_r18tab_r2#f39f5etab_r3$td£$b£5.3%$/b£$/td£§+3.2$/td£$/tr£$tr£$td£PVL$/td£tab_r18tab_r2#cbd401tab_r3$td£$b£5.3%$/b£$/td£§+3.8$/td£$/tr£$/table£$br£Schede elettorali valide: $b£341$/b£$br£Tasso di partecipazione: $b£42.2%$/b£ (-3.8%)","PdA"
6432,"La BréviNE","La Brévine (NE)","La BréviNE","Die <b>Grünen</b> erhöhen ihren Stimmenanteil in La Brévine um +18,8 Prozentpunkte deutlich und wird damit zur stärksten politischen Kraft. Am Ende holt die Partei 40,5 Prozent der Wählerstimmen.<br><br>Trotz einem Minus von -17,9 Prozentpunkten gegenüber den Wahlen 2019 belegen die <b>Grünen</b> immer noch den zweiten Platz. Dies dank eines Wähleranteils von 30,8 Prozent.<br><br>Der dritte Platz geht and die <b>Grünen</b>. Die Partei erreicht 9,2 Prozent der Stimmen (Veränderung von -0,8 Prozentpunkten gegenüber 2019).","Les <b>Vert-e-s</b> réalisent un bond un avant (+18,8 points de pourcentage). Le voilà le parti le plus fort de La Brévine, avec 40,5 pour centage des voix.<br><br>Malgré un recul de -17,9 points de pourcentage par rapport aux élections de 2019, les <b>Vert-e-s</b> occupent toujours la deuxième place. Il engrange 30,8 pour cent des voix.<br><br>Les <b>Vert-e-s</b> se classent troisième. Il obtient 9,2 pour cent des voix (-0,8 points de pourcentage par rapport à 2019).","Il partito <b>Verdi</b> realizza una forte progressione (+18,8 punti percentuali). Ora è il partito più forte di La Brévine, ottenendo il 40,5 percento dei voti.<br><br>Il partito <b>Verdi</b> perde molti voti, registrando una perdita di -17,9 punti percentuali rispetto alle elezioni del 2019. Nonostante ciò, rimane in seconda posizione con una quota di elettori del 30,8 percento.<br><br>La terza posizione è occupata dal partito <b>Verdi</b>. Ottiene una percentuale di elettori del il 9,2. (-0,8 punti percentuali di differenza rispetto al 2019).","tab_h$tr£$td£FDP$/td£tab_r161tab_r2#6268AFtab_r3$td£$b£40.5%$/b£$/td£§+18.8$/td£$/tr£$tr£$td£SVP$/td£tab_r146tab_r2#547d34tab_r3$td£$b£30.8%$/b£$/td£§-17.9$/td£$/tr£$tr£$td£PdA$/td£tab_r114tab_r2#792a8ftab_r3$td£$b£9.2%$/b£$/td£§-0.8$/td£$/tr£$tr£$td£Grüne$/td£tab_r113tab_r2#26b300tab_r3$td£$b£8.5%$/b£$/td£§+4.4$/td£$/tr£$tr£$td£SP$/td£tab_r18tab_r2#ea546ftab_r3$td£$b£5.3%$/b£$/td£§-6.0$/td£$/tr£$tr£$td£Mitte$/td£tab_r18tab_r2#f39f5etab_r3$td£$b£5.0%$/b£$/td£§+2.2$/td£$/tr£$/table£$br£Gültige Wahlzettel: $b£255$/b£$br£Wahlbeteiligung: $b£49.8%$/b£ (-1.5%)","tab_h_fr$tr£$td£PLR$/td£tab_r161tab_r2#6268AFtab_r3$td£$b£40.5%$/b£$/td£§+18.8$/td£$/tr£$tr£$td£UDC$/td£tab_r146tab_r2#547d34tab_r3$td£$b£30.8%$/b£$/td£§-17.9$/td£$/tr£$tr£$td£PST-POP$/td£tab_r114tab_r2#792a8ftab_r3$td£$b£9.2%$/b£$/td£§-0.8$/td£$/tr£$tr£$td£Vert-e-s$/td£tab_r113tab_r2#26b300tab_r3$td£$b£8.5%$/b£$/td£§+4.4$/td£$/tr£$tr£$td£PS$/td£tab_r18tab_r2#ea546ftab_r3$td£$b£5.3%$/b£$/td£§-6.0$/td£$/tr£$tr£$td£Centre$/td£tab_r18tab_r2#f39f5etab_r3$td£$b£5.0%$/b£$/td£§+2.2$/td£$/tr£$/table£$br£Bulletins de vote valables: $b£255$/b£$br£Taux de participation: $b£49.8%$/b£ (-1.5%)","tab_h_it$tr£$td£PLR$/td£tab_r161tab_r2#6268AFtab_r3$td£$b£40.5%$/b£$/td£§+18.8$/td£$/tr£$tr£$td£UDC$/td£tab_r146tab_r2#547d34tab_r3$td£$b£30.8%$/b£$/td£§-17.9$/td£$/tr£$tr£$td£POP$/td£tab_r114tab_r2#792a8ftab_r3$td£$b£9.2%$/b£$/td£§-0.8$/td£$/tr£$tr£$td£Verdi$/td£tab_r113tab_r2#26b300tab_r3$td£$b£8.5%$/b£$/td£§+4.4$/td£$/tr£$tr£$td£PS$/td£tab_r18tab_r2#ea546ftab_r3$td£$b£5.3%$/b£$/td£§-6.0$/td£$/tr£$tr£$td£Centro$/td£tab_r18tab_r2#f39f5etab_r3$td£$b£5.0%$/b£$/td£§+2.2$/td£$/tr£$/table£$br£Schede elettorali valide: $b£255$/b£$br£Tasso di partecipazione: $b£49.8%$/b£ (-1.5%)","FDP"
6433,"Brot-Plamboz NE","Brot-Plamboz (NE)","Brot-Plamboz NE","Die Wählerinnen und Wähler von  Brot-Plamboz stimmen am meisten für die <b>Grünen</b> (123 Stimmen), gefolgt von den <b>Grünen</b> (117 Stimmen) und den <b>Grünen</b> (39 Stimmen).<br><br>","Le podium de Brot-Plamboz est constitué des <b>Vert-e-s</b> (123 voix), des <b>Vert-e-s</b> (117 voix) et des <b>Vert-e-s</b> (39 voix).<br><br>","Il partito <b>Verdi</b> riceve il maggior numero di voti (123) a Brot-Plamboz. È seguito dal partito <b>Verdi</b> (117 voti) e dal partito <b>Verdi</b> (39).<br><br>","tab_h$tr£$td£FDP$/td£tab_r148tab_r2#6268AFtab_r3$td£$b£31.9%$/b£$/td£§+5.3$/td£$/tr£$tr£$td£SVP$/td£tab_r146tab_r2#547d34tab_r3$td£$b£30.4%$/b£$/td£§-10.0$/td£$/tr£$tr£$td£PdA$/td£tab_r115tab_r2#792a8ftab_r3$td£$b£10.1%$/b£$/td£§+4.2$/td£$/tr£$tr£$td£Grüne$/td£tab_r114tab_r2#26b300tab_r3$td£$b£9.4%$/b£$/td£§+4.0$/td£$/tr£$tr£$td£Mitte$/td£tab_r113tab_r2#f39f5etab_r3$td£$b£8.6%$/b£$/td£§+3.8$/td£$/tr£$tr£$td£SP$/td£tab_r18tab_r2#ea546ftab_r3$td£$b£5.5%$/b£$/td£§-8.0$/td£$/tr£$tr£$td£GLP$/td£tab_r16tab_r2#cbd401tab_r3$td£$b£4.2%$/b£$/td£§+3.8$/td£$/tr£$/table£$br£Gültige Wahlzettel: $b£97$/b£$br£Wahlbeteiligung: $b£46.9%$/b£ (-16.2%)","tab_h_fr$tr£$td£PLR$/td£tab_r148tab_r2#6268AFtab_r3$td£$b£31.9%$/b£$/td£§+5.3$/td£$/tr£$tr£$td£UDC$/td£tab_r146tab_r2#547d34tab_r3$td£$b£30.4%$/b£$/td£§-10.0$/td£$/tr£$tr£$td£PST-POP$/td£tab_r115tab_r2#792a8ftab_r3$td£$b£10.1%$/b£$/td£§+4.2$/td£$/tr£$tr£$td£Vert-e-s$/td£tab_r114tab_r2#26b300tab_r3$td£$b£9.4%$/b£$/td£§+4.0$/td£$/tr£$tr£$td£Centre$/td£tab_r113tab_r2#f39f5etab_r3$td£$b£8.6%$/b£$/td£§+3.8$/td£$/tr£$tr£$td£PS$/td£tab_r18tab_r2#ea546ftab_r3$td£$b£5.5%$/b£$/td£§-8.0$/td£$/tr£$tr£$td£PVL$/td£tab_r16tab_r2#cbd401tab_r3$td£$b£4.2%$/b£$/td£§+3.8$/td£$/tr£$/table£$br£Bulletins de vote valables: $b£97$/b£$br£Taux de participation: $b£46.9%$/b£ (-16.2%)","tab_h_it$tr£$td£PLR$/td£tab_r148tab_r2#6268AFtab_r3$td£$b£31.9%$/b£$/td£§+5.3$/td£$/tr£$tr£$td£UDC$/td£tab_r146tab_r2#547d34tab_r3$td£$b£30.4%$/b£$/td£§-10.0$/td£$/tr£$tr£$td£POP$/td£tab_r115tab_r2#792a8ftab_r3$td£$b£10.1%$/b£$/td£§+4.2$/td£$/tr£$tr£$td£Verdi$/td£tab_r114tab_r2#26b300tab_r3$td£$b£9.4%$/b£$/td£§+4.0$/td£$/tr£$tr£$td£Centro$/td£tab_r113tab_r2#f39f5etab_r3$td£$b£8.6%$/b£$/td£§+3.8$/td£$/tr£$tr£$td£PS$/td£tab_r18tab_r2#ea546ftab_r3$td£$b£5.5%$/b£$/td£§-8.0$/td£$/tr£$tr£$td£PVL$/td£tab_r16tab_r2#cbd401tab_r3$td£$b£4.2%$/b£$/td£§+3.8$/td£$/tr£$/table£$br£Schede elettorali valide: $b£97$/b£$br£Tasso di partecipazione: $b£46.9%$/b£ (-16.2%)","FDP"
6434,"Le Cerneux-Péquignot NE","Le Cerneux-Péquignot (NE)","Le Cerneux-Péquignot NE","Die <b>Grünen</b> erhöhen ihren Stimmenanteil in Le Cerneux-Péquignot um +10,8 Prozentpunkte deutlich und wird damit zur stärksten politischen Kraft. Am Ende holt die Partei 40,6 Prozent der Wählerstimmen.<br><br>Mit einer markanten Verbesserung um +6,8 Prozentpunkte sind die <b>Grünen</b> die zweitstärkste Kraft in der Gemeinde. Der Wählerstimmenanteil der Partei liegt neu bei 17,8 Prozent.<br><br>Die <b>Grünen</b> müssen sich sich mit dem dritten Platz begnügen. Die Partei erreicht nur noch 16,1 Prozent der Stimmen und damit -16,3 Prozentpunkte weniger als vor vier Jahren.","Les <b>Vert-e-s</b> réalisent un bond un avant (+10,8 points de pourcentage). Le voilà le parti le plus fort du Cerneux-Péquignot, avec 40,6 pour centage des voix.<br><br>Les <b>Vert-e-s</b> sont le deuxième parti le plus fort au Cerneux-Péquignot. Il s'est amélioré de +6,8 points de pourcentage par rapport aux élections pour le Conseil national de 2019.<br><br>Les <b>Vert-e-s</b> perdent -16,3 points de pourcentage. Il n'arrive plus qu'en troisième position avec 16,1 pour cent des voix.","Il partito <b>Verdi</b> aumenta significativamente la sua percentuale di voti a Le Cerneux-Péquignot (+10,8 punti percentuali), diventando così la formazione più forte. Alla fine ottiene il 40,6 percento dei voti degli elettori.<br><br>Il partito <b>Verdi</b> perde molte preferenze. Il partito registra una diminuzione di +6,8 punti percentuali rispetto alle elezioni del 2019. Nonostante ciò, rimane in seconda posizione con una percentuale di elettori del 17,8 percento.<br><br>Il partito <b>Verdi</b> perde -16,3 punti percentuali e si classifica ora al terzo posto con il 16,1 percento dei voti.","tab_h$tr£$td£FDP$/td£tab_r161tab_r2#6268AFtab_r3$td£$b£40.6%$/b£$/td£§+10.8$/td£$/tr£$tr£$td£PdA$/td£tab_r127tab_r2#792a8ftab_r3$td£$b£17.8%$/b£$/td£§+6.8$/td£$/tr£$tr£$td£SVP$/td£tab_r124tab_r2#547d34tab_r3$td£$b£16.1%$/b£$/td£§-16.3$/td£$/tr£$tr£$td£Grüne$/td£tab_r113tab_r2#26b300tab_r3$td£$b£8.4%$/b£$/td£§+0.7$/td£$/tr£$tr£$td£GLP$/td£tab_r110tab_r2#cbd401tab_r3$td£$b£6.7%$/b£$/td£§+5.0$/td£$/tr£$tr£$td£SP$/td£tab_r19tab_r2#ea546ftab_r3$td£$b£6.3%$/b£$/td£§-8.5$/td£$/tr£$tr£$td£Mitte$/td£tab_r16tab_r2#f39f5etab_r3$td£$b£4.1%$/b£$/td£§+2.1$/td£$/tr£$/table£$br£Gültige Wahlzettel: $b£129$/b£$br£Wahlbeteiligung: $b£48.5%$/b£ (-5.7%)","tab_h_fr$tr£$td£PLR$/td£tab_r161tab_r2#6268AFtab_r3$td£$b£40.6%$/b£$/td£§+10.8$/td£$/tr£$tr£$td£PST-POP$/td£tab_r127tab_r2#792a8ftab_r3$td£$b£17.8%$/b£$/td£§+6.8$/td£$/tr£$tr£$td£UDC$/td£tab_r124tab_r2#547d34tab_r3$td£$b£16.1%$/b£$/td£§-16.3$/td£$/tr£$tr£$td£Vert-e-s$/td£tab_r113tab_r2#26b300tab_r3$td£$b£8.4%$/b£$/td£§+0.7$/td£$/tr£$tr£$td£PVL$/td£tab_r110tab_r2#cbd401tab_r3$td£$b£6.7%$/b£$/td£§+5.0$/td£$/tr£$tr£$td£PS$/td£tab_r19tab_r2#ea546ftab_r3$td£$b£6.3%$/b£$/td£§-8.5$/td£$/tr£$tr£$td£Centre$/td£tab_r16tab_r2#f39f5etab_r3$td£$b£4.1%$/b£$/td£§+2.1$/td£$/tr£$/table£$br£Bulletins de vote valables: $b£129$/b£$br£Taux de participation: $b£48.5%$/b£ (-5.7%)","tab_h_it$tr£$td£PLR$/td£tab_r161tab_r2#6268AFtab_r3$td£$b£40.6%$/b£$/td£§+10.8$/td£$/tr£$tr£$td£POP$/td£tab_r127tab_r2#792a8ftab_r3$td£$b£17.8%$/b£$/td£§+6.8$/td£$/tr£$tr£$td£UDC$/td£tab_r124tab_r2#547d34tab_r3$td£$b£16.1%$/b£$/td£§-16.3$/td£$/tr£$tr£$td£Verdi$/td£tab_r113tab_r2#26b300tab_r3$td£$b£8.4%$/b£$/td£§+0.7$/td£$/tr£$tr£$td£PVL$/td£tab_r110tab_r2#cbd401tab_r3$td£$b£6.7%$/b£$/td£§+5.0$/td£$/tr£$tr£$td£PS$/td£tab_r19tab_r2#ea546ftab_r3$td£$b£6.3%$/b£$/td£§-8.5$/td£$/tr£$tr£$td£Centro$/td£tab_r16tab_r2#f39f5etab_r3$td£$b£4.1%$/b£$/td£§+2.1$/td£$/tr£$/table£$br£Schede elettorali valide: $b£129$/b£$br£Tasso di partecipazione: $b£48.5%$/b£ (-5.7%)","FDP"
