"ID","Gemeinde_de","Gemeinde_fr","Gemeinde_it","Text_de","Text_fr","Text_it","Tabelle_de","Tabelle_fr","Tabelle_it","Staerkste_Partei"
5401,"Aigle VD","Aigle (VD)","Aigle VD","Die <b>FDP</b> kann ihre Position als dominierende politische Kraft in Aigle beibehalten, mit einem Wähleranteil von 32,2 Prozent (-2,8 Prozentpunkte).<br><br>Auf dem zweiten Platz in der Gemeinde liegt die <b>SP</b>. Die Partei erreicht einen Wählerstimmenanteil von 18,6 Prozent (+0,4 Prozentpunkte).<br><br>Mit einem Wähleranteil von 16,4 Prozent belegt die <b>SVP</b> den dritten Platz (Veränderung gegenüber 2019: -4,8 Prozentpunkte).","Les électeurs d'Aigle n'ont pas retourné leur veste depuis 2019. Le parti le plus fort dans leur commune reste le <b><b>PL</b>R</b>, avec 32,2 % des suffrages (-2,8 points de pourcentage).<br><br>Le <b>PS</b> est le deuxième parti le plus fort avec 18,6 % des voix (+0,4 points de pourcentage par rapport à 2019).<br><br>La troisième place est occupée par l'<b>UDC</b>. La formation obtient un pourcentage d'électeurs de 16,4. (-4,8 points de pourcentage de différence par rapport à 2019).","Gli elettori di Aigle mantengono la loro fiducia nel partito <b>PLR</b>, che risulta il primo nel loro comune, come nel 2019, con il 32,2 percento dei voti (-2,8 punti percentuali).<br><br>Il partito <b>PS</b> è la seconda formazione più forte con il 18,6 percento dei voti (+0,4 punti percentuali rispetto al 2019).<br><br>La terza posizione è occupata dal partito <b>UDC</b>. Ottiene una percentuale di elettori del il 16,4. (-4,8 punti percentuali di differenza rispetto al 2019).","tab_h$tr£$td£FDP$/td£tab_r148tab_r2#6268AFtab_r3$td£$b£32.2%$/b£$/td£§-2.8$/td£$/tr£$tr£$td£SP$/td£tab_r128tab_r2#ea546ftab_r3$td£$b£18.6%$/b£$/td£§+0.4$/td£$/tr£$tr£$td£SVP$/td£tab_r125tab_r2#547d34tab_r3$td£$b£16.4%$/b£$/td£§-4.8$/td£$/tr£$tr£$td£Grüne$/td£tab_r122tab_r2#26b300tab_r3$td£$b£14.7%$/b£$/td£§+5.0$/td£$/tr£$tr£$td£GLP$/td£tab_r19tab_r2#cbd401tab_r3$td£$b£5.8%$/b£$/td£§+3.3$/td£$/tr£$tr£$td£PdA$/td£tab_r17tab_r2#792a8ftab_r3$td£$b£4.5%$/b£$/td£§+1.8$/td£$/tr£$/table£$br£Gültige Wahlzettel: $b£1'779$/b£$br£Wahlbeteiligung: $b£36.6%$/b£ (-5.9%)","tab_h_fr$tr£$td£PLR$/td£tab_r148tab_r2#6268AFtab_r3$td£$b£32.2%$/b£$/td£§-2.8$/td£$/tr£$tr£$td£PS$/td£tab_r128tab_r2#ea546ftab_r3$td£$b£18.6%$/b£$/td£§+0.4$/td£$/tr£$tr£$td£UDC$/td£tab_r125tab_r2#547d34tab_r3$td£$b£16.4%$/b£$/td£§-4.8$/td£$/tr£$tr£$td£Vert-e-s$/td£tab_r122tab_r2#26b300tab_r3$td£$b£14.7%$/b£$/td£§+5.0$/td£$/tr£$tr£$td£PVL$/td£tab_r19tab_r2#cbd401tab_r3$td£$b£5.8%$/b£$/td£§+3.3$/td£$/tr£$tr£$td£PST-POP$/td£tab_r17tab_r2#792a8ftab_r3$td£$b£4.5%$/b£$/td£§+1.8$/td£$/tr£$/table£$br£Bulletins de vote valables: $b£1'779$/b£$br£Taux de participation: $b£36.6%$/b£ (-5.9%)","tab_h_it$tr£$td£PLR$/td£tab_r148tab_r2#6268AFtab_r3$td£$b£32.2%$/b£$/td£§-2.8$/td£$/tr£$tr£$td£PS$/td£tab_r128tab_r2#ea546ftab_r3$td£$b£18.6%$/b£$/td£§+0.4$/td£$/tr£$tr£$td£UDC$/td£tab_r125tab_r2#547d34tab_r3$td£$b£16.4%$/b£$/td£§-4.8$/td£$/tr£$tr£$td£Verdi$/td£tab_r122tab_r2#26b300tab_r3$td£$b£14.7%$/b£$/td£§+5.0$/td£$/tr£$tr£$td£PVL$/td£tab_r19tab_r2#cbd401tab_r3$td£$b£5.8%$/b£$/td£§+3.3$/td£$/tr£$tr£$td£POP$/td£tab_r17tab_r2#792a8ftab_r3$td£$b£4.5%$/b£$/td£§+1.8$/td£$/tr£$/table£$br£Schede elettorali valide: $b£1'779$/b£$br£Tasso di partecipazione: $b£36.6%$/b£ (-5.9%)","FDP"
5402,"Bex VD","Bex (VD)","Bex VD","In Bex ist neu die <b>SP</b> die stärkste Partei mit 24,4 Prozent aller Stimmen. Vor vier Jahren lag die Partei noch auf Rang 2.<br><br>Die <b>SVP</b> verliert mit einem Minus von -7,4 Prozentpunkten gegenüber den Wahlen 2019 sehr viele Wählerstimmen. Trotzdem liegt die Partei mit einem Wähleranteil von 23,2 Prozent noch auf dem zweiten Platz.<br><br>Die <b>FDP</b> sichert sich den dritten Platz, mit einem Wähleranteil von 19,8 Prozent (Veränderung gegenüber 2019: +0,7 Prozentpunkte).","Les préférences des électeurs de Bex ont changé en quatre ans. Le <b>PS</b> obtient le plus grand nombre de voix avec 24,4 % (-2,3 points de pourcentage) et passe ainsi du rang deux à la première place.<br><br>Malgré un recul de -7,4 points de pourcentage par rapport aux élections de 2019, l'<b>UDC</b> occupe toujours la deuxième place. La formation engrange 23,2 % des voix.<br><br>La troisième place est occupée par le <b><b>PL</b>R</b>. La formation obtient un pourcentage d'électeurs de 19,8. (+0,7 points de pourcentage de différence par rapport à 2019).","Classificato al due posto nel 2019, il partito <b>PS</b> è ora il partito più forte a Bex. Ottiene il 24,4 percento dei voti.<br><br>Nonostante una perdita di -7,4 punti percentuali rispetto alle elezioni del 2019, il partito <b>UDC</b> occupa ancora il secondo posto. Raccoglie il 23,2 percento dei voti.<br><br>Il partito <b>PLR</b> si posiziona terzo con il 19,8 percento dei voti. Questo rappresenta una variazione di +0,7 punti percentuali rispetto al 2019.","tab_h$tr£$td£SP$/td£tab_r137tab_r2#ea546ftab_r3$td£$b£24.4%$/b£$/td£§-2.3$/td£$/tr£$tr£$td£SVP$/td£tab_r135tab_r2#547d34tab_r3$td£$b£23.2%$/b£$/td£§-7.4$/td£$/tr£$tr£$td£FDP$/td£tab_r130tab_r2#6268AFtab_r3$td£$b£19.8%$/b£$/td£§+0.7$/td£$/tr£$tr£$td£Grüne$/td£tab_r123tab_r2#26b300tab_r3$td£$b£15.1%$/b£$/td£§+6.8$/td£$/tr£$tr£$td£GLP$/td£tab_r110tab_r2#cbd401tab_r3$td£$b£6.9%$/b£$/td£§+3.9$/td£$/tr£$tr£$td£PdA$/td£tab_r16tab_r2#792a8ftab_r3$td£$b£4.3%$/b£$/td£§+1.4$/td£$/tr£$/table£$br£Gültige Wahlzettel: $b£1'631$/b£$br£Wahlbeteiligung: $b£39.5%$/b£ (-2.9%)","tab_h_fr$tr£$td£PS$/td£tab_r137tab_r2#ea546ftab_r3$td£$b£24.4%$/b£$/td£§-2.3$/td£$/tr£$tr£$td£UDC$/td£tab_r135tab_r2#547d34tab_r3$td£$b£23.2%$/b£$/td£§-7.4$/td£$/tr£$tr£$td£PLR$/td£tab_r130tab_r2#6268AFtab_r3$td£$b£19.8%$/b£$/td£§+0.7$/td£$/tr£$tr£$td£Vert-e-s$/td£tab_r123tab_r2#26b300tab_r3$td£$b£15.1%$/b£$/td£§+6.8$/td£$/tr£$tr£$td£PVL$/td£tab_r110tab_r2#cbd401tab_r3$td£$b£6.9%$/b£$/td£§+3.9$/td£$/tr£$tr£$td£PST-POP$/td£tab_r16tab_r2#792a8ftab_r3$td£$b£4.3%$/b£$/td£§+1.4$/td£$/tr£$/table£$br£Bulletins de vote valables: $b£1'631$/b£$br£Taux de participation: $b£39.5%$/b£ (-2.9%)","tab_h_it$tr£$td£PS$/td£tab_r137tab_r2#ea546ftab_r3$td£$b£24.4%$/b£$/td£§-2.3$/td£$/tr£$tr£$td£UDC$/td£tab_r135tab_r2#547d34tab_r3$td£$b£23.2%$/b£$/td£§-7.4$/td£$/tr£$tr£$td£PLR$/td£tab_r130tab_r2#6268AFtab_r3$td£$b£19.8%$/b£$/td£§+0.7$/td£$/tr£$tr£$td£Verdi$/td£tab_r123tab_r2#26b300tab_r3$td£$b£15.1%$/b£$/td£§+6.8$/td£$/tr£$tr£$td£PVL$/td£tab_r110tab_r2#cbd401tab_r3$td£$b£6.9%$/b£$/td£§+3.9$/td£$/tr£$tr£$td£POP$/td£tab_r16tab_r2#792a8ftab_r3$td£$b£4.3%$/b£$/td£§+1.4$/td£$/tr£$/table£$br£Schede elettorali valide: $b£1'631$/b£$br£Tasso di partecipazione: $b£39.5%$/b£ (-2.9%)","SP"
5403,"Chessel VD","Chessel (VD)","Chessel VD","Die <b>SVP</b> ist weiterhin die stärkste Kraft in Chessel. Mit 28,4 Prozent Wähleranteil verweist die Partei die <b>FDP</b> allerdings nur mit 0,9 Prozentpunkten Abstand auf den zweiten Platz. Die zweitstärkste Partei holt 27,5 Prozent. Die Veränderungen gegenüber 2019: <b>SVP</b>: -2,9 Prozentpunkte; <b>FDP</b>: +3 Prozentpunkte.<br><br>Auf dem dritten Platz landen die <b>Grünen</b> mit 19 Prozent der Stimmen. Das bedeutet eine Veränderung von +0,6 Prozentpunkten gegenüber 2019. ","Avec 28,4 % des voix (-2,9 points de pourcentage), l'<b>UDC</b> est toujours le parti le plus fort à Chessel. Le <b><b>PL</b>R</b>, qui réalise 27,5 % des suffrages (+3 points de pourcentage), est cependant en embuscade. L'écart entre les deux formations politiques est de 0,9 points.<br><br>Les <b>Vert-e-s</b> arrivent en troisième position avec 19 % des votes. Cela représente un changement de +0,6 points de pourcentage par rapport à 2019.","Con il 28,4 percento dei voti (-2,9 punti percentuali), il partito <b>UDC</b> rimane in testa a Chessel. Tuttavia, il partito <b>PLR</b>, che ottiene il 27,5 percento dei voti (+3 punti percentuali), è in agguato. La differenza tra i due partiti è di 0,9 punti.<br><br>Al terzo posto troviamo il partito <b>Verdi</b> con il 19 percento dei voti (+0,6).","tab_h$tr£$td£SVP$/td£tab_r143tab_r2#547d34tab_r3$td£$b£28.4%$/b£$/td£§-2.9$/td£$/tr£$tr£$td£FDP$/td£tab_r141tab_r2#6268AFtab_r3$td£$b£27.5%$/b£$/td£§+3.0$/td£$/tr£$tr£$td£Grüne$/td£tab_r129tab_r2#26b300tab_r3$td£$b£19.0%$/b£$/td£§+0.6$/td£$/tr£$tr£$td£SP$/td£tab_r115tab_r2#ea546ftab_r3$td£$b£10.0%$/b£$/td£§-2.0$/td£$/tr£$tr£$td£GLP$/td£tab_r16tab_r2#cbd401tab_r3$td£$b£4.1%$/b£$/td£§+2.2$/td£$/tr£$tr£$td£Mitte$/td£tab_r16tab_r2#f39f5etab_r3$td£$b£3.9%$/b£$/td£§+0.8$/td£$/tr£$/table£$br£Gültige Wahlzettel: $b£130$/b£$br£Wahlbeteiligung: $b£47.1%$/b£ (-3.1%)","tab_h_fr$tr£$td£UDC$/td£tab_r143tab_r2#547d34tab_r3$td£$b£28.4%$/b£$/td£§-2.9$/td£$/tr£$tr£$td£PLR$/td£tab_r141tab_r2#6268AFtab_r3$td£$b£27.5%$/b£$/td£§+3.0$/td£$/tr£$tr£$td£Vert-e-s$/td£tab_r129tab_r2#26b300tab_r3$td£$b£19.0%$/b£$/td£§+0.6$/td£$/tr£$tr£$td£PS$/td£tab_r115tab_r2#ea546ftab_r3$td£$b£10.0%$/b£$/td£§-2.0$/td£$/tr£$tr£$td£PVL$/td£tab_r16tab_r2#cbd401tab_r3$td£$b£4.1%$/b£$/td£§+2.2$/td£$/tr£$tr£$td£Centre$/td£tab_r16tab_r2#f39f5etab_r3$td£$b£3.9%$/b£$/td£§+0.8$/td£$/tr£$/table£$br£Bulletins de vote valables: $b£130$/b£$br£Taux de participation: $b£47.1%$/b£ (-3.1%)","tab_h_it$tr£$td£UDC$/td£tab_r143tab_r2#547d34tab_r3$td£$b£28.4%$/b£$/td£§-2.9$/td£$/tr£$tr£$td£PLR$/td£tab_r141tab_r2#6268AFtab_r3$td£$b£27.5%$/b£$/td£§+3.0$/td£$/tr£$tr£$td£Verdi$/td£tab_r129tab_r2#26b300tab_r3$td£$b£19.0%$/b£$/td£§+0.6$/td£$/tr£$tr£$td£PS$/td£tab_r115tab_r2#ea546ftab_r3$td£$b£10.0%$/b£$/td£§-2.0$/td£$/tr£$tr£$td£PVL$/td£tab_r16tab_r2#cbd401tab_r3$td£$b£4.1%$/b£$/td£§+2.2$/td£$/tr£$tr£$td£Centro$/td£tab_r16tab_r2#f39f5etab_r3$td£$b£3.9%$/b£$/td£§+0.8$/td£$/tr£$/table£$br£Schede elettorali valide: $b£130$/b£$br£Tasso di partecipazione: $b£47.1%$/b£ (-3.1%)","SVP"
5404,"Corbeyrier VD","Corbeyrier (VD)","Corbeyrier VD","In Corbeyrier behält die <b>SVP</b> ihren Status als stärkste politische Kraft. Die Partei sichert sich einen Wähleranteil von 31,7 Prozent (-5,2 Prozentpunkte).<br><br>Zweitstärkste Partei sind die <b>Grünen</b>. Die Partei verbessert sich gegenüber den Wahlen 2019 um +5,2 Prozentpunkte deutlich und weist neu einen Wähleranteil von 20,3 Prozent auf.<br><br>Mit einem Wähleranteil von 18,2 Prozent belegt die <b>SP</b> den dritten Platz (Veränderung gegenüber 2019: -0,4 Prozentpunkte).","L'<b>UDC</b> maintient sa première place à Corbeyrier et obtient 31,7 pour des voix (-5,2 points de pourcentage).<br><br>Les <b>Vert-e-s</b> progressent fortement: le parti améliore son résultat d'il y a quatre ans de +5,2 points de pourcentage et occupe désormais la deuxième place dans la commune. La proportion de voix du parti s'élève désormais à 20,3 %.<br><br>La troisième place est occupée par le <b>PS</b>. La formation obtient un pourcentage d'électeurs de 18,2. (-0,4 points de pourcentage de différence par rapport à 2019).","Il partito <b>UDC</b> mantiene il primo posto a Corbeyrier e ottiene il 31,7 percento dei voti (-5,2 punti percentuali).<br><br>Il partito <b>Verdi</b> perde molte preferenze. Il partito registra una diminuzione di +5,2 punti percentuali rispetto alle elezioni del 2019. Nonostante ciò, rimane in seconda posizione con una percentuale di elettori del 20,3 percento.<br><br>Il partito <b>PS</b> si classifica terzo, ottenendo il 18,2 percento dei voti (-0,4 punti percentuali rispetto al 2019).","tab_h$tr£$td£SVP$/td£tab_r148tab_r2#547d34tab_r3$td£$b£31.7%$/b£$/td£§-5.2$/td£$/tr£$tr£$td£Grüne$/td£tab_r130tab_r2#26b300tab_r3$td£$b£20.3%$/b£$/td£§+5.2$/td£$/tr£$tr£$td£SP$/td£tab_r127tab_r2#ea546ftab_r3$td£$b£18.2%$/b£$/td£§-0.4$/td£$/tr£$tr£$td£FDP$/td£tab_r121tab_r2#6268AFtab_r3$td£$b£14.2%$/b£$/td£§-2.9$/td£$/tr£$tr£$td£PdA$/td£tab_r113tab_r2#792a8ftab_r3$td£$b£8.9%$/b£$/td£§+6.6$/td£$/tr£$/table£$br£Gültige Wahlzettel: $b£169$/b£$br£Wahlbeteiligung: $b£53.9%$/b£ (+1.4%)","tab_h_fr$tr£$td£UDC$/td£tab_r148tab_r2#547d34tab_r3$td£$b£31.7%$/b£$/td£§-5.2$/td£$/tr£$tr£$td£Vert-e-s$/td£tab_r130tab_r2#26b300tab_r3$td£$b£20.3%$/b£$/td£§+5.2$/td£$/tr£$tr£$td£PS$/td£tab_r127tab_r2#ea546ftab_r3$td£$b£18.2%$/b£$/td£§-0.4$/td£$/tr£$tr£$td£PLR$/td£tab_r121tab_r2#6268AFtab_r3$td£$b£14.2%$/b£$/td£§-2.9$/td£$/tr£$tr£$td£PST-POP$/td£tab_r113tab_r2#792a8ftab_r3$td£$b£8.9%$/b£$/td£§+6.6$/td£$/tr£$/table£$br£Bulletins de vote valables: $b£169$/b£$br£Taux de participation: $b£53.9%$/b£ (+1.4%)","tab_h_it$tr£$td£UDC$/td£tab_r148tab_r2#547d34tab_r3$td£$b£31.7%$/b£$/td£§-5.2$/td£$/tr£$tr£$td£Verdi$/td£tab_r130tab_r2#26b300tab_r3$td£$b£20.3%$/b£$/td£§+5.2$/td£$/tr£$tr£$td£PS$/td£tab_r127tab_r2#ea546ftab_r3$td£$b£18.2%$/b£$/td£§-0.4$/td£$/tr£$tr£$td£PLR$/td£tab_r121tab_r2#6268AFtab_r3$td£$b£14.2%$/b£$/td£§-2.9$/td£$/tr£$tr£$td£POP$/td£tab_r113tab_r2#792a8ftab_r3$td£$b£8.9%$/b£$/td£§+6.6$/td£$/tr£$/table£$br£Schede elettorali valide: $b£169$/b£$br£Tasso di partecipazione: $b£53.9%$/b£ (+1.4%)","SVP"
5405,"Gryon VD","Gryon (VD)","Gryon VD","Die <b>FDP</b> behauptet ihre Position als vorherrschende Partei in Gryon. Die Partei verzeichnet einen Wähleranteil von 26,6 Prozent (-2,4 Prozentpunkte).<br><br>Einen markanten Verlust muss die <b>SVP</b> hinnehmen: Die Partei verliert -5,7 Prozentpunkte gegenüber den Wahlen 2019 und liegt jetzt noch bei 20,3 Prozent Wähleranteil. Das bedeutet dennoch Rang 2.<br><br>Die <b>Grünen</b> verzeichnen einen deutlichen Zuwachs. Die Partei belegt nun den dritten Platz in der Gemeinde und erreicht neu einen Wähleranteil von 18,3 Prozent. Das sind +9,7 Prozentpunkte mehr als im Vergleich zu den letzten Wahlen.","Le <b><b>PL</b>R</b> maintient sa position de première force politique dans la commune de Gryon. Le parti récolte 26,6 % des suffrages (-2,4 points de pourcentage).<br><br>L'<b>UDC</b> connaît un fort recul à Gryon. La formation perd -5,7 points de pourcentage par rapport aux élections pour le Conseil national de 2019 et est désormais le deuxième parti de la commune avec 20,3 % des suffrages.<br><br>Les <b>Vert-e-s</b> enregistrent une nette progression. La formation occupe désormais la troisième place dans la commune et obtient désormais 18,3 % des voix. Cela représente +9,7 points de pourcentage de plus qu'en 2019.","Gli elettori di Gryon mantengono la loro fiducia nel partito <b>PLR</b>, che risulta il primo nel loro comune, come nel 2019, con il 26,6 percento dei voti (-2,4 punti percentuali).<br><br>Nonostante una perdita di -5,7 punti percentuali rispetto alle elezioni del 2019, il partito <b>UDC</b> occupa ancora il secondo posto. Raccoglie il 20,3 percento dei voti.<br><br>Il partito <b>Verdi</b> registra una forte crescita. Ora si classifica terzo nel comune e riceve il 18,3 percento dei voti, ovvero +9,7 punti percentuali in più rispetto al 2019.","tab_h$tr£$td£FDP$/td£tab_r140tab_r2#6268AFtab_r3$td£$b£26.6%$/b£$/td£§-2.4$/td£$/tr£$tr£$td£SVP$/td£tab_r130tab_r2#547d34tab_r3$td£$b£20.3%$/b£$/td£§-5.7$/td£$/tr£$tr£$td£Grüne$/td£tab_r128tab_r2#26b300tab_r3$td£$b£18.3%$/b£$/td£§+9.7$/td£$/tr£$tr£$td£SP$/td£tab_r123tab_r2#ea546ftab_r3$td£$b£15.1%$/b£$/td£§-0.2$/td£$/tr£$tr£$td£GLP$/td£tab_r112tab_r2#cbd401tab_r3$td£$b£8.1%$/b£$/td£§+3.9$/td£$/tr£$tr£$td£Mitte$/td£tab_r110tab_r2#f39f5etab_r3$td£$b£6.6%$/b£$/td£§-2.0$/td£$/tr£$/table£$br£Gültige Wahlzettel: $b£358$/b£$br£Wahlbeteiligung: $b£44.8%$/b£ (-4.5%)","tab_h_fr$tr£$td£PLR$/td£tab_r140tab_r2#6268AFtab_r3$td£$b£26.6%$/b£$/td£§-2.4$/td£$/tr£$tr£$td£UDC$/td£tab_r130tab_r2#547d34tab_r3$td£$b£20.3%$/b£$/td£§-5.7$/td£$/tr£$tr£$td£Vert-e-s$/td£tab_r128tab_r2#26b300tab_r3$td£$b£18.3%$/b£$/td£§+9.7$/td£$/tr£$tr£$td£PS$/td£tab_r123tab_r2#ea546ftab_r3$td£$b£15.1%$/b£$/td£§-0.2$/td£$/tr£$tr£$td£PVL$/td£tab_r112tab_r2#cbd401tab_r3$td£$b£8.1%$/b£$/td£§+3.9$/td£$/tr£$tr£$td£Centre$/td£tab_r110tab_r2#f39f5etab_r3$td£$b£6.6%$/b£$/td£§-2.0$/td£$/tr£$/table£$br£Bulletins de vote valables: $b£358$/b£$br£Taux de participation: $b£44.8%$/b£ (-4.5%)","tab_h_it$tr£$td£PLR$/td£tab_r140tab_r2#6268AFtab_r3$td£$b£26.6%$/b£$/td£§-2.4$/td£$/tr£$tr£$td£UDC$/td£tab_r130tab_r2#547d34tab_r3$td£$b£20.3%$/b£$/td£§-5.7$/td£$/tr£$tr£$td£Verdi$/td£tab_r128tab_r2#26b300tab_r3$td£$b£18.3%$/b£$/td£§+9.7$/td£$/tr£$tr£$td£PS$/td£tab_r123tab_r2#ea546ftab_r3$td£$b£15.1%$/b£$/td£§-0.2$/td£$/tr£$tr£$td£PVL$/td£tab_r112tab_r2#cbd401tab_r3$td£$b£8.1%$/b£$/td£§+3.9$/td£$/tr£$tr£$td£Centro$/td£tab_r110tab_r2#f39f5etab_r3$td£$b£6.6%$/b£$/td£§-2.0$/td£$/tr£$/table£$br£Schede elettorali valide: $b£358$/b£$br£Tasso di partecipazione: $b£44.8%$/b£ (-4.5%)","FDP"
5406,"Lavey-Morcles VD","Lavey-Morcles (VD)","Lavey-Morcles VD","Ganz knapp bleibt die <b>SVP</b> die grösste Partei in Lavey-Morcles. Die Partei holt 23,1 Prozent der Stimmen und hält damit ihren Vorsprung, mit 0,4 Prozentpunkten, vor der <b>FDP</b>. Diese muss sich mit 22,7 Prozent und Platz zwei begnügen. Die Veränderungen gegenüber 2019: <b>SVP</b>: -12,1 Prozentpunkte; <b>FDP</b>: -0,8 Prozentpunkte.<br><br>Die <b>SP</b> landet mit 20,7 Prozent auf dem dritten Platz (Veränderung gegenüber 2019: +0,6 Prozentpunkte).","Avec 23,1 % des voix (-12,1 points de pourcentage), l'<b>UDC</b> est toujours le parti le plus fort à Lavey-Morcles. Le <b><b>PL</b>R</b>, qui réalise 22,7 % des suffrages (-0,8 points de pourcentage), est cependant en embuscade. L'écart entre les deux formations politiques est de 0,4 points.<br><br>Le <b>PS</b> complète le podium. La formation récolte 20,7 % des suffrages (+0,6).","Con il 23,1 percento dei voti (-12,1 punti percentuali), il partito <b>UDC</b> rimane in testa a Lavey-Morcles. Tuttavia, il partito <b>PLR</b>, che ottiene il 22,7 percento dei voti (-0,8 punti percentuali), è in agguato. La differenza tra i due partiti è di 0,4 punti.<br><br>Il partito <b>PS</b> si posiziona terzo con il 20,7 percento dei voti. Questo rappresenta una variazione di +0,6 punti percentuali rispetto al 2019.","tab_h$tr£$td£SVP$/td£tab_r135tab_r2#547d34tab_r3$td£$b£23.1%$/b£$/td£§-12.1$/td£$/tr£$tr£$td£FDP$/td£tab_r134tab_r2#6268AFtab_r3$td£$b£22.7%$/b£$/td£§-0.8$/td£$/tr£$tr£$td£SP$/td£tab_r131tab_r2#ea546ftab_r3$td£$b£20.7%$/b£$/td£§+0.6$/td£$/tr£$tr£$td£Grüne$/td£tab_r127tab_r2#26b300tab_r3$td£$b£17.7%$/b£$/td£§+10.8$/td£$/tr£$tr£$td£GLP$/td£tab_r18tab_r2#cbd401tab_r3$td£$b£5.3%$/b£$/td£§+2.7$/td£$/tr£$tr£$td£PdA$/td£tab_r15tab_r2#792a8ftab_r3$td£$b£3.2%$/b£$/td£§+2.3$/td£$/tr£$/table£$br£Gültige Wahlzettel: $b£233$/b£$br£Wahlbeteiligung: $b£38.4%$/b£ (-2.4%)","tab_h_fr$tr£$td£UDC$/td£tab_r135tab_r2#547d34tab_r3$td£$b£23.1%$/b£$/td£§-12.1$/td£$/tr£$tr£$td£PLR$/td£tab_r134tab_r2#6268AFtab_r3$td£$b£22.7%$/b£$/td£§-0.8$/td£$/tr£$tr£$td£PS$/td£tab_r131tab_r2#ea546ftab_r3$td£$b£20.7%$/b£$/td£§+0.6$/td£$/tr£$tr£$td£Vert-e-s$/td£tab_r127tab_r2#26b300tab_r3$td£$b£17.7%$/b£$/td£§+10.8$/td£$/tr£$tr£$td£PVL$/td£tab_r18tab_r2#cbd401tab_r3$td£$b£5.3%$/b£$/td£§+2.7$/td£$/tr£$tr£$td£PST-POP$/td£tab_r15tab_r2#792a8ftab_r3$td£$b£3.2%$/b£$/td£§+2.3$/td£$/tr£$/table£$br£Bulletins de vote valables: $b£233$/b£$br£Taux de participation: $b£38.4%$/b£ (-2.4%)","tab_h_it$tr£$td£UDC$/td£tab_r135tab_r2#547d34tab_r3$td£$b£23.1%$/b£$/td£§-12.1$/td£$/tr£$tr£$td£PLR$/td£tab_r134tab_r2#6268AFtab_r3$td£$b£22.7%$/b£$/td£§-0.8$/td£$/tr£$tr£$td£PS$/td£tab_r131tab_r2#ea546ftab_r3$td£$b£20.7%$/b£$/td£§+0.6$/td£$/tr£$tr£$td£Verdi$/td£tab_r127tab_r2#26b300tab_r3$td£$b£17.7%$/b£$/td£§+10.8$/td£$/tr£$tr£$td£PVL$/td£tab_r18tab_r2#cbd401tab_r3$td£$b£5.3%$/b£$/td£§+2.7$/td£$/tr£$tr£$td£POP$/td£tab_r15tab_r2#792a8ftab_r3$td£$b£3.2%$/b£$/td£§+2.3$/td£$/tr£$/table£$br£Schede elettorali valide: $b£233$/b£$br£Tasso di partecipazione: $b£38.4%$/b£ (-2.4%)","SVP"
5407,"Leysin VD","Leysin (VD)","Leysin VD","In Leysin behält die <b>FDP</b> ihren Status als stärkste politische Kraft. Die Partei sichert sich einen Wähleranteil von 34,2 Prozent (-3,4 Prozentpunkte).<br><br>Die <b>Grünen</b> steigern sich mit einem Plus von +7,5 Prozentpunkte stark. Die Partei belegt nun den zweiten Platz in der Gemeinde. Der Wählerstimmenanteil beträgt neu 17 Prozent.<br><br>Mit einem Wähleranteil von 15,6 Prozent belegt die <b>SP</b> den dritten Platz (Veränderung gegenüber 2019: -3,1 Prozentpunkte).","Aucune formation politique ne parvient à prendre la place de numéro un au <b><b>PL</b>R</b> à Leysin. Le parti obtient 34,2 % des suffrages (-3,4 points de pourcentage).<br><br>Une progression significative de +7,5 points de pourcentage permet aux <b>Vert-e-s</b> de devenir le deuxième parti de sa commune. La formation politique recueille17 % des voix.<br><br>La troisième place est occupée par le <b>PS</b>. La formation obtient un pourcentage d'électeurs de 15,6. (-3,1 points de pourcentage de différence par rapport à 2019).","Gli elettori di Leysin mantengono la loro fiducia nel partito <b>PLR</b>, che risulta il primo nel loro comune, come nel 2019, con il 34,2 percento dei voti (-3,4 punti percentuali).<br><br>Il partito <b>Verdi</b> subisce una forte diminuzione a Leysin. Perde +7,5 punti percentuali rispetto alle elezioni per il Consiglio Nazionale del 2019 ed è ora il secondo partito del comune con il 17 percento dei voti.<br><br>Il partito <b>PS</b> si posiziona terzo con il 15,6 percento dei voti. Questo rappresenta una variazione di -3,1 punti percentuali rispetto al 2019.","tab_h$tr£$td£FDP$/td£tab_r151tab_r2#6268AFtab_r3$td£$b£34.2%$/b£$/td£§-3.4$/td£$/tr£$tr£$td£Grüne$/td£tab_r125tab_r2#26b300tab_r3$td£$b£17.0%$/b£$/td£§+7.5$/td£$/tr£$tr£$td£SP$/td£tab_r123tab_r2#ea546ftab_r3$td£$b£15.6%$/b£$/td£§-3.1$/td£$/tr£$tr£$td£SVP$/td£tab_r122tab_r2#547d34tab_r3$td£$b£14.4%$/b£$/td£§-6.8$/td£$/tr£$tr£$td£GLP$/td£tab_r111tab_r2#cbd401tab_r3$td£$b£7.3%$/b£$/td£§+4.4$/td£$/tr£$tr£$td£PdA$/td£tab_r17tab_r2#792a8ftab_r3$td£$b£4.4%$/b£$/td£§+1.2$/td£$/tr£$/table£$br£Gültige Wahlzettel: $b£559$/b£$br£Wahlbeteiligung: $b£39.3%$/b£ (-5.9%)","tab_h_fr$tr£$td£PLR$/td£tab_r151tab_r2#6268AFtab_r3$td£$b£34.2%$/b£$/td£§-3.4$/td£$/tr£$tr£$td£Vert-e-s$/td£tab_r125tab_r2#26b300tab_r3$td£$b£17.0%$/b£$/td£§+7.5$/td£$/tr£$tr£$td£PS$/td£tab_r123tab_r2#ea546ftab_r3$td£$b£15.6%$/b£$/td£§-3.1$/td£$/tr£$tr£$td£UDC$/td£tab_r122tab_r2#547d34tab_r3$td£$b£14.4%$/b£$/td£§-6.8$/td£$/tr£$tr£$td£PVL$/td£tab_r111tab_r2#cbd401tab_r3$td£$b£7.3%$/b£$/td£§+4.4$/td£$/tr£$tr£$td£PST-POP$/td£tab_r17tab_r2#792a8ftab_r3$td£$b£4.4%$/b£$/td£§+1.2$/td£$/tr£$/table£$br£Bulletins de vote valables: $b£559$/b£$br£Taux de participation: $b£39.3%$/b£ (-5.9%)","tab_h_it$tr£$td£PLR$/td£tab_r151tab_r2#6268AFtab_r3$td£$b£34.2%$/b£$/td£§-3.4$/td£$/tr£$tr£$td£Verdi$/td£tab_r125tab_r2#26b300tab_r3$td£$b£17.0%$/b£$/td£§+7.5$/td£$/tr£$tr£$td£PS$/td£tab_r123tab_r2#ea546ftab_r3$td£$b£15.6%$/b£$/td£§-3.1$/td£$/tr£$tr£$td£UDC$/td£tab_r122tab_r2#547d34tab_r3$td£$b£14.4%$/b£$/td£§-6.8$/td£$/tr£$tr£$td£PVL$/td£tab_r111tab_r2#cbd401tab_r3$td£$b£7.3%$/b£$/td£§+4.4$/td£$/tr£$tr£$td£POP$/td£tab_r17tab_r2#792a8ftab_r3$td£$b£4.4%$/b£$/td£§+1.2$/td£$/tr£$/table£$br£Schede elettorali valide: $b£559$/b£$br£Tasso di partecipazione: $b£39.3%$/b£ (-5.9%)","FDP"
