"ID","Gemeinde_de","Gemeinde_fr","Gemeinde_it","Text_de","Text_fr","Text_it","Tabelle_de","Tabelle_fr","Tabelle_it","Staerkste_Partei"
2841,"Anwil BL","Anwil (BL)","Anwil BL","In Anwil bleibt die <b>SVP</b> unangefochten die stärkste Partei. Sie vereinigt bei den Nationalratswahlen 42,5 Prozent der Stimmen (+12,4 Prozentpunkte) auf sich, 25,5 Prozentpunkte mehr als die zweitplatzierte <b>SP</b> (17 Prozent, +5,9 Prozentpunkte).<br><br>Die <b>Grünen</b> verlieren -11 Prozentpunkte und damit so viele Stimmen, dass sie mit einem Wähleranteil von 14 Prozent nur noch auf dem dritten Platz landet.<br><br>Speziell: In keiner anderen Gemeinde des Kantons schneidet die <b>FDP</b> schwächer ab (ohne Kleinstgemeinden).","Avec 42,5 % des voix (+12,4 points de pourcentage), la position de leader du <b>UDC</b> est solide à Anwil. L'avance atteint 25,5 points par rapport au parti suivant. En comparaison, le <b>PS</b> se classe à la deuxième place avec 17 % des suffrages (+5,9 points de pourcentage). <br><br>Les <b>Vert-e-s</b> perdent -11 points de pourcentage. La formation n'arrive plus qu'en troisième position avec 14 % des voix.<br><br>Le <b><b>PL</b>R</b> a enregistré dans cette commune son moins bon résultat cantonal (sans tenir compte des petites communes).","Il partito <b>UDC</b> è in una posizione di forza a Anwil. Ottiene il 42,5 percento dei voti (+12,4 punti percentuali). La differenza con il partito <b>PS</b> è notevole (25,5 punti percentuali). Il secondo partito del comune ha convinto il 17 percento degli elettori (+5,9 punti percentuali).<br><br>Il partito <b>Verdi</b> perde -11 punti percentuali e si classifica ora al terzo posto con il 14 percento dei voti.<br><br>Il partito <b>PLR</b> ha registrato in questo comune il suo peggior risultato a livello cantonale (senza considerare i piccoli comuni).","tab_h$tr£$td£SVP$/td£tab_r164tab_r2#547d34tab_r3$td£$b£42.5%$/b£$/td£§+12.4$/td£$/tr£$tr£$td£SP$/td£tab_r126tab_r2#ea546ftab_r3$td£$b£17.0%$/b£$/td£§+5.9$/td£$/tr£$tr£$td£Grüne$/td£tab_r121tab_r2#26b300tab_r3$td£$b£14.0%$/b£$/td£§-11.0$/td£$/tr£$tr£$td£GLP$/td£tab_r19tab_r2#cbd401tab_r3$td£$b£6.2%$/b£$/td£§-1.0$/td£$/tr£$tr£$td£EVP$/td£tab_r19tab_r2#87bfdctab_r3$td£$b£6.0%$/b£$/td£§-8.0$/td£$/tr£$tr£$td£Mitte$/td£tab_r18tab_r2#f39f5etab_r3$td£$b£5.6%$/b£$/td£§+2.0$/td£$/tr£$tr£$td£FDP$/td£tab_r18tab_r2#6268AFtab_r3$td£$b£5.5%$/b£$/td£§-3.5$/td£$/tr£$/table£$br£Gültige Wahlzettel: $b£219$/b£$br£Wahlbeteiligung: $b£57.8%$/b£ (+9.9%)","tab_h_fr$tr£$td£UDC$/td£tab_r164tab_r2#547d34tab_r3$td£$b£42.5%$/b£$/td£§+12.4$/td£$/tr£$tr£$td£PS$/td£tab_r126tab_r2#ea546ftab_r3$td£$b£17.0%$/b£$/td£§+5.9$/td£$/tr£$tr£$td£Vert-e-s$/td£tab_r121tab_r2#26b300tab_r3$td£$b£14.0%$/b£$/td£§-11.0$/td£$/tr£$tr£$td£PVL$/td£tab_r19tab_r2#cbd401tab_r3$td£$b£6.2%$/b£$/td£§-1.0$/td£$/tr£$tr£$td£PEV$/td£tab_r19tab_r2#87bfdctab_r3$td£$b£6.0%$/b£$/td£§-8.0$/td£$/tr£$tr£$td£Centre$/td£tab_r18tab_r2#f39f5etab_r3$td£$b£5.6%$/b£$/td£§+2.0$/td£$/tr£$tr£$td£PLR$/td£tab_r18tab_r2#6268AFtab_r3$td£$b£5.5%$/b£$/td£§-3.5$/td£$/tr£$/table£$br£Bulletins de vote valables: $b£219$/b£$br£Taux de participation: $b£57.8%$/b£ (+9.9%)","tab_h_it$tr£$td£UDC$/td£tab_r164tab_r2#547d34tab_r3$td£$b£42.5%$/b£$/td£§+12.4$/td£$/tr£$tr£$td£PS$/td£tab_r126tab_r2#ea546ftab_r3$td£$b£17.0%$/b£$/td£§+5.9$/td£$/tr£$tr£$td£Verdi$/td£tab_r121tab_r2#26b300tab_r3$td£$b£14.0%$/b£$/td£§-11.0$/td£$/tr£$tr£$td£PVL$/td£tab_r19tab_r2#cbd401tab_r3$td£$b£6.2%$/b£$/td£§-1.0$/td£$/tr£$tr£$td£PEV$/td£tab_r19tab_r2#87bfdctab_r3$td£$b£6.0%$/b£$/td£§-8.0$/td£$/tr£$tr£$td£Centro$/td£tab_r18tab_r2#f39f5etab_r3$td£$b£5.6%$/b£$/td£§+2.0$/td£$/tr£$tr£$td£PLR$/td£tab_r18tab_r2#6268AFtab_r3$td£$b£5.5%$/b£$/td£§-3.5$/td£$/tr£$/table£$br£Schede elettorali valide: $b£219$/b£$br£Tasso di partecipazione: $b£57.8%$/b£ (+9.9%)","SVP"
2842,"Böckten BL","Böckten (BL)","Böckten BL","Die <b>SVP</b> kann ihre Position als dominierende politische Kraft in Böckten beibehalten, mit einem Wähleranteil von 32 Prozent (+1,4 Prozentpunkte).<br><br>Die <b>SP</b> steigert sich mit einem Plus von +5,9 Prozentpunkte stark. Die Partei belegt nun den zweiten Platz in der Gemeinde. Der Wählerstimmenanteil beträgt neu 25,5 Prozent.<br><br>Auf dem dritten Platz landet die <b>FDP</b> mit 11,5 Prozent der Stimmen. Das bedeutet eine Veränderung von -4 Prozentpunkten gegenüber 2019. ","L'<b>UDC</b> maintient sa position de première force politique dans la commune de Böckten. Le parti récolte 32 % des suffrages (+1,4 points de pourcentage).<br><br>Le <b>PS</b> est le deuxième parti le plus fort à Böckten. La formation s'est améliorée de +5,9 points de pourcentage par rapport aux élections pour le Conseil national de 2019.<br><br>A la troisième place figure le <b><b>PL</b>R</b>, qui réalise 11,5 % des voix (-4).","Il partito <b>UDC</b> mantiene il primo posto a Böckten e ottiene il 32 percento dei voti (+1,4 punti percentuali).<br><br>Il partito <b>PS</b> perde molte preferenze. Il partito registra una diminuzione di +5,9 punti percentuali rispetto alle elezioni del 2019. Nonostante ciò, rimane in seconda posizione con una percentuale di elettori del 25,5 percento.<br><br>La terza posizione è occupata dal partito <b>PLR</b>. Ottiene una percentuale di elettori del il 11,5. (-4 punti percentuali di differenza rispetto al 2019).","tab_h$tr£$td£SVP$/td£tab_r148tab_r2#547d34tab_r3$td£$b£32.0%$/b£$/td£§+1.4$/td£$/tr£$tr£$td£SP$/td£tab_r138tab_r2#ea546ftab_r3$td£$b£25.5%$/b£$/td£§+5.9$/td£$/tr£$tr£$td£FDP$/td£tab_r117tab_r2#6268AFtab_r3$td£$b£11.5%$/b£$/td£§-4.0$/td£$/tr£$tr£$td£Grüne$/td£tab_r115tab_r2#26b300tab_r3$td£$b£10.1%$/b£$/td£§-9.8$/td£$/tr£$tr£$td£Mitte$/td£tab_r114tab_r2#f39f5etab_r3$td£$b£9.4%$/b£$/td£§+3.6$/td£$/tr£$tr£$td£GLP$/td£tab_r18tab_r2#cbd401tab_r3$td£$b£5.5%$/b£$/td£§+1.8$/td£$/tr£$tr£$td£EVP$/td£tab_r15tab_r2#87bfdctab_r3$td£$b£3.3%$/b£$/td£§-1.8$/td£$/tr£$/table£$br£Gültige Wahlzettel: $b£323$/b£$br£Wahlbeteiligung: $b£55.3%$/b£ (+6.3%)","tab_h_fr$tr£$td£UDC$/td£tab_r148tab_r2#547d34tab_r3$td£$b£32.0%$/b£$/td£§+1.4$/td£$/tr£$tr£$td£PS$/td£tab_r138tab_r2#ea546ftab_r3$td£$b£25.5%$/b£$/td£§+5.9$/td£$/tr£$tr£$td£PLR$/td£tab_r117tab_r2#6268AFtab_r3$td£$b£11.5%$/b£$/td£§-4.0$/td£$/tr£$tr£$td£Vert-e-s$/td£tab_r115tab_r2#26b300tab_r3$td£$b£10.1%$/b£$/td£§-9.8$/td£$/tr£$tr£$td£Centre$/td£tab_r114tab_r2#f39f5etab_r3$td£$b£9.4%$/b£$/td£§+3.6$/td£$/tr£$tr£$td£PVL$/td£tab_r18tab_r2#cbd401tab_r3$td£$b£5.5%$/b£$/td£§+1.8$/td£$/tr£$tr£$td£PEV$/td£tab_r15tab_r2#87bfdctab_r3$td£$b£3.3%$/b£$/td£§-1.8$/td£$/tr£$/table£$br£Bulletins de vote valables: $b£323$/b£$br£Taux de participation: $b£55.3%$/b£ (+6.3%)","tab_h_it$tr£$td£UDC$/td£tab_r148tab_r2#547d34tab_r3$td£$b£32.0%$/b£$/td£§+1.4$/td£$/tr£$tr£$td£PS$/td£tab_r138tab_r2#ea546ftab_r3$td£$b£25.5%$/b£$/td£§+5.9$/td£$/tr£$tr£$td£PLR$/td£tab_r117tab_r2#6268AFtab_r3$td£$b£11.5%$/b£$/td£§-4.0$/td£$/tr£$tr£$td£Verdi$/td£tab_r115tab_r2#26b300tab_r3$td£$b£10.1%$/b£$/td£§-9.8$/td£$/tr£$tr£$td£Centro$/td£tab_r114tab_r2#f39f5etab_r3$td£$b£9.4%$/b£$/td£§+3.6$/td£$/tr£$tr£$td£PVL$/td£tab_r18tab_r2#cbd401tab_r3$td£$b£5.5%$/b£$/td£§+1.8$/td£$/tr£$tr£$td£PEV$/td£tab_r15tab_r2#87bfdctab_r3$td£$b£3.3%$/b£$/td£§-1.8$/td£$/tr£$/table£$br£Schede elettorali valide: $b£323$/b£$br£Tasso di partecipazione: $b£55.3%$/b£ (+6.3%)","SVP"
2843,"Buckten BL","Buckten (BL)","Buckten BL","Ganz knapp bleibt die <b>SP</b> die grösste Partei in Buckten. Die Partei holt 31,9 Prozent der Stimmen und hält damit ihren Vorsprung, mit 0,4 Prozentpunkten, vor der <b>SVP</b>. Diese muss sich mit 31,5 Prozent und Platz zwei begnügen. Die Veränderungen gegenüber 2019: <b>SP</b>: +1,5 Prozentpunkte; <b>SVP</b>: +3,3 Prozentpunkte.<br><br>Die <b>Grünen</b> müssen sich mit dem dritten Platz begnügen. Die Partei erreicht nur noch 12,8 Prozent der Stimmen und damit -6,8 Prozentpunkte weniger als vor vier Jahren.","Avec 31,9 % des voix (+1,5 points de pourcentage), le <b>PS</b> est toujours le parti le plus fort à Buckten. L'<b>UDC</b>, qui réalise 31,5 % des suffrages (+3,3 points de pourcentage), est cependant en embuscade. L'écart entre les deux formations politiques est de 0,4 points.<br><br>Les <b>Vert-e-s</b> perdent -6,8 points de pourcentage. La formation n'arrive plus qu'en troisième position avec 12,8 % des voix.","Il partito <b>PS</b> rimane in testa a Buckten con il 31,9 percento dei voti (+1,5 punti percentuali). Il suo rivale, il partito <b>UDC</b>, minaccia però di sovrastarlo con il 31,9 percento dei voti (+3,3 punti percentuali). La differenza tra le due formazioni è solo di 0,4 punti.<br><br>Il partito <b>Verdi</b> perde -6,8 punti percentuali e si classifica ora al terzo posto con il 12,8 percento dei voti.","tab_h$tr£$td£SP$/td£tab_r148tab_r2#ea546ftab_r3$td£$b£31.9%$/b£$/td£§+1.5$/td£$/tr£$tr£$td£SVP$/td£tab_r147tab_r2#547d34tab_r3$td£$b£31.5%$/b£$/td£§+3.3$/td£$/tr£$tr£$td£Grüne$/td£tab_r119tab_r2#26b300tab_r3$td£$b£12.8%$/b£$/td£§-6.8$/td£$/tr£$tr£$td£FDP$/td£tab_r116tab_r2#6268AFtab_r3$td£$b£10.4%$/b£$/td£§-1.2$/td£$/tr£$tr£$td£Mitte$/td£tab_r18tab_r2#f39f5etab_r3$td£$b£5.2%$/b£$/td£§+0.2$/td£$/tr£$tr£$td£GLP$/td£tab_r15tab_r2#cbd401tab_r3$td£$b£3.2%$/b£$/td£§+1.8$/td£$/tr£$tr£$td£weitere$/td£tab_r15tab_r2#bebebetab_r3$td£$b£3.2%$/b£$/td£§+3.2$/td£$/tr£$/table£$br£Gültige Wahlzettel: $b£263$/b£$br£Wahlbeteiligung: $b£55.3%$/b£ (+7.5%)","tab_h_fr$tr£$td£PS$/td£tab_r148tab_r2#ea546ftab_r3$td£$b£31.9%$/b£$/td£§+1.5$/td£$/tr£$tr£$td£UDC$/td£tab_r147tab_r2#547d34tab_r3$td£$b£31.5%$/b£$/td£§+3.3$/td£$/tr£$tr£$td£Vert-e-s$/td£tab_r119tab_r2#26b300tab_r3$td£$b£12.8%$/b£$/td£§-6.8$/td£$/tr£$tr£$td£PLR$/td£tab_r116tab_r2#6268AFtab_r3$td£$b£10.4%$/b£$/td£§-1.2$/td£$/tr£$tr£$td£Centre$/td£tab_r18tab_r2#f39f5etab_r3$td£$b£5.2%$/b£$/td£§+0.2$/td£$/tr£$tr£$td£PVL$/td£tab_r15tab_r2#cbd401tab_r3$td£$b£3.2%$/b£$/td£§+1.8$/td£$/tr£$tr£$td£Divers$/td£tab_r15tab_r2#bebebetab_r3$td£$b£3.2%$/b£$/td£§+3.2$/td£$/tr£$/table£$br£Bulletins de vote valables: $b£263$/b£$br£Taux de participation: $b£55.3%$/b£ (+7.5%)","tab_h_it$tr£$td£PS$/td£tab_r148tab_r2#ea546ftab_r3$td£$b£31.9%$/b£$/td£§+1.5$/td£$/tr£$tr£$td£UDC$/td£tab_r147tab_r2#547d34tab_r3$td£$b£31.5%$/b£$/td£§+3.3$/td£$/tr£$tr£$td£Verdi$/td£tab_r119tab_r2#26b300tab_r3$td£$b£12.8%$/b£$/td£§-6.8$/td£$/tr£$tr£$td£PLR$/td£tab_r116tab_r2#6268AFtab_r3$td£$b£10.4%$/b£$/td£§-1.2$/td£$/tr£$tr£$td£Centro$/td£tab_r18tab_r2#f39f5etab_r3$td£$b£5.2%$/b£$/td£§+0.2$/td£$/tr£$tr£$td£PVL$/td£tab_r15tab_r2#cbd401tab_r3$td£$b£3.2%$/b£$/td£§+1.8$/td£$/tr£$tr£$td£altro$/td£tab_r15tab_r2#bebebetab_r3$td£$b£3.2%$/b£$/td£§+3.2$/td£$/tr£$/table£$br£Schede elettorali valide: $b£263$/b£$br£Tasso di partecipazione: $b£55.3%$/b£ (+7.5%)","SP"
2844,"Buus BL","Buus (BL)","Buus BL","In Buus bleibt die <b>SVP</b> unangefochten die stärkste Partei. Sie vereinigt bei den Nationalratswahlen 46,4 Prozent der Stimmen (+2,6 Prozentpunkte) auf sich, 29,7 Prozentpunkte mehr als die zweitplatzierte <b>SP</b> (16,7 Prozent, +4,3 Prozentpunkte).<br><br>Die <b>Grünen</b> müssen sich mit dem dritten Platz begnügen. Die Partei erreicht nur noch 10,1 Prozent der Stimmen und damit -7,4 Prozentpunkte weniger als vor vier Jahren.","L'<b>UDC</b> maintient sa position de plus grand parti dans la commune de Buus, avec un pourcentage d'électeurs de 46,4 (+2,6 points de pourcentage). L'écart avec le deuxième plus grand parti, le <b>PS</b>, est de 29,7 points de pourcentage. <b>PS</b> obtient 16,7 pourcent des voix (+4,3 points de pourcentage).<br><br>Les <b>Vert-e-s</b>, troisième parti de la commune, a perdu beaucoup de voix. La formation obtient 10,1 % des voix, ce qui représente une perte de -7,4 points de pourcentage.","Il partito <b>UDC</b> è in una posizione di forza a Buus. Ottiene il 46,4 percento dei voti (+2,6 punti percentuali). La differenza con il partito <b>PS</b> è notevole (29,7 punti percentuali). Il secondo partito del comune ha convinto il 16,7 percento degli elettori (+4,3 punti percentuali).<br><br>Il partito <b>Verdi</b> deve accontentarsi del terzo posto, ricevendo solo il 10,1 percento dei voti, ovvero -7,4 punti percentuali in meno rispetto a quattro anni fa.","tab_h$tr£$td£SVP$/td£tab_r170tab_r2#547d34tab_r3$td£$b£46.4%$/b£$/td£§+2.6$/td£$/tr£$tr£$td£SP$/td£tab_r125tab_r2#ea546ftab_r3$td£$b£16.7%$/b£$/td£§+4.3$/td£$/tr£$tr£$td£Grüne$/td£tab_r115tab_r2#26b300tab_r3$td£$b£10.1%$/b£$/td£§-7.4$/td£$/tr£$tr£$td£FDP$/td£tab_r113tab_r2#6268AFtab_r3$td£$b£8.6%$/b£$/td£§-2.8$/td£$/tr£$tr£$td£GLP$/td£tab_r111tab_r2#cbd401tab_r3$td£$b£7.0%$/b£$/td£§+1.5$/td£$/tr£$tr£$td£Mitte$/td£tab_r110tab_r2#f39f5etab_r3$td£$b£6.8%$/b£$/td£§-0.1$/td£$/tr£$/table£$br£Gültige Wahlzettel: $b£388$/b£$br£Wahlbeteiligung: $b£47.4%$/b£ (+5.8%)","tab_h_fr$tr£$td£UDC$/td£tab_r170tab_r2#547d34tab_r3$td£$b£46.4%$/b£$/td£§+2.6$/td£$/tr£$tr£$td£PS$/td£tab_r125tab_r2#ea546ftab_r3$td£$b£16.7%$/b£$/td£§+4.3$/td£$/tr£$tr£$td£Vert-e-s$/td£tab_r115tab_r2#26b300tab_r3$td£$b£10.1%$/b£$/td£§-7.4$/td£$/tr£$tr£$td£PLR$/td£tab_r113tab_r2#6268AFtab_r3$td£$b£8.6%$/b£$/td£§-2.8$/td£$/tr£$tr£$td£PVL$/td£tab_r111tab_r2#cbd401tab_r3$td£$b£7.0%$/b£$/td£§+1.5$/td£$/tr£$tr£$td£Centre$/td£tab_r110tab_r2#f39f5etab_r3$td£$b£6.8%$/b£$/td£§-0.1$/td£$/tr£$/table£$br£Bulletins de vote valables: $b£388$/b£$br£Taux de participation: $b£47.4%$/b£ (+5.8%)","tab_h_it$tr£$td£UDC$/td£tab_r170tab_r2#547d34tab_r3$td£$b£46.4%$/b£$/td£§+2.6$/td£$/tr£$tr£$td£PS$/td£tab_r125tab_r2#ea546ftab_r3$td£$b£16.7%$/b£$/td£§+4.3$/td£$/tr£$tr£$td£Verdi$/td£tab_r115tab_r2#26b300tab_r3$td£$b£10.1%$/b£$/td£§-7.4$/td£$/tr£$tr£$td£PLR$/td£tab_r113tab_r2#6268AFtab_r3$td£$b£8.6%$/b£$/td£§-2.8$/td£$/tr£$tr£$td£PVL$/td£tab_r111tab_r2#cbd401tab_r3$td£$b£7.0%$/b£$/td£§+1.5$/td£$/tr£$tr£$td£Centro$/td£tab_r110tab_r2#f39f5etab_r3$td£$b£6.8%$/b£$/td£§-0.1$/td£$/tr£$/table£$br£Schede elettorali valide: $b£388$/b£$br£Tasso di partecipazione: $b£47.4%$/b£ (+5.8%)","SVP"
2845,"Diepflingen BL","Diepflingen (BL)","Diepflingen BL","Mit deutlichem Abstand bleibt die <b>SVP</b> die grösste Partei in Diepflingen. Ihre Parteistärke beträgt 44,5 Prozent (+2,7 Prozentpunkte). Der Vorsprung auf die nächstgrössere Partei, die <b>FDP</b>, ist gross: 28 Prozentpunkte. Die <b>FDP</b> holt 16,6 Prozent (+3,8 Prozentpunkte).<br><br>Der dritte Platz geht an die <b>SP</b>. Die Partei erreicht 11,7 Prozent der Stimmen (Veränderung von -1,7 Prozentpunkten gegenüber 2019).","L'<b>UDC</b> est en position de force à Diepflingen. La formation remporte 44,5 % des voix (+2,7 points de pourcentage). L'écart est important avec le <b><b>PL</b>R</b> (28 points de pourcentage). Le deuxième parti de la commune a convaincu 16,6 % des électeurs (+3,8 points de pourcentage). <br><br>A la troisième place figure le <b>PS</b>, qui réalise 11,7 % des voix (-1,7).","Il partito <b>UDC</b> rimane il partito preferito degli elettori di Diepflingen, totalizzando il 44,5 percento dei voti (+2,7 punti percentuali rispetto al 2019). Ha 28 punti in più del partito <b>PLR</b> che, con il 16,6 percento dei voti (+3,8 punti percentuali), si classifica al secondo posto in questo comune.<br><br>Al terzo posto troviamo il partito <b>PS</b> con il 11,7 percento dei voti (-1,7).","tab_h$tr£$td£SVP$/td£tab_r167tab_r2#547d34tab_r3$td£$b£44.5%$/b£$/td£§+2.7$/td£$/tr£$tr£$td£FDP$/td£tab_r125tab_r2#6268AFtab_r3$td£$b£16.6%$/b£$/td£§+3.8$/td£$/tr£$tr£$td£SP$/td£tab_r117tab_r2#ea546ftab_r3$td£$b£11.7%$/b£$/td£§-1.7$/td£$/tr£$tr£$td£Grüne$/td£tab_r112tab_r2#26b300tab_r3$td£$b£8.0%$/b£$/td£§-11.3$/td£$/tr£$tr£$td£Mitte$/td£tab_r112tab_r2#f39f5etab_r3$td£$b£7.7%$/b£$/td£§+1.3$/td£$/tr£$tr£$td£GLP$/td£tab_r110tab_r2#cbd401tab_r3$td£$b£6.7%$/b£$/td£§+1.9$/td£$/tr£$/table£$br£Gültige Wahlzettel: $b£225$/b£$br£Wahlbeteiligung: $b£43.5%$/b£ (+4.3%)","tab_h_fr$tr£$td£UDC$/td£tab_r167tab_r2#547d34tab_r3$td£$b£44.5%$/b£$/td£§+2.7$/td£$/tr£$tr£$td£PLR$/td£tab_r125tab_r2#6268AFtab_r3$td£$b£16.6%$/b£$/td£§+3.8$/td£$/tr£$tr£$td£PS$/td£tab_r117tab_r2#ea546ftab_r3$td£$b£11.7%$/b£$/td£§-1.7$/td£$/tr£$tr£$td£Vert-e-s$/td£tab_r112tab_r2#26b300tab_r3$td£$b£8.0%$/b£$/td£§-11.3$/td£$/tr£$tr£$td£Centre$/td£tab_r112tab_r2#f39f5etab_r3$td£$b£7.7%$/b£$/td£§+1.3$/td£$/tr£$tr£$td£PVL$/td£tab_r110tab_r2#cbd401tab_r3$td£$b£6.7%$/b£$/td£§+1.9$/td£$/tr£$/table£$br£Bulletins de vote valables: $b£225$/b£$br£Taux de participation: $b£43.5%$/b£ (+4.3%)","tab_h_it$tr£$td£UDC$/td£tab_r167tab_r2#547d34tab_r3$td£$b£44.5%$/b£$/td£§+2.7$/td£$/tr£$tr£$td£PLR$/td£tab_r125tab_r2#6268AFtab_r3$td£$b£16.6%$/b£$/td£§+3.8$/td£$/tr£$tr£$td£PS$/td£tab_r117tab_r2#ea546ftab_r3$td£$b£11.7%$/b£$/td£§-1.7$/td£$/tr£$tr£$td£Verdi$/td£tab_r112tab_r2#26b300tab_r3$td£$b£8.0%$/b£$/td£§-11.3$/td£$/tr£$tr£$td£Centro$/td£tab_r112tab_r2#f39f5etab_r3$td£$b£7.7%$/b£$/td£§+1.3$/td£$/tr£$tr£$td£PVL$/td£tab_r110tab_r2#cbd401tab_r3$td£$b£6.7%$/b£$/td£§+1.9$/td£$/tr£$/table£$br£Schede elettorali valide: $b£225$/b£$br£Tasso di partecipazione: $b£43.5%$/b£ (+4.3%)","SVP"
2846,"Gelterkinden BL","Gelterkinden (BL)","Gelterkinden BL","In Gelterkinden ist neu die <b>SVP</b> die stärkste Kraft (Rang vor vier Jahren: 2). Bei den diesjährigen Nationalratswahlen vereinigt die Partei 28,1 Prozent der Stimmen auf sich.<br><br>In der Gemeinde landet die <b>SP</b> auf dem zweiten Platz. Die Partei erreicht einen Wählerstimmenanteil von 27,3 Prozent (+2,4 Prozentpunkte). <br><br>Die <b>FDP</b> sichert sich den dritten Platz, mit einem Wähleranteil von 13,1 Prozent (Veränderung gegenüber 2019: -1,2 Prozentpunkte).","Classé au deux ème rang en 2019, l'<b>UDC</b> est le nouveau parti le plus fort à Gelterkinden. La formation obtient 28,1 % des suffrages.<br><br>Le deuxième rang est occupé par le <b>PS</b> qui réalise 27,3 % des voix (+2,4 points de pourcentage par rapport à 2019).<br><br>A la troisième place figure le <b><b>PL</b>R</b>, qui réalise 13,1 % des voix (-1,2).","Classificato al due posto nel 2019, il partito <b>UDC</b> è ora il partito più forte a Gelterkinden. Ottiene il 28,1 percento dei voti.<br><br>Il partito <b>PS</b> è la seconda formazione più forte con il 27,3 percento dei voti (+2,4 punti percentuali rispetto al 2019).<br><br>La terza posizione è occupata dal partito <b>PLR</b>. Ottiene una percentuale di elettori del il 13,1. (-1,2 punti percentuali di differenza rispetto al 2019).","tab_h$tr£$td£SVP$/td£tab_r142tab_r2#547d34tab_r3$td£$b£28.1%$/b£$/td£§+4.5$/td£$/tr£$tr£$td£SP$/td£tab_r141tab_r2#ea546ftab_r3$td£$b£27.3%$/b£$/td£§+2.4$/td£$/tr£$tr£$td£FDP$/td£tab_r120tab_r2#6268AFtab_r3$td£$b£13.1%$/b£$/td£§-1.2$/td£$/tr£$tr£$td£Grüne$/td£tab_r119tab_r2#26b300tab_r3$td£$b£12.4%$/b£$/td£§-10.2$/td£$/tr£$tr£$td£Mitte$/td£tab_r110tab_r2#f39f5etab_r3$td£$b£6.6%$/b£$/td£§+1.6$/td£$/tr£$tr£$td£GLP$/td£tab_r19tab_r2#cbd401tab_r3$td£$b£6.3%$/b£$/td£§+2.0$/td£$/tr£$tr£$td£EVP$/td£tab_r18tab_r2#87bfdctab_r3$td£$b£5.0%$/b£$/td£§-0.4$/td£$/tr£$/table£$br£Gültige Wahlzettel: $b£2'151$/b£$br£Wahlbeteiligung: $b£51.1%$/b£ (+4.6%)","tab_h_fr$tr£$td£UDC$/td£tab_r142tab_r2#547d34tab_r3$td£$b£28.1%$/b£$/td£§+4.5$/td£$/tr£$tr£$td£PS$/td£tab_r141tab_r2#ea546ftab_r3$td£$b£27.3%$/b£$/td£§+2.4$/td£$/tr£$tr£$td£PLR$/td£tab_r120tab_r2#6268AFtab_r3$td£$b£13.1%$/b£$/td£§-1.2$/td£$/tr£$tr£$td£Vert-e-s$/td£tab_r119tab_r2#26b300tab_r3$td£$b£12.4%$/b£$/td£§-10.2$/td£$/tr£$tr£$td£Centre$/td£tab_r110tab_r2#f39f5etab_r3$td£$b£6.6%$/b£$/td£§+1.6$/td£$/tr£$tr£$td£PVL$/td£tab_r19tab_r2#cbd401tab_r3$td£$b£6.3%$/b£$/td£§+2.0$/td£$/tr£$tr£$td£PEV$/td£tab_r18tab_r2#87bfdctab_r3$td£$b£5.0%$/b£$/td£§-0.4$/td£$/tr£$/table£$br£Bulletins de vote valables: $b£2'151$/b£$br£Taux de participation: $b£51.1%$/b£ (+4.6%)","tab_h_it$tr£$td£UDC$/td£tab_r142tab_r2#547d34tab_r3$td£$b£28.1%$/b£$/td£§+4.5$/td£$/tr£$tr£$td£PS$/td£tab_r141tab_r2#ea546ftab_r3$td£$b£27.3%$/b£$/td£§+2.4$/td£$/tr£$tr£$td£PLR$/td£tab_r120tab_r2#6268AFtab_r3$td£$b£13.1%$/b£$/td£§-1.2$/td£$/tr£$tr£$td£Verdi$/td£tab_r119tab_r2#26b300tab_r3$td£$b£12.4%$/b£$/td£§-10.2$/td£$/tr£$tr£$td£Centro$/td£tab_r110tab_r2#f39f5etab_r3$td£$b£6.6%$/b£$/td£§+1.6$/td£$/tr£$tr£$td£PVL$/td£tab_r19tab_r2#cbd401tab_r3$td£$b£6.3%$/b£$/td£§+2.0$/td£$/tr£$tr£$td£PEV$/td£tab_r18tab_r2#87bfdctab_r3$td£$b£5.0%$/b£$/td£§-0.4$/td£$/tr£$/table£$br£Schede elettorali valide: $b£2'151$/b£$br£Tasso di partecipazione: $b£51.1%$/b£ (+4.6%)","SVP"
2847,"Häfelfingen BL","Häfelfingen (BL)","Häfelfingen BL","Mit grossem Abstand verteidigt die <b>SVP</b> ihre Position als grösste Partei in Häfelfingen, mit einem Wähleranteil von 48 Prozent (-1,6 Prozentpunkte). Der Abstand zur zweitgrößten Partei, der <b>SP</b>, beträgt 25,4 Prozentpunkte. Die <b>SP</b> erhält 22,5 Prozent der Stimmen (+6,7 Prozentpunkte).<br><br>Die <b>Grünen</b> verlieren -9 Prozentpunkte und damit so viele Stimmen, dass sie mit einem Wähleranteil von 10,9 Prozent nur noch auf dem dritten Platz landet.","L'<b>UDC</b> est en position de force à Häfelfingen. La formation remporte 48 % des voix (-1,6 points de pourcentage). L'écart est important avec le <b>PS</b> (25,4 points de pourcentage). Le deuxième parti de la commune a convaincu 22,5 % des électeurs (+6,7 points de pourcentage). <br><br>Les <b>Vert-e-s</b>, troisième parti de la commune, a perdu beaucoup de voix. La formation obtient 10,9 % des voix, ce qui représente une perte de -9 points de pourcentage.","Il partito <b>UDC</b> mantiene la sua posizione come la formazione più grande nel comune di Häfelfingen, con una percentuale di elettori del 48 (-1,6 punti percentuali). La differenza con il secondo partito più grande, il partito <b>PS</b>, è di 25,4 punti percentuali. Il partito <b>PS</b> ottiene il 22,5 percento dei voti (+6,7 punti percentuali).<br><br>Il partito <b>Verdi</b>, terzo partito, ha perso molti voti, ricevendo il 10,9 percento dei voti, una perdita di -9 punti percentuali.","tab_h$tr£$td£SVP$/td£tab_r172tab_r2#547d34tab_r3$td£$b£48.0%$/b£$/td£§-1.6$/td£$/tr£$tr£$td£SP$/td£tab_r134tab_r2#ea546ftab_r3$td£$b£22.5%$/b£$/td£§+6.7$/td£$/tr£$tr£$td£Grüne$/td£tab_r116tab_r2#26b300tab_r3$td£$b£10.9%$/b£$/td£§-9.0$/td£$/tr£$tr£$td£FDP$/td£tab_r111tab_r2#6268AFtab_r3$td£$b£7.1%$/b£$/td£§-0.7$/td£$/tr£$tr£$td£Mitte$/td£tab_r110tab_r2#f39f5etab_r3$td£$b£6.5%$/b£$/td£§+2.5$/td£$/tr£$/table£$br£Gültige Wahlzettel: $b£100$/b£$br£Wahlbeteiligung: $b£54.5%$/b£ (+5.5%)","tab_h_fr$tr£$td£UDC$/td£tab_r172tab_r2#547d34tab_r3$td£$b£48.0%$/b£$/td£§-1.6$/td£$/tr£$tr£$td£PS$/td£tab_r134tab_r2#ea546ftab_r3$td£$b£22.5%$/b£$/td£§+6.7$/td£$/tr£$tr£$td£Vert-e-s$/td£tab_r116tab_r2#26b300tab_r3$td£$b£10.9%$/b£$/td£§-9.0$/td£$/tr£$tr£$td£PLR$/td£tab_r111tab_r2#6268AFtab_r3$td£$b£7.1%$/b£$/td£§-0.7$/td£$/tr£$tr£$td£Centre$/td£tab_r110tab_r2#f39f5etab_r3$td£$b£6.5%$/b£$/td£§+2.5$/td£$/tr£$/table£$br£Bulletins de vote valables: $b£100$/b£$br£Taux de participation: $b£54.5%$/b£ (+5.5%)","tab_h_it$tr£$td£UDC$/td£tab_r172tab_r2#547d34tab_r3$td£$b£48.0%$/b£$/td£§-1.6$/td£$/tr£$tr£$td£PS$/td£tab_r134tab_r2#ea546ftab_r3$td£$b£22.5%$/b£$/td£§+6.7$/td£$/tr£$tr£$td£Verdi$/td£tab_r116tab_r2#26b300tab_r3$td£$b£10.9%$/b£$/td£§-9.0$/td£$/tr£$tr£$td£PLR$/td£tab_r111tab_r2#6268AFtab_r3$td£$b£7.1%$/b£$/td£§-0.7$/td£$/tr£$tr£$td£Centro$/td£tab_r110tab_r2#f39f5etab_r3$td£$b£6.5%$/b£$/td£§+2.5$/td£$/tr£$/table£$br£Schede elettorali valide: $b£100$/b£$br£Tasso di partecipazione: $b£54.5%$/b£ (+5.5%)","SVP"
