"ID","Gemeinde_de","Gemeinde_fr","Gemeinde_it","Text_de","Text_fr","Text_it","Tabelle_de","Tabelle_fr","Tabelle_it","Staerkste_Partei"
6404,"Boudry NE","Boudry (NE)","Boudry NE","Die <b>Grünen</b> sind weiterhin die stärkste Kraft in Boudry. Mit 23,6 Prozent Wähleranteil verweist die Partei die <b>Grünen</b> allerdings nur mit 1,6 Prozentpunkten Abstand auf den zweiten Platz. Die zweitstärkste Partei holt 22 Prozent. Die Veränderungen gegenüber 2019: Grüne: -6,3 Prozentpunkte; Grüne: +13,1 Prozentpunkte.<br><br>Die <b>Grünen</b> müssen sich sich mit dem dritten Platz begnügen. Die Partei erreicht nur noch 18,8 Prozent der Stimmen und damit -5,4 Prozentpunkte weniger als vor vier Jahren.","Avec 23,6 pour cent des voix (-6,3 points de pourcentage), les <b>Vert-e-s</b> sont toujours le parti le plus fort à Boudry. Les <b>Vert-e-s</b>, qui réalisent 22 pour cent des suffrages (+13,1 points de pourcentage), est cependant en embuscade. L'écart entre les deux formations politiques est de 1,6 points.<br><br>Les <b>Vert-e-s</b>, troisième parti, ont perdu beaucoup de voix. La formation obtient 18,8 pour cent des voix, ce qui représente une perte de -5,4 points de pourcentage.","Il partito <b>Verdi</b> rimane in testa a Boudry con il 23,6 percento dei voti (-6,3 punti percentuali). Il suo rivale, il partito <b>Verdi</b>, minaccia però di sovrastarlo con il 23,6 percento dei voti (+13,1 punti percentuali). La differenza tra le due formazioni è solo di 1,6 punti.<br><br>Il partito <b>Verdi</b> perde -5,4 punti percentuali e si classifica ora al terzo posto con il 18,8 percento dei voti.","tab_h$tr£$td£FDP$/td£tab_r135tab_r2#6268AFtab_r3$td£$b£23.6%$/b£$/td£§-6.3$/td£$/tr£$tr£$td£Grüne$/td£tab_r133tab_r2#26b300tab_r3$td£$b£22.0%$/b£$/td£§+13.1$/td£$/tr£$tr£$td£SP$/td£tab_r128tab_r2#ea546ftab_r3$td£$b£18.8%$/b£$/td£§-5.4$/td£$/tr£$tr£$td£SVP$/td£tab_r119tab_r2#547d34tab_r3$td£$b£12.5%$/b£$/td£§-7.0$/td£$/tr£$tr£$td£GLP$/td£tab_r116tab_r2#cbd401tab_r3$td£$b£10.4%$/b£$/td£§+6.8$/td£$/tr£$tr£$td£PdA$/td£tab_r113tab_r2#792a8ftab_r3$td£$b£8.9%$/b£$/td£§+2.0$/td£$/tr£$tr£$td£Mitte$/td£tab_r16tab_r2#f39f5etab_r3$td£$b£3.7%$/b£$/td£§+0.3$/td£$/tr£$/table£$br£Gültige Wahlzettel: $b£1'271$/b£$br£Wahlbeteiligung: $b£35.4%$/b£ (-0.9%)","tab_h_fr$tr£$td£PLR$/td£tab_r135tab_r2#6268AFtab_r3$td£$b£23.6%$/b£$/td£§-6.3$/td£$/tr£$tr£$td£Vert-e-s$/td£tab_r133tab_r2#26b300tab_r3$td£$b£22.0%$/b£$/td£§+13.1$/td£$/tr£$tr£$td£PS$/td£tab_r128tab_r2#ea546ftab_r3$td£$b£18.8%$/b£$/td£§-5.4$/td£$/tr£$tr£$td£UDC$/td£tab_r119tab_r2#547d34tab_r3$td£$b£12.5%$/b£$/td£§-7.0$/td£$/tr£$tr£$td£PVL$/td£tab_r116tab_r2#cbd401tab_r3$td£$b£10.4%$/b£$/td£§+6.8$/td£$/tr£$tr£$td£PST-POP$/td£tab_r113tab_r2#792a8ftab_r3$td£$b£8.9%$/b£$/td£§+2.0$/td£$/tr£$tr£$td£Centre$/td£tab_r16tab_r2#f39f5etab_r3$td£$b£3.7%$/b£$/td£§+0.3$/td£$/tr£$/table£$br£Bulletins de vote valables: $b£1'271$/b£$br£Taux de participation: $b£35.4%$/b£ (-0.9%)","tab_h_it$tr£$td£PLR$/td£tab_r135tab_r2#6268AFtab_r3$td£$b£23.6%$/b£$/td£§-6.3$/td£$/tr£$tr£$td£Verdi$/td£tab_r133tab_r2#26b300tab_r3$td£$b£22.0%$/b£$/td£§+13.1$/td£$/tr£$tr£$td£PS$/td£tab_r128tab_r2#ea546ftab_r3$td£$b£18.8%$/b£$/td£§-5.4$/td£$/tr£$tr£$td£UDC$/td£tab_r119tab_r2#547d34tab_r3$td£$b£12.5%$/b£$/td£§-7.0$/td£$/tr£$tr£$td£PVL$/td£tab_r116tab_r2#cbd401tab_r3$td£$b£10.4%$/b£$/td£§+6.8$/td£$/tr£$tr£$td£POP$/td£tab_r113tab_r2#792a8ftab_r3$td£$b£8.9%$/b£$/td£§+2.0$/td£$/tr£$tr£$td£Centro$/td£tab_r16tab_r2#f39f5etab_r3$td£$b£3.7%$/b£$/td£§+0.3$/td£$/tr£$/table£$br£Schede elettorali valide: $b£1'271$/b£$br£Tasso di partecipazione: $b£35.4%$/b£ (-0.9%)","FDP"
6407,"Corcelles-Cormondrèche NE","Corcelles-Cormondrèche (NE)","Corcelles-Cormondrèche NE","Keine Änderung an der Spitze in Corcelles-Cormondrèche: Die <b>Grünen</b> holen  wie vor vier Jahren die meisten Stimmen (26,6 Prozent, -5,5 Prozentpunkte).<br><br>Zweitstärkste Partei sind die <b>Grünen</b>. Die Partei verbessert sich gegenüber den Wahlen 2019 um +12,9 Prozentpunkte deutlich und weist neu einen Wähleranteil von 21,6 Prozent auf.<br><br>Viele Wählerstimmen eingebüsst hat die drittplatzierte Grüne. Die Partei holt noch 17,9 Prozent, was einen Verlust von -7,9 Prozentpunkte bedeutet.","Les électeurs de Corcelles-Cormondrèche n'ont pas retourné leur veste depuis 2019. Le parti le plus fort dans leur commune reste les <b>Vert-e-s</b>, avec 26,6 pour cent des suffrages (-5,5 points de pourcentage).<br><br>Les <b>Vert-e-s</b> sont le deuxième parti le plus fort à Corcelles-Cormondrèche. Il s'est amélioré de +12,9 points de pourcentage par rapport aux élections pour le Conseil national de 2019.<br><br>Les <b>Vert-e-s</b> perdent -7,9 points de pourcentage. Il n'arrive plus qu'en troisième position avec 17,9 pour cent des voix.","Il partito <b>Verdi</b> mantiene la sua posizione come principale forza politica nel comune di Corcelles-Cormondrèche, ottenendo il 26,6 percento dei voti (#Party_change punti percentuali).<br><br>Il partito <b>Verdi</b> subisce una forte diminuzione a Corcelles-Cormondrèche. Perde +12,9 punti percentuali rispetto alle elezioni per il Consiglio Nazionale del 2019 ed è ora il secondo partito del comune con il 21,6 percento dei voti.<br><br>Il partito <b>Verdi</b>, terzo partito, ha perso molti voti, ricevendo il 17,9 percento dei voti, una perdita di -7,9 punti percentuali.","tab_h$tr£$td£FDP$/td£tab_r140tab_r2#6268AFtab_r3$td£$b£26.6%$/b£$/td£§-5.5$/td£$/tr£$tr£$td£Grüne$/td£tab_r132tab_r2#26b300tab_r3$td£$b£21.6%$/b£$/td£§+12.9$/td£$/tr£$tr£$td£SP$/td£tab_r127tab_r2#ea546ftab_r3$td£$b£17.9%$/b£$/td£§-7.9$/td£$/tr£$tr£$td£GLP$/td£tab_r121tab_r2#cbd401tab_r3$td£$b£13.7%$/b£$/td£§+8.8$/td£$/tr£$tr£$td£SVP$/td£tab_r116tab_r2#547d34tab_r3$td£$b£10.4%$/b£$/td£§-6.3$/td£$/tr£$tr£$td£PdA$/td£tab_r110tab_r2#792a8ftab_r3$td£$b£6.8%$/b£$/td£§+0.7$/td£$/tr£$/table£$br£Gültige Wahlzettel: $b£1'494$/b£$br£Wahlbeteiligung: $b£48.0%$/b£ (-3.1%)","tab_h_fr$tr£$td£PLR$/td£tab_r140tab_r2#6268AFtab_r3$td£$b£26.6%$/b£$/td£§-5.5$/td£$/tr£$tr£$td£Vert-e-s$/td£tab_r132tab_r2#26b300tab_r3$td£$b£21.6%$/b£$/td£§+12.9$/td£$/tr£$tr£$td£PS$/td£tab_r127tab_r2#ea546ftab_r3$td£$b£17.9%$/b£$/td£§-7.9$/td£$/tr£$tr£$td£PVL$/td£tab_r121tab_r2#cbd401tab_r3$td£$b£13.7%$/b£$/td£§+8.8$/td£$/tr£$tr£$td£UDC$/td£tab_r116tab_r2#547d34tab_r3$td£$b£10.4%$/b£$/td£§-6.3$/td£$/tr£$tr£$td£PST-POP$/td£tab_r110tab_r2#792a8ftab_r3$td£$b£6.8%$/b£$/td£§+0.7$/td£$/tr£$/table£$br£Bulletins de vote valables: $b£1'494$/b£$br£Taux de participation: $b£48.0%$/b£ (-3.1%)","tab_h_it$tr£$td£PLR$/td£tab_r140tab_r2#6268AFtab_r3$td£$b£26.6%$/b£$/td£§-5.5$/td£$/tr£$tr£$td£Verdi$/td£tab_r132tab_r2#26b300tab_r3$td£$b£21.6%$/b£$/td£§+12.9$/td£$/tr£$tr£$td£PS$/td£tab_r127tab_r2#ea546ftab_r3$td£$b£17.9%$/b£$/td£§-7.9$/td£$/tr£$tr£$td£PVL$/td£tab_r121tab_r2#cbd401tab_r3$td£$b£13.7%$/b£$/td£§+8.8$/td£$/tr£$tr£$td£UDC$/td£tab_r116tab_r2#547d34tab_r3$td£$b£10.4%$/b£$/td£§-6.3$/td£$/tr£$tr£$td£POP$/td£tab_r110tab_r2#792a8ftab_r3$td£$b£6.8%$/b£$/td£§+0.7$/td£$/tr£$/table£$br£Schede elettorali valide: $b£1'494$/b£$br£Tasso di partecipazione: $b£48.0%$/b£ (-3.1%)","FDP"
6408,"Cortaillod NE","Cortaillod (NE)","Cortaillod NE","Grüne behauptet ihre Position als vorherrschende Partei in Cortaillod. Die Partei verzeichnet einen Wähleranteil von 28,9 Prozent (-1 Prozentpunkte).<br><br>Die <b>Grünen</b> steigern sich mit einem Plus von +10,2 Prozentpunkte stark. Die Partei belegt nun den zweiten Platz in der Gemeinde. Der Wählerstimmenanteil beträgt neu 23,6 Prozent.<br><br>Die <b>Grünen</b> verlieren -5,2 Prozentpunkte und damit so viele Stimmen, dass die Partei mit einem Wähleranteil von 15,7 Prozent nur noch auf dem dritten Platz landet.","Les <b>Vert-e-s</b> maintiennent leur position de première force politique dans la commune de Cortaillod. Le parti récolte 28,9 pour cent des suffrages (-1 points de pourcentage).<br><br>Les <b>Vert-e-s</b> sont le deuxième parti le plus fort à Cortaillod. Il s'est amélioré de +10,2 points de pourcentage par rapport aux élections pour le Conseil national de 2019.<br><br>Les <b>Vert-e-s</b> doivent se contenter de la troisième place. Le parti n'obtient plus que 15,7 pour cent des voix, soit -5,2 points de pourcentage de moins qu'il y a quatre ans.","Gli elettori di Cortaillod mantengono la loro fiducia nel partito <b>Verdi</b>, che risulta il primo nel loro comune, come nel 2019, con il 28,9 percento dei voti (-1 punti percentuali).<br><br>Il partito <b>Verdi</b> progredisce notevolmente: ha migliorato il suo risultato di quattro anni fa di +10,2 punti percentuali ed è ora al secondo posto nel comune. La proporzione di voti del partito è ora del 23,6 percento.<br><br>Il partito <b>Verdi</b> deve accontentarsi del terzo posto, ricevendo solo il 15,7 percento dei voti, ovvero -5,2 punti percentuali in meno rispetto a quattro anni fa.","tab_h$tr£$td£FDP$/td£tab_r143tab_r2#6268AFtab_r3$td£$b£28.9%$/b£$/td£§-1.0$/td£$/tr£$tr£$td£Grüne$/td£tab_r135tab_r2#26b300tab_r3$td£$b£23.6%$/b£$/td£§+10.2$/td£$/tr£$tr£$td£SP$/td£tab_r124tab_r2#ea546ftab_r3$td£$b£15.7%$/b£$/td£§-5.2$/td£$/tr£$tr£$td£SVP$/td£tab_r118tab_r2#547d34tab_r3$td£$b£11.9%$/b£$/td£§-8.8$/td£$/tr£$tr£$td£GLP$/td£tab_r115tab_r2#cbd401tab_r3$td£$b£9.9%$/b£$/td£§+6.1$/td£$/tr£$tr£$td£PdA$/td£tab_r111tab_r2#792a8ftab_r3$td£$b£7.1%$/b£$/td£§+1.8$/td£$/tr£$/table£$br£Gültige Wahlzettel: $b£1'212$/b£$br£Wahlbeteiligung: $b£39.8%$/b£ (-2.6%)","tab_h_fr$tr£$td£PLR$/td£tab_r143tab_r2#6268AFtab_r3$td£$b£28.9%$/b£$/td£§-1.0$/td£$/tr£$tr£$td£Vert-e-s$/td£tab_r135tab_r2#26b300tab_r3$td£$b£23.6%$/b£$/td£§+10.2$/td£$/tr£$tr£$td£PS$/td£tab_r124tab_r2#ea546ftab_r3$td£$b£15.7%$/b£$/td£§-5.2$/td£$/tr£$tr£$td£UDC$/td£tab_r118tab_r2#547d34tab_r3$td£$b£11.9%$/b£$/td£§-8.8$/td£$/tr£$tr£$td£PVL$/td£tab_r115tab_r2#cbd401tab_r3$td£$b£9.9%$/b£$/td£§+6.1$/td£$/tr£$tr£$td£PST-POP$/td£tab_r111tab_r2#792a8ftab_r3$td£$b£7.1%$/b£$/td£§+1.8$/td£$/tr£$/table£$br£Bulletins de vote valables: $b£1'212$/b£$br£Taux de participation: $b£39.8%$/b£ (-2.6%)","tab_h_it$tr£$td£PLR$/td£tab_r143tab_r2#6268AFtab_r3$td£$b£28.9%$/b£$/td£§-1.0$/td£$/tr£$tr£$td£Verdi$/td£tab_r135tab_r2#26b300tab_r3$td£$b£23.6%$/b£$/td£§+10.2$/td£$/tr£$tr£$td£PS$/td£tab_r124tab_r2#ea546ftab_r3$td£$b£15.7%$/b£$/td£§-5.2$/td£$/tr£$tr£$td£UDC$/td£tab_r118tab_r2#547d34tab_r3$td£$b£11.9%$/b£$/td£§-8.8$/td£$/tr£$tr£$td£PVL$/td£tab_r115tab_r2#cbd401tab_r3$td£$b£9.9%$/b£$/td£§+6.1$/td£$/tr£$tr£$td£POP$/td£tab_r111tab_r2#792a8ftab_r3$td£$b£7.1%$/b£$/td£§+1.8$/td£$/tr£$/table£$br£Schede elettorali valide: $b£1'212$/b£$br£Tasso di partecipazione: $b£39.8%$/b£ (-2.6%)","FDP"
6412,"Peseux NE","Peseux (NE)","Peseux NE","In Peseux bleiben die <b>Grünen</b> die stimmenstärkste Partei. Die Partei holte 22,6 Prozent aller Stimmen (-7 Prozentpunkte).<br><br>Zweitstärkste Partei sind die <b>Grünen</b>. Die Partei verbessert sich gegenüber den Wahlen 2019 um +10,5 Prozentpunkte deutlich und weist neu einen Wähleranteil von 17,9 Prozent auf.<br><br>Viele Wählerstimmen eingebüsst hat die drittplatzierte Grüne. Die Partei holt noch 17,3 Prozent, was einen Verlust von -7,2 Prozentpunkte bedeutet.","Les électeurs de Peseux maintiennent leur confiance aux <b>Vert-e-s</b>, qui terminent en tête dans leur commune, comme en 2019, avec 22,6 pour cent des voix (-7 points de pourcentage).<br><br>Une progression significative de +10,5 points de pourcentage permet aux <b>Vert-e-s</b> de devenir le deuxième parti de sa commune. La formation politique recueille17,9 pour cent des voix.<br><br>Les <b>Vert-e-s</b> doivent se contenter de la troisième place. Le parti n'obtient plus que 17,3 pour cent des voix, soit -7,2 points de pourcentage de moins qu'il y a quatre ans.","Il partito <b>Verdi</b> mantiene la sua posizione come principale forza politica nel comune di Peseux, ottenendo il 22,6 percento dei voti (#Party_change punti percentuali).<br><br>Il partito <b>Verdi</b> subisce una forte diminuzione a Peseux. Perde +10,5 punti percentuali rispetto alle elezioni per il Consiglio Nazionale del 2019 ed è ora il secondo partito del comune con il 17,9 percento dei voti.<br><br>Il partito <b>Verdi</b> deve accontentarsi del terzo posto, ricevendo solo il 17,3 percento dei voti, ovvero -7,2 punti percentuali in meno rispetto a quattro anni fa.","tab_h$tr£$td£FDP$/td£tab_r134tab_r2#6268AFtab_r3$td£$b£22.6%$/b£$/td£§-7.0$/td£$/tr£$tr£$td£Grüne$/td£tab_r127tab_r2#26b300tab_r3$td£$b£17.9%$/b£$/td£§+10.5$/td£$/tr£$tr£$td£SP$/td£tab_r126tab_r2#ea546ftab_r3$td£$b£17.3%$/b£$/td£§-7.2$/td£$/tr£$tr£$td£GLP$/td£tab_r123tab_r2#cbd401tab_r3$td£$b£15.1%$/b£$/td£§+11.0$/td£$/tr£$tr£$td£SVP$/td£tab_r120tab_r2#547d34tab_r3$td£$b£13.4%$/b£$/td£§-7.5$/td£$/tr£$tr£$td£PdA$/td£tab_r116tab_r2#792a8ftab_r3$td£$b£10.8%$/b£$/td£§+3.5$/td£$/tr£$/table£$br£Gültige Wahlzettel: $b£1'142$/b£$br£Wahlbeteiligung: $b£36.1%$/b£ (-4.7%)","tab_h_fr$tr£$td£PLR$/td£tab_r134tab_r2#6268AFtab_r3$td£$b£22.6%$/b£$/td£§-7.0$/td£$/tr£$tr£$td£Vert-e-s$/td£tab_r127tab_r2#26b300tab_r3$td£$b£17.9%$/b£$/td£§+10.5$/td£$/tr£$tr£$td£PS$/td£tab_r126tab_r2#ea546ftab_r3$td£$b£17.3%$/b£$/td£§-7.2$/td£$/tr£$tr£$td£PVL$/td£tab_r123tab_r2#cbd401tab_r3$td£$b£15.1%$/b£$/td£§+11.0$/td£$/tr£$tr£$td£UDC$/td£tab_r120tab_r2#547d34tab_r3$td£$b£13.4%$/b£$/td£§-7.5$/td£$/tr£$tr£$td£PST-POP$/td£tab_r116tab_r2#792a8ftab_r3$td£$b£10.8%$/b£$/td£§+3.5$/td£$/tr£$/table£$br£Bulletins de vote valables: $b£1'142$/b£$br£Taux de participation: $b£36.1%$/b£ (-4.7%)","tab_h_it$tr£$td£PLR$/td£tab_r134tab_r2#6268AFtab_r3$td£$b£22.6%$/b£$/td£§-7.0$/td£$/tr£$tr£$td£Verdi$/td£tab_r127tab_r2#26b300tab_r3$td£$b£17.9%$/b£$/td£§+10.5$/td£$/tr£$tr£$td£PS$/td£tab_r126tab_r2#ea546ftab_r3$td£$b£17.3%$/b£$/td£§-7.2$/td£$/tr£$tr£$td£PVL$/td£tab_r123tab_r2#cbd401tab_r3$td£$b£15.1%$/b£$/td£§+11.0$/td£$/tr£$tr£$td£UDC$/td£tab_r120tab_r2#547d34tab_r3$td£$b£13.4%$/b£$/td£§-7.5$/td£$/tr£$tr£$td£POP$/td£tab_r116tab_r2#792a8ftab_r3$td£$b£10.8%$/b£$/td£§+3.5$/td£$/tr£$/table£$br£Schede elettorali valide: $b£1'142$/b£$br£Tasso di partecipazione: $b£36.1%$/b£ (-4.7%)","FDP"
6413,"Rochefort NE","Rochefort (NE)","Rochefort NE","Die <b>Grünen</b> sind weiterhin die stärkste Kraft in Rochefort. Mit 30,1 Prozent Wähleranteil verweist die Partei die <b>Grünen</b> allerdings nur mit 2,5 Prozentpunkten Abstand auf den zweiten Platz. Die zweitstärkste Partei holt 27,7 Prozent. Die Veränderungen gegenüber 2019: Grüne: +1 Prozentpunkte; Grüne: +14,5 Prozentpunkte.<br><br>Die <b>Grünen</b> müssen sich sich mit dem dritten Platz begnügen. Die Partei erreicht nur noch 13,5 Prozent der Stimmen und damit -7,7 Prozentpunkte weniger als vor vier Jahren.","Les <b>Vert-e-s</b> restent en tête à Rochefort (30,1 pour cent des voix, +1 points de pourcentage). Son poursuivant, les <b>Vert-e-s</b>, menacent toutefois de lui ravir son fauteuil (27,7 pour cent des suffrages, +14,5 points de pourcentage). L'écart entre les deux formations n'est que de 2,5 points. <br><br>Les <b>Vert-e-s</b> perdent -7,7 points de pourcentage. Il n'arrive plus qu'en troisième position avec 13,5 pour cent des voix.","Il partito <b>Verdi</b> rimane in testa a Rochefort con il 30,1 percento dei voti (+1 punti percentuali). Il suo rivale, il partito <b>Verdi</b>, minaccia però di sovrastarlo con il 30,1 percento dei voti (+14,5 punti percentuali). La differenza tra le due formazioni è solo di 2,5 punti.<br><br>Il partito <b>Verdi</b> perde -7,7 punti percentuali e si classifica ora al terzo posto con il 13,5 percento dei voti.","tab_h$tr£$td£FDP$/td£tab_r145tab_r2#6268AFtab_r3$td£$b£30.1%$/b£$/td£§+1.0$/td£$/tr£$tr£$td£Grüne$/td£tab_r142tab_r2#26b300tab_r3$td£$b£27.7%$/b£$/td£§+14.5$/td£$/tr£$tr£$td£SP$/td£tab_r120tab_r2#ea546ftab_r3$td£$b£13.5%$/b£$/td£§-7.7$/td£$/tr£$tr£$td£SVP$/td£tab_r115tab_r2#547d34tab_r3$td£$b£9.8%$/b£$/td£§-10.3$/td£$/tr£$tr£$td£GLP$/td£tab_r114tab_r2#cbd401tab_r3$td£$b£9.4%$/b£$/td£§+5.0$/td£$/tr£$tr£$td£PdA$/td£tab_r110tab_r2#792a8ftab_r3$td£$b£6.6%$/b£$/td£§+0.8$/td£$/tr£$/table£$br£Gültige Wahlzettel: $b£464$/b£$br£Wahlbeteiligung: $b£47.9%$/b£ (-1.5%)","tab_h_fr$tr£$td£PLR$/td£tab_r145tab_r2#6268AFtab_r3$td£$b£30.1%$/b£$/td£§+1.0$/td£$/tr£$tr£$td£Vert-e-s$/td£tab_r142tab_r2#26b300tab_r3$td£$b£27.7%$/b£$/td£§+14.5$/td£$/tr£$tr£$td£PS$/td£tab_r120tab_r2#ea546ftab_r3$td£$b£13.5%$/b£$/td£§-7.7$/td£$/tr£$tr£$td£UDC$/td£tab_r115tab_r2#547d34tab_r3$td£$b£9.8%$/b£$/td£§-10.3$/td£$/tr£$tr£$td£PVL$/td£tab_r114tab_r2#cbd401tab_r3$td£$b£9.4%$/b£$/td£§+5.0$/td£$/tr£$tr£$td£PST-POP$/td£tab_r110tab_r2#792a8ftab_r3$td£$b£6.6%$/b£$/td£§+0.8$/td£$/tr£$/table£$br£Bulletins de vote valables: $b£464$/b£$br£Taux de participation: $b£47.9%$/b£ (-1.5%)","tab_h_it$tr£$td£PLR$/td£tab_r145tab_r2#6268AFtab_r3$td£$b£30.1%$/b£$/td£§+1.0$/td£$/tr£$tr£$td£Verdi$/td£tab_r142tab_r2#26b300tab_r3$td£$b£27.7%$/b£$/td£§+14.5$/td£$/tr£$tr£$td£PS$/td£tab_r120tab_r2#ea546ftab_r3$td£$b£13.5%$/b£$/td£§-7.7$/td£$/tr£$tr£$td£UDC$/td£tab_r115tab_r2#547d34tab_r3$td£$b£9.8%$/b£$/td£§-10.3$/td£$/tr£$tr£$td£PVL$/td£tab_r114tab_r2#cbd401tab_r3$td£$b£9.4%$/b£$/td£§+5.0$/td£$/tr£$tr£$td£POP$/td£tab_r110tab_r2#792a8ftab_r3$td£$b£6.6%$/b£$/td£§+0.8$/td£$/tr£$/table£$br£Schede elettorali valide: $b£464$/b£$br£Tasso di partecipazione: $b£47.9%$/b£ (-1.5%)","FDP"
6416,"Milvignes NE","Milvignes (NE)","Milvignes NE","Grüne behauptet ihre Position als vorherrschende Partei in Milvignes. Die Partei verzeichnet einen Wähleranteil von 28,7 Prozent (-6,2 Prozentpunkte).<br><br>Die <b>Grünen</b> steigern sich mit einem Plus von +11,7 Prozentpunkte stark. Die Partei belegt nun den zweiten Platz in der Gemeinde. Der Wählerstimmenanteil beträgt neu 19,2 Prozent.<br><br>Auf dem dritten Platz landen die <b>Grünen</b> mit 18,1 Prozent der Stimmen. Das bedeutet eine Veränderung von -4,5 Prozentpunkte gegenüber 2019. ","Les électeurs de Milvignes maintiennent leur confiance aux <b>Vert-e-s</b>, qui terminent en tête dans leur commune, comme en 2019, avec 28,7 pour cent des voix (-6,2 points de pourcentage).<br><br>Les <b>Vert-e-s</b> sont le deuxième parti le plus fort à Milvignes. Il s'est amélioré de +11,7 points de pourcentage par rapport aux élections pour le Conseil national de 2019.<br><br>La troisième place est occupée par les <b>Vert-e-s</b>. Ils obtiennent un pourcentage d'électeurs de 18,1. (-4,5 points de pourcentage de différence par rapport à 2019).","Il partito <b>Verdi</b> mantiene la sua posizione come principale forza politica nel comune di Milvignes, ottenendo il 28,7 percento dei voti (#Party_change punti percentuali).<br><br>Il partito <b>Verdi</b> subisce una forte diminuzione a Milvignes. Perde +11,7 punti percentuali rispetto alle elezioni per il Consiglio Nazionale del 2019 ed è ora il secondo partito del comune con il 19,2 percento dei voti.<br><br>Il partito <b>Verdi</b> completa il podio con il 18,1 percento dei voti (-4,5).","tab_h$tr£$td£FDP$/td£tab_r143tab_r2#6268AFtab_r3$td£$b£28.7%$/b£$/td£§-6.2$/td£$/tr£$tr£$td£Grüne$/td£tab_r129tab_r2#26b300tab_r3$td£$b£19.2%$/b£$/td£§+11.7$/td£$/tr£$tr£$td£SP$/td£tab_r127tab_r2#ea546ftab_r3$td£$b£18.1%$/b£$/td£§-4.5$/td£$/tr£$tr£$td£GLP$/td£tab_r118tab_r2#cbd401tab_r3$td£$b£12.1%$/b£$/td£§+8.4$/td£$/tr£$tr£$td£SVP$/td£tab_r116tab_r2#547d34tab_r3$td£$b£11.0%$/b£$/td£§-6.5$/td£$/tr£$tr£$td£PdA$/td£tab_r111tab_r2#792a8ftab_r3$td£$b£7.3%$/b£$/td£§+0.6$/td£$/tr£$tr£$td£Mitte$/td£tab_r15tab_r2#f39f5etab_r3$td£$b£3.4%$/b£$/td£§-0.3$/td£$/tr£$/table£$br£Gültige Wahlzettel: $b£2'647$/b£$br£Wahlbeteiligung: $b£44.0%$/b£ (-1.9%)","tab_h_fr$tr£$td£PLR$/td£tab_r143tab_r2#6268AFtab_r3$td£$b£28.7%$/b£$/td£§-6.2$/td£$/tr£$tr£$td£Vert-e-s$/td£tab_r129tab_r2#26b300tab_r3$td£$b£19.2%$/b£$/td£§+11.7$/td£$/tr£$tr£$td£PS$/td£tab_r127tab_r2#ea546ftab_r3$td£$b£18.1%$/b£$/td£§-4.5$/td£$/tr£$tr£$td£PVL$/td£tab_r118tab_r2#cbd401tab_r3$td£$b£12.1%$/b£$/td£§+8.4$/td£$/tr£$tr£$td£UDC$/td£tab_r116tab_r2#547d34tab_r3$td£$b£11.0%$/b£$/td£§-6.5$/td£$/tr£$tr£$td£PST-POP$/td£tab_r111tab_r2#792a8ftab_r3$td£$b£7.3%$/b£$/td£§+0.6$/td£$/tr£$tr£$td£Centre$/td£tab_r15tab_r2#f39f5etab_r3$td£$b£3.4%$/b£$/td£§-0.3$/td£$/tr£$/table£$br£Bulletins de vote valables: $b£2'647$/b£$br£Taux de participation: $b£44.0%$/b£ (-1.9%)","tab_h_it$tr£$td£PLR$/td£tab_r143tab_r2#6268AFtab_r3$td£$b£28.7%$/b£$/td£§-6.2$/td£$/tr£$tr£$td£Verdi$/td£tab_r129tab_r2#26b300tab_r3$td£$b£19.2%$/b£$/td£§+11.7$/td£$/tr£$tr£$td£PS$/td£tab_r127tab_r2#ea546ftab_r3$td£$b£18.1%$/b£$/td£§-4.5$/td£$/tr£$tr£$td£PVL$/td£tab_r118tab_r2#cbd401tab_r3$td£$b£12.1%$/b£$/td£§+8.4$/td£$/tr£$tr£$td£UDC$/td£tab_r116tab_r2#547d34tab_r3$td£$b£11.0%$/b£$/td£§-6.5$/td£$/tr£$tr£$td£POP$/td£tab_r111tab_r2#792a8ftab_r3$td£$b£7.3%$/b£$/td£§+0.6$/td£$/tr£$tr£$td£Centro$/td£tab_r15tab_r2#f39f5etab_r3$td£$b£3.4%$/b£$/td£§-0.3$/td£$/tr£$/table£$br£Schede elettorali valide: $b£2'647$/b£$br£Tasso di partecipazione: $b£44.0%$/b£ (-1.9%)","FDP"
6417,"La Grande Béroche NE","La Grande Béroche (NE)","La Grande Béroche NE","Grüne behauptet ihre Position als vorherrschende Partei in La Grande Béroche. Die Partei verzeichnet einen Wähleranteil von 25,8 Prozent (-3,9 Prozentpunkte).<br><br>Mit einer markanten Verbesserung um +13,4 Prozentpunkte sind die <b>Grünen</b> die zweitstärkste Kraft in der Gemeinde. Der Wählerstimmenanteil der Partei liegt neu bei 21,9 Prozent.<br><br>Viele Wählerstimmen eingebüsst hat die drittplatzierte Grüne. Die Partei holt noch 19 Prozent, was einen Verlust von -6,7 Prozentpunkte bedeutet.","Aucune formation politique ne parvient à prendre la place de numéro un aux <b>Vert-e-s</b> à La Grande Béroche. Le parti obtient 25,8 pour cent des suffrages (-3,9 points de pourcentage).<br><br>Une progression significative de +13,4 points de pourcentage permet aux <b>Vert-e-s</b> de devenir le deuxième parti de sa commune. La formation politique recueille21,9 pour cent des voix.<br><br>Les <b>Vert-e-s</b> doivent se contenter de la troisième place. Le parti n'obtient plus que 19 pour cent des voix, soit -6,7 points de pourcentage de moins qu'il y a quatre ans.","Il partito <b>Verdi</b> è imbattuto a La Grande Béroche, dove ha ottenuto il 25,8 percento dei voti (#Party_change punti percentuali).<br><br>Il partito <b>Verdi</b> perde molte preferenze. Il partito registra una diminuzione di +13,4 punti percentuali rispetto alle elezioni del 2019. Nonostante ciò, rimane in seconda posizione con una percentuale di elettori del 21,9 percento.<br><br>Il partito <b>Verdi</b> perde -6,7 punti percentuali e si classifica ora al terzo posto con il 19 percento dei voti.","tab_h$tr£$td£FDP$/td£tab_r139tab_r2#6268AFtab_r3$td£$b£25.8%$/b£$/td£§-3.9$/td£$/tr£$tr£$td£Grüne$/td£tab_r133tab_r2#26b300tab_r3$td£$b£21.9%$/b£$/td£§+13.4$/td£$/tr£$tr£$td£SP$/td£tab_r128tab_r2#ea546ftab_r3$td£$b£19.0%$/b£$/td£§-6.7$/td£$/tr£$tr£$td£SVP$/td£tab_r120tab_r2#547d34tab_r3$td£$b£13.4%$/b£$/td£§-6.9$/td£$/tr£$tr£$td£GLP$/td£tab_r115tab_r2#cbd401tab_r3$td£$b£10.2%$/b£$/td£§+6.2$/td£$/tr£$tr£$td£PdA$/td£tab_r110tab_r2#792a8ftab_r3$td£$b£6.7%$/b£$/td£§+0.8$/td£$/tr£$/table£$br£Gültige Wahlzettel: $b£2'418$/b£$br£Wahlbeteiligung: $b£41.2%$/b£ (-3.0%)","tab_h_fr$tr£$td£PLR$/td£tab_r139tab_r2#6268AFtab_r3$td£$b£25.8%$/b£$/td£§-3.9$/td£$/tr£$tr£$td£Vert-e-s$/td£tab_r133tab_r2#26b300tab_r3$td£$b£21.9%$/b£$/td£§+13.4$/td£$/tr£$tr£$td£PS$/td£tab_r128tab_r2#ea546ftab_r3$td£$b£19.0%$/b£$/td£§-6.7$/td£$/tr£$tr£$td£UDC$/td£tab_r120tab_r2#547d34tab_r3$td£$b£13.4%$/b£$/td£§-6.9$/td£$/tr£$tr£$td£PVL$/td£tab_r115tab_r2#cbd401tab_r3$td£$b£10.2%$/b£$/td£§+6.2$/td£$/tr£$tr£$td£PST-POP$/td£tab_r110tab_r2#792a8ftab_r3$td£$b£6.7%$/b£$/td£§+0.8$/td£$/tr£$/table£$br£Bulletins de vote valables: $b£2'418$/b£$br£Taux de participation: $b£41.2%$/b£ (-3.0%)","tab_h_it$tr£$td£PLR$/td£tab_r139tab_r2#6268AFtab_r3$td£$b£25.8%$/b£$/td£§-3.9$/td£$/tr£$tr£$td£Verdi$/td£tab_r133tab_r2#26b300tab_r3$td£$b£21.9%$/b£$/td£§+13.4$/td£$/tr£$tr£$td£PS$/td£tab_r128tab_r2#ea546ftab_r3$td£$b£19.0%$/b£$/td£§-6.7$/td£$/tr£$tr£$td£UDC$/td£tab_r120tab_r2#547d34tab_r3$td£$b£13.4%$/b£$/td£§-6.9$/td£$/tr£$tr£$td£PVL$/td£tab_r115tab_r2#cbd401tab_r3$td£$b£10.2%$/b£$/td£§+6.2$/td£$/tr£$tr£$td£POP$/td£tab_r110tab_r2#792a8ftab_r3$td£$b£6.7%$/b£$/td£§+0.8$/td£$/tr£$/table£$br£Schede elettorali valide: $b£2'418$/b£$br£Tasso di partecipazione: $b£41.2%$/b£ (-3.0%)","FDP"
