"ID","Gemeinde_de","Gemeinde_fr","Gemeinde_it","Text_de","Text_fr","Text_it","Tabelle_de","Tabelle_fr","Tabelle_it","Staerkste_Partei"
6455,"Le Landeron NE","Le Landeron (NE)","Le Landeron NE","Die <b>Grünen</b> können ihre Position als dominierende politische Kraft in Le Landeron beibehalten, mit einem Wähleranteil von 31,6 Prozent (-2,2 Prozentpunkte).<br><br>Die <b>Grünen</b> steigern sich mit einem Plus von +11,1 Prozentpunkte stark. Die Partei belegt nun den zweiten Platz in der Gemeinde. Der Wählerstimmenanteil beträgt neu 16,4 Prozent.<br><br>Die <b>Grünen</b> müssen sich sich mit dem dritten Platz begnügen. Die Partei erreicht nur noch 14,2 Prozent der Stimmen und damit -6,6 Prozentpunkte weniger als vor vier Jahren.","Les électeurs du Landeron maintiennent leur confiance aux <b>Vert-e-s</b>, qui terminent en tête dans leur commune, comme en 2019, avec 31,6 pour cent des voix (-2,2 points de pourcentage).<br><br>Une progression significative de +11,1 points de pourcentage permet aux <b>Vert-e-s</b> de devenir le deuxième parti de sa commune. La formation politique recueille16,4 pour cent des voix.<br><br>Les <b>Vert-e-s</b> perdent -6,6 points de pourcentage. Il n'arrive plus qu'en troisième position avec 14,2 pour cent des voix.","Il partito <b>Verdi</b> mantiene il primo posto a Le Landeron e ottiene il 31,6 percento dei voti (-2,2 punti percentuali).<br><br>Il partito <b>Verdi</b> subisce una forte diminuzione a Le Landeron. Perde +11,1 punti percentuali rispetto alle elezioni per il Consiglio Nazionale del 2019 ed è ora il secondo partito del comune con il 16,4 percento dei voti.<br><br>Il partito <b>Verdi</b>, terzo partito, ha perso molti voti, ricevendo il 14,2 percento dei voti, una perdita di -6,6 punti percentuali.","tab_h$tr£$td£FDP$/td£tab_r147tab_r2#6268AFtab_r3$td£$b£31.6%$/b£$/td£§-2.2$/td£$/tr£$tr£$td£Grüne$/td£tab_r125tab_r2#26b300tab_r3$td£$b£16.4%$/b£$/td£§+11.1$/td£$/tr£$tr£$td£SP$/td£tab_r121tab_r2#ea546ftab_r3$td£$b£14.2%$/b£$/td£§-6.6$/td£$/tr£$tr£$td£SVP$/td£tab_r121tab_r2#547d34tab_r3$td£$b£14.1%$/b£$/td£§-9.6$/td£$/tr£$tr£$td£GLP$/td£tab_r118tab_r2#cbd401tab_r3$td£$b£12.3%$/b£$/td£§+8.8$/td£$/tr£$tr£$td£PdA$/td£tab_r111tab_r2#792a8ftab_r3$td£$b£7.0%$/b£$/td£§+2.6$/td£$/tr£$tr£$td£Mitte$/td£tab_r16tab_r2#f39f5etab_r3$td£$b£4.1%$/b£$/td£§-0.4$/td£$/tr£$/table£$br£Gültige Wahlzettel: $b£1'225$/b£$br£Wahlbeteiligung: $b£39.8%$/b£ (+0.2%)","tab_h_fr$tr£$td£PLR$/td£tab_r147tab_r2#6268AFtab_r3$td£$b£31.6%$/b£$/td£§-2.2$/td£$/tr£$tr£$td£Vert-e-s$/td£tab_r125tab_r2#26b300tab_r3$td£$b£16.4%$/b£$/td£§+11.1$/td£$/tr£$tr£$td£PS$/td£tab_r121tab_r2#ea546ftab_r3$td£$b£14.2%$/b£$/td£§-6.6$/td£$/tr£$tr£$td£UDC$/td£tab_r121tab_r2#547d34tab_r3$td£$b£14.1%$/b£$/td£§-9.6$/td£$/tr£$tr£$td£PVL$/td£tab_r118tab_r2#cbd401tab_r3$td£$b£12.3%$/b£$/td£§+8.8$/td£$/tr£$tr£$td£PST-POP$/td£tab_r111tab_r2#792a8ftab_r3$td£$b£7.0%$/b£$/td£§+2.6$/td£$/tr£$tr£$td£Centre$/td£tab_r16tab_r2#f39f5etab_r3$td£$b£4.1%$/b£$/td£§-0.4$/td£$/tr£$/table£$br£Bulletins de vote valables: $b£1'225$/b£$br£Taux de participation: $b£39.8%$/b£ (+0.2%)","tab_h_it$tr£$td£PLR$/td£tab_r147tab_r2#6268AFtab_r3$td£$b£31.6%$/b£$/td£§-2.2$/td£$/tr£$tr£$td£Verdi$/td£tab_r125tab_r2#26b300tab_r3$td£$b£16.4%$/b£$/td£§+11.1$/td£$/tr£$tr£$td£PS$/td£tab_r121tab_r2#ea546ftab_r3$td£$b£14.2%$/b£$/td£§-6.6$/td£$/tr£$tr£$td£UDC$/td£tab_r121tab_r2#547d34tab_r3$td£$b£14.1%$/b£$/td£§-9.6$/td£$/tr£$tr£$td£PVL$/td£tab_r118tab_r2#cbd401tab_r3$td£$b£12.3%$/b£$/td£§+8.8$/td£$/tr£$tr£$td£POP$/td£tab_r111tab_r2#792a8ftab_r3$td£$b£7.0%$/b£$/td£§+2.6$/td£$/tr£$tr£$td£Centro$/td£tab_r16tab_r2#f39f5etab_r3$td£$b£4.1%$/b£$/td£§-0.4$/td£$/tr£$/table£$br£Schede elettorali valide: $b£1'225$/b£$br£Tasso di partecipazione: $b£39.8%$/b£ (+0.2%)","FDP"
6456,"Lignières NE","Lignières (NE)","Lignières NE","Unverändert sind die <b>Grünen</b> die stärkste Partei in Lignières mit 33,5 Prozent (-0,8 Prozentpunkte).<br><br>Mit einem Wählerstimmenanteil von 17,5 Prozent (+1,7 Prozentpunkte) sind die <b>Grünen</b> die zweitstärkste Kraft in der Gemeinde.<br><br>Die <b>Grünen</b> verzeichnen einen deutlichen Zuwachs. Die Partei belegt nun den dritten Platz in der Gemeinde und erreicht neu einen Wähleranteil von 14,5 Prozent. Das sind +6,3 Prozentpunkte mehr als im Vergleich bei den letzten Wahlen.","Les <b>Vert-e-s</b> maintiennent leur position de première force politique dans la commune de Lignières. Le parti récolte 33,5 pour cent des suffrages (-0,8 points de pourcentage).<br><br>Les <b>Vert-e-s</b> arrivent en deuxième position.Il obtient un pourcentage de voix de 17,5 (+1,7 points de pourcentage).<br><br>Une forte progression de +6,3 points de pourcentage par rapport aux dernières élections fédérales permet aux <b>Vert-e-s</b> de grimper à la troisième place dans la commune. Son pourcentage d'électeurs est désormais de 14,5 pour cent.","Il partito <b>Verdi</b> è imbattuto a Lignières, dove ha ottenuto il 33,5 percento dei voti (#Party_change punti percentuali).<br><br>Il partito <b>Verdi</b> arriva in seconda posizione nel comune con una percentuale di votanti del 17,5 (+1,7 punti percentuali).<br><br>Il partito <b>Verdi</b> registra una forte crescita. Ora si classifica terzo nel comune e riceve il 14,5 percento dei voti, ovvero +6,3 punti percentuali in più rispetto al 2019.","tab_h$tr£$td£FDP$/td£tab_r150tab_r2#6268AFtab_r3$td£$b£33.5%$/b£$/td£§-0.8$/td£$/tr£$tr£$td£SP$/td£tab_r126tab_r2#ea546ftab_r3$td£$b£17.5%$/b£$/td£§+1.7$/td£$/tr£$tr£$td£Grüne$/td£tab_r122tab_r2#26b300tab_r3$td£$b£14.5%$/b£$/td£§+6.3$/td£$/tr£$tr£$td£SVP$/td£tab_r122tab_r2#547d34tab_r3$td£$b£14.4%$/b£$/td£§-13.4$/td£$/tr£$tr£$td£GLP$/td£tab_r120tab_r2#cbd401tab_r3$td£$b£13.5%$/b£$/td£§+9.7$/td£$/tr£$tr£$td£PdA$/td£tab_r16tab_r2#792a8ftab_r3$td£$b£3.9%$/b£$/td£§+0.5$/td£$/tr£$/table£$br£Gültige Wahlzettel: $b£281$/b£$br£Wahlbeteiligung: $b£42.2%$/b£ (-2.4%)","tab_h_fr$tr£$td£PLR$/td£tab_r150tab_r2#6268AFtab_r3$td£$b£33.5%$/b£$/td£§-0.8$/td£$/tr£$tr£$td£PS$/td£tab_r126tab_r2#ea546ftab_r3$td£$b£17.5%$/b£$/td£§+1.7$/td£$/tr£$tr£$td£Vert-e-s$/td£tab_r122tab_r2#26b300tab_r3$td£$b£14.5%$/b£$/td£§+6.3$/td£$/tr£$tr£$td£UDC$/td£tab_r122tab_r2#547d34tab_r3$td£$b£14.4%$/b£$/td£§-13.4$/td£$/tr£$tr£$td£PVL$/td£tab_r120tab_r2#cbd401tab_r3$td£$b£13.5%$/b£$/td£§+9.7$/td£$/tr£$tr£$td£PST-POP$/td£tab_r16tab_r2#792a8ftab_r3$td£$b£3.9%$/b£$/td£§+0.5$/td£$/tr£$/table£$br£Bulletins de vote valables: $b£281$/b£$br£Taux de participation: $b£42.2%$/b£ (-2.4%)","tab_h_it$tr£$td£PLR$/td£tab_r150tab_r2#6268AFtab_r3$td£$b£33.5%$/b£$/td£§-0.8$/td£$/tr£$tr£$td£PS$/td£tab_r126tab_r2#ea546ftab_r3$td£$b£17.5%$/b£$/td£§+1.7$/td£$/tr£$tr£$td£Verdi$/td£tab_r122tab_r2#26b300tab_r3$td£$b£14.5%$/b£$/td£§+6.3$/td£$/tr£$tr£$td£UDC$/td£tab_r122tab_r2#547d34tab_r3$td£$b£14.4%$/b£$/td£§-13.4$/td£$/tr£$tr£$td£PVL$/td£tab_r120tab_r2#cbd401tab_r3$td£$b£13.5%$/b£$/td£§+9.7$/td£$/tr£$tr£$td£POP$/td£tab_r16tab_r2#792a8ftab_r3$td£$b£3.9%$/b£$/td£§+0.5$/td£$/tr£$/table£$br£Schede elettorali valide: $b£281$/b£$br£Tasso di partecipazione: $b£42.2%$/b£ (-2.4%)","FDP"
6458,"Neuenburg NE","Neuchâtel (NE)","Neuenburg NE","Die <b>Grünen</b> erhöhen ihren Stimmenanteil in Neuenburg um +14,1 Prozentpunkte deutlich und wird damit zur stärksten politischen Kraft. Am Ende holt die Partei 26,2 Prozent der Wählerstimmen.<br><br>Trotz einem Minus von -8,4 Prozentpunkten gegenüber den Wahlen 2019 belegen die <b>Grünen</b> immer noch den zweiten Platz. Dies dank eines Wähleranteils von 20,9 Prozent.<br><br>Die <b>Grünen</b> müssen sich sich mit dem dritten Platz begnügen. Die Partei erreicht nur noch 17,8 Prozent der Stimmen und damit -5 Prozentpunkte weniger als vor vier Jahren.","Les <b>Vert-e-s</b> réalisent une forte progression (+14,1 points de pourcentage) Il est désormais le parti le plus fort de Neuchâtel. Le parti obtient 26,2 pour centage des voix.<br><br>Les <b>Vert-e-s</b> connaissent un fort recul à Neuchâtel. Il perd -8,4 points de pourcentage par rapport aux élections pour le Conseil national de 2019 et est désormais le deuxième parti de la commune avec 20,9 pour cent des suffrages.<br><br>Les <b>Vert-e-s</b>, troisième parti, ont perdu beaucoup de voix. La formation obtient 17,8 pour cent des voix, ce qui représente une perte de -5 points de pourcentage.","Il partito <b>Verdi</b> aumenta significativamente la sua percentuale di voti a Neuenburg (+14,1 punti percentuali), diventando così la formazione più forte. Alla fine ottiene il 26,2 percento dei voti degli elettori.<br><br>Nonostante una perdita di -8,4 punti percentuali rispetto alle elezioni del 2019, il partito <b>Verdi</b> occupa ancora il secondo posto. Raccoglie il 20,9 percento dei voti.<br><br>Il partito <b>Verdi</b>, terzo partito, ha perso molti voti, ricevendo il 17,8 percento dei voti, una perdita di -5 punti percentuali.","tab_h$tr£$td£Grüne$/td£tab_r139tab_r2#26b300tab_r3$td£$b£26.2%$/b£$/td£§+14.1$/td£$/tr£$tr£$td£SP$/td£tab_r131tab_r2#ea546ftab_r3$td£$b£20.9%$/b£$/td£§-8.4$/td£$/tr£$tr£$td£FDP$/td£tab_r127tab_r2#6268AFtab_r3$td£$b£17.8%$/b£$/td£§-5.0$/td£$/tr£$tr£$td£PdA$/td£tab_r119tab_r2#792a8ftab_r3$td£$b£12.9%$/b£$/td£§+2.8$/td£$/tr£$tr£$td£GLP$/td£tab_r117tab_r2#cbd401tab_r3$td£$b£11.2%$/b£$/td£§+5.7$/td£$/tr£$tr£$td£SVP$/td£tab_r112tab_r2#547d34tab_r3$td£$b£7.7%$/b£$/td£§-5.8$/td£$/tr£$tr£$td£Mitte$/td£tab_r15tab_r2#f39f5etab_r3$td£$b£3.2%$/b£$/td£§-0.6$/td£$/tr£$/table£$br£Gültige Wahlzettel: $b£7'977$/b£$br£Wahlbeteiligung: $b£41.0%$/b£ (-0.3%)","tab_h_fr$tr£$td£Vert-e-s$/td£tab_r139tab_r2#26b300tab_r3$td£$b£26.2%$/b£$/td£§+14.1$/td£$/tr£$tr£$td£PS$/td£tab_r131tab_r2#ea546ftab_r3$td£$b£20.9%$/b£$/td£§-8.4$/td£$/tr£$tr£$td£PLR$/td£tab_r127tab_r2#6268AFtab_r3$td£$b£17.8%$/b£$/td£§-5.0$/td£$/tr£$tr£$td£PST-POP$/td£tab_r119tab_r2#792a8ftab_r3$td£$b£12.9%$/b£$/td£§+2.8$/td£$/tr£$tr£$td£PVL$/td£tab_r117tab_r2#cbd401tab_r3$td£$b£11.2%$/b£$/td£§+5.7$/td£$/tr£$tr£$td£UDC$/td£tab_r112tab_r2#547d34tab_r3$td£$b£7.7%$/b£$/td£§-5.8$/td£$/tr£$tr£$td£Centre$/td£tab_r15tab_r2#f39f5etab_r3$td£$b£3.2%$/b£$/td£§-0.6$/td£$/tr£$/table£$br£Bulletins de vote valables: $b£7'977$/b£$br£Taux de participation: $b£41.0%$/b£ (-0.3%)","tab_h_it$tr£$td£Verdi$/td£tab_r139tab_r2#26b300tab_r3$td£$b£26.2%$/b£$/td£§+14.1$/td£$/tr£$tr£$td£PS$/td£tab_r131tab_r2#ea546ftab_r3$td£$b£20.9%$/b£$/td£§-8.4$/td£$/tr£$tr£$td£PLR$/td£tab_r127tab_r2#6268AFtab_r3$td£$b£17.8%$/b£$/td£§-5.0$/td£$/tr£$tr£$td£POP$/td£tab_r119tab_r2#792a8ftab_r3$td£$b£12.9%$/b£$/td£§+2.8$/td£$/tr£$tr£$td£PVL$/td£tab_r117tab_r2#cbd401tab_r3$td£$b£11.2%$/b£$/td£§+5.7$/td£$/tr£$tr£$td£UDC$/td£tab_r112tab_r2#547d34tab_r3$td£$b£7.7%$/b£$/td£§-5.8$/td£$/tr£$tr£$td£Centro$/td£tab_r15tab_r2#f39f5etab_r3$td£$b£3.2%$/b£$/td£§-0.6$/td£$/tr£$/table£$br£Schede elettorali valide: $b£7'977$/b£$br£Tasso di partecipazione: $b£41.0%$/b£ (-0.3%)","Grüne"
6459,"Saint-Blaise NE","Saint-Blaise (NE)","Saint-Blaise NE","In Saint-Blaise verlieren die <b>Grünen</b> zwar deutlich an Stimmen. Die Partei bleibt aber dennoch die stärkste Kraft und kommt neu auf einen Wähleranteil von 30,4 Prozent (-8,2 Prozentpunkte).<br><br>Zweitstärkste Partei sind die <b>Grünen</b>. Die Partei verbessert sich gegenüber den Wahlen 2019 um +11,2 Prozentpunkte deutlich und weist neu einen Wähleranteil von 18,6 Prozent auf.<br><br>Die <b>Grünen</b> müssen sich sich mit dem dritten Platz begnügen. Die Partei erreicht nur noch 17,1 Prozent der Stimmen und damit -8,4 Prozentpunkte weniger als vor vier Jahren.","Malgré des pertes considérables à Saint-Blaise, les <b>Vert-e-s</b> reste en tête. Il convainc encore 30,4 pour cent des électeurs (-8,2ment de points de pourcentage).<br><br>Une progression significative de +11,2 points de pourcentage permet aux <b>Vert-e-s</b> de devenir le deuxième parti de sa commune. La formation politique recueille18,6 pour cent des voix.<br><br>Les <b>Vert-e-s</b> doivent se contenter de la troisième place. Le parti n'obtient plus que 17,1 pour cent des voix, soit -8,4 points de pourcentage de moins qu'il y a quatre ans.","Nonostante le significative perdite a Saint-Blaise, il partito <b>Verdi</b> rimane in testa. Riesce ancora a convincere il 30,4 percento degli elettori (-8,2ment punti percentuali).<br><br>Il partito <b>Verdi</b> progredisce notevolmente: ha migliorato il suo risultato di quattro anni fa di +11,2 punti percentuali ed è ora al secondo posto nel comune. La proporzione di voti del partito è ora del 18,6 percento.<br><br>Il partito <b>Verdi</b> deve accontentarsi del terzo posto, ricevendo solo il 17,1 percento dei voti, ovvero -8,4 punti percentuali in meno rispetto a quattro anni fa.","tab_h$tr£$td£FDP$/td£tab_r146tab_r2#6268AFtab_r3$td£$b£30.4%$/b£$/td£§-8.2$/td£$/tr£$tr£$td£Grüne$/td£tab_r128tab_r2#26b300tab_r3$td£$b£18.6%$/b£$/td£§+11.2$/td£$/tr£$tr£$td£SP$/td£tab_r126tab_r2#ea546ftab_r3$td£$b£17.1%$/b£$/td£§-8.4$/td£$/tr£$tr£$td£GLP$/td£tab_r124tab_r2#cbd401tab_r3$td£$b£15.8%$/b£$/td£§+11.8$/td£$/tr£$tr£$td£SVP$/td£tab_r112tab_r2#547d34tab_r3$td£$b£7.7%$/b£$/td£§-6.3$/td£$/tr£$tr£$td£PdA$/td£tab_r19tab_r2#792a8ftab_r3$td£$b£6.3%$/b£$/td£§+1.0$/td£$/tr£$tr£$td£Mitte$/td£tab_r16tab_r2#f39f5etab_r3$td£$b£4.0%$/b£$/td£§+1.0$/td£$/tr£$/table£$br£Gültige Wahlzettel: $b£1'059$/b£$br£Wahlbeteiligung: $b£49.5%$/b£ (-0.6%)","tab_h_fr$tr£$td£PLR$/td£tab_r146tab_r2#6268AFtab_r3$td£$b£30.4%$/b£$/td£§-8.2$/td£$/tr£$tr£$td£Vert-e-s$/td£tab_r128tab_r2#26b300tab_r3$td£$b£18.6%$/b£$/td£§+11.2$/td£$/tr£$tr£$td£PS$/td£tab_r126tab_r2#ea546ftab_r3$td£$b£17.1%$/b£$/td£§-8.4$/td£$/tr£$tr£$td£PVL$/td£tab_r124tab_r2#cbd401tab_r3$td£$b£15.8%$/b£$/td£§+11.8$/td£$/tr£$tr£$td£UDC$/td£tab_r112tab_r2#547d34tab_r3$td£$b£7.7%$/b£$/td£§-6.3$/td£$/tr£$tr£$td£PST-POP$/td£tab_r19tab_r2#792a8ftab_r3$td£$b£6.3%$/b£$/td£§+1.0$/td£$/tr£$tr£$td£Centre$/td£tab_r16tab_r2#f39f5etab_r3$td£$b£4.0%$/b£$/td£§+1.0$/td£$/tr£$/table£$br£Bulletins de vote valables: $b£1'059$/b£$br£Taux de participation: $b£49.5%$/b£ (-0.6%)","tab_h_it$tr£$td£PLR$/td£tab_r146tab_r2#6268AFtab_r3$td£$b£30.4%$/b£$/td£§-8.2$/td£$/tr£$tr£$td£Verdi$/td£tab_r128tab_r2#26b300tab_r3$td£$b£18.6%$/b£$/td£§+11.2$/td£$/tr£$tr£$td£PS$/td£tab_r126tab_r2#ea546ftab_r3$td£$b£17.1%$/b£$/td£§-8.4$/td£$/tr£$tr£$td£PVL$/td£tab_r124tab_r2#cbd401tab_r3$td£$b£15.8%$/b£$/td£§+11.8$/td£$/tr£$tr£$td£UDC$/td£tab_r112tab_r2#547d34tab_r3$td£$b£7.7%$/b£$/td£§-6.3$/td£$/tr£$tr£$td£POP$/td£tab_r19tab_r2#792a8ftab_r3$td£$b£6.3%$/b£$/td£§+1.0$/td£$/tr£$tr£$td£Centro$/td£tab_r16tab_r2#f39f5etab_r3$td£$b£4.0%$/b£$/td£§+1.0$/td£$/tr£$/table£$br£Schede elettorali valide: $b£1'059$/b£$br£Tasso di partecipazione: $b£49.5%$/b£ (-0.6%)","FDP"
6461,"La TèNE","La Tène (NE)","La TèNE","In La Tène sind neu die <b>Grünen</b> die stärkste Partei mit 23,4 Prozent aller Stimmen. Vor vier Jahren lag die Partei noch auf Rang 2.<br><br>Einen markanten Verlust müssen die <b>Grünen</b> hinnehmen: Die Partei verliert -8 Prozentpunkte gegenüber den Wahlen 2019 und liegt jetzt noch bei 19,4 Prozent Wähleranteil. Das bedeutet dennoch Rang 2.<br><br>Deutlich zulegen können die <b>Grünen</b>. Die Partei ist die dritte Kraft in der Gemeinde und kommt neu auf einen Wähleranteil von 18,9 Prozent, was einer Zunahme von +12,9 Prozentpunkten gegenüber der letzten Wahl entspricht.","Classé au deux ème rang en 2019, les <b>Vert-e-s</b> sont le nouveau parti le plus fort à La Tène. Il obtient 23,4 pour cent des suffrages.<br><br>Malgré un recul de -8 points de pourcentage par rapport aux élections de 2019, les <b>Vert-e-s</b> occupent toujours la deuxième place. Il engrange 19,4 pour cent des voix.<br><br>Les <b>Vert-e-s</b> ont nettement progressé. Le parti devient la troisième force électorale de la commune et obtient 18,9 pour cent des voix, ce qui correspond à une augmentation de +12,9 points de pourcentage par rapport à 2019.","Le preferenze degli elettori di La Tène sono cambiate in quattro anni. Il partito <b>Verdi</b> ottiene il numero più alto di voti con il 23,4 % (-3,8 punti percentuali) e passa così dal due esimo posto al primo.<br><br>Nonostante una diminuzione di -8 punti percentuali rispetto alle elezioni del 2019, il partito <b>Verdi</b> mantiene sempre la seconda posizione. Raccoglie il 19,4 percento dei voti.<br><br>Grazie a un notevole aumento di +12,9 punti percentuali rispetto alle ultime elezioni federali, il partito <b>Verdi</b> raggiunge il terzo posto nel comune. Ora ha una percentuale di elettori del 18,9 percento.","tab_h$tr£$td£FDP$/td£tab_r135tab_r2#6268AFtab_r3$td£$b£23.4%$/b£$/td£§-3.8$/td£$/tr£$tr£$td£SP$/td£tab_r129tab_r2#ea546ftab_r3$td£$b£19.4%$/b£$/td£§-8.0$/td£$/tr£$tr£$td£Grüne$/td£tab_r128tab_r2#26b300tab_r3$td£$b£18.9%$/b£$/td£§+12.9$/td£$/tr£$tr£$td£GLP$/td£tab_r117tab_r2#cbd401tab_r3$td£$b£11.5%$/b£$/td£§+8.2$/td£$/tr£$tr£$td£SVP$/td£tab_r116tab_r2#547d34tab_r3$td£$b£10.3%$/b£$/td£§-6.8$/td£$/tr£$tr£$td£Mitte$/td£tab_r113tab_r2#f39f5etab_r3$td£$b£8.6%$/b£$/td£§-0.2$/td£$/tr£$tr£$td£PdA$/td£tab_r111tab_r2#792a8ftab_r3$td£$b£7.3%$/b£$/td£§+0.0$/td£$/tr£$/table£$br£Gültige Wahlzettel: $b£1'239$/b£$br£Wahlbeteiligung: $b£40.6%$/b£ (-2.1%)","tab_h_fr$tr£$td£PLR$/td£tab_r135tab_r2#6268AFtab_r3$td£$b£23.4%$/b£$/td£§-3.8$/td£$/tr£$tr£$td£PS$/td£tab_r129tab_r2#ea546ftab_r3$td£$b£19.4%$/b£$/td£§-8.0$/td£$/tr£$tr£$td£Vert-e-s$/td£tab_r128tab_r2#26b300tab_r3$td£$b£18.9%$/b£$/td£§+12.9$/td£$/tr£$tr£$td£PVL$/td£tab_r117tab_r2#cbd401tab_r3$td£$b£11.5%$/b£$/td£§+8.2$/td£$/tr£$tr£$td£UDC$/td£tab_r116tab_r2#547d34tab_r3$td£$b£10.3%$/b£$/td£§-6.8$/td£$/tr£$tr£$td£Centre$/td£tab_r113tab_r2#f39f5etab_r3$td£$b£8.6%$/b£$/td£§-0.2$/td£$/tr£$tr£$td£PST-POP$/td£tab_r111tab_r2#792a8ftab_r3$td£$b£7.3%$/b£$/td£§+0.0$/td£$/tr£$/table£$br£Bulletins de vote valables: $b£1'239$/b£$br£Taux de participation: $b£40.6%$/b£ (-2.1%)","tab_h_it$tr£$td£PLR$/td£tab_r135tab_r2#6268AFtab_r3$td£$b£23.4%$/b£$/td£§-3.8$/td£$/tr£$tr£$td£PS$/td£tab_r129tab_r2#ea546ftab_r3$td£$b£19.4%$/b£$/td£§-8.0$/td£$/tr£$tr£$td£Verdi$/td£tab_r128tab_r2#26b300tab_r3$td£$b£18.9%$/b£$/td£§+12.9$/td£$/tr£$tr£$td£PVL$/td£tab_r117tab_r2#cbd401tab_r3$td£$b£11.5%$/b£$/td£§+8.2$/td£$/tr£$tr£$td£UDC$/td£tab_r116tab_r2#547d34tab_r3$td£$b£10.3%$/b£$/td£§-6.8$/td£$/tr£$tr£$td£Centro$/td£tab_r113tab_r2#f39f5etab_r3$td£$b£8.6%$/b£$/td£§-0.2$/td£$/tr£$tr£$td£POP$/td£tab_r111tab_r2#792a8ftab_r3$td£$b£7.3%$/b£$/td£§+0.0$/td£$/tr£$/table£$br£Schede elettorali valide: $b£1'239$/b£$br£Tasso di partecipazione: $b£40.6%$/b£ (-2.1%)","FDP"
6485,"Valangin NE","Valangin (NE)","Valangin NE","Bei der Stimmenauszählung in Valangin gibt es für die <b>Grünen</b> 164 Stimmen und für die <b>Grünen</b> 102 Stimmen. Die <b>Grünen</b> kommen auf 71 Stimmen.<br><br>","Les <b>Vert-e-s</b>, les <b>Vert-e-s</b> et les <b>Vert-e-s</b> sont les trois partis ayant obtenu le plus de votes à Valangin. Ils obtiennent respectivement 164, 102 et 71 voix.<br><br>","Gli elettori di Valangin distribuiscono i loro voti tra <b>Verdi</b> (164 voti), <b>Verdi</b> (102 voti) e <b>Verdi</b> (71 voti). Questi tre partiti sono quelli che hanno ottenuto più voti.<br><br>","tab_h$tr£$td£SP$/td£tab_r150tab_r2#ea546ftab_r3$td£$b£33.5%$/b£$/td£§-0.9$/td£$/tr£$tr£$td£FDP$/td£tab_r131tab_r2#6268AFtab_r3$td£$b£20.8%$/b£$/td£§-5.5$/td£$/tr£$tr£$td£Grüne$/td£tab_r122tab_r2#26b300tab_r3$td£$b£14.5%$/b£$/td£§+2.3$/td£$/tr£$tr£$td£PdA$/td£tab_r118tab_r2#792a8ftab_r3$td£$b£12.2%$/b£$/td£§+5.2$/td£$/tr£$tr£$td£SVP$/td£tab_r117tab_r2#547d34tab_r3$td£$b£11.0%$/b£$/td£§-2.3$/td£$/tr£$tr£$td£GLP$/td£tab_r19tab_r2#cbd401tab_r3$td£$b£5.7%$/b£$/td£§+2.7$/td£$/tr£$/table£$br£Gültige Wahlzettel: $b£125$/b£$br£Wahlbeteiligung: $b£44.9%$/b£ (-0.3%)","tab_h_fr$tr£$td£PS$/td£tab_r150tab_r2#ea546ftab_r3$td£$b£33.5%$/b£$/td£§-0.9$/td£$/tr£$tr£$td£PLR$/td£tab_r131tab_r2#6268AFtab_r3$td£$b£20.8%$/b£$/td£§-5.5$/td£$/tr£$tr£$td£Vert-e-s$/td£tab_r122tab_r2#26b300tab_r3$td£$b£14.5%$/b£$/td£§+2.3$/td£$/tr£$tr£$td£PST-POP$/td£tab_r118tab_r2#792a8ftab_r3$td£$b£12.2%$/b£$/td£§+5.2$/td£$/tr£$tr£$td£UDC$/td£tab_r117tab_r2#547d34tab_r3$td£$b£11.0%$/b£$/td£§-2.3$/td£$/tr£$tr£$td£PVL$/td£tab_r19tab_r2#cbd401tab_r3$td£$b£5.7%$/b£$/td£§+2.7$/td£$/tr£$/table£$br£Bulletins de vote valables: $b£125$/b£$br£Taux de participation: $b£44.9%$/b£ (-0.3%)","tab_h_it$tr£$td£PS$/td£tab_r150tab_r2#ea546ftab_r3$td£$b£33.5%$/b£$/td£§-0.9$/td£$/tr£$tr£$td£PLR$/td£tab_r131tab_r2#6268AFtab_r3$td£$b£20.8%$/b£$/td£§-5.5$/td£$/tr£$tr£$td£Verdi$/td£tab_r122tab_r2#26b300tab_r3$td£$b£14.5%$/b£$/td£§+2.3$/td£$/tr£$tr£$td£POP$/td£tab_r118tab_r2#792a8ftab_r3$td£$b£12.2%$/b£$/td£§+5.2$/td£$/tr£$tr£$td£UDC$/td£tab_r117tab_r2#547d34tab_r3$td£$b£11.0%$/b£$/td£§-2.3$/td£$/tr£$tr£$td£PVL$/td£tab_r19tab_r2#cbd401tab_r3$td£$b£5.7%$/b£$/td£§+2.7$/td£$/tr£$/table£$br£Schede elettorali valide: $b£125$/b£$br£Tasso di partecipazione: $b£44.9%$/b£ (-0.3%)","SP"
6487,"Val-de-Ruz NE","Val-de-Ruz (NE)","Val-de-Ruz NE","Ganz knapp bleiben die <b>Grünen</b> die grösste Partei in Val-de-Ruz. Die Partei holte 24,6 Prozent der Stimmen und hält damit ihren Vorsprung von 2,8 Prozentpunkte vor den <b>Grünen</b>. Diese müssen sich mit 21,9 Prozent und Platz zwei begnügen. Die Veränderungen gegenüber 2019: Grüne: -2,6 Prozentpunkte; Grüne: +13,5 Prozentpunkte.<br><br>Die <b>Grünen</b> müssen sich sich mit dem dritten Platz begnügen. Die Partei erreicht nur noch 15,1 Prozent der Stimmen und damit -8,4 Prozentpunkte weniger als vor vier Jahren.","Les <b>Vert-e-s</b> restent en tête à Val-de-Ruz (24,6 pour cent des voix, -2,6 points de pourcentage). Son poursuivant, les <b>Vert-e-s</b>, menacent toutefois de lui ravir son fauteuil (21,9 pour cent des suffrages, +13,5 points de pourcentage). L'écart entre les deux formations n'est que de 2,8 points. <br><br>Les <b>Vert-e-s</b> perdent -8,4 points de pourcentage. Il n'arrive plus qu'en troisième position avec 15,1 pour cent des voix.","Il partito <b>Verdi</b> rimane in testa a Val-de-Ruz con il 24,6 percento dei voti (-2,6 punti percentuali). Il suo rivale, il partito <b>Verdi</b>, minaccia però di sovrastarlo con il 24,6 percento dei voti (+13,5 punti percentuali). La differenza tra le due formazioni è solo di 2,8 punti.<br><br>Il partito <b>Verdi</b>, terzo partito, ha perso molti voti, ricevendo il 15,1 percento dei voti, una perdita di -8,4 punti percentuali.","tab_h$tr£$td£FDP$/td£tab_r137tab_r2#6268AFtab_r3$td£$b£24.6%$/b£$/td£§-2.6$/td£$/tr£$tr£$td£Grüne$/td£tab_r133tab_r2#26b300tab_r3$td£$b£21.9%$/b£$/td£§+13.5$/td£$/tr£$tr£$td£SVP$/td£tab_r123tab_r2#547d34tab_r3$td£$b£15.1%$/b£$/td£§-8.4$/td£$/tr£$tr£$td£SP$/td£tab_r121tab_r2#ea546ftab_r3$td£$b£14.0%$/b£$/td£§-7.9$/td£$/tr£$tr£$td£PdA$/td£tab_r116tab_r2#792a8ftab_r3$td£$b£10.4%$/b£$/td£§+2.2$/td£$/tr£$tr£$td£GLP$/td£tab_r114tab_r2#cbd401tab_r3$td£$b£9.1%$/b£$/td£§+6.5$/td£$/tr£$tr£$td£Mitte$/td£tab_r17tab_r2#f39f5etab_r3$td£$b£4.5%$/b£$/td£§+0.3$/td£$/tr£$/table£$br£Gültige Wahlzettel: $b£4'692$/b£$br£Wahlbeteiligung: $b£41.7%$/b£ (-1.8%)","tab_h_fr$tr£$td£PLR$/td£tab_r137tab_r2#6268AFtab_r3$td£$b£24.6%$/b£$/td£§-2.6$/td£$/tr£$tr£$td£Vert-e-s$/td£tab_r133tab_r2#26b300tab_r3$td£$b£21.9%$/b£$/td£§+13.5$/td£$/tr£$tr£$td£UDC$/td£tab_r123tab_r2#547d34tab_r3$td£$b£15.1%$/b£$/td£§-8.4$/td£$/tr£$tr£$td£PS$/td£tab_r121tab_r2#ea546ftab_r3$td£$b£14.0%$/b£$/td£§-7.9$/td£$/tr£$tr£$td£PST-POP$/td£tab_r116tab_r2#792a8ftab_r3$td£$b£10.4%$/b£$/td£§+2.2$/td£$/tr£$tr£$td£PVL$/td£tab_r114tab_r2#cbd401tab_r3$td£$b£9.1%$/b£$/td£§+6.5$/td£$/tr£$tr£$td£Centre$/td£tab_r17tab_r2#f39f5etab_r3$td£$b£4.5%$/b£$/td£§+0.3$/td£$/tr£$/table£$br£Bulletins de vote valables: $b£4'692$/b£$br£Taux de participation: $b£41.7%$/b£ (-1.8%)","tab_h_it$tr£$td£PLR$/td£tab_r137tab_r2#6268AFtab_r3$td£$b£24.6%$/b£$/td£§-2.6$/td£$/tr£$tr£$td£Verdi$/td£tab_r133tab_r2#26b300tab_r3$td£$b£21.9%$/b£$/td£§+13.5$/td£$/tr£$tr£$td£UDC$/td£tab_r123tab_r2#547d34tab_r3$td£$b£15.1%$/b£$/td£§-8.4$/td£$/tr£$tr£$td£PS$/td£tab_r121tab_r2#ea546ftab_r3$td£$b£14.0%$/b£$/td£§-7.9$/td£$/tr£$tr£$td£POP$/td£tab_r116tab_r2#792a8ftab_r3$td£$b£10.4%$/b£$/td£§+2.2$/td£$/tr£$tr£$td£PVL$/td£tab_r114tab_r2#cbd401tab_r3$td£$b£9.1%$/b£$/td£§+6.5$/td£$/tr£$tr£$td£Centro$/td£tab_r17tab_r2#f39f5etab_r3$td£$b£4.5%$/b£$/td£§+0.3$/td£$/tr£$/table£$br£Schede elettorali valide: $b£4'692$/b£$br£Tasso di partecipazione: $b£41.7%$/b£ (-1.8%)","FDP"
